Authors,Author full names,Author(s) ID,Title,Year,Source title,Volume,Issue,Art. No.,Page start,Page end,Cited by,DOI,Link,Affiliations,Authors with affiliations,Abstract,Author Keywords,Index Keywords,ISSN,ISBN,CODEN,Document Type,Publication Stage,Open Access,Source,EID
Quiroz D.C.; Di Pietro D.A.,"Quiroz, Daniel Castanon (56703373900); Di Pietro, Daniele A. (6603444428)",56703373900; 6603444428,A Reynolds-semi-robust and pressure-robust Hybrid High-Order method for the time dependent incompressible Navier–Stokes equations on general meshes,2025,Computer Methods in Applied Mechanics and Engineering,436,,117660,,,3,10.1016/j.cma.2024.117660,https://www.scopus.com/pages/publications/85214287504?origin=resultslist,"Instituto de Investigaciones en Matemáticas Aplicadas y en Sistemas, Universidad Nacional Autónoma de México, Circuito Escolar s/n, (México), Ciudad Universitaria C.P., 04510 Cd. Mx., Mexico; IMAG, Univ Montpellier, CNRS, Montpellier, 34090, France","Quiroz D.C., Instituto de Investigaciones en Matemáticas Aplicadas y en Sistemas, Universidad Nacional Autónoma de México, Circuito Escolar s/n, (México), Ciudad Universitaria C.P., 04510 Cd. Mx., Mexico; Di Pietro D.A., IMAG, Univ Montpellier, CNRS, Montpellier, 34090, France","In this work we develop and analyze a Reynolds-semi-robust and pressure-robust Hybrid High-Order (HHO) discretization of the incompressible Navier–Stokes equations. Reynolds-semi-robustness refers to the fact that, under suitable regularity assumptions, the right-hand side of the velocity error estimate does not depend on the inverse of the viscosity. This property is obtained here through a penalty term which involves a subtle projection of the convective term on a subgrid space constructed element by element. Moreover, a method has the pressure-robustness property when it guarantees velocity error estimates that are independent of the pressure. The estimated convergence order for the L∞(L2)- and L2(energy)-norm of the velocity is [Formula presented], which matches the best results for continuous and discontinuous Galerkin methods and corresponds to the one expected for HHO methods in convection-dominated regimes. Two-dimensional numerical results on a variety of polygonal meshes complete the exposition. © 2024 Elsevier B.V.",General meshes; Hybrid high-order methods; Pressure-robustness; Re-semi-robust error estimates; Time-dependent incompressible flow,Convergence of numerical methods; Galerkin methods; Incompressible flow; Inverse problems; Navier Stokes equations; Reynolds equation; Reynolds number; Error estimates; General mesh; High-order methods; Higher-order methods; Hybrid high-order method; Pressure-robustness; Re-semi-robust error estimate; Reynolds; Time dependent; Time-dependent incompressible flow; Mesh generation,00457825,,CMMEC,Article,Final,All Open Access; Green Open Access,Scopus,2-s2.0-85214287504
González J.E.; Díaz-Cortés G.B.; del Castillo R.M.; Espejel R.; Calles A.,"González, J.E. (57191503087); Díaz-Cortés, G.B. (57191888006); del Castillo, Roxana M. (15756840800); Espejel, R. (57209774046); Calles, A. (6603983731)",57191503087; 57191888006; 15756840800; 57209774046; 6603983731,Evolutionary algorithms applied to minimize the thermal transport in atomic nanoribbons,2025,Computational Materials Science,260,,114195,,,0,10.1016/j.commatsci.2025.114195,https://www.scopus.com/pages/publications/105015143664?origin=resultslist,"Department of Physics, Faculty of Sciences, National Autonomous University of Mexico, Circuito Exterior S/N, Ciudad Universitaria, Mexico City, Coyoacán, 04510, Mexico; Research Directorate, Exploration Research Management, Mexican Petroleum Institute, Eje Céntral Lázaro Cárdenas 152, Col. San Bartolo Atepehuacan, Mexico City, Gustavo A. Madero, 07730, Mexico","González J.E., Department of Physics, Faculty of Sciences, National Autonomous University of Mexico, Circuito Exterior S/N, Ciudad Universitaria, Mexico City, Coyoacán, 04510, Mexico; Díaz-Cortés G.B., Research Directorate, Exploration Research Management, Mexican Petroleum Institute, Eje Céntral Lázaro Cárdenas 152, Col. San Bartolo Atepehuacan, Mexico City, Gustavo A. Madero, 07730, Mexico; del Castillo R.M., Department of Physics, Faculty of Sciences, National Autonomous University of Mexico, Circuito Exterior S/N, Ciudad Universitaria, Mexico City, Coyoacán, 04510, Mexico; Espejel R., Department of Physics, Faculty of Sciences, National Autonomous University of Mexico, Circuito Exterior S/N, Ciudad Universitaria, Mexico City, Coyoacán, 04510, Mexico; Calles A., Department of Physics, Faculty of Sciences, National Autonomous University of Mexico, Circuito Exterior S/N, Ciudad Universitaria, Mexico City, Coyoacán, 04510, Mexico","In the pursuit of sustainable energy solutions, the development of materials with tailored transport properties is essential for enhancing device performance. In thermoelectric applications, materials with low thermal conductivity are particularly desirable to improve the dimensionless figure of merit and the efficiency of the Seebeck effect. In this study, we present an atomistic investigation of lattice thermal transport in a binary nanoribbon composed of alternating atomic blocks with a rock-salt structure, coupled to semi-infinite reservoirs at both ends. Using the Born interatomic potential within the harmonic approximation and the lattice thermal Kubo–Greenwood formula based on Green's function techniques, we simulate phonon transport at the atomic scale. The accuracy of this approach depends critically on the selection of interatomic potential parameters. To address this, we apply evolutionary algorithms, specifically Differential Evolution, to optimize atomic masses and force constants in order to minimize the lattice thermal conductivity. These algorithms efficiently explore high-dimensional parameter spaces and identify optimal configurations corresponding to global or near-global minima. Our results, supported by ab initio calculations for real materials with a rock-salt structure, demonstrate an effective strategy for engineering low-thermal-conductivity materials, which are desirable for the design of high-performance thermoelectric devices. © 2025 Elsevier B.V.",Born's interatomic potential; Differential evolution algorithm; Lattice thermal conductivity; Lattice thermal Kubo–Greenwood formula; Minimization,Approximation algorithms; Atoms; Evolutionary algorithms; Global optimization; Nanoribbons; Thermal conductivity of solids; Thermal Engineering; Thermoelectric equipment; Born interatomic potential; Differential evolution algorithms; Interatomic potential; Kubo-Greenwood formula; Lattice thermal conductivity; Lattice thermal kubo–greenwood formula; Low thermal conductivity; Minimisation; Thermal; Thermal transport; Lattice constants,09270256,,CMMSE,Article,Final,All Open Access; Hybrid Gold Open Access,Scopus,2-s2.0-105015143664
Lefranc G.; Gatica G.; Vásquez E.; Peña M.,"Lefranc, Gastón (7005019896); Gatica, Gabriel (57224552988); Vásquez, Edison (60069152700); Peña, Mario (18038232900)",7005019896; 57224552988; 60069152700; 18038232900,AI-Enhanced Supercomputing for Next-Generation Astronomical Data Processing in Latin America: A Case Study of the ALMA Observatory,2025,Procedia Computer Science,266,,,150,157,0,10.1016/j.procs.2025.08.019,https://www.scopus.com/pages/publications/105014155977?origin=resultslist,"Pontificia Universidad Católica de Valparaíso, Avda. Brasil2950, Valparaíso, 2430000, Chile; Startup I+D+i Inteligencia Artificial, ARTIFICYAN, Viña del Mar, Chile; JhedAI Startup., Viña del Mar, Chile; IIMAS-UNAM, Ciudad de México, Mexico","Lefranc G., Pontificia Universidad Católica de Valparaíso, Avda. Brasil2950, Valparaíso, 2430000, Chile; Gatica G., Startup I+D+i Inteligencia Artificial, ARTIFICYAN, Viña del Mar, Chile; Vásquez E., JhedAI Startup., Viña del Mar, Chile; Peña M., IIMAS-UNAM, Ciudad de México, Mexico","This paper presents a proposal for improving the data processing workflow within an AI-powered supercomputing framework for the Atacama Large Millimetre/submillimeter Array (ALMA) Observatory. This framework aims to reduce processing times by 40% to 60%, improve image resolution, and increase data calibration accuracy. A high-performance computing (HPC) architecture with a GPU and artificial intelligence (AI) hardware for astronomical data management is described. The importance of such infrastructure for scientific advancement in developing countries is highlighted by analyzing implementation strategies, cost-benefit analyses, and technology transfer.  © 2025 The Authors.",ALMA Observatory; Artificial Intelligence; Data Processing; GPU Acceleration; High-Performance Computing; Radio Astronomy; Supercomputing,Computer architecture; Cost benefit analysis; Data handling; Image resolution; Information management; Observatories; Supercomputers; Technology transfer; Astronomical data; Atacama Large Millimeter/sub-millimeter Array (ALMA); Atacamum large millimeter/submillimeter array observatory; Case-studies; GPU accelerations; High-performance computing; Latin America; Performance computing; Supercomputing; Work-flows; Radio astronomy,18770509,,,Conference paper,Final,All Open Access; Gold Open Access,Scopus,2-s2.0-105014155977
Hernández-Santamaría V.; Jarohs S.; Saldaña A.; Sinsch L.,"Hernández-Santamaría, Víctor (57188764120); Jarohs, Sven (55999129600); Saldaña, Alberto (55212866300); Sinsch, Leonard (58750442800)",57188764120; 55999129600; 55212866300; 58750442800,FEM for 1D-problems involving the logarithmic Laplacian: Error estimates and numerical implementation,2025,Computers and Mathematics with Applications,192,,,189,211,0,10.1016/j.camwa.2025.05.013,https://www.scopus.com/pages/publications/105005960419?origin=resultslist,"Instituto de Matemáticas, Universidad Nacional Autónoma de México, Circuito Exterior, Ciudad Universitaria, Coyoacán, Ciudad de México, 04510, Mexico; Institut für Mathematik, Goethe-Universität Frankfurt, Robert-Mayer-Str. 10, Frankfurt am Main, D-60629, Germany","Hernández-Santamaría V., Instituto de Matemáticas, Universidad Nacional Autónoma de México, Circuito Exterior, Ciudad Universitaria, Coyoacán, Ciudad de México, 04510, Mexico; Jarohs S., Institut für Mathematik, Goethe-Universität Frankfurt, Robert-Mayer-Str. 10, Frankfurt am Main, D-60629, Germany; Saldaña A., Instituto de Matemáticas, Universidad Nacional Autónoma de México, Circuito Exterior, Ciudad Universitaria, Coyoacán, Ciudad de México, 04510, Mexico; Sinsch L., Institut für Mathematik, Goethe-Universität Frankfurt, Robert-Mayer-Str. 10, Frankfurt am Main, D-60629, Germany","We present the numerical analysis of a finite element method (FEM) for one-dimensional Dirichlet problems involving the logarithmic Laplacian (the pseudo-differential operator that appears as a first-order expansion of the fractional Laplacian as the exponent s→0+). Our analysis exhibits new phenomena in this setting; in particular, using recently obtained regularity results, we prove rigorous error estimates and provide a logarithmic order of convergence in the energy norm using suitable log-weighted spaces. Moreover, we show that the stiffness matrix of logarithmic problems can be obtained as the derivative of the fractional stiffness matrix evaluated at s=0. Lastly, we investigate the relationship between the discrete eigenvalue problem and its convergence to the continuous one. © 2025 The Author(s)",Finite elements; Quasi-interpolation; Weighted logarithmic norms; Zero-order kernel,Discrete element methods; Error analysis; Finite element method; Interpolation; Laplace equation; Laplace transforms; Mathematical operators; Element method; Error estimates; Finite element; Laplacians; Numerical implementation; Quasi-interpolation; Stiffness matrices; Weighted logarithmic norm; Zero order; Zero-order kernel; Convergence of numerical methods,08981221,,CMAPD,Article,Final,All Open Access; Hybrid Gold Open Access,Scopus,2-s2.0-105005960419
Heidari S.; Rogers M.; Wang J.; Soriano Valdez D.A.; Schenone S.; Cunnington G.; Delmas P.; Thrush S.,"Heidari, Shahrokh (57191205089); Rogers, Mitchell (57447520100); Wang, Jiaxuan (58144538800); Soriano Valdez, David Arturo (57217085061); Schenone, Stefano (57202969089); Cunnington, Gemma (60408882900); Delmas, Patrice (8698287700); Thrush, Simon (7005855740)",57191205089; 57447520100; 58144538800; 57217085061; 57202969089; 60408882900; 8698287700; 7005855740,Tool-Assisted Annotation of Seafloor Sediment-linked Features Using Weakly Supervised Semantic Segmentation,2025,International Conference Image and Vision Computing New Zealand,,,,,,0,10.1109/IVCNZ67716.2025.11281825,https://www.scopus.com/pages/publications/105030659137?origin=resultslist,"Institute of Marine Science, The University of Auckland, Auckland, 1142, New Zealand; Centre for Data Science and Artificial Intelligence, Victoria University of Wellington, Wellington, New Zealand; Intelligent Vision Systems Lab (IVSLab), The University of Auckland, Auckland, 1010, New Zealand; ICAT, UNAM, Mexico City, Mexico","Heidari S., Institute of Marine Science, The University of Auckland, Auckland, 1142, New Zealand; Rogers M., Centre for Data Science and Artificial Intelligence, Victoria University of Wellington, Wellington, New Zealand; Wang J., Intelligent Vision Systems Lab (IVSLab), The University of Auckland, Auckland, 1010, New Zealand; Soriano Valdez D.A., ICAT, UNAM, Mexico City, Mexico; Schenone S., Institute of Marine Science, The University of Auckland, Auckland, 1142, New Zealand; Cunnington G., Institute of Marine Science, The University of Auckland, Auckland, 1142, New Zealand; Delmas P., Intelligent Vision Systems Lab (IVSLab), The University of Auckland, Auckland, 1010, New Zealand; Thrush S., Institute of Marine Science, The University of Auckland, Auckland, 1142, New Zealand","Pixel-wise labeling of seafloor imagery is highly time-consuming, limiting the scalability of benthic habitat monitoring. While existing underwater computer vision research has largely focused on visually prominent habitats, sediment-linked benthic features remain underexplored and lack annotated datasets. To address this gap, we propose a tool-assisted annotation framework based on weakly supervised semantic segmentation. The framework follows a three-phase pipeline: feature-based pseudo-mask generation, binary class-specific segmentation, and iterative multiclass segmentation with pseudo-mask expansion and affinity-field regularization. Applied to six ecologically important sediment features, the approach progressively improves pseudo-label quality while reducing reliance on dense expert annotations, providing a scalable solution that can accelerate the annotation of seafloor sediment features. Code is available at: https://github.com/shahrokh1106/seafloor-sediment-segmentation ©2025 IEEE.",feature enhancement; few-shot learning; seafloor sediment; self-supervised learning; semantic segmentation; weakly supervised learning,Computer vision; Ecosystems; Iterative methods; Self-supervised learning; Semantic Segmentation; Semantics; Supervised learning; Benthic habitat monitoring; Feature enhancement; Few-shot learning; Pixel-wise labeling; Seafloor imagery; Seafloor sediments; Semantic segmentation; Underwater computer vision; Vision research; Weakly supervised learning; Sediments,21512191,979-833158654-6,,Conference paper,Final,,Scopus,2-s2.0-105030659137
Arrieta Paternina M.R.; Moreno Corbea J.A.; Ramirez-Arredondo J.M.; Chow J.H.; Zamora-Mendez A.,"Arrieta Paternina, Mario R. (56530728800); Moreno Corbea, José A. (58660416300); Ramirez-Arredondo, Juan M. (7401783221); Chow, Joe H. (7401728829); Zamora-Mendez, Alejandro (57207796016)",56530728800; 58660416300; 7401783221; 7401728829; 57207796016,Data-Driven Power System Linear Model Identification via Quadrature-Based Balanced Truncation,2025,IEEE Latin America Transactions ,23,9,,787,798,2,10.1109/TLA.2025.11119494,https://www.scopus.com/pages/publications/105013102175?origin=resultslist,"Universidad Nacional Autonoma de Mexico, (UNAM), Mexico; Centro de Investigacion y de Estudios Avanzados del IPN, Unidad Guadalajara, Mexico; Rensselaer Polytechnic Institute, United States; Universidad Michoacana San Nicolas de Hidalgo, Mexico","Arrieta Paternina M.R., Universidad Nacional Autonoma de Mexico, (UNAM), Mexico; Moreno Corbea J.A., Universidad Nacional Autonoma de Mexico, (UNAM), Mexico; Ramirez-Arredondo J.M., Centro de Investigacion y de Estudios Avanzados del IPN, Unidad Guadalajara, Mexico; Chow J.H., Rensselaer Polytechnic Institute, United States; Zamora-Mendez A., Universidad Michoacana San Nicolas de Hidalgo, Mexico","This paper introduces the novel formulation of the quadrature-based balanced truncation (QBBT) method to precisely identify large-scale power system linear models. The QBBT interpolates a directional frequency dataset that is extracted from a dynamic system, following a quadrature rule to be applied from weighted data to derive a linear system model based on approximations of Gramians, and providing an alternative approach to the classic balanced truncation (BT) formulation that makes use of the system model. In this investigation, an accurate theoretical framework is presented to achieve the application of QBBT considering power systems as black-box models. The Boyd/Clenshaw-Curtis (BCC) quadrature rule is implemented by using different adjustments to accurately identify linear models of different order. The attained results and their validation with analytical power system models confirm the method's potential to retail oscillatory dynamics. The QBBT's effectiveness is compared with the Loewner-based frequency interpolation (LBFI) approach and the BT method on the Klein-Rogers-Kundur (KRK) benchmark power system and the equivalent of the New England transmission system - New York power system (NETS-NYPS), achieving a small absolute error in the magnitude of the frequency response of the models of the order of 1x10-3 dB in comparison with other state-of-the-art methods. © 2003-2012 IEEE.",balanced truncation; directional frequency data-set; power system linear model; quadrature rules; system identification,Dynamics; Electric power transmission; Frequency response; Interpolation; Linear systems; Power system simulation; Transmissions; Balanced truncation; Balanced truncation method; Data set; Directional frequency data-set; Frequency data; Linear modeling; Power; Power system linear model; Quadrature rules; System-identification; Identification (control systems),15480992,,,Article,Final,,Scopus,2-s2.0-105013102175
Urquiza-Yllescas J.F.; Mendoza S.; Sánchez-Adame L.M.; Rodríguez J.; Decouchant D.,"Urquiza-Yllescas, José Fidel (57219960372); Mendoza, Sonia (13105758700); Sánchez-Adame, Luis Martín (57203842913); Rodríguez, José (14023450800); Decouchant, Dominique (6602352648)",57219960372; 13105758700; 57203842913; 14023450800; 6602352648,Towards an Architecture for Educational Chatbots,2024,Lecture Notes in Computer Science (including subseries Lecture Notes in Artificial Intelligence and Lecture Notes in Bioinformatics),14724 LNCS,,,333,351,1,10.1007/978-3-031-61691-4_22,https://www.scopus.com/pages/publications/85196827776?origin=resultslist,"Computer Science Department, CINVESTAV-IPN, Av. Instituto Politécnico Nacional 2508, San Pedro Zacatenco, Gustavo A. Madero, Mexico City, 07360, Mexico; Design and Building Division, FES-Acatlán, UNAM, Av. Jardines de San Mateo s/n, Sta. Cruz Acatlán, Naucalpan de Juárez, 53150, Mexico; Department of Information Technologies, UAM-Cuajimalpa, Av. Vasco de Quiroga 4871, Santa Fe, Cuajimalpa, Mexico City, 05300, Mexico","Urquiza-Yllescas J.F., Computer Science Department, CINVESTAV-IPN, Av. Instituto Politécnico Nacional 2508, San Pedro Zacatenco, Gustavo A. Madero, Mexico City, 07360, Mexico; Mendoza S., Computer Science Department, CINVESTAV-IPN, Av. Instituto Politécnico Nacional 2508, San Pedro Zacatenco, Gustavo A. Madero, Mexico City, 07360, Mexico; Sánchez-Adame L.M., Design and Building Division, FES-Acatlán, UNAM, Av. Jardines de San Mateo s/n, Sta. Cruz Acatlán, Naucalpan de Juárez, 53150, Mexico; Rodríguez J., Computer Science Department, CINVESTAV-IPN, Av. Instituto Politécnico Nacional 2508, San Pedro Zacatenco, Gustavo A. Madero, Mexico City, 07360, Mexico; Decouchant D., Department of Information Technologies, UAM-Cuajimalpa, Av. Vasco de Quiroga 4871, Santa Fe, Cuajimalpa, Mexico City, 05300, Mexico","Chatbots are gaining significant relevance due to their enormous potential in various sectors, particularly education. The COVID-19 pandemic led to suspending in-person classes for students and teachers, creating an opportunity for research in developing educational chatbots. However, the proposal of a widely accepted structure for chatbots poses a challenge due to the constant evolution of technologies and tools employed in their implementation and deployment. Moreover, generic chatbot architectures present limitations when instantiated in specific contexts. For instance, in the case of educational chatbots, it is necessary to have an architecture specifically tailored to the functionalities required in the academic domain. This article follows a formal approach to designing and implementing a software architecture for educational chatbots. We rely on an iterative method called ADD 3.0 to achieve this objective. Our proposal consists of a three-tier architecture to define the component distribution of chatbots and a six-layer architecture to specify their structure. © The Author(s), under exclusive license to Springer Nature Switzerland AG 2024.",Distribution Structure; Educational Chatbots; Layers; Method ADD 3.0; Software Architecture,Client server computer systems; Iterative methods; Chatbots; Component distributions; Distribution structure; Educational chatbot; Evolution of technology; Formal approach; Layer; Method ADD 3.0; Teachers'; Three-tier architecture; Software architecture,03029743,978-303161690-7,,Conference paper,Final,,Scopus,2-s2.0-85196827776
Argáez C.; Klüpfel S.; Arandía M.E.A.; Appendini C.M.,"Argáez, C. (53881147300); Klüpfel, S. (53984216300); Arandía, M.E. Allende (60091843200); Appendini, C.M. (6507216122)",53881147300; 53984216300; 60091843200; 6507216122,"C-Xool: ERA5 Atmospheric boundary conditions toolbox for ocean modelling with ROMS, Version 1",2025,SoftwareX,31,,102343,,,0,10.1016/j.softx.2025.102343,https://www.scopus.com/pages/publications/105015588435?origin=resultslist,"Instituto de Ingeniería, Unidad Académica Sisal, Universidad Nacional Autónoma de Mexico, Mexico; Axelyf, Hafnarfjörður, Iceland; Aarhus Institute of Advanced Studies, University of Aarhus, 1630, Hoegh-Guldbergs Gade, Aarhus, 8000, Denmark","Argáez C., Instituto de Ingeniería, Unidad Académica Sisal, Universidad Nacional Autónoma de Mexico, Mexico; Klüpfel S., Instituto de Ingeniería, Unidad Académica Sisal, Universidad Nacional Autónoma de Mexico, Mexico, Axelyf, Hafnarfjörður, Iceland; Arandía M.E.A., Instituto de Ingeniería, Unidad Académica Sisal, Universidad Nacional Autónoma de Mexico, Mexico; Appendini C.M., Instituto de Ingeniería, Unidad Académica Sisal, Universidad Nacional Autónoma de Mexico, Mexico, Aarhus Institute of Advanced Studies, University of Aarhus, 1630, Hoegh-Guldbergs Gade, Aarhus, 8000, Denmark","We introduce C-Xool, an open-source, Python-based command-line toolbox that streamlines the preparation of atmospheric forcing data for the Regional Ocean Modelling System (ROMS). Provided with a user-generated grid file, C-Xool automates the downloading and processing of ERA5 reanalysis data (the fifth-generation global climate and weather dataset from the European Centre for Medium-Range Weather Forecasts), eliminating the need for manual handling of NetCDF (Network Common Data Form) files, a format predominantly used for storing multidimensional scientific data in atmospheric science, oceanography, and climate research. Users can customise the workflow through command-line arguments, specifying which variables to process, the requested time period, and the temporal resolution of the output. By automating this process, C-Xool supports reproducible ocean modelling, reduces the likelihood of manual errors, and accelerates the setup of ROMS computations. In addition, an integrated plotting tool enables users to visually inspect the generated forcing files, ensuring the data is consistent and ready for use. © 2025",Atmospheric forcing; Automation; Earth science modelling; Python; ROMS,C (programming language); Oceanography; Open source software; Open systems; Python; Weather forecasting; Atmospheric boundary conditions; Atmospheric forcing; Command line; Earth science modeling; Grid files; Ocean model; Open-source; Regional ocean modeling system; System version; User-generated; ROM,23527110,,,Article,Final,All Open Access; Gold Open Access; Green Open Access,Scopus,2-s2.0-105015588435
