"Authors","Author full names","Author(s) ID","Title","Year","Source title","Volume","Issue","Art. No.","Page start","Page end","Cited by","DOI","Link","Affiliations","Authors with affiliations","Abstract","Author Keywords","Index Keywords","ISSN","ISBN","CODEN","Document Type","Publication Stage","Open Access","Source","EID"
"Avellaneda-Tamayo J.F.; Chávez-Hernández A.L.; Prado-Romero D.L.; Medina-Franco J.L.","Avellaneda-Tamayo, Juan F. (58567078600); Chávez-Hernández, Ana L. (57216591230); Prado-Romero, Diana L. (57250606000); Medina-Franco, José L. (57119398400)","58567078600; 57216591230; 57250606000; 57119398400","Chemical Multiverse and Diversity of Food Chemicals","2024","Journal of Chemical Information and Modeling","64","4","","1229","1244","9","10.1021/acs.jcim.3c01617","https://www.scopus.com/pages/publications/85185597680?origin=resultslist","DIFACQUIM Research Group, Department of Pharmacy, School of Chemistry, Universidad Nacional Autónoma de México, Avenida Universidad 3000, Mexico City, 04510, Mexico","Avellaneda-Tamayo J.F., DIFACQUIM Research Group, Department of Pharmacy, School of Chemistry, Universidad Nacional Autónoma de México, Avenida Universidad 3000, Mexico City, 04510, Mexico; Chávez-Hernández A.L., DIFACQUIM Research Group, Department of Pharmacy, School of Chemistry, Universidad Nacional Autónoma de México, Avenida Universidad 3000, Mexico City, 04510, Mexico; Prado-Romero D.L., DIFACQUIM Research Group, Department of Pharmacy, School of Chemistry, Universidad Nacional Autónoma de México, Avenida Universidad 3000, Mexico City, 04510, Mexico; Medina-Franco J.L., DIFACQUIM Research Group, Department of Pharmacy, School of Chemistry, Universidad Nacional Autónoma de México, Avenida Universidad 3000, Mexico City, 04510, Mexico","Food chemicals have a fundamental role in our lives, with an extended impact on nutrition, disease prevention, and marked economic implications in the food industry. The number of food chemical compounds in public databases has substantially increased in the past few years, which can be characterized using chemoinformatics approaches. We and other groups explored public food chemical libraries containing up to 26,500 compounds. This study aimed to analyze the chemical contents, diversity, and coverage in the chemical space of food chemicals and additives and, from here on, food components. The approach to food components addressed in this study is a public database with more than 70,000 compounds, including those predicted via omics techniques. It was concluded that food components have distinctive physicochemical properties and constitutional descriptors despite sharing many chemical structures with natural products. Food components, on average, have large molecular weights and several apolar structures with saturated hydrocarbons. Compared to reference databases, food component structures have low scaffold and fingerprint-based diversity and high structural complexity, as measured by the fraction of sp3 carbons. These structural features are associated with a large fraction of macronutrients as lipids. Lipids in food components were decompiled by an analysis of the maximum common substructures. The chemical multiverse representation of food chemicals showed a larger coverage of chemical space than natural products and FDA-approved drugs by using different sets of representations. © 2024 The Authors. Published by American Chemical Society.","","Biological Products; Databases, Factual; Lipids; Additives; Database systems; Indicators (chemical); Physicochemical properties; Scaffolds; biological product; lipid; Chemical content; Chemical libraries; Chemical space; Chemoinformatics; Disease prevention; Economic implications; Food components; Food industries; Natural products; Public database; chemistry; factual database; Lipids","15499596","","JCISD","Article","Final","All Open Access; Green Open Access; Hybrid Gold Open Access","Scopus","2-s2.0-85185597680"
"Ayala-Niño F.; Fabila-Bustos D.A.; Cortés-Caballero J.M.; Pérez-Martínez Á.A.; López-Galindo F.; Hernández-Chávez M.","Ayala-Niño, Fernando (57218541947); Fabila-Bustos, Diego A. (57215791777); Cortés-Caballero, José M. (57246298200); Pérez-Martínez, Ángel A. (57245879200); López-Galindo, Francisco (57207696241); Hernández-Chávez, Macaria (57202213226)","57218541947; 57215791777; 57246298200; 57245879200; 57207696241; 57202213226","Augmented reality to the creation of hybrid maps applied in soil sciences: a study case in Ixmiquilpan Hidalgo, Mexico","2024","Multimedia Tools and Applications","83","16","","49595","49613","3","10.1007/s11042-023-17491-3","https://www.scopus.com/pages/publications/85175629363?origin=resultslist","Laboratorio de Edafología Aplicada y Servicios Ambientales, UBIPRO, Facultad de Estudios Superiores Iztacala, Universidad Nacional Autónoma de México (UNAM), Estado de México, Tlalnepantla de Baz, 54090, Mexico; Laboratorio de Optomecatrónica, UPIIH, Instituto Politécnico Nacional (IPN), Distrito de Educación, Salud, Ciencia, Tecnología E Innovación, Hidalgo, San Agustín Tlaxiaca, 42162, Mexico","Ayala-Niño F., Laboratorio de Edafología Aplicada y Servicios Ambientales, UBIPRO, Facultad de Estudios Superiores Iztacala, Universidad Nacional Autónoma de México (UNAM), Estado de México, Tlalnepantla de Baz, 54090, Mexico; Fabila-Bustos D.A., Laboratorio de Optomecatrónica, UPIIH, Instituto Politécnico Nacional (IPN), Distrito de Educación, Salud, Ciencia, Tecnología E Innovación, Hidalgo, San Agustín Tlaxiaca, 42162, Mexico; Cortés-Caballero J.M., Laboratorio de Optomecatrónica, UPIIH, Instituto Politécnico Nacional (IPN), Distrito de Educación, Salud, Ciencia, Tecnología E Innovación, Hidalgo, San Agustín Tlaxiaca, 42162, Mexico; Pérez-Martínez Á.A., Laboratorio de Optomecatrónica, UPIIH, Instituto Politécnico Nacional (IPN), Distrito de Educación, Salud, Ciencia, Tecnología E Innovación, Hidalgo, San Agustín Tlaxiaca, 42162, Mexico; López-Galindo F., Laboratorio de Edafología Aplicada y Servicios Ambientales, UBIPRO, Facultad de Estudios Superiores Iztacala, Universidad Nacional Autónoma de México (UNAM), Estado de México, Tlalnepantla de Baz, 54090, Mexico; Hernández-Chávez M., Laboratorio de Optomecatrónica, UPIIH, Instituto Politécnico Nacional (IPN), Distrito de Educación, Salud, Ciencia, Tecnología E Innovación, Hidalgo, San Agustín Tlaxiaca, 42162, Mexico","The combination or mixture of methodologies offers so-called hybrid results, whose benefits can be focused on all areas of knowledge. In the present study, the creation of an Interactive Hybrid Maps Augmented Reality (AR) Application focused on teaching earth sciences was combined with edaphological, geographical, and cartographic information as a complement to online teaching due to the pandemic caused by COVID-19. Information was collected by studies carried out in the municipalities of Ixmiquilpan, Tasquillo, and Cardonal located at Mezquital Valley in Hidalgo, Mexico. The application was developed under evolutionary development models in combination with 2D maps, and Geographic Information Systems through the software Unity 3D graphics engine and AR Foundation SDK. In addition, laboratory results, information from historical databases, as well as field information, and pictures showing soil profiles of the study region were incorporated. The Interactive Hybrid Maps AR Application was installed and evaluated by Bachelor´s students of Biology with a specialty in soil sciences from the National Autonomous University of Mexico through a survey quiz that included items such as a learning tool, graphic 3D maps quality in augmented reality, easy handling, interaction and recommendable. Our results obtained a value of 0.90 Cronbach Alpha Coefficient indicating excellent reliability of the instrument. Moreover, an analysis of the last 10 years shows an incipient development of applications based on Augmented Reality for teaching earth sciences for university education. However, it is shown a wide development of AR applications in several fields since mathematics to museums. © The Author(s), under exclusive licence to Springer Science+Business Media, LLC, part of Springer Nature 2023.","Augmented reality; Cartography; Edaphology; Hybrid maps; Interactive educational application","Application programs; Maps; Quality control; Soils; Three dimensional computer graphics; Augmented reality applications; Edaphology; Educational Applications; Evolutionary development; Hybrid map; Interactive educational application; Me-xico; Online teaching; Soil science; Study case; Augmented reality","13807501","","MTAPF","Article","Final","","Scopus","2-s2.0-85175629363"
"Pacheco E.E.L.; Rosas M.O.; Loza-Pacheco D.; Sosa M.L.D.; Garcia G.E.; Ruiz M.T.; Elizondo C.C.D.","Pacheco, Eduardo Eloy Loza (55446906700); Rosas, Mayra Olguin (59500270400); Loza-Pacheco, Dulce (57352321600); Sosa, Mayra Lorena Díaz (55078320900); Garcia, Georgina Eslava (59500678400); Ruiz, Miguel Torres (57223027980); Elizondo, Christian Carlos Delgado (57219311209)","55446906700; 59500270400; 57352321600; 55078320900; 59500678400; 57223027980; 57219311209","Spatial Analysis of Student Feedback on Learning Management Systems in Mathematics: Leveraging GIS for Enhanced Insights","2025","Communications in Computer and Information Science","2298 CCIS","","","138","147","1","10.1007/978-3-031-80017-7_9","https://www.scopus.com/pages/publications/85214095385?origin=resultslist","Universidad Nacional Autónoma de México, Acatlán Edomex, MEX, 08544, Mexico; Centro de Investigacion en Computo, Alcaldía Gustavo A. Madero, CDMX, C.P. 07700, Mexico","Pacheco E.E.L., Universidad Nacional Autónoma de México, Acatlán Edomex, MEX, 08544, Mexico; Rosas M.O., Universidad Nacional Autónoma de México, Acatlán Edomex, MEX, 08544, Mexico; Loza-Pacheco D., Universidad Nacional Autónoma de México, Acatlán Edomex, MEX, 08544, Mexico; Sosa M.L.D., Universidad Nacional Autónoma de México, Acatlán Edomex, MEX, 08544, Mexico; Garcia G.E., Universidad Nacional Autónoma de México, Acatlán Edomex, MEX, 08544, Mexico; Ruiz M.T., Centro de Investigacion en Computo, Alcaldía Gustavo A. Madero, CDMX, C.P. 07700, Mexico; Elizondo C.C.D., Universidad Nacional Autónoma de México, Acatlán Edomex, MEX, 08544, Mexico","The use of Learning Management Systems is Important in Hybrid courses especially in Mathematics. In addition to that since the COVID LMS are a important mechanism to enforce the learning at home for students. However, the feedback from students is important to adapt the learning objects so students can learn and study in a more effective way. On the Other hand, Geographic Information Systems helps to represent a reason spatial information to give more accurate information about where objects are located. Natural Process Language has different applications for example to understand written and speak language. It is use in web search engines, translate, intelligent assistants. The present work with GIS and NLP is used to measure the level of effectiveness a LMS called TEDI have in students of Mathematics by analyzing their locations, responses in order to build the LMS system more effective to students. © The Author(s), under exclusive license to Springer Nature Switzerland AG 2025.","Artificial Intelligence; Learning Management Systems; Natural Process Language; Smart education","Adversarial machine learning; Federated learning; Natural language processing systems; Online searching; Students; Hybrid course; Learn+; Learning management system; Learning objects; Natural process; Natural process language; Process languages; Smart education; Spatial analysis; Student feedback; Contrastive Learning","18650929","978-303180016-0","","Conference paper","Final","","Scopus","2-s2.0-85214095385"
"Gómez-Monroy C.; Ramírez-Reivich A.C.","Gómez-Monroy, Carla (60549075500); Ramírez-Reivich, Alejandro C. (56013842500)","60549075500; 56013842500","Exertion Trainer: Smartphone Exergame Design to Support Children’s Kinesthetic Learning Through Playful Feedback","2024","Lecture Notes in Computer Science (including subseries Lecture Notes in Artificial Intelligence and Lecture Notes in Bioinformatics)","14517 LNCS","","","166","178","1","10.1007/978-3-031-59235-5_14","https://www.scopus.com/pages/publications/85201981526?origin=resultslist","Universidad Nacional Autónoma de México, Mexico City, Mexico","Gómez-Monroy C., Universidad Nacional Autónoma de México, Mexico City, Mexico; Ramírez-Reivich A.C., Universidad Nacional Autónoma de México, Mexico City, Mexico","Learning Apps have come a long way; nevertheless, Apps focused on physical education are underrepresented. This research explores exertion games that enable smartphone users to playfully learn the correct execution of target physical activities, as it is the straight punch in boxing. By implementing the sensors and actuators commonly found on modern smartphones, the proposed exertion game measures the movement of the user’s punching hand while performing a straight punch. The Exertion Trainer uses the resulting smartphone accelerometer data to evaluate the users’ techniques and provides sensory feedback to correct them. A graphic user interface was developed to convey the example movement that the user should replicate. A vital feature of this research is the user-centered design approach, which aims to generate new human-computer interactions by exploiting existing and pervasive mobile devices. So far, an expert user performance has been assessed to define a data baseline of the correct technique of the straight punch. Preliminary tests were done with two users. An A/B comparative experiment is proposed to validate this research. The control group, a traditional video-based tutorial, will be compared to the experimental group, a gamified interaction with the proposed exertion game. Participants will engage in a quantitative experiment (performance) and a qualitative questionnaire (experience). This study aims to transform the time users spend on the screen from visual content consumption to physical activation. © The Author(s), under exclusive license to Springer Nature Switzerland AG 2024.","Empirical studies in ubiquitous and mobile computing; Exertion Game; Human-Computer Interaction; Interaction Design; Learning through Smartphones; Movement-Based Design; User-Centered Design","Contrastive Learning; Game design; Graphical user interfaces; Punching; Sensory feedback; Smartphones; Ubiquitous computing; User centered design; Computer interaction; Empirical studies; Empirical study in ubiquitous and mobile computing; Exertion games; Interaction design; Learning through smartphone; Mobile-computing; Movement-based; Movement-based design; Smart phones; User-centred","03029743","978-303159234-8","","Conference paper","Final","","Scopus","2-s2.0-85201981526"
"Flores-Saviaga C.; Hanrahan B.V.; Imteyaz K.; Clarke S.; Savage S.","Flores-Saviaga, Claudia (57188753590); Hanrahan, Benjamin V. (37035791400); Imteyaz, Kashif (59144579800); Clarke, Steven (57195339726); Savage, Saiph (52964500900)","57188753590; 37035791400; 59144579800; 57195339726; 52964500900","The Impact of Generative AI Coding Assistants on Developers Who Are Visually Impaired","2025","Conference on Human Factors in Computing Systems - Proceedings ","","","1164","","","4","10.1145/3706598.3714008","https://www.scopus.com/pages/publications/105005769172?origin=resultslist","Northeastern University, Boston, MA, United States; Microsoft, Redmond, WA, United States; Microsoft, Edinburgh, United Kingdom; Universidad Nacional Autonoma de Mexico (UNAM), Mexico City, Mexico","Flores-Saviaga C., Northeastern University, Boston, MA, United States; Hanrahan B.V., Microsoft, Redmond, WA, United States; Imteyaz K., Northeastern University, Boston, MA, United States; Clarke S., Microsoft, Edinburgh, United Kingdom; Savage S., Universidad Nacional Autonoma de Mexico (UNAM), Mexico City, Mexico","The rapid adoption of generative AI in software development has impacted the industry, yet its effects on developers with visual impairments remain largely unexplored. To address this gap, we used an Activity Theory framework to examine how developers with visual impairments interact with AI coding assistants. For this purpose, we conducted a study where developers who are visually impaired completed a series of programming tasks using a generative AI coding assistant. We uncovered that, while participants found the AI assistant beneficial and reported significant advantages, they also highlighted accessibility challenges. Specifically, the AI coding assistant often exacerbated existing accessibility barriers and introduced new challenges. For example, it overwhelmed users with an excessive number of suggestions, leading developers who are visually impaired to express a desire for ""AI timeouts.""Additionally, the generative AI coding assistant made it more difficult for developers to switch contexts between the AI-generated content and their own code. Despite these challenges, participants were optimistic about the potential of AI coding assistants to transform the coding experience for developers with visual impairments. Our findings emphasize the need to apply activity-centered design principles to generative AI assistants, ensuring they better align with user behaviors and address specific accessibility needs. This approach can enable the assistants to provide more intuitive, inclusive, and effective experiences, while also contributing to the broader goal of enhancing accessibility in software development. © 2025 Copyright held by the owner/author(s).","accessibility; ai coding assistants; assistive technology; generative ai","Software prototyping; User centered design; Accessibility; Accessibility barriers; Activity Theory; Ai coding assistant; Assistive technology; Generative ai; Optimistics; Programming tasks; Visual impairment; Visually impaired; Software design","","979-840071394-1","","Conference paper","Final","All Open Access; Gold Open Access; Green Open Access","Scopus","2-s2.0-105005769172"
"García-Noguez L.R.; Salazar-Colores S.; Mondragón-Rodríguez S.; Tovar-Arriaga S.","García-Noguez, Luis Roberto (58686417900); Salazar-Colores, Sebastián (57204354992); Mondragón-Rodríguez, Siddhartha (56013734200); Tovar-Arriaga, Saúl (56013677600)","58686417900; 57204354992; 56013734200; 56013677600","A Novel Methodology for Data Augmentation in Cognitive Impairment Subjects Using Semantic and Pragmatic Features Through Large Language Models","2025","Technologies","13","8","344","","","0","10.3390/technologies13080344","https://www.scopus.com/pages/publications/105014328547?origin=resultslist","Facultad de Ingeniería, Universidad Autónoma de Querétaro, Queretaro, C.P. 76010, Mexico; Centro de Investigaciones en Óptica, C.P., Leon, 37150, Mexico; Instituto de Neurobiología, Universidad Nacional Autónoma de México Campus Juriquilla, Queretaro, C.P. 76230, Mexico","García-Noguez L.R., Facultad de Ingeniería, Universidad Autónoma de Querétaro, Queretaro, C.P. 76010, Mexico; Salazar-Colores S., Centro de Investigaciones en Óptica, C.P., Leon, 37150, Mexico; Mondragón-Rodríguez S., Instituto de Neurobiología, Universidad Nacional Autónoma de México Campus Juriquilla, Queretaro, C.P. 76230, Mexico; Tovar-Arriaga S., Facultad de Ingeniería, Universidad Autónoma de Querétaro, Queretaro, C.P. 76010, Mexico","In recent years, researchers have become increasingly interested in identifying traits of cognitive impairment using audio from neuropsychological tests. Unfortunately, there is no universally accepted terminology system that can be used to describe language impairment, and considerable variability exists between clinicians, making detection particularly challenging. Furthermore, databases commonly used by the scientific community present sparse or unbalanced data, which hinders the optimal performance of machine learning models. Therefore, this study aims to test a new methodology for augmenting text data from neuropsychological tests in the Pitt Corpus database to increase classification and interpretability results. The proposed method involves augmenting text data with symptoms commonly present in subjects with cognitive impairment. This innovative approach has enabled us to differentiate between two groups in the database better than widely used text augmentation techniques. The proposed method yielded an increase in the metrics, achieving 0.8742 accuracy, 0.8744 F1-score, 0.8736 precision, and 0.8781 recall. It is shown that implementing large language models with commonly observed symptoms in the language of patients with cognitive impairment in text augmentation can improve the results in low-resource scenarios. © 2025 by the authors.","cognitive impairment; low-resource scenarios; memory impairment; Pitt Corpus; text augmentation","Artificial intelligence; Classification (of information); Computational linguistics; Database systems; Human rehabilitation engineering; Learning systems; Terminology; Text processing; Cognitive impairment; Data augmentation; Language model; Low-resource scenario; Memory impairment; Neuropsychological tests; Novel methodology; Pitt corpus; Text augmentation; Text data; Semantics","22277080","","","Article","Final","All Open Access; Gold Open Access; Green Open Access","Scopus","2-s2.0-105014328547"
"Acosta G.; Morales E.; Gómez-Adorno H.","Acosta, Guido (60145256900); Morales, Eduardo (60145403500); Gómez-Adorno, Helena (55641734200)","60145256900; 60145403500; 55641734200","UCOM_UNAM_PLN at CheckThat! 2025: Evaluating LLMs in a two-Step Architecture for Numerical Fact Checking","2025","CEUR Workshop Proceedings","4038","","","743","753","0","","https://www.scopus.com/pages/publications/105019058911?origin=resultslist","Maestría en Ciencia de Datos, Universidad Comunera, Monseñor Bogarín, Asunción, 284, Paraguay; Instituto de Investigaciones en Matemáticas Aplicadas y en Sistemas, Universidad Nacional Autónoma de México, Av. Universidad 3000, C.U., Coyoacán, Ciudad de México, Mexico","Acosta G., Maestría en Ciencia de Datos, Universidad Comunera, Monseñor Bogarín, Asunción, 284, Paraguay; Morales E., Maestría en Ciencia de Datos, Universidad Comunera, Monseñor Bogarín, Asunción, 284, Paraguay; Gómez-Adorno H., Instituto de Investigaciones en Matemáticas Aplicadas y en Sistemas, Universidad Nacional Autónoma de México, Av. Universidad 3000, C.U., Coyoacán, Ciudad de México, Mexico","This paper presents the approach developed by the UCOM-UNAM-PLN team for Task 3 of the CLEF 2025 CheckThat! Lab, focused on verifying numerical and temporal claims in Spanish. We propose a two-step fact-checking architecture leveraging large language models (LLMs) in both stages: (1) evidence retrieval through BM25-preselected documents, and (2) veracity classification using zero-shot and few-shot prompting strategies. We conduct a comprehensive evaluation of retrieval techniques—including statistical, embedding-based, and LLM-based models—on the CLEF 2024 development set, identifying GPT-4o as the top-performing retriever. Based on these findings, we deploy GPT-4o for both evidence extraction and classification. Our best-performing pipeline combines few-shot prompting with curated evidence, achieving a macro-averaged F1 score of 0.3595 on the official CLEF 2025 test set. Results highlight the effectiveness of hybrid LLM-based architectures in identifying false claims, while also revealing challenges in handling ambiguous or true statements. This study underscores the potential of combining semantic retrieval and task-specific prompting for robust fact verification in real-world contexts. © 2025 Copyright for this paper by its authors. Use permitted under Creative Commons License Attribution 4.0 International (CC BY 4.0).","Classification; Fact checking; Information Retrieval; LLMS","Architecture; Semantics; Comprehensive evaluation; Embeddings; Evidence extraction; F1 scores; Fact checking; Language model; LLMS; Model-based OPC; Retrieval techniques; Test sets; Classification (of information); Information retrieval","16130073","","","Conference paper","Final","","Scopus","2-s2.0-105019058911"
