"Authors","Author full names","Author(s) ID","Title","Year","Source title","Volume","Issue","Art. No.","Page start","Page end","Cited by","DOI","Link","Affiliations","Authors with affiliations","Abstract","Author Keywords","Index Keywords","ISSN","ISBN","CODEN","Document Type","Publication Stage","Open Access","Source","EID"
"Tenorio-Salgado S.; Maya C.R.; Galan-Vasquez E.; Farias A.B.; Álvarez-López D.; Villalpando-Aguilar J.L.; Martin A.J.; Ledesma-Dominguez L.; Perez-Rueda E.","Tenorio-Salgado, Silvia (6504231208); Maya, Cinthia Rodríguez (57552375300); Galan-Vasquez, Edgardo (55758378800); Farias, André Borges (57209830767); Álvarez-López, Dulce (57203408991); Villalpando-Aguilar, Jose Luis (57220088182); Martin, Alberto J. (14719808500); Ledesma-Dominguez, Leonardo (57204166249); Perez-Rueda, Ernesto (55993682900)","6504231208; 57552375300; 55758378800; 57209830767; 57203408991; 57220088182; 14719808500; 57204166249; 55993682900","ENcyclopedia of TRAnscription Factors in Bacteria and Archaea genomes (ENTRAF) version 2.0","2025","Database","2025","","baaf071","","","0","10.1093/database/baaf071","https://www.scopus.com/pages/publications/105020034231?origin=resultslist","Tecnológico Nacional de México, Instituto Tecnológico de Mérida, Av. Tecnológico km. 4.5, Yucatan, Merida, 97118, Mexico; Centro de Estudios en Computación Avanzada, Coordinación de la Investigación Científica, Universidad Nacional Autónoma de México, Avenida Universidad 3000. Col. UNAM-CU.Coyoacan, Ciudad de México, 04510, Mexico; Instituto de Investigaciones en Matemáticas Aplicadas y en Sistemas, UNAM, Avenida Universidad 3000. Col. UNAM-CU.Coyoacan, Ciudad de México, 04510, Mexico; Laboratório Nacional de Computação Científica—LNCC, Avenida Getúlio Vargas, Rio de Janeiro, Petrópolis, 25651075, Brazil; Instituto de Investigaciones en Matemáticas Aplicadas y en Sistemas, Unidad Académica del Estado de Yucatán, Universidad Nacional Autónoma de México, Carretera Sierra Papacal - Chuburná. Km. 5.5., Yucatán, Mérida, 97302, Mexico; Tecnológico Nacional de México, Instituto Tecnológico de Campeche, Carretera Campeche—Escárcega Km. 9, Campeche, Lerma, 24500, Mexico; Laboratorio de Redes Biológicas, Centro Científico y Tecnológico de Excelencia Ciencia & Vida, Fundación Ciencia & Vida, Av. del Valle Nte. 725, Región Metropolitana, Huechuraba, 8580704, Chile; Escuela de Ingeniería, Facultad de Ingeniería, Arquitectura y Diseño, Universidad San Sebastián, Bellavista 7, Recoleta, Santiago, 8580704, Chile; Facultad de Ingeniería, División de Ingeniería Eléctrica, Universidad Nacional Autónoma de México, Avenida Universidad 3000. Col. UNAM-CU.Coyoacan, Ciudad de México, 04510, Mexico","Tenorio-Salgado S., Tecnológico Nacional de México, Instituto Tecnológico de Mérida, Av. Tecnológico km. 4.5, Yucatan, Merida, 97118, Mexico; Maya C.R., Centro de Estudios en Computación Avanzada, Coordinación de la Investigación Científica, Universidad Nacional Autónoma de México, Avenida Universidad 3000. Col. UNAM-CU.Coyoacan, Ciudad de México, 04510, Mexico; Galan-Vasquez E., Instituto de Investigaciones en Matemáticas Aplicadas y en Sistemas, UNAM, Avenida Universidad 3000. Col. UNAM-CU.Coyoacan, Ciudad de México, 04510, Mexico; Farias A.B., Laboratório Nacional de Computação Científica—LNCC, Avenida Getúlio Vargas, Rio de Janeiro, Petrópolis, 25651075, Brazil; Álvarez-López D., Instituto de Investigaciones en Matemáticas Aplicadas y en Sistemas, Unidad Académica del Estado de Yucatán, Universidad Nacional Autónoma de México, Carretera Sierra Papacal - Chuburná. Km. 5.5., Yucatán, Mérida, 97302, Mexico; Villalpando-Aguilar J.L., Tecnológico Nacional de México, Instituto Tecnológico de Campeche, Carretera Campeche—Escárcega Km. 9, Campeche, Lerma, 24500, Mexico; Martin A.J., Laboratorio de Redes Biológicas, Centro Científico y Tecnológico de Excelencia Ciencia & Vida, Fundación Ciencia & Vida, Av. del Valle Nte. 725, Región Metropolitana, Huechuraba, 8580704, Chile, Escuela de Ingeniería, Facultad de Ingeniería, Arquitectura y Diseño, Universidad San Sebastián, Bellavista 7, Recoleta, Santiago, 8580704, Chile; Ledesma-Dominguez L., Facultad de Ingeniería, División de Ingeniería Eléctrica, Universidad Nacional Autónoma de México, Avenida Universidad 3000. Col. UNAM-CU.Coyoacan, Ciudad de México, 04510, Mexico; Perez-Rueda E., Instituto de Investigaciones en Matemáticas Aplicadas y en Sistemas, Unidad Académica del Estado de Yucatán, Universidad Nacional Autónoma de México, Carretera Sierra Papacal - Chuburná. Km. 5.5., Yucatán, Mérida, 97302, Mexico","DNA-binding transcription factors (TFs) have a central role in regulation of gene expression at the transcription initiation level. These proteins have been experimentally described in multiple bacterial and archaeal genomes. These descriptions have allowed their prediction in complete genomes. In this work, we collected 1784 experimentally validated TFs across 25 bacterial and seven archaeal phyla, including Gammaproteobacteria, Bacillota, and Actinomycetota in bacteria and Thermoproteota and Thermococci in archaea. The collection of regulatory proteins was organized into a relational database, named ENcyclopedia of TRAnscription Factors in Bacteria and Archaea genomes or ENTRAF. The database shows the experimental evidence for all the TFs [protein structure information (X-ray or NMR structural data); binding of purified proteins; footprinting assays; site mutation; in vitro transcription assay; and PRiMer extension analysis, among others], their global regulatory roles (carbon source assimilation, virulence, antibiotic resistance, stress, and DNA damage), evolutionary families, and structural classifications. In addition, we achieved a global description of the collection in terms of their regulatory mechanisms (activation, repression, and dual activities), structural diversity, functional categories, and protein families. We consider that this collection of well-annotated TFs could be used as a benchmark, enhancing the predictions for this class of proteins in complete genomes. The complete collection of TFs is available at https://entraf.iimas.unam.mx and https://github.com/BioIIMAS/ENTRAF. © The Author(s) 2025. Published by Oxford University Press.","","Archaea; Archaeal Proteins; Bacteria; Bacterial Proteins; Databases, Genetic; Genome, Archaeal; Genome, Bacterial; Transcription Factors; archaeal protein; bacterial protein; transcription factor; archaeal genome; archaeon; bacterial genome; bacterium; genetic database; genetics; metabolism","17580463","","","Article","Final","All Open Access; Gold Open Access; Green Open Access","Scopus","2-s2.0-105020034231"
"Gómez-García A.; Lavecchia M.J.; Olmedo D.A.; Solís P.N.; Medina-Franco J.L.","Gómez-García, Alejandro (57203352896); Lavecchia, Martin J. (36622589800); Olmedo, Dionisio A. (8570014600); Solís, Pablo N. (57192121167); Medina-Franco, José L. (57119398400)","57203352896; 36622589800; 8570014600; 57192121167; 57119398400","Update and ADMET Profile of the Latin American Natural Product Database: LANaPDB","2025","Molecular Informatics ","44","11-12","e70013","","","0","10.1002/minf.70013","https://www.scopus.com/pages/publications/105024385695?origin=resultslist","DIFACQUIM Research Group, Department of Pharmacy, School of Chemistry, Universidad Nacional Autónoma de México, Mexico City, Mexico; CEQUINOR (UNLP-CONICET, CCT La Plata, associated with CIC PBA), Departamento de Química, Facultad de Ciencias Exactas, Universidad Nacional de la Plata, La Plata, Argentina; Center for Pharmacognostic Research on Panamanian Flora (CIFLORPAN), College of Pharmacy, University of Panama, Panama City, Panama","Gómez-García A., DIFACQUIM Research Group, Department of Pharmacy, School of Chemistry, Universidad Nacional Autónoma de México, Mexico City, Mexico; Lavecchia M.J., CEQUINOR (UNLP-CONICET, CCT La Plata, associated with CIC PBA), Departamento de Química, Facultad de Ciencias Exactas, Universidad Nacional de la Plata, La Plata, Argentina; Olmedo D.A., Center for Pharmacognostic Research on Panamanian Flora (CIFLORPAN), College of Pharmacy, University of Panama, Panama City, Panama; Solís P.N., Center for Pharmacognostic Research on Panamanian Flora (CIFLORPAN), College of Pharmacy, University of Panama, Panama City, Panama; Medina-Franco J.L., DIFACQUIM Research Group, Department of Pharmacy, School of Chemistry, Universidad Nacional Autónoma de México, Mexico City, Mexico","For more than 5 years, several countries in Latin America have been developing and updating compound databases of natural products (NPs) isolated and characterized by their countries. In parallel, multiple research groups have been collaborating and assembling a unified Latin American Natural Product Database (LANaPDB), an open-access compound collection representative of Latin America that stands out as a geographical region distinct from its vastness and richness of NP resources. Herein, we report a significant update of LANaPDB, which gathers NPs from eight countries. Major updates to the database include adding 1,164 new compounds obtained from NaturAr, a NP collection from Argentina published in 2025, and 132 new compounds from Panama. The updated LANaPDB has 14,742 nonduplicate compounds. Moreover, a comprehensive evaluation of 41 ADMET (absorption, distribution, metabolism, excretion, and toxicity)-related parameters was carried out for LANaPDB, and the results were compared with one of the largest NP databases, the Universal Natural Product Database, and the approved small-molecule drugs. The results indicated that the three databases have a very similar ADMET profile. Besides, most of the LANaPDB compounds presented high bioavailability, volume of distribution, plasma protein binding rate, blood–brain barrier penetration, susceptibility to CYP3A4, and half-life less than 12 h. Moreover, most of the LANaPDB compounds were predicted with a low probability of inducing toxicity-related reactions. The third version of LANaPDB and the codes for the curation and determination of 41 ADMET-related parameters are freely available at https://doi.org/10.5281/zenodo.15595030. The code is general and can be used to analyze other compound libraries. © 2025 The Author(s). Molecular Informatics published by Wiley-VCH GmbH.","ADMET; databases; LANaPDB; natural products; open-access","Biological Products; Databases, Factual; Databases, Pharmaceutical; Humans; Latin America; Biochemistry; Geographical regions; Indium compounds; Open access; Physiology; Plasma applications; Toxicity; ABC transporter subfamily B; aromatic hydrocarbon receptor; cytochrome P450 3A4; heat shock transcription factor; natural product; biological product; Absorption distribution; Absorption, distribution, metabolism, excretion, and toxicity; Latin America; Latin american natural product database; Latin americans; Multiple research; Natural products; OpenAccess; Product database; absorption; absorption parameters; antioxidant responsive element; Argentina; Article; artificial membrane; artificial neural network; bioavailability; blood brain barrier; Caco-2 cell line; chemical structure; cheminformatics; Chinese medicine; computer language; data base; distribution parameters; drug absorption; drug excretion; drug half life; drug metabolism; drug toxicity; elimination parameters; endophytic fungus; excretion; human; in vitro study; information processing; intestine absorption; Latin American medicine; lipophilicity; metabolism; mitochondrial membrane potential; Nrf2 signaling; particle size; physical chemistry; plasma protein binding; reference database; skin sensitization; South and Central America; volume of distribution; volume of distribution at steady-state; water solubility; chemistry; drug database; factual database; Database systems","18681743","","MIONB","Article","Final","All Open Access; Green Open Access; Hybrid Gold Open Access","Scopus","2-s2.0-105024385695"
"Gomez-Monroy C.G.; Borja V.; Ramirez-Reivich A.; Corona-Lira M.D.P.","Gomez-Monroy, Carlos Gilberto (57223406245); Borja, Vicente (57203684556); Ramirez-Reivich, Alejandro (56013842500); Corona-Lira, Maria del Pilar (57208708928)","57223406245; 57203684556; 56013842500; 57208708928","Assessing User Experience with Piezoresistive Force Sensors: Interpreting Button Press Impulse and Duration","2025","Sensors","25","21","6685","","","0","10.3390/s25216685","https://www.scopus.com/pages/publications/105021469653?origin=resultslist","Postgraduate School of Engineering, Universidad Nacional Autónoma de México, Ciudad Universitaria, Ciudad de México, 04510, Mexico; Department of Mechanical Engineering, Universidad Nacional Autónoma de México, Ciudad Universitaria, Ciudad de México, 04510, Mexico","Gomez-Monroy C.G., Postgraduate School of Engineering, Universidad Nacional Autónoma de México, Ciudad Universitaria, Ciudad de México, 04510, Mexico; Borja V., Department of Mechanical Engineering, Universidad Nacional Autónoma de México, Ciudad Universitaria, Ciudad de México, 04510, Mexico; Ramirez-Reivich A., Department of Mechanical Engineering, Universidad Nacional Autónoma de México, Ciudad Universitaria, Ciudad de México, 04510, Mexico; Corona-Lira M.D.P., Department of Mechanical Engineering, Universidad Nacional Autónoma de México, Ciudad Universitaria, Ciudad de México, 04510, Mexico","As robotic systems become increasingly integrated into daily life, the need for user experience (UX) assessment methods that are both privacy-conscious and suitable for embedded hardware platforms has grown. Traditional UX evaluations relying on vision, audio, or lengthy questionnaires are often intrusive, computationally demanding, or impractical for low-power devices. In this study, we introduce a novel sensor-based method for assessing UX through direct physical interaction. We designed a robot lamp with a force-sensing button interface and conducted a user study involving controlled robot errors. Participants interacted with the lamp during a reading task and rated their UX on a 7-point Likert scale. Using force and time data from button presses, we correlated force and time data to user experience and demographic information. Our results demonstrate the potential of bodily interaction metrics as a viable alternative for UX assessment in human-robot interaction, enabling real-time, embedded, and privacy-aware evaluation of user satisfaction in robotic systems. © 2025 by the authors.","embedded UX; force sensors; human-robot interaction; physical human-robot interaction; piezoresistive force sensors; privacy-aware sensing; user experience","Adult; Female; Humans; Male; Robotics; Embedded systems; Human computer interaction; Man machine systems; Presses (machine tools); User experience; User interfaces; Daily lives; Embedded UX; Force sensor; Humans-robot interactions; Physical humanrobot interaction (phri); Piezoresistive force sensors; Privacy aware; Privacy-aware sensing; Robotic systems; Users' experiences; adult; devices; female; human; male; procedures; robotics; Human robot interaction","14248220","","","Article","Final","All Open Access; Gold Open Access; Green Open Access","Scopus","2-s2.0-105021469653"
"Pedroza-Santiago E.A.; Quiroz-Ibarra J.E.; Bojorges-Valdez E.R.; Padilla-Castañeda M.Á.","Pedroza-Santiago, Enrique Antonio (58764351100); Quiroz-Ibarra, José Emilio (57224480786); Bojorges-Valdez, Erik René (16400733800); Padilla-Castañeda, Miguel Ángel (6507221438)","58764351100; 57224480786; 16400733800; 6507221438","Comparison of Manual, Automatic, and Voice Control in Wheelchair Navigation Simulation in Virtual Environments: Performance Evaluation of User and Motion Sickness","2025","Sensors","25","2","530","","","7","10.3390/s25020530","https://www.scopus.com/pages/publications/85215820359?origin=resultslist","Instituto de Investigación Aplicada y Tecnología (InIAT), Universidad Iberoamericana, Ciudad de México C.P. 01376, Dominican Republic; Departamento de Estudios en Ingeniería para la Innovación (DEII), Universidad Iberoamericana, Ciudad de México C.P. 01376, Dominican Republic; Instituto de Ciencias Aplicadas y Tecnología (ICAT), Universidad Nacional Autónoma de México, Ciudad de México C.P. 04510, Mexico","Pedroza-Santiago E.A., Instituto de Investigación Aplicada y Tecnología (InIAT), Universidad Iberoamericana, Ciudad de México C.P. 01376, Dominican Republic; Quiroz-Ibarra J.E., Instituto de Investigación Aplicada y Tecnología (InIAT), Universidad Iberoamericana, Ciudad de México C.P. 01376, Dominican Republic; Bojorges-Valdez E.R., Departamento de Estudios en Ingeniería para la Innovación (DEII), Universidad Iberoamericana, Ciudad de México C.P. 01376, Dominican Republic; Padilla-Castañeda M.Á., Instituto de Ciencias Aplicadas y Tecnología (ICAT), Universidad Nacional Autónoma de México, Ciudad de México C.P. 04510, Mexico","Mobility is essential for individuals with physical disabilities, and wheelchairs significantly enhance their quality of life. Recent advancements focus on developing sophisticated control systems for effective and efficient interaction. This study evaluates the usability and performance of three wheelchair control modes manual, automatic, and voice controlled using a virtual reality (VR) simulation tool. VR provides a controlled and repeatable environment to assess navigation performance and motion sickness across three scenarios: supermarket, museum, and city. Twenty participants completed nine tests each, resulting in 180 trials. Findings revealed significant differences in navigation efficiency, distance, and collision rates across control modes and scenarios. Automatic control consistently achieved faster navigation times and fewer collisions, particularly in the supermarket. Manual control offered precision but required greater user effort. Voice control, while intuitive, resulted in longer distances traveled and higher collision rates in complex scenarios like the city. Motion sickness levels varied across scenarios, with higher discomfort reported in the city during voice and automatic control. Participant feedback, gathered via a Likert scale questionnaire, highlighted the potential of VR simulation for evaluating user comfort and performance. This research underscores the advantages of VR-based testing for rapid prototyping and user-centered design, offering valuable insights into improving wheelchair control systems. Future work will explore adaptive algorithms to enhance usability and accessibility in real world applications. © 2025 by the authors.","daily life scenarios; immersive environments; navigation performance; navigation systems; virtual reality; voice control; wheelchair user interfaces","Adult; Algorithms; Female; Humans; Male; Motion Sickness; Persons with Disabilities; User-Computer Interface; Virtual Reality; Voice; Wheelchairs; Young Adult; Adaptive control systems; Disease control; Rapid prototyping; Risk management; Usability engineering; User centered design; Virtual environments; Control modes; Daily life scenario; Daily lives; Immersive environment; Motion sickness; Navigation performance; Voice control; Wheelchair control; Wheelchair user interface; Wheelchair users; adult; algorithm; comparative study; computer interface; disabled person; female; human; male; motion sickness; pathophysiology; physiology; prevention and control; virtual reality; voice; wheelchair; young adult; Adaptive algorithms","14248220","","","Article","Final","All Open Access; Gold Open Access; Green Open Access","Scopus","2-s2.0-85215820359"
"Monroy Rodríguez G.; Mendoza S.; Sánchez-Adame L.M.; Valdespin-Garcia I.G.; Decouchant D.","Monroy Rodríguez, Guillermo (58593180700); Mendoza, Sonia (13105758700); Sánchez-Adame, Luis Martín (57203842913); Valdespin-Garcia, Ivan Giovanni (58592739700); Decouchant, Dominique (6602352648)","58593180700; 13105758700; 57203842913; 58592739700; 6602352648","Wearable and Pervasive Architecture for Digital Companions in Chronic Disease Care","2024","Lecture Notes in Computer Science (including subseries Lecture Notes in Artificial Intelligence and Lecture Notes in Bioinformatics)","14719 LNCS","","","68","85","2","10.1007/978-3-031-60012-8_5","https://www.scopus.com/pages/publications/85196098372?origin=resultslist","Computer Science Department, CINVESTAV-IPN, Av. Instituto Politécnico Nacional 2508, San Pedro Zacatenco, Gustavo A. Madero Mexico City, 07360, Mexico; Design and Building Division, FES-Acatlán, UNAM, Av. Jardines de San Mateo s/n, State of Mexico, Sta. Cruz Acatlán, Naucalpan de Juárez, 53150, Mexico; Department of Information Technologies, UAM-Cuajimalpa, Av. Vasco de Quiroga 4871, Santa Fe, Delegación Cuajimalpa, Mexico City, 05300, Mexico","Monroy Rodríguez G., Computer Science Department, CINVESTAV-IPN, Av. Instituto Politécnico Nacional 2508, San Pedro Zacatenco, Gustavo A. Madero Mexico City, 07360, Mexico; Mendoza S., Computer Science Department, CINVESTAV-IPN, Av. Instituto Politécnico Nacional 2508, San Pedro Zacatenco, Gustavo A. Madero Mexico City, 07360, Mexico; Sánchez-Adame L.M., Design and Building Division, FES-Acatlán, UNAM, Av. Jardines de San Mateo s/n, State of Mexico, Sta. Cruz Acatlán, Naucalpan de Juárez, 53150, Mexico; Valdespin-Garcia I.G., Computer Science Department, CINVESTAV-IPN, Av. Instituto Politécnico Nacional 2508, San Pedro Zacatenco, Gustavo A. Madero Mexico City, 07360, Mexico; Decouchant D., Department of Information Technologies, UAM-Cuajimalpa, Av. Vasco de Quiroga 4871, Santa Fe, Delegación Cuajimalpa, Mexico City, 05300, Mexico","Nowadays, advancements in sensor technologies, microcontrollers, and radiofrequency systems have facilitated the development of systems capable of measuring various physical parameters in diverse environments. This progression underscores the necessity for seamless integration of these systems to accomplish diverse objectives. Digital companions, epitomizing this trend, are computer-assisted systems designed to synergize with human users. They are a nexus between rigorous process efficiency, voluminous data management, and human interactions. In response to the imperative for integrating these technological and scientific innovations, a compelling proposition has emerged to develop a digital companion architecture tailored to assist patients with chronic conditions such as diabetes. This proposed architecture comprises various services, including speech recognition and biometric monitoring control. These elements are integral to the system’s ability to deliver tailored and effective responses to the user, aiming to enhance the quality of life for individuals suffering from this chronic disease. Preliminary evaluations of a prototype grounded in our architecture demonstrate a positive anticipated user experience. © The Author(s), under exclusive license to Springer Nature Switzerland AG 2024.","Diabetes; Digital Companions; Pervasive Computing; Software Architectures; User Experience; Wearable Technology","Diseases; Information management; Software architecture; Speech recognition; User interfaces; Wearable computers; Chronic disease; Digital companion; Microcontroller systems; Pervasive architecture; Physical parameters; Radio frequency systems; Seamless integration; Sensor technologies; Technology system; Users' experiences; Ubiquitous computing","03029743","978-303160011-1","","Conference paper","Final","","Scopus","2-s2.0-85196098372"
