"Authors","Author full names","Author(s) ID","Title","Year","Source title","Volume","Issue","Art. No.","Page start","Page end","Cited by","DOI","Link","Affiliations","Authors with affiliations","Abstract","Author Keywords","Index Keywords","ISSN","ISBN","CODEN","Document Type","Publication Stage","Open Access","Source","EID"
"Lefranc G.; Schleyer G.; Osorio-Comparán R.; López-Juárez I.","Lefranc, Gastón (7005019896); Schleyer, Gustavo (57195511304); Osorio-Comparán, Román (24470341200); López-Juárez, Ismael (6507474784)","7005019896; 57195511304; 24470341200; 6507474784","Towards Adaptive and Safe Human-Robot Collaboration: A Multimodal AI Framework for Cross-Domain Cobot Integration","2025","Proceedings -  IEEE CHILEAN Conference on Electrical, Electronics Engineering, Information and Communication Technologies, ChileCon","","","","","","0","10.1109/CHILECON66915.2025.11476290","https://www.scopus.com/pages/publications/105038035337?origin=resultslist","Facultad de Ingeniería, Pontificia Universidad Católica de Valparáiso, Valparaíso, Chile; Instituto de Electricidad y Electrónica, Facultad de Ciencias Universidad Austral, Chile; IIMAS, Universidad Autónoma de México UNAM, DF, México, Mexico; Robotics and Advanced Manufacturing CINVESTAV, Coah, Saltillo, Mexico","Lefranc G., Facultad de Ingeniería, Pontificia Universidad Católica de Valparáiso, Valparaíso, Chile; Schleyer G., Instituto de Electricidad y Electrónica, Facultad de Ciencias Universidad Austral, Chile; Osorio-Comparán R., IIMAS, Universidad Autónoma de México UNAM, DF, México, Mexico; López-Juárez I., Robotics and Advanced Manufacturing CINVESTAV, Coah, Saltillo, Mexico","This article presents the integration of advanced artificial intelligence algorithms applied to collaborative robots (cobots) in five strategic sectors: underground mining, geriatric medicine, precision agriculture, port logistics, and high-precision manufacturing. It proposes the use of Graph Convolutional Neural Networks (Graph-CNNs) to model spatiotemporal motion; Multimodal Transformers to fuse heterogeneous sensor data; Soft Actor-Critic with Constrained Policy Optimization (SAC-RCPO) for safe and adaptive control; and TactileGAN to generate realistic haptic feedback. Within this framework, multimodal AI improves operational efficiency, task accuracy, and the quality of human-robot interaction. In practice, it contributes to risk reduction in hazardous environments such as mining and logistics, improves accuracy in agricultural and manufacturing tasks, and fosters greater acceptance among older adults in healthcare settings. A review of existing literature and simulations in agriculture and mining confirms performance improvements and supports the feasibility of integrating algorithms into collaborative robotic systems. © 2025 IEEE.","Collaborative robots; Graph-CNN; Human-robot interaction; Multimodal AI; SAC-RCPO; TactileGAN","Agricultural robots; Collaborative robots; Data mining; Graph neural networks; Haptic interfaces; Human computer interaction; Man machine systems; Mice (computer peripherals); Precision agriculture; Smart agriculture; Tactile sensors; Actor critic; Collaborative robots; Graph-CNN; Human-robot collaboration; Humans-robot interactions; Multi-modal; Multimodal AI; Policy optimization; Soft actor-critic with constrained policy optimization; Tactilegan; Intelligent robots","28321529","979-835035736-3","","Conference paper","Final","","Scopus","2-s2.0-105038035337"
"Escobedo-Muñoz A.S.; Carmona-Campos D.; Trapaga A.G.G.; Freyre-González J.A.","Escobedo-Muñoz, A.S. (57227151000); Carmona-Campos, Diego (60155356300); Trapaga, Armando G.G. (60155469200); Freyre-González, Julio A. (16635755000)","57227151000; 60155356300; 60155469200; 16635755000","How far are we from the era of big data in transcriptomics? Lessons from the bacterial data in GEO","2025","Briefings in Bioinformatics","26","5","bbaf560","","","0","10.1093/bib/bbaf560","https://www.scopus.com/pages/publications/105019728064?origin=resultslist","Regulatory Systems Biology Research Group, Program of Systems Biology, Mexico; Undergraduate Program in Genomic Sciences, Center for Genomic Sciences, Universidad Nacional Autónoma de México, Av. Universidad s/n, Col. Chamilpa, Morelos, Cuernavaca, 62210, Mexico","Escobedo-Muñoz A.S., Regulatory Systems Biology Research Group, Program of Systems Biology, Mexico, Undergraduate Program in Genomic Sciences, Center for Genomic Sciences, Universidad Nacional Autónoma de México, Av. Universidad s/n, Col. Chamilpa, Morelos, Cuernavaca, 62210, Mexico; Carmona-Campos D., Regulatory Systems Biology Research Group, Program of Systems Biology, Mexico, Undergraduate Program in Genomic Sciences, Center for Genomic Sciences, Universidad Nacional Autónoma de México, Av. Universidad s/n, Col. Chamilpa, Morelos, Cuernavaca, 62210, Mexico; Trapaga A.G.G., Regulatory Systems Biology Research Group, Program of Systems Biology, Mexico, Undergraduate Program in Genomic Sciences, Center for Genomic Sciences, Universidad Nacional Autónoma de México, Av. Universidad s/n, Col. Chamilpa, Morelos, Cuernavaca, 62210, Mexico; Freyre-González J.A., Regulatory Systems Biology Research Group, Program of Systems Biology, Mexico","The Gene Expression Omnibus (GEO) is the largest functional genomics repository, including ~5 million entries related to the main transcriptomic technologies: microarrays and RNA-seq. This amount of data has the potential to be reused in large-scale meta-analysis, such as those in bacterial systems biology, where the landscape of biological conditions is wider and more diverse than any individual experiment alone. Notwithstanding the accelerated growth in RNA-seq experiments, microarray still accounts for ~48% of bacterial transcriptomic entries in GEO, highlighting the need to revalue this data. Therefore, in this work, we assess the current state of bacterial microarray and RNA-seq data and metadata. We report diverse inconsistencies in both the GEO metadata documentation and community usage, limiting the automated access to biological context essential for high-throughput analysis interpretation. Additionally, while access to and analysis of RNA-seq data are topics widely discussed by the community, microarray data processing and normalization present challenges that need to be addressed for the proper data integration into large-scale reanalysis. Thus, we delve into the availability and processability of bacterial microarray data in GEO, showing a complex panorama where the lack of standard formats limits our reusability potential to at least 44% of the ~45 000 microarray entries. We conclude that GEO transcriptomic data and metadata should be viewed as valuable resources that require ongoing revision and maintenance. Finally, we propose a series of guidelines to enhance the Findability, Accessibility, Interoperability, and Reusability of GEO, thereby taking a step forward into the era of big data. © The Author(s) 2025. Published by Oxford University Press.","FAIR; GEO; metadata; microarrays; normalization; RNA-seq","Bacteria; Big Data; Computational Biology; Databases, Genetic; Gene Expression Profiling; Metadata; Transcriptome; transcriptome; bacterium; big data; data integration; data processing; FAIR principles; functional genomics; gene expression; high throughput analysis; meta analysis; metadata; nonhuman; review; RNA sequencing; systems biology; transcriptomics; bioinformatics; gene expression profiling; genetic database; genetics; metadata; procedures","14675463","","","Review","Final","All Open Access; Gold Open Access; Green Open Access","Scopus","2-s2.0-105019728064"
"Borunda M.; Vega A.O.; Garduno R.; Conde L.; Medina M.A.; Aparicio J.R.; Cacho L.M.; Jaramillo O.A.","Borunda, Monica (57019162600); Vega, Arturo Ortega (59895603800); Garduno, Raul (57205416152); Conde, Luis (58701234100); Medina, Manuel Adam (57458174200); Aparicio, Jeannete Ramírez (59895679800); Cacho, Lorena Magallón (59895603900); Jaramillo, O.A. (57196465754)","57019162600; 59895603800; 57205416152; 58701234100; 57458174200; 59895679800; 59895603900; 57196465754","An Intelligent Method for Day-Ahead Regional Load Demand Forecasting via Machine-Learning Analysis of Energy Consumption Patterns Across Daily, Weekly, and Annual Scales","2025","Applied Sciences (Switzerland)","15","9","4717","","","2","10.3390/app15094717","https://www.scopus.com/pages/publications/105005026427?origin=resultslist","SECIHTI, Centro Nacional de Investigación y Desarrollo Tecnológico, Tecnológico Nacional de México, Cuernavaca, 62490, Mexico; Facultad de Ciencias, Universidad Nacional Autónoma de México, Ciudad de México, 04510, Mexico; Instituto Nacional de Electricidad y Energías Limpias, Cuernavaca, 62490, Mexico; Centro Nacional de Control de Energía, Gerencia de Control Regional Oriental, Heroica Puebla de Zaragoza, 72307, Mexico; Centro Nacional de Investigación y Desarrollo Tecnológico, Tecnológico Nacional de México, Cuernavaca, 62490, Mexico; SECIHTI, Centro de Investigación en Ingeniería y Ciencias Aplicadas, Universidad Autónoma del Estado de Morelos, Cuernavaca, 62209, Mexico; Instituto de Energías Renovables, Universidad Nacional Autónoma de México, Temixco, 62590, Mexico","Borunda M., SECIHTI, Centro Nacional de Investigación y Desarrollo Tecnológico, Tecnológico Nacional de México, Cuernavaca, 62490, Mexico; Vega A.O., Facultad de Ciencias, Universidad Nacional Autónoma de México, Ciudad de México, 04510, Mexico; Garduno R., Instituto Nacional de Electricidad y Energías Limpias, Cuernavaca, 62490, Mexico; Conde L., Centro Nacional de Control de Energía, Gerencia de Control Regional Oriental, Heroica Puebla de Zaragoza, 72307, Mexico; Medina M.A., Centro Nacional de Investigación y Desarrollo Tecnológico, Tecnológico Nacional de México, Cuernavaca, 62490, Mexico; Aparicio J.R., SECIHTI, Centro de Investigación en Ingeniería y Ciencias Aplicadas, Universidad Autónoma del Estado de Morelos, Cuernavaca, 62209, Mexico; Cacho L.M., SECIHTI, Centro de Investigación en Ingeniería y Ciencias Aplicadas, Universidad Autónoma del Estado de Morelos, Cuernavaca, 62209, Mexico; Jaramillo O.A., Instituto de Energías Renovables, Universidad Nacional Autónoma de México, Temixco, 62590, Mexico","Electric power load forecasting is essential for the efficient operation and strategic planning of utilities. Decisions regarding the electric market, power generation, load management, and infrastructure development all rely on accurate load predictions. This work presents a novel methodology for day-ahead load forecasting. The approach employs a long short-term memory neural network (LSTM NN) trained on representative load and meteorological data from the region. Before training, the load dataset is grouped by its statistical seasonality through K-means clustering analysis. Clustering load demand, along with similar-day data management, enables more focused training of the LSTM network on uniform data subsets, enhancing the model’s ability to capture temporal patterns and reducing the complexity associated with high variability in demand data. A case study using hourly load demand time-series data provided by the Centro Nacional de Control de Energía (CENACE) is analyzed, and the mean absolute percentage error (MAPE) is calculated, showing lower MAPE than traditional methods. This hybrid approach demonstrates the potential of integrating clustering techniques with neural networks and representative meteorological data from the region to achieve more reliable and accurate regional day-ahead load forecasting. © 2025 by the authors.","clustering; day-ahead forecasting; hourly electrical load forecasting; K-means; LSTM NN; seasonality; similar days","Information management; K-means clustering; Strategic planning; Clusterings; Day-ahead; Day-ahead forecasting; Electrical load forecasting; Hourly electrical load forecasting; K-means; Long short-term memory neural network; Neural-networks; Seasonality; Short term memory; Similar day; Electric load forecasting","20763417","","","Article","Final","All Open Access; Gold Open Access; Green Open Access","Scopus","2-s2.0-105005026427"
"Teófilo-Salvador E.; Ambrocio-Cruz P.; Rosado-Solís M.","Teófilo-Salvador, Eduardo (57205366954); Ambrocio-Cruz, Patricia (6603100816); Rosado-Solís, Margarita (60023117900)","57205366954; 6603100816; 60023117900","Methodological Characterization and Computational Codes in the Simulation of Interacting Galaxies: Image Evaluation with CNN","2025","Artificial Intelligence and Applications","3","3","","262","274","0","10.47852/bonviewAIA3202743","https://www.scopus.com/pages/publications/105012224225?origin=resultslist","Tlahuelilpan High School, Autonomous University of the State of Hidalgo, Mexico; Institute of Astronomy, National Autonomous University of Mexico, Mexico","Teófilo-Salvador E., Tlahuelilpan High School, Autonomous University of the State of Hidalgo, Mexico; Ambrocio-Cruz P., Tlahuelilpan High School, Autonomous University of the State of Hidalgo, Mexico; Rosado-Solís M., Institute of Astronomy, National Autonomous University of Mexico, Mexico","Currently, technological development has exponentially fostered a growing collection of dispersed and diversified information. In the case of galaxy interaction studies, it is important to identify and recognize the parameters in the process, the tools, and the computational codes available to select the appropriate one in depending on the availability of data. The objective was to characterize the parameters, techniques, and methods developed, as well as the computational codes for numerical simulation by implementing Convolutional Neural Network; with information retrieval, image and video analysis and pattern recognition. From the bibliography, it was reviewed how various authors have studied the interaction, presence of gas and star formation, and then the review of computer codes with the requirements and benefits, to analyze and compare the initial and boundary conditions. With images, the convolutional neural network (CNN) method programmed in python was applied to identify the differences and their possible accuracy. Smoothed Particle Hydrodynamics systems use more robust algorithms with invariance, simplicity in implementation, flexible geometries, but do not parameterize artificial viscosities, discontinuous solutions, and instabilities. In the case of adaptive mesh refinement, there is no artificial viscosity, resolution of discontinuities, and suppression of instabilities but with complex implementation, mesh details, and resolution problems, and they are not scalable. It is necessary to use indirect methods to infer some properties or perform preliminary iterations. The availability of observable data governs the behavior of possible numerical simulations, in addition to having tools such as a supercomputer, generating errors that can be adjusted, compared, or verified, according to the techniques and methods shown in this study, in addition to the fact that codes that are not so well known and used stand out as those that are currently more applied. Thus, CNN enables pattern recognition, based on the recovery and analysis of images and videos, as well as simulations of interacting galaxies. © The Author(s) 2023.","computer code; galaxy pairs; numerical simulation; spectroscopy","","28110854","","","Article","Final","All Open Access; Gold Open Access","Scopus","2-s2.0-105012224225"
"Acuña-Jiménez D.A.; Rodríguez-Zúñiga J.; Gutiérrez-Ramírez D.; Quesada-Grosso R.; Conejo-López V.; Arce-Villalobos K.; Zamora W.J.; Medina-Franco J.L.","Acuña-Jiménez, Daniel A. (58565418500); Rodríguez-Zúñiga, Jose (60093711400); Gutiérrez-Ramírez, Daniela (60093854500); Quesada-Grosso, Ricardo (59547258400); Conejo-López, Valery (57946899900); Arce-Villalobos, Kelvin (57833016100); Zamora, William J. (57193581512); Medina-Franco, José L. (57119398400)","58565418500; 60093711400; 60093854500; 59547258400; 57946899900; 57833016100; 57193581512; 57119398400","Natural Products Repository of Costa Rica (NAPRORE-CR): An Open-Access Database","2025","Journal of Chemical Information and Modeling","65","19","","10269","10288","1","10.1021/acs.jcim.5c01552","https://www.scopus.com/pages/publications/105018623593?origin=resultslist","DIFACQUIM Research Group, Department of Pharmacy, School of Chemistry, Universidad Nacional Autónoma de México, Avenida Universidad 3000, Mexico City, 04510, Mexico; CBio3 Laboratory, School of Chemistry, University of Costa Rica, San Pedro José, San, 11501, Costa Rica; Laboratory of Computational Toxicology, Biological Testing Laboratory (LEBi), University of Costa Rica, San Pedro José, San, 11501, Costa Rica; Advanced Computing Lab (CNCA), National High Technology Center (CeNAT), Pavas José, San, 11501, Costa Rica","Acuña-Jiménez D.A., DIFACQUIM Research Group, Department of Pharmacy, School of Chemistry, Universidad Nacional Autónoma de México, Avenida Universidad 3000, Mexico City, 04510, Mexico; Rodríguez-Zúñiga J., CBio3 Laboratory, School of Chemistry, University of Costa Rica, San Pedro José, San, 11501, Costa Rica; Gutiérrez-Ramírez D., CBio3 Laboratory, School of Chemistry, University of Costa Rica, San Pedro José, San, 11501, Costa Rica; Quesada-Grosso R., CBio3 Laboratory, School of Chemistry, University of Costa Rica, San Pedro José, San, 11501, Costa Rica; Conejo-López V., CBio3 Laboratory, School of Chemistry, University of Costa Rica, San Pedro José, San, 11501, Costa Rica; Arce-Villalobos K., CBio3 Laboratory, School of Chemistry, University of Costa Rica, San Pedro José, San, 11501, Costa Rica; Zamora W.J., CBio3 Laboratory, School of Chemistry, University of Costa Rica, San Pedro José, San, 11501, Costa Rica, Laboratory of Computational Toxicology, Biological Testing Laboratory (LEBi), University of Costa Rica, San Pedro José, San, 11501, Costa Rica, Advanced Computing Lab (CNCA), National High Technology Center (CeNAT), Pavas José, San, 11501, Costa Rica; Medina-Franco J.L., DIFACQUIM Research Group, Department of Pharmacy, School of Chemistry, Universidad Nacional Autónoma de México, Avenida Universidad 3000, Mexico City, 04510, Mexico","Natural products are outstanding sources of bioactive compounds with potential applications not only in drug discovery, but also in the cosmetic industry and natural pesticides. Costa Rica is among the most biologically diverse countries in terms of the number of known species per unit of area, even above conventionally considered megadiverse countries. In this work, we introduce the Natural Products Repository of Costa Rica (NAPRORE-CR), the first dedicated database that compiles structural representations and predicted properties of natural products found and/or characterized in Costa Rica. The first version of this collection comprises 1161 compounds, annotated with structural classifications, calculated structural and physicochemical properties (MW, HBD, HBA, RB, AlogP, and TPSA), and complex descriptors (SA score, QED, nSPS). The diversity and chemical space coverage of compounds in NAPRORE-CR were compared to drugs, pesticides, and cosmetics. Through the analysis and visualization of chemical space coverage and diversity, it was found that NAPRORE-CR has a property profile compatible with applications in all three fields and that its compounds are structurally similar to those of approved drugs and natural pesticides. Cross-referencing NAPRORE-CR with PubChem and ChEMBL, combined with activity predictions, facilitated the identification of both known applications of the included compounds and potential new areas of study. In favor of open science and FAIR principles for data sharing, NAPRORE-CR is freely available at 10.5281/zenodo.7858061. © 2025 The Authors. Published by American Chemical Society","","Access to Information; Biological Products; Costa Rica; Databases, Factual; Drug Discovery; Data Sharing; Database systems; Drug discovery; Drug products; Open access; Pesticides; biological product; ACCESS database; American Chemical Society; Bioactive compounds; Chemical space; Costa Rica; Drug discovery; Natural pesticides; Natural products; OpenAccess; Space coverage; access to information; chemistry; Costa Rica; drug development; factual database; Physicochemical properties","15499596","","JCISD","Article","Final","All Open Access; Green Open Access; Hybrid Gold Open Access","Scopus","2-s2.0-105018623593"
"Pérez-Romero J.; Aguilar W.","Pérez-Romero, Jesús (57219994296); Aguilar, Wendy (24437782600)","57219994296; 24437782600","Towards a Collaborative Game Designer Using the CCDSF Framework","2025","New Generation Computing","43","1","4","","","0","10.1007/s00354-024-00287-w","https://www.scopus.com/pages/publications/85211893521?origin=resultslist","Posgrado en Ciencia e Ingeniería de la Computación, Universidad Nacional Autónoma de México, Mexico City, 04510, Mexico; Department of Computer Science, Instituto de Investigaciones en Matemáticas Aplicadas y en Sistemas, Universidad Nacional Autónoma de México, Mexico City, 04510, Mexico","Pérez-Romero J., Posgrado en Ciencia e Ingeniería de la Computación, Universidad Nacional Autónoma de México, Mexico City, 04510, Mexico; Aguilar W., Department of Computer Science, Instituto de Investigaciones en Matemáticas Aplicadas y en Sistemas, Universidad Nacional Autónoma de México, Mexico City, 04510, Mexico","The Computational Creative Design Systems Framework (CCDSF) was formulated from a mixed perspective of the fields of design research and computational creativity to describe, analyze, and model Computational Creative Design Systems (CCDSs) either as autonomous agents or as collaborative systems involving two or more design agents in purely computational or human-computer interaction mode. In this paper, we present the first proof-of-concept (PoC) of the CCDSF, demonstrating the incremental construction of a human-computer collaborative CCDS for the design of puzzle-type video games. This CCDS is composed of a computational design agent that evolves through three versions—assistant, apprentice, and creative assistant—each acquiring new technical and creative capabilities and assuming roles with higher levels of collaboration. The system includes a graphical user interface (collaborative environment) that has been conceptualized, implemented, and evaluated following the principles of user interface, user experience, and interaction design. Each building block of the CCDSF was systematically designed, encompassing the top-level experience-dynamics-mechanics design schema down to the underlying perception-action strategies. While further research is needed, our collaborative CCDS, presented as a PoC of the CCDSF, demonstrates its potential to aid human designers in generating viable designs and enhancing their technical and creative performance in various ways. © The Author(s), under exclusive licence to The Japanese Society for Artificial Intelligence and Springer Nature Japan KK, part of Springer Nature 2024.","Artificial designer; Co-creativity; Computational creative design system; Framework; Puzzle video game design","Autonomous agents; Design for manufacturability; Engineering education; Game design; Integrated circuit design; Interactive computer graphics; Machine design; Artificial designer; Co-creativity; Computational creative design system; Creative design; Design systems; Framework; Game design; Puzzle video game design; Puzzle video games; System framework; Graphical user interfaces","02883635","","NGCOE","Article","Final","","Scopus","2-s2.0-85211893521"
