"Document Title",Authors,"Author Affiliations","Publication Title",Date Added To Xplore,"Publication Year","Volume","Issue","Start Page","End Page","Abstract","ISSN",ISBNs,"DOI",Funding Information,PDF Link,"Author Keywords","IEEE Terms","Mesh_Terms",Article Citation Count,Patent Citation Count,"Reference Count","License",Online Date,Issue Date,"Meeting Date","Publisher",Document Identifier
"Symmetric Cipher for Grayscale Images Based on Quantum Differential Geometry","E. Gonzalez-Ramos; L. Olvera-Martinez; M. Cedillo-Hernandez; C. Diaz-Rodriguez; L. Faustino-Morales","Instituto Politecnico Nacional, SEPI ESIME Culhuacan Ciudad de Mexico, Mexico; Instituto Politecnico Nacional, SEPI ESIME Culhuacan Ciudad de Mexico, Mexico; Instituto Politecnico Nacional, SEPI ESIME Culhuacan Ciudad de Mexico, Mexico; Instituto Politecnico Nacional, SEPI ESIME Culhuacan Ciudad de Mexico, Mexico; Facultad de Ciencias Ciudad de Mexico, Universidad Nacional Autonoma de Mexico, Mexico","2024 21st International Conference on Electrical Engineering, Computing Science and Automatic Control (CCE)","4 Dec 2024","2024","","","1","6","The increase in information technologies has generated the need to implement new methodologies to secure the exchange of information. This paper proposes a cryptographic algorithm based on the use of quantum differential geometry operators. These operators exhibit mathematical behaviors similar to quantum behavior, with the advantage that specialized equipment is not required to perform the encryption process. The algorithm is composed of two phases: In the first phase, a subkey is generated through an addition and multiplication process in Z_16 based on a user-defined key. In the second phase, three types of fundamental quantum operators are employed: creation, annihilation, and crossing, which are sequentially connected. The specific selection and configuration of these operators are based on their ability to avoid generating correlation between the data. The method proposed in this work is implemented using grayscale images, obtaining the Peak Signal-to-Noise Ratio (PSNR), the Structural Similarity Index Measure (SSIM), and the Correlation Value, in order to evaluate the fidelity and integrity of the recovered images.","2642-3766","979-8-3503-7754-5","10.1109/CCE62852.2024.10770909","","https://ieeexplore.ieee.org/stamp/stamp.jsp?arnumber=10770909","Subkey Generation;Quantum Operators;Grayscale Images;Configurable Cipher;Finite Fields","Geometry;Ciphers;Visualization;PSNR;Correlation;Quantum computing;Merging;Gray-scale;Encryption;Proposals","","","","9","IEEE","4 Dec 2024","23-25 Oct. 2024","23-25 Oct. 2024","IEEE","IEEE Conferences"
"A Reasoning System for Graded Modal Logic","R. López-Villafán; E. Bárcenas","IIMAS: Posgrado en Ciencia e lngeniería de la Computación, Universidad Nacional Autónoma de México, Mexico City, Mexico; Facultad de Ingenería: Dpto. de Computación, Universidad Nacional Autónoma de México, Mexico City, Mexico",2024 12th International Conference in Software Engineering Research and Innovation (CONISOFT),"18 Dec 2024","2024","","","228","236","In this paper, we propose a deduction system for the modal logic $\mathbf{K}$ with graded modalities, which is obtained by adding numerical constraints to the modal operators. Graded modalities can be seen as a generalization of traditional modal operators since they include numerical bounds in the modalities, thus enabling the formal treatment of more detailed expressions, such as “there are at least $n+1$ individuals satisfying a certain property”, where $n$ is a natural number. This kind of properties commonly arise in contexts such as concurrent systems: “if at least 3 processors are free, then proceed to compute the next task”, or epistemic logic:”if more than 2 people know $P$, then $P$ is known”. The system is based on the notion of tree-hypersequents. We show the system is correct, i.e. sound and complete.","","979-8-3315-3211-6","10.1109/CONISOFT63288.2024.00037","","https://ieeexplore.ieee.org/stamp/stamp.jsp?arnumber=10795561","graded modalities;proof theory;hypersequents;automated reasoning","Technological innovation;Interpolation;Program processors;Computational modeling;Syntactics;Cognition;Numerical models;Logic;Iterative methods;Formal verification","","","","21","IEEE","18 Dec 2024","28 Oct.-1 Nov. 2024","28 Oct.-1 Nov. 2024","IEEE","IEEE Conferences"
"Color Image Protection via Quantum Encryption and HVS-Based Mini-Block Data Hiding","L. Olvera-Martinez; M. Cedillo-Hernandez; C. Diaz-Rodriguez; L. Faustinos-Morales","Instituto Politécnico Nacional Escuela Superior de Ingeniería, Mecánica y Eléctrica Unidad Culhuacan, CDMX, México; Instituto Politécnico Nacional Escuela Superior de Ingeniería, Mecánica y Eléctrica Unidad Culhuacan, CDMX, México; Instituto Politécnico Nacional Escuela Superior de Ingeniería, Mecánica y Eléctrica Unidad Culhuacan, CDMX, México; Universidad Nacional Autónoma de Mexico, CDMX, Mexico",2025 10th International Conference on Frontiers of Signal Processing (ICFSP),"29 Jan 2026","2025","","","16","20","With the growing demand for secure and efficient digital image processing, the integration of data hiding and encryption techniques has become essential to ensure both confidentiality and integrity of visual information. This paper proposes a hybrid approach that combines a low complexity steganographic scheme for binary and color images with a computationally efficient encryption technique inspired by quantum operators. In the data hiding component, an RGB channel of a color image is selected, and its least significant bit plane is extracted. This bit plane is then divided into suitable blocks, and HVS-based encoding tables are used to embed the information within these blocks, achieving high embedding capacity while preserving visual quality. In parallel, the encryption stage operates on color images and is based on a novel operator model that simulates quantum behaviors such as creation, exchange, and annihilation, enabling effective protection without requiring intensive mathematical processing. Experimental validation confirms the robustness of the combined approach through quality metrics such as PSNR, SSIM and entropy.","","979-8-3315-7442-0","10.1109/ICFSP67350.2025.11353827","Instituto Politécnico Nacional; ","https://ieeexplore.ieee.org/stamp/stamp.jsp?arnumber=11353827","Braided Quantum;Quantum Operators;Dynamic Matrices;Finite Fields","Visualization;Steganography;Signal processing algorithms;Color;Signal processing;Robustness;Real-time systems;Encryption;Data mining;Protection","","","","17","IEEE","29 Jan 2026","10-12 Sept. 2025","10-12 Sept. 2025","IEEE","IEEE Conferences"
"Quasi-PT Symmetry: A Pathway to Better Laser Performance","B. Olyaeefar; E. Karabey; E. Şeker; R. El-Ganainy; A. Demir","UNAM - Institute of Materials Science and Nanotechnology, Bilkent University, Ankara, Turkey; UNAM - Institute of Materials Science and Nanotechnology, Bilkent University, Ankara, Turkey; UNAM - Institute of Materials Science and Nanotechnology, Bilkent University, Ankara, Turkey; Department of Electrical and Computer Engineering, Saint Louis University, Saint Louis, MO, USA; UNAM - Institute of Materials Science and Nanotechnology, Bilkent University, Ankara, Turkey",2025 Conference on Lasers and Electro-Optics Europe & European Quantum Electronics Conference (CLEO/Europe-EQEC),"15 Aug 2025","2025","","","1","1","Semiconductor laser diodes (LDs) are key enablers in various applications, including optical communication, material processing, and healthcare, because of their compact size, efficiency, and ease of integration. However, increasing LD output power while preserving spatial and spectral beam quality remains a challenge, often limited by nonlinear effects and filamentation. Established solutions, such as photonic crystals in VCSELs or tapered/antiguiding designs in EELDs, boost power and beam quality but inflate fabrication complexity and cost, hindering widespread adoption. [1]. Recently, non-Hermitian photonics has emerged as a paradigm for engineering the spatial distribution of optical gain and loss. Parity-time-symmetric (PTS) lasers, in particular, can achieve single-mode operation in both longitudinal and transverse directions. More advanced approaches, combining non-Hermitian engineering, supersymmetry, and topological physics, have been proposed for large-area laser arrays, yet realistic power levels and high beam quality remain elusive, often relying on pulsed pumping or exhibiting spurious passive-waveguide emission [2], [3]. Here, we present a systematic theoretical and experimental comparison of PTS and quasi-PTS (q-PTS) EELDs (see Fig. 1). Although both architectures achieve comparable output powers under similar pumping conditions, only q-PTS lasers maintain excellent beam quality (M2 < 1.5) at power levels near 0.5 W, surpassing PTS devices (M2 ≈ 4). Moreover, power conversion efficiency remains unaffected in q-PTS structures, indicating a minimal trade-off between filtering higher-order modes and preserving overall device efficiency. Equally important, these benefits are achieved without adding complexity or additional fabrication steps beyond a conventional EELD process. These findings challenge the prevailing notion that spatial filtering must be enforced by PTS, which can introduce side lobes that degrade beam quality. Instead, q-PTS leverages stronger coupling among higher-order modes while leaving the fundamental mode unperturbed, striking an optimal balance between mode selectivity and practicality. Our results, therefore, offer a roadmap for large-area single-mode EELDs that deliver both high power and high beam quality, translating non-Hermitian concepts from proof-of-concept to real-world impact.","2833-1052","979-8-3315-1252-1","10.1109/CLEO/Europe-EQEC65582.2025.11110189","TUBITAK(grant numbers:117F361,123F158); ","https://ieeexplore.ieee.org/stamp/stamp.jsp?arnumber=11110189","","Laser theory;Filtering;Power lasers;Laser modes;Laser excitation;Complexity theory;Laser beams;Vertical cavity surface emitting lasers;Pump lasers;Power generation","","","","3","IEEE","15 Aug 2025","23-27 June 2025","23-27 June 2025","IEEE","IEEE Conferences"
"Oscillation Source Location Assisted by the O-splines Filter","R. Dominguez-Navarrete; A. Zamora; J. Ortiz-Bejar; M. R. A. Paternina","Universidad Michoacana de San Nicolás de Hidalgo, Morelia, Mexico; Universidad Michoacana de San Nicolás de Hidalgo, Morelia, Mexico; Universidad Michoacana de San Nicolás de Hidalgo, Morelia, Mexico; UNAM, Mexico City","2025 IEEE International Autumn Meeting on Power, Electronics and Computing (ROPEC)","3 Feb 2026","2025","9","","1","6","In this paper, an efficient filtering process is proposed to improve the location of oscillation sources in power systems. The proposed method is based on the multiresolution discrete-time Taylor–Fourier transform (DTTFT) designed with O-splines. This multiresolution approach employs a specific design of bandpass filters for the precise extraction of oscillatory components from measured synchrophasor signals. This allows the integration of the Taylor-Fourier filter-bank with O-splines into the well-known dissipating energy flow (DEF) method for oscillation source location, which conventionally uses the Butterworth bandpass filter. The proposed O-splines filter, combined with the DEF method, has been validated considering different scenarios of forced oscillations, where four test cases were created from the well-known Kundur two-area power system to validate the proposal. The attained results confirm that the proposal’s advantages compared with the Butterworth filter, since it exhibits an outstanding oscillation source location performance, especially at the beginning of the disturbance.","2573-0770","979-8-3315-7673-8","10.1109/ROPEC68163.2025.11354047","","https://ieeexplore.ieee.org/stamp/stamp.jsp?arnumber=11354047","","Band-pass filters;Filtering;Energy resolution;Position measurement;Power electronics;Phasor measurement units;Power systems;Proposals;Oscillators;Signal resolution","","","","22","IEEE","3 Feb 2026","12-14 Nov. 2025","12-14 Nov. 2025","IEEE","IEEE Conferences"
