Title,Author,Author affiliation,Source,Sponsor,Publisher/Repository,Volume and Issue,Pages,Issue date,Monograph title,Publication year,ISSN,E-ISSN,ISBN13,DOI,Conference name,Conference date,Conference location,Abstract,Number of references,Main Heading,Controlled/Subject terms,Uncontrolled terms,Classification code,IPC code,Treatment,Open Access type(s),Database,Copyright,Data Provider
"The Computational Power of Distributed Shared-Memory Models with Bounded-Size Registers","Delporte-Gallet, C. (1); Fauconnier, H. (1); Fraigniaud, P. (1); Rajsbaum, S. (2); Travers, C. (3) ","(1) Université Paris Cité, IRIF, France (2) UNAM, Instituto de Matematicas, Mexico (3) Université Aix-Marseille, LIS, France ","PODC '24: Proceedings of the 43rd ACM Symposium on Principles of Distributed Computing","SIGACT;SIGOPS","ACM, New York, NY, USA","","310-20","2024","","","","","979-8-4007-0668-4","10.1145/3662158.3662789","PODC '24: 43rd ACM Symposium on Principles of Distributed Computing","2024","Nantes, France","The celebrated Asynchronous Computability Theorem of Herlihy and Shavit (JACM 1999) provided a topological characterization of the tasks that are wait-free solvable by processes communicating through writing and reading shared registers. This characterization assumes the use of full-information protocols, in which each time a process writes in the shared memory, it communicates everything it learned since the beginning of the execution. Thus, each register in the shared memory is of unbounded size. Whether unbounded size registers are unavoidable for the model of computation to be universal is the central question studied in this paper. More generally, when at most t out of n processes can crash, is the model with bounded size registers universal?We show that when 1 ≤ t n/2 registers of size O(t) bits are sufficient to solve any task that is solvable by a full-information protocol. The situation is radically different when n/2 t n, which includes the wait-free case. We show that bounded registers are not universal. Specifically, we show that, for any bound f: ℕ → ℕ, and for any n > 2, there exists a task that cannot be solved by n processes communicating via registers of size f(n) bits, but is solvable by n processes using unbounded registers. The case n = 2, t = 1, where 1-resilient computing and wait-free computing coincide, does not display the same behavior. We show that any task solvable by 2 processes in the wait-free shared-memory model with unbounded-size registers can be solved by 2 processes in the wait-free shared-memory model with constant size registers.Finally, we consider the iterated shared memory model, which has played a crucial role since Herlihy and Shavit's characterization. We show that 1-bit registers (per iteration) are sufficient for solving wait-free any task that is solvable by a full-information wait-free protocol. Therefore, while the wait-free read/write shared-memory model is known to be computationally equivalent to the iterated model, this equivalence only holds if registers are unbounded.",,,"computational complexity - distributed shared memory systems - shared memory systems","1-bit registers - 1-resilient computing - Asynchronous Computability Theorem - bounded registers - bounded size registers - bounded-size registers - computational power - constant size registers - distributed shared-memory models - full-information protocol - full-information wait-free protocol - iterated model - iterated shared memory model - reading shared registers - register - unbounded registers - unbounded size registers - unbounded-size registers - wait-free case - wait-free computing coincide - wait-free shared-memory model","C4240P Parallel programming and algorithm theory - C4240C Computational complexity - C5440 Multiprocessing systems - C6120 File organisation","G06F15/16 - G06F12/00","Practical (PRA); Theoretical or Mathematical (THR)","All Open Access, Green","Inspec","Copyright 2024, The Institution of Engineering and Technology","Engineering Village"
"AI-Enhanced Supercomputing for Next-Generation Astronomical Data Processing in Latin America: A Case Study of the ALMA Observatory","Lefranc, Gastón (1); Gatica, Gabriel (2); Vásquez, Edison (3); Peña, Mario (4) ","(1) Pontificia Universidad Católica de Valparaíso, Avda. Brasil2950, Valparaíso; 2430000, Chile (2) Startup I+D+i Inteligencia Artificial, ARTIFICYAN, Viña del Mar, Chile (3) JhedAI Startup., Viña del Mar, Chile (4) IIMAS-UNAM, Ciudad de México, Mexico ","Procedia Computer Science","","Elsevier B.V.","v 266","p 150-157","2025","12th International Conference on Information Technology and Quantitative Management, ITQM 2025","2025","","18770509","","10.1016/j.procs.2025.08.019","12th International Conference on Information Technology and Quantitative Management, ITQM 2025","August 15, 2025 - August 17, 2025","","This paper presents a proposal for improving the data processing workflow within an AI-powered supercomputing framework for the Atacama Large Millimetre/submillimeter Array (ALMA) Observatory. This framework aims to reduce processing times by 40% to 60%, improve image resolution, and increase data calibration accuracy. A high-performance computing (HPC) architecture with a GPU and artificial intelligence (AI) hardware for astronomical data management is described. The importance of such infrastructure for scientific advancement in developing countries is highlighted by analyzing implementation strategies, cost-benefit analyses, and technology transfer. © 2025 The Authors.","28","Radio astronomy","Computer architecture - Cost benefit analysis - Data handling - Image resolution - Information management - Observatories - Supercomputers - Technology transfer","Astronomical data - Atacama Large Millimeter/sub-millimeter Array (ALMA) - Atacamum large millimeter/submillimeter array observatory - Case-studies - GPU accelerations - High-performance computing - Latin America - Performance computing - Supercomputing - Work-flows","656.2 Space Research - 716.3 Radio Systems and Equipment - 903 Information Science - 911.1 Cost Accounting - 912.2 Management - 1103.4 Digital Computers and Systems - 1104 Computer Architecture - 1106.2 Data Handling and Data Processing - 1106.3.1 Image Processing - 1302 Astronomy","",,"All Open Access, Gold","Compendex","Compilation and indexing terms, Copyright 2026 Elsevier Inc.","Engineering Village"
"Some New Results With k -Set Agreement","Delporte-Gallet, C. (1); Fauconnier, H. (1); Safir, M. (1, 2) ","(1) Institut de Recherche en Informatique Fondamentale, France (2) Université Polytechnique Mohammed VI Benguerir, College of Computing, Morocco ","Networked Systems: 12th International Conference, NETYS 2024, Proceedings. Lecture Notes in Computer Science (14783)","","Springer Nature, Berlin, Germany","","83-99","2024","","","","","978-3-031-67321-4","10.1007/978-3-031-67321-4_5","International Conference on Networked Systems","2024","Rabat, Morocco","In this article, we investigate the solvability of k -set agreement among n processes in distributed systems prone to different types of process failures. k -set agreement allows each process to propose a value and decide a value such that at most k different values are decided by the correct processes, in such a way that, if all the correct processes propose the same value v , they will decide v . We specially explore two scenarios: synchronous message-passing systems prone to up to t Byzantine failures of processes, and asynchronous shared memory systems prone to up to t crash failures. Our goal is to address the gaps left by previous works [ 4 , 8 , 15 ] in these areas. In the message passing system with Byzantine failures we enrished the system with authentication, we present an algorithm that ensures k -set agreement in only two rounds, with no constraints on the number of faults t , with k determined as k ≥ ⌊n/n - t ⌋ + 1 , and an optimal algorihtm ensuring k -set agreement in t + 1 rounds for k ≥ ⌊n/n-t⌋. While in the crash asynchronous shared memory systems, we introduce an algorithm that ensure k -set agreement when n > 2 t for k ≥ ⌊ n-t/n-2t ⌋+1, and an impossibility result for k ≤ ⌊n-t/n-2t⌋-1 .","18",,"authorisation - message passing - shared memory systems","asynchronous shared memory systems - authentication - Byzantine failures - correct processes - distributed systems - k -set agreement - optimal algorihtm - synchronous message-passing systems","C5440 Multiprocessing systems - C6130S Data security","G06F15/16 - G06F21/00","Practical (PRA)",,"Inspec","Copyright 2025, The Institution of Engineering and Technology","Engineering Village"
"A Parallel Steganography Algorithm Using a New Secret Key Generation","Al-Jarah, A.I.H. (1); Arjona, J.L.O. (2) ","(1) National Autonomous University of Mexico, Postgraduate in Science and Computing Engineering, Mexico (2) Mathematics department, Science faculty National Autonomous University of Mexico, Mexico ","2024 IEEE 15th Annual Ubiquitous Computing, Electronics & Mobile Communication Conference (UEMCON)","Smart;ICCC;IEEE;IEM;UEM","IEEE, Piscataway, NJ, USA","","356-65","2024","","","","","979-8-3315-4090-6","10.1109/UEMCON62879.2024.10754748","2024 IEEE 15th Annual Ubiquitous Computing, Electronics & Mobile Communication Conference (UEMCON)","2024","Yorktown Heights, NY, USA","Computation has mostly used parallelism for high-performance computation, and multicore processors have gained popularity because they offer better processing time. However, one of the most challenging tasks to achieve is securely exchange confidential data over the network between sender and receiver. The research work in this paper explains how secret key steganography, combined with parallel processing, is utilized to conceal secret data within an image. The proposed algorithm describes and focuses on the generation method of a secret key while merging it with the Least Significant Bit (LSB) algorithm to achieve robustness, as well as parallel computing to improve the processing time in both the encoding/decoding phases. The proposed algorithm adds another layer of security by adding a robustness parameter (secret key), convenient for keeping secret, confidential, and crucial data. Parallel processing, combined with the new method to formulate the secret key is the novelty and strongest attribute of the proposed algorithm. When parallel computing is applied, the process speeds up compared with the same algorithm in the sequential version. The results are compared with the LSB algorithm in terms of the peak signal to noise ratio (PSNR) and mean square error (MSE) values, aspiring to present that the proposed algorithm adds robustness without affecting image imperceptibility.","18",,"image coding - mean square error methods - multiprocessing systems - parallel processing - steganography","confidential, data - crucial data - generation method - high-performance computation - Least Significant Bit algorithm - LSB algorithm - new secret key generation - parallel computing - parallel processing - parallel steganography algorithm - parallelism - processing time - robustness parameter - secret data - secret key steganography - securely exchange confidential data","C5260B Computer vision and image processing techniques - B6120D Cryptography - C6130S Data security - B6135C Image and video coding","H04L9/00 - G06T - G06F21/00 - G06T9/00","Practical (PRA); Theoretical or Mathematical (THR)",,"Inspec","Copyright 2024, The Institution of Engineering and Technology","Engineering Village"
"A speedup theorem for asynchronous computation with applications to consensus and approximate agreement","Fraigniaud, P. (1); Paz, A. (2); Rajsbaum, S. (3) ","(1) Université Paris Cité, France (2) Université Paris-Saclay, France (3) Universidad Nacional Autonoma de Mexico, Instituto de Matemáticas, Mexico ","Distributed Computing","","Springer Nature, Germany","v 38, n 3","163-83","Sept 2025","","","1432-0452","","","10.1007/s00446-025-00480-0","","","","We study two fundamental problems of distributed computing, consensus and approximate agreement, through a novel approach for proving lower bounds and impossibility results, that we call the asynchronous speedup theorem. For a given n-process task Π and a given computational model M, we define a new task, called the closure of Π with respect to M. The asynchronous speedup theorem states that if a task Π is solvable in t≥1 rounds in M, then its closure w.r.t. M is solvable in t-1 rounds in M. We prove this theorem for iterated models, as long as the model allows solo executions. We illustrate the power of our asynchronous speedup theorem by providing a new proof of the wait-free impossibility of consensus using read/write registers, and a new proof of the wait-free impossibility of solving consensus using registers and test&set objects for n>2. The proof is merely by showing that, in each case, the closure of consensus (w.r.t. the corresponding model) is consensus itself. Our main application is the study of the power of additional objects, namely test&set and binary consensus, for wait-free solving approximate agreement faster. By analyzing the closure of approximate agreement w.r.t. each of the two models, we show that while these objects are more powerful than read/write registers from the computability perspective, they are not more powerful as far as helping solving approximate agreement faster is concerned.","39",,"computational complexity - concurrency theory - distributed algorithms - multi-agent systems - theorem proving","approximate agreement - asynchronous computation - asynchronous speedup theorem states - binary consensus - computability perspective - consensus closure - distributed computing - n-process task - read/write registers - wait-free impossibility - wait-free solving approximate agreement","C4240C Computational complexity - C4240P Parallel programming and algorithm theory","","Theoretical or Mathematical (THR)","All Open Access, Hybrid Gold","Inspec","Copyright 2026, The Institution of Engineering and Technology","Engineering Village"
"Static Data Race Detection via Lazy Sequentialization","Fischer, B. (1); Garbi, G. (2, 3); La Torre, S. (3); Parlato, G. (2); Schrammel, P. (4) ","(1) Stellenbosch University, South Africa (2) University of Molise, Italy (3) University of Salerno, Italy (4) Diffblue Ltd, United Kingdom ","Networked Systems: 12th International Conference, NETYS 2024, Proceedings. Lecture Notes in Computer Science (14783)","","Springer Nature, Berlin, Germany","","124-41","2024","","","","","978-3-031-67321-4","10.1007/978-3-031-67321-4_8","International Conference on Networked Systems","2024","Rabat, Morocco","We present a new symbolic static data race detection algorithm, which is defined as a code-to-code translation that injects code to monitor any accesses to shared memory locations. We implemented this algorithm in the LaDR tool as an extension of an existing lazy sequentialization schema which works well when used in tandem with bounded model checkers. We evaluated LaDR on the benchmarks from the data race demonstration category of SV-COMP 2024, and on safestack, a lock-free data structure that contains a rare ABA-related bug. LaDR finds more data races than all other tools participating in SV-COMP 2024, and is the only tool that can find a data race in safestack.","31",,"data structures - program debugging - program diagnostics - program verification","bounded model checkers - code-to-code translation - data race demonstration category - existing lazy sequentialization schema - LaDR tool - lock-free data structure - shared memory locations - SV-COMP 2024 - symbolic static data race detection algorithm","C6110F Formal methods - C6120 File organisation - C6150G Diagnostic, testing, debugging and evaluating systems - C6190P Parallel software","G06F9/44 - G06F12/00 - G06F9/46 - G06F11/36","Practical (PRA); Theoretical or Mathematical (THR)",,"Inspec","Copyright 2024, The Institution of Engineering and Technology","Engineering Village"
"A Comparative Study of Numerical Laplace Inversion Methods for HeatTransfer in Fractured Reservoirs","Martinez, V. (1); Ascencio, F. (2) ","(1) UNAM, Mexico City, Mexico (2) PEMEX, Ciudad del Carmen, Campeche, Mexico ","Proceedings of the Annual Offshore Technology Conference","","Offshore Technology Conference","","","2025","OTC 2025 - Proceedings of the Annual Offshore Technology Conference","2025","01603663","","9781959025610","10.4043/35519-MS","Offshore Technology Conference, OTC 2025","May 5, 2024 - May 8, 2024","","Some fractured geothermal systems present analytical solutions expressed in Laplace space, necessitatingthe application of numerical inversion algorithms for accurate translation to time domain. This paperconducts a comprehensive analysis of some inversion techniques applied to geothermal equations, aiming toenhance precision and efficiency in the inversion process. Selected algorithms, including Stehfest, Brančik,Euler, and den Iseger undergo evaluation based on computational performance and accuracy in capturingthe dynamic behavior of fractured geothermal systems. The study systematically compares the performanceof these algorithms through testing against benchmark cases. Results reveal diverse levels of accuracy andefficiency, providing valuable insights into their applicability across different models. Furthermore, theresearch underscores the computational advantages of utilizing Laplace space solutions, recognizing theirpragmatic benefits in addressing the inherent complexity of geothermal analytical solutions in real domain. © 2025, Offshore Technology Conference.","15","Offshore technology","Laplace transforms - Numerical methods - Petroleum reservoir evaluation - Time domain analysis","Comparatives studies - Comprehensive analysis - Fractured reservoir - Geothermal systems - Inversion algorithm - Inversion methods - Laplace space - Numerical inversion - Numerical Laplace inversion - Time domain","512.1.2 Petroleum Development Operations - 674.2 Marine Drilling Rigs and Platforms - 675 Marine Engineering - 1201 Mathematics - 1201.3 Mathematical Transformations - 1201.9 Numerical Methods","",,,"Compendex","Compilation and indexing terms, Copyright 2026 Elsevier Inc.","Engineering Village"
