Title,Author,Author affiliation,Source,Sponsor,Publisher/Repository,Volume and Issue,Pages,Issue date,Monograph title,Publication year,ISSN,E-ISSN,ISBN13,DOI,Conference name,Conference date,Conference location,Abstract,Number of references,Main Heading,Controlled/Subject terms,Uncontrolled terms,Classification code,IPC code,Treatment,Funding details,Funding text,Open Access type(s),Database,Copyright,Data Provider
"Modelling and simulation of a trickling filter bioreactor for ex-situ hydrogenotrophic methanation","Ortiz-Ricárdez, F.A. (1); Muñoz-Páez, K.M. (1); Vargas, A. (1) ","(1) UNAM, Laboratory for Research on Advanced Processes for Water Treatment, Mexico ","IFAC PapersOnLine","","Elsevier B.V., Netherlands","v 59, n 6","445-50","2025","","","2405-8963","","","10.1016/j.ifacol.2025.07.186","","","","A mathematical modelling approach for a hydrogenotrophic methanation process in a trickling filter bioreactor (TFB) is formulated and simulated. As other works have suggested, the proposed model partitions the physical space in an arbitrary number of vertical levels and uses the first Fickian diffusion law along its vertical axis and along the thickness of the biofilm layer attached to the inert bed material. The biological hydrogenotrophy reaction is modelled using Monod kinetics. According to the ideal gas law, to calculate gas flows among levels, the model approach considers the fixed amount of moles of gas in each TFB level. Simulations of the proposed model were compared to experimental results of ex-situ hydrogenotrophic methanation in a TFB. Model performance against the experimental results of the real reactor fitted remarkably well the effluent proportions within an average 2% error band in the reported best experimental case. It even surpassed real productivity by 20% on average, considering an ideal scenario in which the model formulation assumes that hydrogenotrophic methanation by archaea is the sole biological transformation. A qualitative analysis of important model parameters was crucial for fitting simulation results to real experimental data. Particularly, influent raw biogas proportions near the ideal stoichiometry for hydrogenotrophic methanation is detrimental to purity and productivity of the desired biomethane effluent. The numerical effort needed for simulations was remarkably lower than expected, given the large-sized models the approach may produce. Simulation results provided insight into possible model modifications for further discussion. All rights reserved Elsevier.","8",,"biofuel - bioreactors - biotechnology - chemical reactors - diffusion - effluents - microorganisms - stoichiometry","biological hydrogenotrophy reaction - Fickian diffusion law - gas flows - hydrogenotrophic methanation process - ideal gas law - important model parameters - large-sized models - mathematical modelling approach - model approach - model formulation - model partitions - possible model modifications - reported best experimental case - TFB level - trickling filter bioreactor - vertical levels","E0230 Environmental issues - E1525 Industrial processes - E1560 Production equipment - E3624 Fuel processing industry - E3628 Biotechnology industry","","Theoretical or Mathematical (THR)",,,"All Open Access, Gold","Inspec","Copyright 2025, The Institution of Engineering and Technology","Engineering Village"
"Wind internal shocks in a binary system","Castellanos-Ramírez, A. (1); Cantó, J. (1); Lizano, S. (2); Raga, A.C. (3); González, R.F. (2); Zapata, L.A. (2) ","(1) Universidad Nacional Autonoma de Mexico, Instituto de Astronomia, A.P. 70-264, Mexico (2) Universidad Nacional Autonoma de Mexico, Instituto de Radioastronomia y Astrofisica, Mexico (3) Universidad Nacional Autonoma de Mexico, Instituto de Ciencias Nucleares, A.P. 70-543, Mexico ","Monthly Notices of the Royal Astronomical Society","","Oxford University Press, UK","v 540, n 1","973-83","8 May 2025","","","1365-2966","","","10.1093/mnras/staf757","","","","The wind ejection velocity of a star in orbital motion in a binary system undergoes a variation along its orbit with respect to the centre of mass. Due to this time-dependent ejection velocity, the wind collides with itself, generating two-shock wave structures called working surfaces, which propagate outwards in the flow. In this work, we present both an analytic model and one-dimensional numerical simulations to describe the formation and dynamical evolution of the working surfaces, assuming an elliptic orbit for the star. In addition, the luminosity emitted by these structures, as they move away from the source, is computed. Our semi-analytic model of internal shock dynamics and numerical simulations show that two working surfaces are formed for directions near the periastron (in the range of ± 60°), which propagate with different velocities, where the faster one is produced later. These two working surfaces collide with each other, producing a single working surface. We found a good agreement between our analytic model and our numerical simulations.",,,"astrophysical jets - numerical analysis - shock waves - stellar winds","analytic model - binary system - dynamical evolution - elliptic orbit - internal shock dynamics - one-dimensional numerical simulations - orbital motion - semianalytic model - single working surface - time-dependent ejection velocity - two-shock wave structures - wind internal shocks - working surfaces collide","A4740N Shock-wave interactions - A9530L Astrophysical fluid dynamics - A9710H Stellar mass transfer","","Theoretical or Mathematical (THR)",,,"All Open Access, Gold","Inspec","Copyright 2026, The Institution of Engineering and Technology","Engineering Village"
"Anticipating synchronization in electrochemical systems","Vidal, R. (1); Escalona, J. (1); Rivera, M. (1); Flores-Rosas, A. (2); Montoya, F. (3); Roy, T. (4); Parmananda, P. (5) ","(1) Universidad Autónoma del Estado de Morelos, Centro de Investigación en Ciencias, Avenida Universidad 1001, Mexico (2) Universidad Autonoma de Chiapas, Facultad de Ciencias en Física y Matemáticas, Killometer 8, Mexico (3) Universidad Nacional Autonoma de Mexico, Departamento de Ingeniería Celular y Biocatálisis, Mexico (4) Indian Institute of Technology Mandi, School of Physical Sciences, India (5) Indian Institute of Technology Bombay, Department of Physics, India ","Physical Review E","","APS - American Physical Society, USA","v 111, n 6","064206 (6 pp.)","00 June 2025","","","2470-0053","","","10.1103/PhysRevE.111.064206","","","","The anticipating synchronization in an ensemble of electrochemical cell oscillators exhibiting chaotic dynamics is analyzed. Using a setup up of up to three oscillators, it is observed that when such systems are coupled by unidirectional delayed time terms, the slave system can anticipate the dynamics of the master system by an anticipation time of t. This anticipating time has an upper limit (critical t) beyond which the slave system can no longer predict the master's chaotic dynamics due to Lyapunov instability. In order to enhance the anticipating time, we used a chain of oscillators in a master-slave configuration (i.e., via unidirectional coupling). The experimental observations were verified by numerical simulations using appropriate model systems. These results indicate that this specific type of synchronization is prevalent in a group of coupled electrochemical oscillators despite the inherent heterogeneities and drift phenomena, making them relevant for possible applications in biological systems.","34",,"chaos - Lyapunov methods - nonlinear dynamical systems - numerical analysis - synchronisation","biological systems - chaotic dynamics - coupled electrochemical oscillators - drift phenomena - electrochemical cell oscillators - Lyapunov instability - master-slave system configuration - synchronization - unidirectional coupling - unidirectional delayed time","A0260 Numerical approximation and analysis - A0545 Theory and models of chaotic systems - A0547 Nonlinear dynamical systems and bifurcations","","Theoretical or Mathematical (THR)",,,,"Inspec","Copyright 2025, The Institution of Engineering and Technology","Engineering Village"
"A Parallel Steganography Algorithm Using a New Secret Key Generation","Al-Jarah, A.I.H. (1); Arjona, J.L.O. (2) ","(1) National Autonomous University of Mexico, Postgraduate in Science and Computing Engineering, Mexico (2) Mathematics department, Science faculty National Autonomous University of Mexico, Mexico ","2024 IEEE 15th Annual Ubiquitous Computing, Electronics & Mobile Communication Conference (UEMCON)","Smart;ICCC;IEEE;IEM;UEM","IEEE, Piscataway, NJ, USA","","356-65","2024","","","","","979-8-3315-4090-6","10.1109/UEMCON62879.2024.10754748","2024 IEEE 15th Annual Ubiquitous Computing, Electronics & Mobile Communication Conference (UEMCON)","2024","Yorktown Heights, NY, USA","Computation has mostly used parallelism for high-performance computation, and multicore processors have gained popularity because they offer better processing time. However, one of the most challenging tasks to achieve is securely exchange confidential data over the network between sender and receiver. The research work in this paper explains how secret key steganography, combined with parallel processing, is utilized to conceal secret data within an image. The proposed algorithm describes and focuses on the generation method of a secret key while merging it with the Least Significant Bit (LSB) algorithm to achieve robustness, as well as parallel computing to improve the processing time in both the encoding/decoding phases. The proposed algorithm adds another layer of security by adding a robustness parameter (secret key), convenient for keeping secret, confidential, and crucial data. Parallel processing, combined with the new method to formulate the secret key is the novelty and strongest attribute of the proposed algorithm. When parallel computing is applied, the process speeds up compared with the same algorithm in the sequential version. The results are compared with the LSB algorithm in terms of the peak signal to noise ratio (PSNR) and mean square error (MSE) values, aspiring to present that the proposed algorithm adds robustness without affecting image imperceptibility.","18",,"image coding - mean square error methods - multiprocessing systems - parallel processing - steganography","confidential, data - crucial data - generation method - high-performance computation - Least Significant Bit algorithm - LSB algorithm - new secret key generation - parallel computing - parallel processing - parallel steganography algorithm - parallelism - processing time - robustness parameter - secret data - secret key steganography - securely exchange confidential data","C5260B Computer vision and image processing techniques - B6120D Cryptography - C6130S Data security - B6135C Image and video coding","H04L9/00 - G06T - G06F21/00 - G06T9/00","Practical (PRA); Theoretical or Mathematical (THR)",,,,"Inspec","Copyright 2024, The Institution of Engineering and Technology","Engineering Village"
"Transitions to intermittent chaos in quorum sensing dynamics","Flores-Pérez, A. (1); González-Olvera, M.A. (2); Breña-Medina, V.F. (3) ","(1) Universidad Nacional Autonoma de Mexico, Faculty of Engineering, Mexico (2) Universidad Autonoma de la Ciudad de Mexico, Mexico (3) Instituto Tecnologico Autonomo de Mexico, Department of Mathematics, Mexico ","Chaos, Solitons & Fractals","","Elsevier B.V., Netherlands","v 199","116728","Oct. 2025","","","1873-2887","","","10.1016/j.chaos.2025.116728","","","","This study analyses the dynamical consequences of heterogeneous temporal delays within a quorum sensing-inspired (QS-inspired) system, specifically addressing the differential response kinetics of two sub-populations to signalling molecules. A nonlinear delay differential equation (DDE) model, predicated upon an activator-inhibitor framework, is formulated to represent the interspecies interactions. Key analytical techniques, including the derivation of the pseudo-characteristic polynomial and the determination of Hopf bifurcation criteria, are employed to investigate the stability properties of steady-state solutions. The analysis reveals the critical role of multiple, dissimilar delays in modulating system dynamics and inducing bifurcations. Numerical simulations, conducted in conjunction with analytical results, reveal the emergence of periodic self-sustained oscillations and intermittent chaotic behaviour. These observations emphasise the intricate relationship between temporal heterogeneity and the stability landscape of systems exhibiting QS-inspired dynamics. This interplay highlights the capacity for temporal variations to induce complex dynamical transitions within such systems. These findings assist to the comprehension of temporal dynamics within these and related systems, and may contribute to the development of strategies aimed at modulating intercellular communication and engineering synthetic biological systems with temporal control. All rights reserved Elsevier.","63",,"bifurcation - chaos - differential equations - nonlinear dynamical systems - numerical analysis - oscillations","activator-inhibitor framework - complex dynamical transitions - DDE - differential response kinetics - dissimilar delays - dynamical consequences - engineering synthetic biological systems - heterogeneous temporal delays - Hopf bifurcation criteria - intercellular communication - intermittent chaos - intermittent chaotic behaviour - interspecies interactions - key analytical techniques - multiple delays - nonlinear delay differential equation model - numerical simulations - periodic self-sustained oscillations - pseudocharacteristic polynomial - quorum sensing dynamics - signalling molecules - stability landscape - stability properties - steady-state solutions - system dynamics - temporal control - temporal dynamics - temporal heterogeneity - temporal variations","A0230 Function theory, analysis - A0260 Numerical approximation and analysis - A0545 Theory and models of chaotic systems - A0547 Nonlinear dynamical systems and bifurcations","","Theoretical or Mathematical (THR)",,,,"Inspec","Copyright 2026, The Institution of Engineering and Technology","Engineering Village"
"Irrigation Efficiency Using a Systems Dynamics Model: A Case Study of a Pepper Crop in La Merced - Peru","Lara Jauregui, Seleni (1); Sánchez, Oroselfia (2); Flores-De la Mota, Idalia (1); Soler Anguiano, Francisca Irene (1) ","(1) Universidad Nacional Autónoma de México, Coyoacán, CDMX; 04510, Mexico (2) Department of Chemical, Industrial and Food Engineering, Universidad Iberoamericana, Mexico City; 01219, Mexico ","Communications in Computer and Information Science","","Springer Science and Business Media Deutschland GmbH","v 2032 CCIS","p 3-18","2024","Simulation for a Sustainable Future - 11th Congress, EUROSIM 2023, Proceedings","2024","18650929","18650937","9783031684340","10.1007/978-3-031-68435-7_1","11th EUROSIM Congress on Simulation for a Sustainable Future, EUROSIM 2023","July 3, 2023 - July 5, 2023","","This paper presents a system dynamics simulation model for an irrigation system applied to bell pepper crops, integrating various components of a cropping system, including water usage and plant growth. The study focuses on Latin American regions with limited irrigation facilities, highlighting the importance of simulation techniques to analyze different levels of analysis for irrigation components, including water wastage. The increasing global population, food security, and water management concerns require innovative approaches to overcome difficulties and paradigms in crop irrigation. The simulation model proposed in this study provides insights into the irrigation system’s behavior and explores various scenarios to optimize crop yield while minimizing water wastage. Results obtained through simulation demonstrate the dynamics between irrigation time and water discarded in a crop, considering the complex behavior of living systems. The paper’s contribution highlights the value of simulation models as a powerful tool for analyzing and improving crop irrigation systems, ultimately contributing to sustainable agriculture and water management practices. © The Author(s), under exclusive license to Springer Nature Switzerland AG 2024.","23","Pepper","Irrigation","Case-studies - Irrigation efficiency - Irrigation model - Irrigation systems - Pepper crop - Simulation model - System Dynamics - System dynamics modelling - System dynamics simulation - Waters managements","821.4 Agricultural Methods - 821.5 Agricultural Products","",,,,,"Compendex","Compilation and indexing terms, Copyright 2026 Elsevier Inc.","Engineering Village"
"Optimization and performance enhancement of parabolic trough collectors using hybrid nanofluids and ANN modeling","Singh, S.K. (1); Tiwari, A.K. (2); Ajbar, W. (3) ","(1) Mechanical Engineering Department, Indian Institute of Technology (Indian School of Mines), India (2) Dr. A.P.J. Abdul Kalam Technical University, Mechanical Engineering Department, India (3) National Autonomous University of Mexico, Mexico ","Journal of the Taiwan Institute of Chemical Engineers","","Elsevier B.V., Netherlands","v 169","105984","April 2025","","","1876-1089","","","10.1016/j.jtice.2025.105984","","","","BackgroundEnhancing the performance of renewable energy systems is pivotal to overcoming global energy challenges, with parabolic trough collectors (PTC) emerging as a promising technology for harnessing solar energy. This study focuses on the numerical modeling with various nanofluids of the PTC. Many previously reported studies on hybrid nanofluids have not adequately considered the appropriate Reynolds, Prandtl numbers and temperature, raising concerns about the reliability. This study ensures proper Reynolds numbers and inlet temperature for the investigated heat transfer fluids.MethodsThe model is tested with mono (Al2O3, TiO2) and hybrid (Al2O3+TiO2) nanofluids, with thermal analysis mathematically modelled. ANN and ANNi modeling are applied in to optimize governing parameters for the collector with working fluids.FindingsTurbulence boosts heat transfer coefficient (HTC), with the hybrid nanofluid exhibiting the highest increase (86.88 %). Energy efficiency peaks at lower temperatures and fluid Reynolds numbers, while exergy efficiency rises with increasing inlet temperature and Reynolds number. The optimal performance of ANN model is achieved with four neurons in the hidden layer and a 6-4-1 architecture, with highest value of R2 (0.999513) and lowest RMSE (0.000186). GA optimization shows that lower inlet fluid temperature and Reynolds number enhance thermal efficiency. All rights reserved Elsevier.","45",,"aluminium compounds - exergy - heat transfer - nanofluidics - solar absorber-convertors - titanium compounds","Al2O3-TiO2/ss - ANN model - ANN modeling - energy efficiency - fluid Reynolds numbers - GA optimization - global energy challenges - heat transfer coefficient - heat transfer fluids - hybrid nanofluid - inlet temperature - lower inlet fluid temperature - numerical modeling - optimal performance - optimization - parabolic trough collectors - PTC - renewable energy systems - Reynolds numbers - solar energy - turbulence","E2120 Heat and thermodynamic processes (mechanical engineering) - E2130 Fluid mechanics and aerodynamics (mechanical engineering) - A4725Q Convection and heat transfer - A4760 Flows in ducts, channels, and conduits - A4785 Applied fluid mechanics - A4787 Microfluidics and nanofluidics - A8610K Solar energy - A8630S Photothermal conversion","F15D - F24S20/00","Theoretical or Mathematical (THR)",,,,"Inspec","Copyright 2025, The Institution of Engineering and Technology","Engineering Village"
