Title,Author,Author affiliation,Source,Sponsor,Publisher/Repository,Volume and Issue,Pages,Issue date,Monograph title,Publication year,ISSN,E-ISSN,ISBN13,DOI,Conference name,Conference date,Conference location,Abstract,Number of references,Main Heading,Controlled/Subject terms,Uncontrolled terms,Classification code,IPC code,Treatment,Funding details,Funding text,Open Access type(s),Database,Copyright,Data Provider
"Benchmarking thermo-hydro-mechanical models for geological barrier integrity in clay-based repositories","Simo, E. (1); De Lesquen, C. (3); Vu, M.-N. (3); Raude, S. (4); El Tabbal, G. (4); Narkuniene, A. (5); Poskas, P. (5); Collin, F. (6); Abhishek, R. (6); Song, H. (6); Gens, A. (7); Song, F. (7); Leon-Vargas, R.P. (2); Tatomir, A.-B. (8); Mánica, M. (9); Nagel, T. (1); Buchwald, J. (1) ","(1) TU Bergakademie Freiberg, Geotechnical Institute, Gustav-Zeuner-Strasse 1, Germany (2) Bundesgesellschaft für Endlagerung, Eschenstrasse 55, Germany (3) ANDRA, 1/7 rue Jean Monnet, France (4) EDF R&D, 7 Bvd Gaspard Monge, France (5) Lithuanian Energy Institute, 3 Breslaujos str., 44403, Lithuania (6) Universite de Liege, Urban and Environmental Engineering Research Unit, Belgium (7) Universitat Politècnica de Catalunya, Department of Civil and Environmental Engineering, Jordi Girona 1-3, Spain (8) BGE mbH, Eschenstrasse 55, Germany (9) Universidad Nacional Autonoma de Mexico, Institute of Engineering, Mexico ","Acta Geotechnica","","Springer Nature, Germany","v 20, n 10","5407-25","Oct. 2025","","","1861-1133","","","10.1007/s11440-025-02683-y","","","","This study investigates the thermo-hydro-mechanical (THM) behavior of argillaceous formations, particularly the Callovo-Oxfordian (COx) claystone, over extended timescales to evaluate the long-term safety of radioactive waste repositories. Numerical simulations were performed as part of a benchmark exercise to study the response of the COx formation under heating scenarios representative of high-level radioactive waste disposal. Six modeling teams from various institutions participated in this benchmark, using various numerical codes, providing valuable information on the evolution of temperature, pore water pressure, and stresses within the repository environment, particularly around the disposal cells. The results highlight that the COx formation exhibits significant thermal pressurization and stress relaxation because of its low permeability, whereas the excavation damaged zone (EDZ) remains confined to the near field and does not extend significantly under the thermal load considered. The study demonstrates the robustness of numerical tools for repository safety assessments and emphasizes the importance of validated THM formulations to ensure long-term containment of radioactive waste.","45",,"clay - geotechnical engineering - numerical analysis - permeability - radioactive waste repositories - radioactive waste storage - rocks - stress analysis - stress relaxation","argillaceous formations - benchmark exercise - benchmarking thermo-hydro-mechanical models - clay-based repositories - disposal cells - EDZ - excavation damaged zone - exhibits significant thermal pressurization - extended timescales - geological barrier integrity - heating scenarios representative - high-level radioactive waste disposal - long-term containment - long-term safety - modeling teams - numerical codes - numerical simulations - numerical tools - pore water pressure - radioactive waste repositories - repository environment - repository safety assessments - stress relaxation - thermal load - validated THM formulations","A0260 Numerical approximation and analysis - A2842K Radioactive wastes from fission reactors - A2875M Radioactive waste disposal and storage - A8675T Waste disposal (environmental science technology) - A9160B Mechanical and acoustic properties of rocks, minerals and soil - A9165 Geophysical aspects of geology and mineralogy","G21F9/00 - G21F9/20","Practical (PRA); Theoretical or Mathematical (THR)",,,"All Open Access, Hybrid Gold","Inspec","Copyright 2026, The Institution of Engineering and Technology","Engineering Village"
"Investigating the relationship between acoustic sound and wood anatomy by coupling computed tomography and ultrasonic wave propagation","Espinoza-Herrera, R. (1); Olmos, L. (2); Arreola-Garcia, E. (1); Carrillo-Gomez, M.I. (3); Murillo-Sanchez, I.E. (4); Arteaga, D. (5) ","(1) Universidad Michoacana de San Nicolas de Hidalgo, Facultad de Ingenieria en Tecnologia de la Madera, Michoacan, Mexico (2) Universidad Michoacana de San Nicolas de Hidalgo, INICIT, Michoacan, Mexico (3) Universidad Michoacana de San Nicolas de Hidalgo, Facultad de Arquitectura, Michoacan, Mexico (4) Instituto Nacional de Bellas Artes y Literatura, Escuela de Lauderia, Mexico (5) Universidad Nacional Autonoma de Mexico, Centro de Geociencias, Mexico ","MRS Advances","","Springer Nature, Germany","v 10, n 5","683-7","May 2025","","","2059-8521","","","10.1557/s43580-025-01216-9","","","","Picea abies is the most commonly used wood species for making soundboards for high-quality stringed musical instruments. This work performs for the first time an analysis of the propagation velocity of ultrasonic waves by coupling experimental measurements with numerical flow simulations on the 3D real microstructure of Picea abies wood. X-ray microtomography allows to determine a 3D anatomical characteristics as well as to simulate fluid through the anatomical structure of Picea abies wood in its three main directions: longitudinal, tangential, and radial. Results showed that ultrasonic wave's propagation is anisotropic in the three main directions because the anatomical characteristics of woody tissue strongly influences their path. Longitudinal direction had the highest velocity values, then tangential direction and finally the lowest propagation was in the Radial one. These differences agreed with the flow numerical simulations, generated from the data provided by computed tomography.","22",,"computerised tomography - flow simulation - medical image processing - musical acoustics - musical instruments - numerical analysis - ultrasonic propagation - ultrasonic waves - wood","acoustic sound - anatomical characteristics - anatomical structure - commonly used wood species - computed tomography - flow numerical simulations - high-quality stringed musical instruments - longitudinal direction - lowest propagation - numerical flow simulations - Picea abies wood - propagation velocity - simulate fluid - tangential direction - ultrasonic wave propagation - ultrasonic waves - wood anatomy","A0260 Numerical approximation and analysis - E3614 Wood processing industry - A4375 Music and musical instruments - A4710 General fluid dynamics theory, simulation and other computational methods - C7330 Biology and medical computing - A8770E Patient diagnostic methods and instrumentation","B27 - G10 - G16B - G01N33/48","Theoretical or Mathematical (THR)",,,,"Inspec","Copyright 2025, The Institution of Engineering and Technology","Engineering Village"
"Development Of An Algorithm For Strength Training With Use Haptic Feedback And Artificial Intelligence (AI) Based Enhancement","Villegas-Jimenez, E.A. (1); Bello-Guerrero, A.H. (1); Padilla-Torres, M.D. (1); Villagomez-Venegas, L.N. (1); Chavez-Ramirez, C.S. (1) ","(1) Universidad Nacional Autonoma de Mexico, Facultad de Estudios Superiores Aragon, Mexico ","2025 5th International Conference on Electrical, Computer and Energy Technologies (ICECET)","","IEEE, Piscataway, NJ, USA","","1-6","2025","","","","","979-8-3315-3559-9","10.1109/ICECET63943.2025.11472504","2025 5th International Conference on Electrical, Computer and Energy Technologies (ICECET)","2025","Paris, France","The increasing popularity of the use of AI in everyday life has enabled the development of virtual systems for human assistance. This research proposes an implemented linear regression model with a vector of random weights, using a mean square error (MSE), based cost function and regularisation and corresponding Python code that integrates AI-based haptic feedback through vibration, specifically designed to optimise weight training.The results of the simulation model analysis show how key biomechanical parameters are identified and used to improve a person's posture by adjusting technique through real-time vibrational stimuli. The development of the system involves physical benefits such as injury prevention, continuous biomechanical monitoring, adaptive programme structuring and haptic vibration feedback for immediate movement correction. Popular and accurate tools for building linguistic models are mentioned, such as machine learning, computer vision and neural networks. Technological tools such as machine learning, computer vision and neural networks, applied to process biomechanical data and trigger personalised vibrational responses, are highlighted.",,,"biomechanics - computer vision - force feedback - haptic interfaces - learning (artificial intelligence) - mean square error methods - neural nets - Python - regression analysis - vibrations","adaptive programme structuring - AI-based haptic feedback - artificial intelligence - based cost function - biomechanical data - computer vision - continuous biomechanical monitoring - corresponding python code - haptic vibration feedback - human assistance - immediate movement correction - implemented linear regression model - injury prevention - key biomechanical parameters - linguistic models - machine learning - mean square error - MSE - neural networks - random weights - real-time vibrational stimuli - simulation model analysis - trigger personalised vibrational responses - virtual systems - weight training","C1140V Regression analysis - C6264 Neural nets - C7330 Biology and medical computing","G06N3/02 - G16B - G06F8/40 - G06N20/00","Practical (PRA); Theoretical or Mathematical (THR)",,,,"Inspec","Copyright 2026, The Institution of Engineering and Technology","Engineering Village"
"Pipe roughness calibration approach for water distribution network models using a nonlinear state observer","Torres, L. (1); Jimenez-Cabas, J. (2); Ponsart, J.C. (3); Theilliol, D. (3); Jimenez-Magana, M.R. (4); Guzman, J.E.V. (1) ","(1) Universidad Nacional Autonoma de Mexico, Instituto de Ingeniería, Mexico (2) Corporacion Universitaria de la Costa, Departamento de Ciencias de la Computacion y Electronica, Colombia (3) University of Lorraine, Centre de Recherche en Automatique de Nancy, France (4) Universidad Nacional Autonoma de Mexico, FES Aragon, Mexico ","Results in Engineering","","Elsevier B.V., Netherlands","v 23","102713","2024","","","2590-1230","","","10.1016/j.rineng.2024.102713","","","","This paper introduces an online approach based on a nonlinear state observer (NSO) to calibrate the roughness of each pipe within a water distribution network (WDN) or a sector thereof. The NSO is designed to obtain the estimations of pipes' friction factors, which are then used to estimate the roughness. The core of the NSO is a dynamic WDN model formulated through a structured set of ordinary differential equations derived from fundamental physical principles and taking advantage of both graph theory and rigid water column theory. By applying a coordinate transformation, the WDN model is represented as a fully connected network of damped nonlinear oscillators, with each oscillator formulated as a Liénard system. This representation allows for estimating the friction factors for each pipe using only flow rate information. The proposed approach facilitates a continuous calibration when hydrodynamic data are readily accessible, which is a capability that empowers engineers to enhance, concurrently or proactively, the day-to-day operations of water distribution networks, such as control or diagnose tasks, whenever data are available. The results of numerical simulations are presented to illustrate the practical utility of the proposed method. All rights reserved Elsevier.","34",,"calibration - damping - design engineering - differential equations - friction - graph theory - hydrodynamics - numerical analysis - observers - oscillators - pipe flow - pipes - rigidity - surface roughness - surface topography measurement","damped nonlinear oscillators - dynamic WDN model - friction factors - graph theory - nonlinear state observer - NSO - numerical simulations - ordinary differential equations - pipe roughness calibration approach - rigid water column theory - water distribution network models","E0210L Numerical analysis - E0210E Combinatorial mathematics - E1400 Design - E1620 Measurement - E1650 Standards and calibration - E2130 Fluid mechanics and aerodynamics (mechanical engineering) - E2140 Tribology (mechanical engineering) - E2180D Vibrations and shock waves (mechanical engineering) - E2180A Elasticity (mechanical engineering) - E2200 Mechanical components, systems and devices","F15D - F16L","Practical (PRA); Theoretical or Mathematical (THR)",,,"All Open Access, Gold","Inspec","Copyright 2025, The Institution of Engineering and Technology","Engineering Village"
"Saltwater intrusion simulations in coastal karstic aquifers related to climate change scenarios","Canul-Macario, C. (1); Pacheco-Castro, R. (2, 3); Hernández-Espriú, A. (4); González-Herrera, R. (5); Salles, P. (2, 3) ","(1) Comisión Nacional del Agua, Mexico (2) Consorcio Universidad Nacional Autonoma de Mexico, Instituto de Ingeniería, Mexico (3) Laboratorio Nacional de Resiliencia, Mexico (4) UNAM, Facultad de Ingeniería, Circuito Escolar 04360, Mexico (5) Universidad Autonoma de Yucatan, Facultad de Ingeniería, Tablaje Catastral 12685, Mexico ","Environmental Earth Sciences","","Springer Nature, Germany","v 83, n 21","609 (18 pp.)","2024","","","1866-6299","","","10.1007/s12665-024-11899-2","","","","Coastal zones are crucial ecosystems supporting significant biodiversity and pertinent socio-economic activities. However, anthropogenic development contributes to socio-environmental complexities, particularly public water supply threats caused by climate change. This research presents a case study on the north-western coast of Yucatan, Mexico, which models potential saltwater intrusion in groundwater for multiple projections of sea level rise and recharge change due to climate change and its implications for the public water supply of the regional population and ecosystem. For this purpose, a previously calibrated and validated numerical model is employed, adapting its boundary conditions, keeping its calibrated hydrogeologic parameters, and considering the 2040 and 2100 climate change projections. Simulation results show that under these projections, significant saltwater intrusion may occur, reducing freshwater thickness due to increased salinity in groundwater and a loss of freshwater sources resulting from brackish-saline wedge intrusion. These scenarios are of particular concern as freshwater in this coastal region is the main source for public water supply and for freshwater input in coastal ecosystems. Moreover, this study underscores the susceptibility of karstic aquifers to salinization, especially in the face of rising sea levels, given their unique hydrogeological characteristics and substantial responsiveness to marine forcings. In spite of the uncertainties in global climate change predictions, this study enhances our understanding of the dynamics of these unique aquifers, and presents future saltwater intrusion projections that offer valuable technical insights to design and implement pertinent and resilient coastal aquifer management strategies.","89",,"boundary-value problems - climatology - ecology - geology - groundwater - numerical analysis - salinity (geophysical) - sea level - water quality - water supply","anthropogenic development contributes - biodiversity - brackish-saline wedge intrusion - climate change scenarios - coastal ecosystems - coastal karstic aquifers - coastal region - coastal zones - freshwater input - freshwater sources - freshwater thickness - future saltwater intrusion projections - global climate change predictions - groundwater - hydrogeologic parameters - karstic aquifers - marine forcings - Mexico - numerical model - public water supply threats - recharge change - resilient coastal aquifer management strategies - salinity - salinization - saltwater intrusion - saltwater intrusion simulations - sea level rise - socio-economic activities - socio-environmental complexities - Yucatan","A0230 Function theory, analysis - A0260 Numerical approximation and analysis - A9165 Geophysical aspects of geology and mineralogy - A9210H Surface waves, tides, and sea level - A9210S Coastal and estuarine oceanography - A9220C Chemistry of the oceans - A9240Q Water quality and water resources - A9240K Groundwater - A9260S Climatology - A9330H North America - A9385 Instrumentation and techniques for geophysical, hydrospheric and lower atmosphere research","G01V - E03","Bibliography (BIB); Theoretical or Mathematical (THR)",,,"All Open Access, Hybrid Gold","Inspec","Copyright 2025, The Institution of Engineering and Technology","Engineering Village"
"Seismic Behavior of Steel Beam to Box Column Connections","Santiago-Flores, Alejandro (1); Tapia-Hernández, Edgar (2) ","(1) Universidad Nacional Autónoma de México, Mexico City, Mexico (2) Materials Department, Universidad Autónoma Metropolitana, Mexico City, Mexico ","IABSE Congress San Jose 2024: Beyond Structural Engineering in a Changing World - Report","ARMABLOQUE; COWI; et al.; Freyssinet; OVM; TIS","International Association for Bridge and Structural Engineering (IABSE)","","p 105-112","2024","IABSE Congress San Jose 2024: Beyond Structural Engineering in a Changing World - Report","2024","","","9783857482052","","IABSE Congress San Jose 2024: Beyond Structural Engineering in a Changing World","September 25, 2024 - September 27, 2024","","In recent years, the use of steel elements in building constructions in seismic regions has increased. Although steel structures have generally performed well during earthquakes, their seismic vulnerability significantly depends on the performance of their components. In this research, the results of two full-scale steel beam-to-column moment connections tested under cyclic loading are discussed. The prototypes were made up of box columns and I-shaped beams with an exterior beam-to-column joint. The physical full-scale cyclic testing was corroborated through nonlinear finite element (FEA). The discussion is centered on a detailed comparison of the obtained results from the experiment and numerical simulation, including stiffness, strength, excessive local damage, ductility, and deformation capacity. Recommendations are proposed for improving the seismic behavior of steel connections. © 2024 IABSE Congress San Jose 2024: Beyond Structural Engineering in a Changing World - Report. All rights reserved.","16","Steel beams and girders","Earthquake effects - Pressure vessels - Seismic response - Steel construction - Steel structures - Structural engineering - Structural Mechanics","Box columns - Damage concentration - Experimental test - Finite element analyse - In-buildings - Non-linear modelling - Seismic behaviour - Steel beams - Steel connections - Steel elements","202.5.3 Steel - 217.5.1 Metal Structural Materials - 408 Structural Design - 408.1 Structural Members and Shapes - 484 Seismology - 484.2 Secondary Earthquake Effects - 610.2 Tanks and Accessories - 1301.1.1 Mechanics","",,"Number: -, Acronym: Conahcyt, Sponsor: Consejo Nacional de Humanidades, Ciencias y Tecnolog&iacute;as; ","The doctoral fellowship granted to the first author by the National Science and Technology Council of Mexico (Conacyt) is gratefully acknowledged. The authors gratefully acknowledge the financial support provided by the Institute for Construction Safety of Mexico City (ISC CDMX). Additionally, the authors appreciate the support of the laboratory staff of the Structures Laboratory of the National Center for Disaster Prevention (Cenapred).",,"Compendex","Compilation and indexing terms, Copyright 2026 Elsevier Inc.","Engineering Village"
"On the Approximation of the Entire Pareto Front of a Constrained Multi-objective Optimization Problem","Rodriguez-Fernandez, A.E. (1); Hernández Castellanos, C.I. (2); Schütze, O. (1) ","(1) Cinvestav, Computer Science Department, Mexico (2) Universidad Nacional Autonoma de Mexico, Instituto de Investigaciones en Matematicas Aplicadas y Sistemas, Mexico ","Evolutionary Multi-Criterion Optimization: 13th International Conference, EMO 2025. Lecture Notes in Computer Science (15513)","","Springer Nature, Berlin, Germany","","85-98","2025","","","","","978-981-96-3538-2","10.1007/978-981-96-3538-2_7","International Conference on Evolutionary Multi-Criterion Optimization","2025","Canberra, ACT, Australia","So far, many constraint-handling techniques (CHTs) exist that allow specialized multi-objective evolutionary algorithms (MOEAs) to deal with constrained multi-objective optimization problems (CMOPs). In contrast, all existing external archivers that yield certain approximation qualities in the limit still assume the feasibility of each incoming candidate solution. While this is acceptable for unconstrained or lightly constrained MOPs, this assumption is inadequate for the consideration of problems with complex domains. In this study, we make a first effort to investigate how these external archivers can be prepared for CMOPs. To this end, we discuss if and how existing CHTs can be leveraged. In this study, we consider the problem of capturing the entire Pareto front (ideally in the mathematical sense). As the base algorithm we will take ArchiveUpdate PQ that stores all non-dominated solutions found during the run of the algorithm. Our discussion and results indicate that while existing CHTs work adequately, they come with certain issues, such as introducing additional parameters that need adjustment, lacking theoretical results, or incurring a certain computational overhead. Finally, we performe a numerical analysis, integrating several MOEAs with the investigated CHTs and comparing the performance of all methods using HV and Δp as indicators.","28",,"approximation theory - evolutionary computation - Pareto optimisation","allow specialized multiobjective - approximation qualities - ArchiveUpdate PQ - CHT - CMOP - constrained multiobjective optimization problem - constraint-handling techniques - entire Pareto front - lightly constrained MOPs - unconstrained constrained MOPs","E0210L Numerical analysis - E0210G Optimisation - B0260 Optimisation techniques - B0290F Interpolation and function approximation (numerical analysis) - C1180 Optimisation techniques - C4130 Interpolation and function approximation (numerical analysis)","","Theoretical or Mathematical (THR)",,,,"Inspec","Copyright 2025, The Institution of Engineering and Technology","Engineering Village"
