Title,Author,Author affiliation,Source,Sponsor,Publisher/Repository,Volume and Issue,Pages,Issue date,Monograph title,Publication year,ISSN,E-ISSN,ISBN13,DOI,Article number,Conference name,Conference date,Conference location,Abstract,Number of references,Main Heading,Controlled/Subject terms,Uncontrolled terms,Classification code,IPC code,Treatment,Funding details,Funding text,Open Access type(s),Database,Copyright,Data Provider
AI-Enhanced Supercomputing for Next-Generation Astronomical Data Processing in Latin America: A Case Study of the ALMA Observatory,"Lefranc, Gastón (1); Gatica, Gabriel (2); Vásquez, Edison (3); Peña, Mario (4) ","(1) Pontificia Universidad Católica de Valparaíso, Avda. Brasil2950, Valparaíso; 2430000, Chile (2) Startup I+D+i Inteligencia Artificial, ARTIFICYAN, Viña del Mar, Chile (3) JhedAI Startup., Viña del Mar, Chile (4) IIMAS-UNAM, Ciudad de México, Mexico ",Procedia Computer Science,,Elsevier B.V.,v 266,p 150-157,2025,"12th International Conference on Information Technology and Quantitative Management, ITQM 2025",2025,,18770509,,10.1016/j.procs.2025.08.019,,"12th International Conference on Information Technology and Quantitative Management, ITQM 2025","August 15, 2025 - August 17, 2025",,"This paper presents a proposal for improving the data processing workflow within an AI-powered supercomputing framework for the Atacama Large Millimetre/submillimeter Array (ALMA) Observatory. This framework aims to reduce processing times by 40% to 60%, improve image resolution, and increase data calibration accuracy. A high-performance computing (HPC) architecture with a GPU and artificial intelligence (AI) hardware for astronomical data management is described. The importance of such infrastructure for scientific advancement in developing countries is highlighted by analyzing implementation strategies, cost-benefit analyses, and technology transfer. © 2025 The Authors.",28,Radio astronomy,Computer architecture - Cost benefit analysis - Data handling - Image resolution - Information management - Observatories - Supercomputers - Technology transfer,Astronomical data - Atacama Large Millimeter/sub-millimeter Array (ALMA) - Atacamum large millimeter/submillimeter array observatory - Case-studies - GPU accelerations - High-performance computing - Latin America - Performance computing - Supercomputing - Work-flows,656.2 Space Research - 716.3 Radio Systems and Equipment - 903 Information Science - 911.1 Cost Accounting - 912.2 Management - 1103.4 Digital Computers and Systems - 1104 Computer Architecture - 1106.2 Data Handling and Data Processing - 1106.3.1 Image Processing - 1302 Astronomy,,,,,"All Open Access, Gold",Compendex,"Compilation and indexing terms, Copyright 2026 Elsevier Inc.",Engineering Village
Large-Scale Validation and Analysis of the Rejection Capacity in Entropic Associative Memory,"Borquez, Angel Fernando (1); Morales, Rafael (2); Pineda, Luis A. (3) ","(1) Universidad de Sonora, Jalisco, Guadalajara, Mexico (2) Universidad de Guadalajara, Jalisco, Guadalajara, Mexico (3) Universidad Nacional Autónoma de México, Jalisco, Guadalajara, Mexico ","2025 Mexican International Conference on Computer Science, ENC 2025",,Institute of Electrical and Electronics Engineers Inc.,,,2025,"2025 Mexican International Conference on Computer Science, ENC 2025",2025,,,9798331590260,10.1109/ENC68268.2025.11311908,,"2025 Mexican International Conference on Computer Science, ENC 2025","November 10, 2025 - November 14, 2025",,"The Entropic Associative Memory (EAM) is a cognitively inspired computational model that combines probabilistic recognition with an efficient pattern storage and retrieval architecture. Previous evaluations, limited to small domains of about ten classes and a few thousand instances per class, showed promising results in classification and reconstruction. This work extends those studies in two ways. First, we assess scalability using Googles Quick, Draw! dataset, which includes over 300 classes and 100,000 instances per class. Second, we test EAMs rejection capability by storing only half of the classes and evaluating performance on the full dataset. Results confirm EAMs adaptability to large-scale scenarios and its effective rejection of novel stimuli, underscoring its potential as a robust and explainable AI model. © 2025 IEEE.",9,Scalability,Associative storage - Computation theory - Memory architecture - Statistical tests,Associative memory - Computational modelling - Entropic associative memory - Large-scales - Open-set recognition - Quick draw - Rejection - Rejection capacity - Scale analysis - Scale validation,"961 Systems Science - 1102.1 Computer Theory, Includes Computational Logic, Automata Theory, Switching Theory, Programming Theory - 1103 Computer Systems and Equipment - 1103.1 Data Storage, Equipment and Techniques - 1104 Computer Architecture - 1106 Computer Software, Data Handling and Applications - 1202.2 Mathematical Statistics",,,"Number: -, Acronym: -, Sponsor: Universidad de Guadalajara; ","The work was conducted during the first author s summer stay at the University of Guadalajara, supported by a scholarship from the Programa Delf n.",,Compendex,"Compilation and indexing terms, Copyright 2026 Elsevier Inc.",Engineering Village
A Parallel Steganography Algorithm Using a New Secret Key Generation,"Al-Jarah, A.I.H. (1); Arjona, J.L.O. (2) ","(1) National Autonomous University of Mexico, Postgraduate in Science and Computing Engineering, Mexico (2) Mathematics department, Science faculty National Autonomous University of Mexico, Mexico ","2024 IEEE 15th Annual Ubiquitous Computing, Electronics & Mobile Communication Conference (UEMCON)",Smart;ICCC;IEEE;IEM;UEM,"IEEE, Piscataway, NJ, USA",,356-65,2024,,,,,979-8-3315-4090-6,10.1109/UEMCON62879.2024.10754748,,"2024 IEEE 15th Annual Ubiquitous Computing, Electronics & Mobile Communication Conference (UEMCON)",2024,"Yorktown Heights, NY, USA","Computation has mostly used parallelism for high-performance computation, and multicore processors have gained popularity because they offer better processing time. However, one of the most challenging tasks to achieve is securely exchange confidential data over the network between sender and receiver. The research work in this paper explains how secret key steganography, combined with parallel processing, is utilized to conceal secret data within an image. The proposed algorithm describes and focuses on the generation method of a secret key while merging it with the Least Significant Bit (LSB) algorithm to achieve robustness, as well as parallel computing to improve the processing time in both the encoding/decoding phases. The proposed algorithm adds another layer of security by adding a robustness parameter (secret key), convenient for keeping secret, confidential, and crucial data. Parallel processing, combined with the new method to formulate the secret key is the novelty and strongest attribute of the proposed algorithm. When parallel computing is applied, the process speeds up compared with the same algorithm in the sequential version. The results are compared with the LSB algorithm in terms of the peak signal to noise ratio (PSNR) and mean square error (MSE) values, aspiring to present that the proposed algorithm adds robustness without affecting image imperceptibility.",18,,image coding - mean square error methods - multiprocessing systems - parallel processing - steganography,"confidential, data - crucial data - generation method - high-performance computation - Least Significant Bit algorithm - LSB algorithm - new secret key generation - parallel computing - parallel processing - parallel steganography algorithm - parallelism - processing time - robustness parameter - secret data - secret key steganography - securely exchange confidential data",C5260B Computer vision and image processing techniques - B6120D Cryptography - C6130S Data security - B6135C Image and video coding,H04L9/00 - G06T - G06F21/00 - G06T9/00,Practical (PRA); Theoretical or Mathematical (THR),,,,Inspec,"Copyright 2024, The Institution of Engineering and Technology",Engineering Village
A Comparative Study of Numerical Laplace Inversion Methods for HeatTransfer in Fractured Reservoirs,"Martinez, V. (1); Ascencio, F. (2) ","(1) UNAM, Mexico City, Mexico (2) PEMEX, Ciudad del Carmen, Campeche, Mexico ",Proceedings of the Annual Offshore Technology Conference,,Offshore Technology Conference,,,2025,OTC 2025 - Proceedings of the Annual Offshore Technology Conference,2025,01603663,,9781959025610,10.4043/35519-MS,,"Offshore Technology Conference, OTC 2025","May 5, 2024 - May 8, 2024",,"Some fractured geothermal systems present analytical solutions expressed in Laplace space, necessitatingthe application of numerical inversion algorithms for accurate translation to time domain. This paperconducts a comprehensive analysis of some inversion techniques applied to geothermal equations, aiming toenhance precision and efficiency in the inversion process. Selected algorithms, including Stehfest, Brančik,Euler, and den Iseger undergo evaluation based on computational performance and accuracy in capturingthe dynamic behavior of fractured geothermal systems. The study systematically compares the performanceof these algorithms through testing against benchmark cases. Results reveal diverse levels of accuracy andefficiency, providing valuable insights into their applicability across different models. Furthermore, theresearch underscores the computational advantages of utilizing Laplace space solutions, recognizing theirpragmatic benefits in addressing the inherent complexity of geothermal analytical solutions in real domain. © 2025, Offshore Technology Conference.",15,Offshore technology,Laplace transforms - Numerical methods - Petroleum reservoir evaluation - Time domain analysis,Comparatives studies - Comprehensive analysis - Fractured reservoir - Geothermal systems - Inversion algorithm - Inversion methods - Laplace space - Numerical inversion - Numerical Laplace inversion - Time domain,512.1.2 Petroleum Development Operations - 674.2 Marine Drilling Rigs and Platforms - 675 Marine Engineering - 1201 Mathematics - 1201.3 Mathematical Transformations - 1201.9 Numerical Methods,,,,,,Compendex,"Compilation and indexing terms, Copyright 2026 Elsevier Inc.",Engineering Village
Development Of An Algorithm For Strength Training With Use Haptic Feedback And Artificial Intelligence (AI) Based Enhancement,"Villegas-Jimenez, E.A. (1); Bello-Guerrero, A.H. (1); Padilla-Torres, M.D. (1); Villagomez-Venegas, L.N. (1); Chavez-Ramirez, C.S. (1) ","(1) Universidad Nacional Autonoma de Mexico, Facultad de Estudios Superiores Aragon, Mexico ","2025 5th International Conference on Electrical, Computer and Energy Technologies (ICECET)",,"IEEE, Piscataway, NJ, USA",,1-6,2025,,,,,979-8-3315-3559-9,10.1109/ICECET63943.2025.11472504,,"2025 5th International Conference on Electrical, Computer and Energy Technologies (ICECET)",2025,"Paris, France","The increasing popularity of the use of AI in everyday life has enabled the development of virtual systems for human assistance. This research proposes an implemented linear regression model with a vector of random weights, using a mean square error (MSE), based cost function and regularisation and corresponding Python code that integrates AI-based haptic feedback through vibration, specifically designed to optimise weight training.The results of the simulation model analysis show how key biomechanical parameters are identified and used to improve a person's posture by adjusting technique through real-time vibrational stimuli. The development of the system involves physical benefits such as injury prevention, continuous biomechanical monitoring, adaptive programme structuring and haptic vibration feedback for immediate movement correction. Popular and accurate tools for building linguistic models are mentioned, such as machine learning, computer vision and neural networks. Technological tools such as machine learning, computer vision and neural networks, applied to process biomechanical data and trigger personalised vibrational responses, are highlighted.",,,biomechanics - computer vision - force feedback - haptic interfaces - learning (artificial intelligence) - mean square error methods - neural nets - Python - regression analysis - vibrations,adaptive programme structuring - AI-based haptic feedback - artificial intelligence - based cost function - biomechanical data - computer vision - continuous biomechanical monitoring - corresponding python code - haptic vibration feedback - human assistance - immediate movement correction - implemented linear regression model - injury prevention - key biomechanical parameters - linguistic models - machine learning - mean square error - MSE - neural networks - random weights - real-time vibrational stimuli - simulation model analysis - trigger personalised vibrational responses - virtual systems - weight training,C1140V Regression analysis - C6264 Neural nets - C7330 Biology and medical computing,G06N3/02 - G16B - G06F8/40 - G06N20/00,Practical (PRA); Theoretical or Mathematical (THR),,,,Inspec,"Copyright 2026, The Institution of Engineering and Technology",Engineering Village
On the Approximation of the Entire Pareto Front of a Constrained Multi-objective Optimization Problem,"Rodriguez-Fernandez, Angel E. (1); Hernández Castellanos, Carlos Ignacio (2); Schütze, Oliver (1) ","(1) Computer Science Department, Cinvestav, Mexico City, Mexico (2) IIMAS-UNAM, Mexico City, Mexico ",Lecture Notes in Computer Science,,Springer Science and Business Media Deutschland GmbH,v 15513 LNCS,p 85-98,2025,"Evolutionary Multi-Criterion Optimization - 13th International Conference, EMO 2025, Proceedings",2025,03029743,16113349,9789819635375,10.1007/978-981-96-3538-2_7,,"13th International Conference on Evolutionary Multi-Criterion Optimization, EMO 2025","March 4, 2025 - March 7, 2025",,"So far, many constraint-handling techniques (CHTs) exist that allow specialized multi-objective evolutionary algorithms (MOEAs) to deal with constrained multi-objective optimization problems (CMOPs). In contrast, all existing external archivers that yield certain approximation qualities in the limit still assume the feasibility of each incoming candidate solution. While this is acceptable for unconstrained or lightly constrained MOPs, this assumption is inadequate for the consideration of problems with complex domains. In this study, we make a first effort to investigate how these external archivers can be prepared for CMOPs. To this end, we discuss if and how existing CHTs can be leveraged. In this study, we consider the problem of capturing the entire Pareto front (ideally in the mathematical sense). As the base algorithm we will take ArchiveUpdatePQ that stores all non-dominated solutions found during the run of the algorithm. Our discussion and results indicate that while existing CHTs work adequately, they come with certain issues, such as introducing additional parameters that need adjustment, lacking theoretical results, or incurring a certain computational overhead. Finally, we performe a numerical analysis, integrating several MOEAs with the investigated CHTs and comparing the performance of all methods using HV and Δp as indicators. © The Author(s), under exclusive license to Springer Nature Singapore Pte Ltd. 2025.",28,Constrained optimization,Consensus algorithm - Evolutionary algorithms - Multiobjective optimization - Optimization algorithms - Pareto principle,Approximation quality - Archiving - Complex domains - Constrained multi-objective optimizations - Constraint handling - Constraint-handling techniques - Multi-Objective Evolutionary Algorithm - Multi-objective optimization problem - Multi-objectives optimization - Pareto front,"1103.3 Data Communication, Equipment and Techniques - 1105.3 Blockchain Technology - 1106.1 Computer Programming - 1201.7 Optimization Techniques",,,"Number: -, Acronym: CINVESTAV, Sponsor: Centro de Investigaci&oacute;n y de Estudios Avanzados del Instituto Polit&eacute;cnico Nacional; Number: CBF2023-2024-1463, Acronym: Conahcyt, Sponsor: Consejo Nacional de Humanidades, Ciencias y Tecnolog&iacute;as; Number: -, Acronym: Conahcyt, Sponsor: Consejo Nacional de Humanidades, Ciencias y Tecnolog&iacute;as; ",O. Sch\u00FCtze acknowledges support from CONAHCYT project CBF2023-2024-1463. Angel E. Rodriguez-Fernandez acknowledges support from the CONAHCYT to pursue his postdoc fellowship at the CINVESTAV-IPN.,,Compendex,"Compilation and indexing terms, Copyright 2026 Elsevier Inc.",Engineering Village
A speedup theorem for asynchronous computation with applications to consensus and approximate agreement,"Fraigniaud, P. (1); Paz, A. (2); Rajsbaum, S. (3) ","(1) Université Paris Cité, France (2) Université Paris-Saclay, France (3) Universidad Nacional Autonoma de Mexico, Instituto de Matemáticas, Mexico ",Distributed Computing,,"Springer Nature, Germany","v 38, n 3",163-83,Sept 2025,,,1432-0452,,,10.1007/s00446-025-00480-0,,,,,"We study two fundamental problems of distributed computing, consensus and approximate agreement, through a novel approach for proving lower bounds and impossibility results, that we call the asynchronous speedup theorem. For a given n-process task Π and a given computational model M, we define a new task, called the closure of Π with respect to M. The asynchronous speedup theorem states that if a task Π is solvable in t≥1 rounds in M, then its closure w.r.t. M is solvable in t-1 rounds in M. We prove this theorem for iterated models, as long as the model allows solo executions. We illustrate the power of our asynchronous speedup theorem by providing a new proof of the wait-free impossibility of consensus using read/write registers, and a new proof of the wait-free impossibility of solving consensus using registers and test&set objects for n>2. The proof is merely by showing that, in each case, the closure of consensus (w.r.t. the corresponding model) is consensus itself. Our main application is the study of the power of additional objects, namely test&set and binary consensus, for wait-free solving approximate agreement faster. By analyzing the closure of approximate agreement w.r.t. each of the two models, we show that while these objects are more powerful than read/write registers from the computability perspective, they are not more powerful as far as helping solving approximate agreement faster is concerned.",39,,computational complexity - concurrency theory - distributed algorithms - multi-agent systems - theorem proving,approximate agreement - asynchronous computation - asynchronous speedup theorem states - binary consensus - computability perspective - consensus closure - distributed computing - n-process task - read/write registers - wait-free impossibility - wait-free solving approximate agreement,C4240C Computational complexity - C4240P Parallel programming and algorithm theory,,Theoretical or Mathematical (THR),,,"All Open Access, Hybrid Gold",Inspec,"Copyright 2026, The Institution of Engineering and Technology",Engineering Village
The Computational Power of Distributed Shared-Memory Models with Bounded-Size Registers,"Delporte-Gallet, C. (1); Fauconnier, H. (1); Fraigniaud, P. (1); Rajsbaum, S. (2); Travers, C. (3) ","(1) Université Paris Cité, IRIF, France (2) UNAM, Instituto de Matematicas, Mexico (3) Université Aix-Marseille, LIS, France ",PODC '24: Proceedings of the 43rd ACM Symposium on Principles of Distributed Computing,SIGACT;SIGOPS,"ACM, New York, NY, USA",,310-20,2024,,,,,979-8-4007-0668-4,10.1145/3662158.3662789,,PODC '24: 43rd ACM Symposium on Principles of Distributed Computing,2024,"Nantes, France","The celebrated Asynchronous Computability Theorem of Herlihy and Shavit (JACM 1999) provided a topological characterization of the tasks that are wait-free solvable by processes communicating through writing and reading shared registers. This characterization assumes the use of full-information protocols, in which each time a process writes in the shared memory, it communicates everything it learned since the beginning of the execution. Thus, each register in the shared memory is of unbounded size. Whether unbounded size registers are unavoidable for the model of computation to be universal is the central question studied in this paper. More generally, when at most t out of n processes can crash, is the model with bounded size registers universal?We show that when 1 ≤ t n/2 registers of size O(t) bits are sufficient to solve any task that is solvable by a full-information protocol. The situation is radically different when n/2 t n, which includes the wait-free case. We show that bounded registers are not universal. Specifically, we show that, for any bound f: ℕ → ℕ, and for any n > 2, there exists a task that cannot be solved by n processes communicating via registers of size f(n) bits, but is solvable by n processes using unbounded registers. The case n = 2, t = 1, where 1-resilient computing and wait-free computing coincide, does not display the same behavior. We show that any task solvable by 2 processes in the wait-free shared-memory model with unbounded-size registers can be solved by 2 processes in the wait-free shared-memory model with constant size registers.Finally, we consider the iterated shared memory model, which has played a crucial role since Herlihy and Shavit's characterization. We show that 1-bit registers (per iteration) are sufficient for solving wait-free any task that is solvable by a full-information wait-free protocol. Therefore, while the wait-free read/write shared-memory model is known to be computationally equivalent to the iterated model, this equivalence only holds if registers are unbounded.",,,computational complexity - distributed shared memory systems - shared memory systems,1-bit registers - 1-resilient computing - Asynchronous Computability Theorem - bounded registers - bounded size registers - bounded-size registers - computational power - constant size registers - distributed shared-memory models - full-information protocol - full-information wait-free protocol - iterated model - iterated shared memory model - reading shared registers - register - unbounded registers - unbounded size registers - unbounded-size registers - wait-free case - wait-free computing coincide - wait-free shared-memory model,C4240P Parallel programming and algorithm theory - C4240C Computational complexity - C5440 Multiprocessing systems - C6120 File organisation,G06F15/16 - G06F12/00,Practical (PRA); Theoretical or Mathematical (THR),,,"All Open Access, Green",Inspec,"Copyright 2024, The Institution of Engineering and Technology",Engineering Village
Integer transformation of Boolean networks and its topological implications,"Bensussen, A. (1); Álvarez-Buylla, E.R. (2); Martínez-García, J.C. (1) ","(1) Centro de Investigacion y de Estudios Avanzados del Instituto Politecnico Nacional, Departamento de Control Automático, Mexico (2) UNAM, Instituto de Ecología & C3, , Mexico ",IFAC PapersOnLine,,"Elsevier B.V., Netherlands","v 58, n 17",61-6,2024,,,2405-8963,,,10.1016/j.ifacol.2024.10.114,,,,,"Studying large-scale Boolean networks is of interest for several areas of biology. One of the simplest ways to approach this type of systems is by implementing iterative synchronous update schemes. However, the complexity of such approach grows exponentially depending on the number of nodes included in the network, being almost impossible to characterize the complete topology of networks with more than 35 nodes. Consequently, in this paper we developed an algebraic method equivalent to the synchronous update scheme able to characterize the entire topology of Boolean networks. To do this, we explored the properties of transforming n-dimensional discrete non-parameterised Boolean systems into relations defined in integers, which can be visualized in the Cartesian plane. This visualization makes then easy to explore in a systematic manner the topology of the attractor landscape. Finally, we show examples of how to implement this method for topological analysis, which opens new possibilities for modeling large Boolean networks for biology and other areas of knowledge. All rights reserved Elsevier.",11,,biology - iterative methods - synchronisation - topology,Cartesian plane - complete topology - integer transformation - iterative synchronous update schemes - large-scale Boolean networks - n-dimensional discrete nonparameterised Boolean systems - topological analysis,C1160 Combinatorial mathematics - C1290L Systems theory applications in biology and medicine - C4130 Interpolation and function approximation (numerical analysis),,Theoretical or Mathematical (THR),,,"All Open Access, Gold",Inspec,"Copyright 2025, The Institution of Engineering and Technology",Engineering Village
