Title,Author,Author affiliation,Source,Sponsor,Publisher/Repository,Volume and Issue,Pages,Issue date,Monograph title,Publication year,ISSN,E-ISSN,ISBN13,DOI,Article number,Conference name,Conference date,Conference location,Abstract,Number of references,Main Heading,Controlled/Subject terms,Uncontrolled terms,Classification code,IPC code,Treatment,Funding details,Funding text,Open Access type(s),Database,Copyright,Data Provider
Symmetry adapted DVR approach using Cartesian basis,"Suárez, E. (1); Lemus, R. (1) ","(1) UNAM, Instituto de Ciencias Nucleares, Mexico ",Physica Scripta,,"IOP Publishing, UK","v 100, n 2",025256 (18 pp.),01 Feb 2025,,,1402-4896,,,10.1088/1402-4896/adab41,,,,,"A discrete variable representation (DVR) approach in the framework of the 2D Cartesian basis is studied to take into account the symmetry of both the potential and the basis. Three cases are analyzed: a rectangular well potential, where the basis carries the symmetry of the system, the circular potential, where the DVR points are not compatible with the boundary conditions of the potential, and a quartic potential in Cartesian coordinates. A truncation method of the basis is also proposed to assure rapid convergence. The computational time and memory involved in the calculations are drastically reduced when compared to previous analysis where the symmetry was taken into account using a different approach.",49,,quantum theory - wave functions,Cartesian basis - Cartesian coordinates - circular potential - discrete variable representation approach - DVR approach - DVR points - quartic potential,"A0210 Algebra, set theory, and graph theory - A0365S Semiclassical theories and applications in quantum theory",,Theoretical or Mathematical (THR),,,"All Open Access, Hybrid Gold",Inspec,"Copyright 2025, The Institution of Engineering and Technology",Engineering Village
'A Cooperative Multi Indicator-Based Ant Colony Optimization Algorithm for the MOGenConVRP',"Velázquez Cruz, R.F. (1); Hernández Castellanos, C.I. (1) ","(1) IIMAS-UNAM, Mexico ",GECCO '23 Companion: Proceedings of the Companion Conference on Genetic and Evolutionary Computation,SIGEVO,"ACM, New York, NY, USA",,215-18,2024,,,,,979-8-4007-0495-6,10.1145/3638530.3654416,,GECCO '24 Companion: Genetic and Evolutionary Computation Conference Companion,2024,"Melbourne, VIC, Australia","Using quality indicators to guide the search on multi-objective evolutionary algorithms (MOEAs) is one of the most prominent approaches. Since quality indicators incorporate the preferences on the Pareto approximation and diversity of solutions. Recently, there has been an interest in algorithms based on the cooperation of multiple indicators, mostly using MOEAs as a baseline.We propose the Cooperative Multi Indicator-Based Ant Colony Optimization algorithm (cMIBACO). A novel algorithm based on the cooperation of three quality indicators (hypervolume, ε+, R2) to improve the diversity and avoid premature convergence to a local optimum. This algorithm uses an external archive to obtain the set of approximated solutions.We tested the algorithm against indicator-based ACOs on several instances of the Multi-objective Generalized Consistent Vehicle Routing Problem (MOGenConVRP) and investigated for statistical significance. Our experimental results show that cMIBACO has competitive results to the state-of-the-art and opens the door for further research in this direction.",,,ant colony optimisation - evolutionary computation - optimisation - Pareto optimisation - search problems - vehicle routing,approximated solutions - indicator-based ACOs - MOEAs - MOGenConVRP - MultiIndicator-Based Ant Colony Optimization algorithm - multiobjective evolutionary algorithms - Multiobjective Generalized Consistent Vehicle Routing Problem - multiple indicators - quality indicators,E0210G Optimisation - B0260 Optimisation techniques - C1160 Combinatorial mathematics - C1180 Optimisation techniques - C1290H Systems theory applications in transportation,,Theoretical or Mathematical (THR),,,,Inspec,"Copyright 2024, The Institution of Engineering and Technology",Engineering Village
Incorporation of Deep Learning Regularization in the Image Reconstruction Algorithm for a Dual-Panel PEM Scanner,"Moncada-Gutierrez, F.G. (1); Rodriguez-Villafuerte, M. (1); Alva-Sanchez, H. (1); Martinez-Davalos, A. (1) ","(1) Universidad Nacional Autonoma de Mexico, Physics Institute, Mexico ","2025 IEEE Nuclear Science Symposium (NSS), Medical Imaging Conference (MIC) and Room Temperature Semiconductor Detector Conference (RTSD)",,"IEEE, Piscataway, NJ, USA",,1-2,2025,,,,,978-1-6654-7767-3,10.1109/NSS/MIC/RTSD57106.2025.11287935,,"2025 IEEE Nuclear Science Symposium (NSS), Medical Imaging Conference (MIC) and Room Temperature Semiconductor Detector Conference (RTSD)",2025,"Yokohama, Japan","A dual-panel Positron Emission Mammography (PEM) scanner prototype is under development in our research group, and its imaging performance is currently being evaluated. The main challenge for dual-panel scanners is the presence of limited-angle artifacts, which appear in the images due to the acquisition geometry. These artifacts diminish the quality of the images, degrade the contrast of the lesions, and generate distortions in the cross-plane slices (perpendicular to the panels). To mitigate such distortions, deep learning regularization has been incorporated into the List Mode Ordered Subsets Expectation Maximization (LM-OSEM) image reconstruction algorithm. For the regularization step, a U-Net was trained with Monte-Carlo simulated data for several image quality phantoms. Data augmentation strategies were used to increase the diversity of the training data and to construct a model that generalizes more effectively to unseen data. The deep learning model was trained with 3840 pairs of cross-plane images of a dual-panel PEM scanner as input and corresponding slices from a dedicated breast-PET ring scanner as target. This approach was selected because a ring-shaped scanner does not face the limited-angle problem. The Forward-backward splitting expectation maximization (FBSEM) algorithm was implemented with the trained U-Net. This framework was applied to both MC-simulated and experimentally acquired data. In both cases, the quality of the cross-plane images was enhanced, without hampering the in-plane slices (parallel to the panels), and the enhancement in the quality of the images was quantified by image quality metrics like noise, contrast, and the Mean Absolute Error (MAE).",0,,deep learning (artificial intelligence) - expectation-maximisation algorithm - image reconstruction - mammography - medical image processing - Monte Carlo methods - phantoms - positron emission tomography,breast-PET ring scanner - cross-plane images - cross-plane slices - data augmentation - deep learning model - dual-panel PEM scanner - dual-panel positron emission mammography scanner - FBSEM algorithm - forward-backward splitting expectation maximization algorithm - image quality phantoms - in-plane slices - list mode ordered subsets expectation maximization image reconstruction algorithm - LM-OSEM image reconstruction algorithm - Monte-Carlo simulated data - ring-shaped scanner - U-Net model,"B0240Z Other topics in statistics - B0240G Monte Carlo methods - C1140Z Other topics in statistics - C1140G Monte Carlo methods - C5260B Computer vision and image processing techniques - B6135 Optical, image and video signal processing - C7330 Biology and medical computing - B7510R Nuclear medicine, emission tomography - A8760K Nuclear medicine, emission tomography - A8770E Patient diagnostic methods and instrumentation",G01T1/164 - G01N33/48 - G06T - G16B - G06N3/02 - G06N20/00 - G01T1/29,Practical (PRA); Theoretical or Mathematical (THR); Experimental (EXP),,,,Inspec,"Copyright 2026, The Institution of Engineering and Technology",Engineering Village
Generalising the team orienteering problem through multi-constraining and multi-objectives,"Gross, R. (1); Montero, E. (2); Gálvez Ramírez, N. (1); Menchaca-Méndez, A. (3) ","(1) Universidad Tecnica Federico Santa Maria, Chile (2) Universidad Tecnica Federico Santa Maria, Chile (3) Universidad Nacional Autonoma de Mexico, Mexico ",GECCO '25 Companion: Proceedings of the Genetic and Evolutionary Computation Conference Companion,SIGEVO,"ACM, New York, NY, USA",,219-22,2025,,,,,979-8-4007-1464-1,10.1145/3712255.3726719,,GECCO '25 Companion: Genetic and Evolutionary Computation Conference Companion,2025,"Malaga, Spain","Among all combinatorial optimization challenges, the class of routing represents a well-known set of problems whose optimized solutions can significantly improve overall solution quality. Within this set, the Orienteering Problem presents a complex challenge: finding a set of Hamiltonian paths from a selected subset of objective points within a given time frame to maximize a global score. In this paper, the Multi-constrained Team Orienteering Problem is addressed by incorporating time windows and constraints on the maximum number of categories. The inclusion of an additional objective to balance route sizes is also explored. The problem is solved by adapting the NSGA-II algorithm, incorporating an integer-based solution representation and a set of transformation operators to achieve high-quality, densely populated Pareto fronts with reduced computation times compared to complete solvers.",0,,combinatorial mathematics - genetic algorithms - mathematical operators - Pareto optimisation,combinatorial optimization - Hamiltonian paths - integer-based solution representation - multiconstrained team orienteering problem - multiobjectives - NSGA-II algorithm - objective points - Pareto fronts - reduced computation times - route sizes - solution quality - time frame - time windows - transformation operators,E0210G Optimisation - E0210E Combinatorial mathematics - B0250 Combinatorial mathematics - B0260 Optimisation techniques - C1160 Combinatorial mathematics - C1180 Optimisation techniques,,Theoretical or Mathematical (THR),,,,Inspec,"Copyright 2025, The Institution of Engineering and Technology",Engineering Village
A R2 Based Multi-objective Reinforcement Learning Algorithm,"Borrel Miller, Sofia Magdalena (1); Hernández Castellanos, Carlos Ignacio (1) ","(1) Universidad Nacional Autónoma de México, Mexico City, Mexico ",Lecture Notes in Computer Science (including subseries Lecture Notes in Artificial Intelligence and Lecture Notes in Bioinformatics),,Springer Science and Business Media Deutschland GmbH,v 14990 LNCS,p 285-289,2025,"Learning and Intelligent Optimization - 18th International Conference, LION 18, Revised Selected Papers",2025,03029743,16113349,9783031756221,10.1007/978-3-031-75623-8_22,,"18th International Conference on Learning and Intelligent Optimization, LION 2024","June 9, 2024 - June 13, 2024",,"In many real-world problems, one faces the problem of having to make decisions considering several conflicting objectives. In such problems, the solution is a set of policies rather than a single one. This leads to multi-objective reinforcement learning problems (MORL) which have not received much attention until recent years by the reinforcement learning community. In this work, we propose coupling the R2 indicator with Pareto Q-learning. The R2 indicator has been successfully used for multi-objective optimization problems making it a good candidate for MORL. We tested our approach on several problems from MO Gymnasium and compared it with HB-MORL, which uses the hypervolume indicator. Our preliminary results show that the novel algorithm obtains competitive results and that could be an interesting alternative when dealing with MORL problems. © The Author(s), under exclusive license to Springer Nature Switzerland AG 2025.",8,Contrastive Learning,Adversarial machine learning - Consensus algorithm - Deep reinforcement learning - Federated learning - Optimization algorithms,Conflicting objectives - Learning community - Learning problem - Multi objective - Multi-objective reinforcement learning - Performance indicators - R2 indicator - Real-world problem - Reinforcement learning algorithms - Reinforcement learnings,"1101.2 Machine Learning - 1101.2.1 Deep Learning - 1103.3 Data Communication, Equipment and Techniques - 1105.3 Blockchain Technology - 1106.1 Computer Programming - 1201.7 Optimization Techniques",,,"Number: IA102923, Acronym: -, Sponsor: -; ",The first and second authors acknowledge the funding from CONAHCyT\u2019s scholarship and project PAPIIT no. IA102923 respectively.,,Compendex,"Compilation and indexing terms, Copyright 2026 Elsevier Inc.",Engineering Village
