"Authors","Author full names","Author(s) ID","Title","Year","Source title","Volume","Issue","Art. No.","Page start","Page end","Cited by","DOI","Link","Affiliations","Authors with affiliations","Abstract","Author Keywords","Index Keywords","ISSN","ISBN","CODEN","Document Type","Publication Stage","Open Access","Source","EID"
"Córdova-Fraga T.; García-Pérez M.; Hernández-Rayas A.; Gómez-Solís C.; Soto-Álvarez J.A.; Oliva J.","Córdova-Fraga, Teodoro (6506905989); García-Pérez, Marysol (57406246100); Hernández-Rayas, Angélica (57194872304); Gómez-Solís, Christian (55144001300); Soto-Álvarez, José Alfredo (58117763500); Oliva, Jorge (57565073100)","6506905989; 57406246100; 57194872304; 55144001300; 58117763500; 57565073100","Bone samples’ behavior in sunlight, IR light, and temperature increase with FEM simulation","2024","Medical and Biological Engineering and Computing","62","1","","225","236","3","10.1007/s11517-023-02929-5","https://www.scopus.com/pages/publications/85173023443?origin=resultslist","Departamento de Ingeniería Física - DCI, Universidad de Guanajuato Campus León Loma del Bosque 103, Lomas del Campestre, GTO, León, 37150, Mexico; Centro de Física Aplicada y Tecnología Avanzada, Universidad Nacional Autónoma de México, Querétaro, Juriquilla, 76230, Mexico","Córdova-Fraga T., Departamento de Ingeniería Física - DCI, Universidad de Guanajuato Campus León Loma del Bosque 103, Lomas del Campestre, GTO, León, 37150, Mexico; García-Pérez M., Departamento de Ingeniería Física - DCI, Universidad de Guanajuato Campus León Loma del Bosque 103, Lomas del Campestre, GTO, León, 37150, Mexico; Hernández-Rayas A., Departamento de Ingeniería Física - DCI, Universidad de Guanajuato Campus León Loma del Bosque 103, Lomas del Campestre, GTO, León, 37150, Mexico; Gómez-Solís C., Departamento de Ingeniería Física - DCI, Universidad de Guanajuato Campus León Loma del Bosque 103, Lomas del Campestre, GTO, León, 37150, Mexico; Soto-Álvarez J.A., Departamento de Ingeniería Física - DCI, Universidad de Guanajuato Campus León Loma del Bosque 103, Lomas del Campestre, GTO, León, 37150, Mexico; Oliva J., Centro de Física Aplicada y Tecnología Avanzada, Universidad Nacional Autónoma de México, Querétaro, Juriquilla, 76230, Mexico","Biological and environmental factors produce biochemical processes that modify the bone structure. A few studies have attempted to show the adverse biological effects of sun radiation. The bone tissue exposures to infrared and sunlight radiation are analyzed by using focused sound, characterization spectroscopy techniques, and image processing. The study is complemented with a finite element method simulation on temperature behaviors. The crystal morphology on the bone hydroxyapatite and functional groups was characterized by X-ray diffraction and infrared spectroscopy. The infrared spectra confirmed the hydroxyl group of bovine hydroxyapatite, amines, and lipids are also correlated with modifications of the hydroxyapatite. The diffractograms showed the characteristic peaks of hydroxyapatite, with the main intensity at 2θ = 32.02°. Bone samples exposed to sun radiation presented a peak at 2θ = 27.5°, evidencing the possible formation of β-TCP y α-TCP. The analysis with the spectroscopy techniques about the structural changes in the samples suggests interpreting an increase of sound obtained by expanding the exposure time. It is possible to verify that there are some structural changes in the bone samples due to exposure to non-ionizing radiation. These results show an increase in the registered intensity sound correlated with the interpretation of the structural changes of bone. Thanks to the different novel analysis techniques established in the present study, it could establish the changes that experienced the bone structure under different sources of radiation, which will help to better detect scenarios of bone deficiency. Graphical Abstract: [Figure not available: see fulltext.] © 2023, International Federation for Medical and Biological Engineering.","Bone; Focused sound; Hydroxyapatite; Spectroscopy; Sun effect","Bone; Finite element method; Hydroxyapatite; Image processing; Infrared spectroscopy; Ionizing radiation; Mammals; Radiation effects; Spectrum analysis; Transmission control protocol; alpha tricalcium phosphate; amine; calcium phosphate; hydroxyapatite; lipid; unclassified drug; Biochemical process; Biological factors; Bone structure; Environmental factors; FEM simulations; Focused sound; IR temperature; Sun effect; Sun radiation; Temperature increase; animal experiment; Article; bone; bone structure; controlled study; cow; femur diaphysis; finite element analysis; Fourier transform infrared spectroscopy; irradiation; nonhuman; radiation exposure; sun exposure; sunlight; temperature; X ray diffraction; Amines","01400118","","MBECD","Article","Final","","Scopus","2-s2.0-85173023443"
"Reyes-Pérez P.; Hernández-Ledesma A.L.; Román-López T.V.; García-Vilchis B.; Ramírez-González D.; Lázaro-Figueroa A.; Martinez D.; Flores-Ocampo V.; Espinosa-Méndez I.M.; Tinajero-Nieto L.; Peña-Ayala A.; Morelos-Figaredo E.; Guerra-Galicia C.M.; Torres-Valdez E.; Gordillo-Huerta M.V.; Gandarilla-Martínez N.A.; Salinas-Barboza K.; Félix-Rodríguez G.; Frontana-Vázquez G.; Matuk-Pérez Y.; Estrada-Bellmann I.; Alpizar-Rodríguez D.; Rodríguez-Violante M.; Rentería M.E.; Ruíz-Contreras A.E.; Alcauter S.; Medina-Rivera A.","Reyes-Pérez, Paula (57223242483); Hernández-Ledesma, Ana Laura (57203139034); Román-López, Talía V. (55918180700); García-Vilchis, Brisa (57204693623); Ramírez-González, Diego (58146026600); Lázaro-Figueroa, Alejandra (58615479700); Martinez, Domingo (58662390400); Flores-Ocampo, Victor (58615121700); Espinosa-Méndez, Ian M. (58615479800); Tinajero-Nieto, Lizbet (57201984589); Peña-Ayala, Angélica (59533728500); Morelos-Figaredo, Eugenia (58615121600); Guerra-Galicia, Carlos M. (58616201100); Torres-Valdez, Estefania (58686259700); Gordillo-Huerta, María Vanessa (58685545000); Gandarilla-Martínez, Nadia A (57219259242); Salinas-Barboza, Karla (57212103139); Félix-Rodríguez, Guillermo (58685545100); Frontana-Vázquez, Gabriel (57221775750); Matuk-Pérez, Yamil (56330628000); Estrada-Bellmann, Ingrid (55753407300); Alpizar-Rodríguez, Deshiré (54879398800); Rodríguez-Violante, Mayela (56013663500); Rentería, Miguel E. (55533608600); Ruíz-Contreras, Alejandra E. (56000876800); Alcauter, Sarael (56013591700); Medina-Rivera, Alejandra (25958198400)","57223242483; 57203139034; 55918180700; 57204693623; 58146026600; 58615479700; 58662390400; 58615121700; 58615479800; 57201984589; 59533728500; 58615121600; 58616201100; 58686259700; 58685545000; 57219259242; 57212103139; 58685545100; 57221775750; 56330628000; 55753407300; 54879398800; 56013663500; 55533608600; 56000876800; 56013591700; 25958198400","Building national patient registries in Mexico: insights from the MexOMICS Consortium","2024","Frontiers in Digital Health","6","","1344103","","","1","10.3389/fdgth.2024.1344103","https://www.scopus.com/pages/publications/85196056045?origin=resultslist","Laboratorio Internacional de Investigación Sobre el Genoma Humano, Universidad Nacional Autónoma de México, Santiago de Querétaro, Mexico; Departamento de Neurobiología Conductual y Cognitiva, Instituto de Neurobiología, Universidad Nacional Autónoma de México, Santiago de Querétaro, Mexico; Laboratorio de Neurogenómica Cognitiva, Unidad de Investigación de Psicobiología y Neurociencias, Coordinación de Psicobiología y Neurociencias, Facultad de Psicología, Universidad Nacional Autónoma de México, Ciudad de México, Mexico; Unidad de Genómica Avanzada, Langebio, Centro de Investigación y Estudios Avanzados del Instituto Politécnico Nacional, Irapuato, Mexico; Escuela Nacional de Estudios Superiores, Unidad Juriquilla, Universidad Nacional Autónoma de México, Santiago de Querétaro, Mexico; Hospital General Regional No. 1, Instituto Mexicano del Seguro Social, Querétaro, Santiago de Querétaro, Mexico; Instituto Nacional de Rehabilitación “Luis Guillermo Ibarra Ibarra”, Ciudad de México, Mexico; Hospital Regional, Instituto de Seguridad y Servicios Sociales de los Trabajadores del Estado, Morelia, Mexico; Neurociencias PRISMA AC, San Luis Potosí, Mexico; Hospital General Regional No. 2, Instituto Mexicano del Seguro Social, El Marqués, Mexico; Hospital General Querétaro, Instituto de Seguridad y Servicios Sociales de los Trabajadores del Estado, Santiago de Querétaro, Mexico; Departament of Neurology, Neurological Center, ABC Medical Center, México City, Mexico; Hospital General de México, Ciudad de México, Mexico; Hospital Star Médica Querétaro, Santiago de Querétaro, Mexico; Facultad de Medicina, Universidad Autónoma de Querétaro. Unidad de Neurociencias, Hospital Angeles Centro Sur, Santiago de Querétaro, Mexico; Movement Disorders Clinic, Neurology Division, Internal Medicine Department, University Hospital “Dr. José E. González”, Universidad Autónoma de Nuevo León, Monterrey, Mexico; Research Unit, Colegio Mexicano de Reumatología, Ciudad de México, Mexico; Laboratorio Clínico de Enfermedades Neurodegenerativas, Instituto Nacional de Neurología y Neurocirugía Manuel Velasco Suárez, Mexico City, Mexico; Mental Health and Neuroscience Program, QIMR Berghofer Medical Research Institute, Brisbane, QLD, Australia; School of Biomedical Sciences, Faculty of Medicine, The University of Queensland, Brisbane, QLD, Australia","Reyes-Pérez P., Laboratorio Internacional de Investigación Sobre el Genoma Humano, Universidad Nacional Autónoma de México, Santiago de Querétaro, Mexico; Hernández-Ledesma A.L., Laboratorio Internacional de Investigación Sobre el Genoma Humano, Universidad Nacional Autónoma de México, Santiago de Querétaro, Mexico; Román-López T.V., Departamento de Neurobiología Conductual y Cognitiva, Instituto de Neurobiología, Universidad Nacional Autónoma de México, Santiago de Querétaro, Mexico; García-Vilchis B., Laboratorio de Neurogenómica Cognitiva, Unidad de Investigación de Psicobiología y Neurociencias, Coordinación de Psicobiología y Neurociencias, Facultad de Psicología, Universidad Nacional Autónoma de México, Ciudad de México, Mexico; Ramírez-González D., Departamento de Neurobiología Conductual y Cognitiva, Instituto de Neurobiología, Universidad Nacional Autónoma de México, Santiago de Querétaro, Mexico; Lázaro-Figueroa A., Laboratorio de Neurogenómica Cognitiva, Unidad de Investigación de Psicobiología y Neurociencias, Coordinación de Psicobiología y Neurociencias, Facultad de Psicología, Universidad Nacional Autónoma de México, Ciudad de México, Mexico; Martinez D., Laboratorio Internacional de Investigación Sobre el Genoma Humano, Universidad Nacional Autónoma de México, Santiago de Querétaro, Mexico, Unidad de Genómica Avanzada, Langebio, Centro de Investigación y Estudios Avanzados del Instituto Politécnico Nacional, Irapuato, Mexico, Escuela Nacional de Estudios Superiores, Unidad Juriquilla, Universidad Nacional Autónoma de México, Santiago de Querétaro, Mexico; Flores-Ocampo V., Laboratorio Internacional de Investigación Sobre el Genoma Humano, Universidad Nacional Autónoma de México, Santiago de Querétaro, Mexico; Espinosa-Méndez I.M., Departamento de Neurobiología Conductual y Cognitiva, Instituto de Neurobiología, Universidad Nacional Autónoma de México, Santiago de Querétaro, Mexico; Tinajero-Nieto L., Hospital General Regional No. 1, Instituto Mexicano del Seguro Social, Querétaro, Santiago de Querétaro, Mexico; Peña-Ayala A., Hospital General Regional No. 1, Instituto Mexicano del Seguro Social, Querétaro, Santiago de Querétaro, Mexico, Instituto Nacional de Rehabilitación “Luis Guillermo Ibarra Ibarra”, Ciudad de México, Mexico; Morelos-Figaredo E., Hospital Regional, Instituto de Seguridad y Servicios Sociales de los Trabajadores del Estado, Morelia, Mexico; Guerra-Galicia C.M., Neurociencias PRISMA AC, San Luis Potosí, Mexico; Torres-Valdez E., Hospital General Regional No. 2, Instituto Mexicano del Seguro Social, El Marqués, Mexico; Gordillo-Huerta M.V., Hospital General Querétaro, Instituto de Seguridad y Servicios Sociales de los Trabajadores del Estado, Santiago de Querétaro, Mexico; Gandarilla-Martínez N.A., Departament of Neurology, Neurological Center, ABC Medical Center, México City, Mexico; Salinas-Barboza K., Hospital General de México, Ciudad de México, Mexico; Félix-Rodríguez G., Hospital Star Médica Querétaro, Santiago de Querétaro, Mexico; Frontana-Vázquez G., Hospital General Regional No. 2, Instituto Mexicano del Seguro Social, El Marqués, Mexico; Matuk-Pérez Y., Facultad de Medicina, Universidad Autónoma de Querétaro. Unidad de Neurociencias, Hospital Angeles Centro Sur, Santiago de Querétaro, Mexico; Estrada-Bellmann I., Movement Disorders Clinic, Neurology Division, Internal Medicine Department, University Hospital “Dr. José E. González”, Universidad Autónoma de Nuevo León, Monterrey, Mexico; Alpizar-Rodríguez D., Research Unit, Colegio Mexicano de Reumatología, Ciudad de México, Mexico; Rodríguez-Violante M., Laboratorio Clínico de Enfermedades Neurodegenerativas, Instituto Nacional de Neurología y Neurocirugía Manuel Velasco Suárez, Mexico City, Mexico; Rentería M.E., Mental Health and Neuroscience Program, QIMR Berghofer Medical Research Institute, Brisbane, QLD, Australia, School of Biomedical Sciences, Faculty of Medicine, The University of Queensland, Brisbane, QLD, Australia; Ruíz-Contreras A.E., Laboratorio de Neurogenómica Cognitiva, Unidad de Investigación de Psicobiología y Neurociencias, Coordinación de Psicobiología y Neurociencias, Facultad de Psicología, Universidad Nacional Autónoma de México, Ciudad de México, Mexico; Alcauter S., Departamento de Neurobiología Conductual y Cognitiva, Instituto de Neurobiología, Universidad Nacional Autónoma de México, Santiago de Querétaro, Mexico; Medina-Rivera A., Laboratorio Internacional de Investigación Sobre el Genoma Humano, Universidad Nacional Autónoma de México, Santiago de Querétaro, Mexico","Objective: To introduce MexOMICS, a Mexican Consortium focused on establishing electronic databases to collect, cross-reference, and share health-related and omics data on the Mexican population. Methods: Since 2019, the MexOMICS Consortium has established three electronic-based registries: the Mexican Twin Registry (TwinsMX), Mexican Lupus Registry (LupusRGMX), and the Mexican Parkinson's Research Network (MEX-PD), designed and implemented using the Research Electronic Data Capture web-based application. Participants were enrolled through voluntary participation and on-site engagement with medical specialists. We also acquired DNA samples and Magnetic Resonance Imaging scans in subsets of participants. Results: The registries have successfully enrolled a large number of participants from a variety of regions within Mexico: TwinsMX (n = 2,915), LupusRGMX (n = 1,761) and MEX-PD (n = 750). In addition to sociodemographic, psychosocial, and clinical data, MexOMICS has collected DNA samples to study the genetic biomarkers across the three registries. Cognitive function has been assessed with the Montreal Cognitive Assessment in a subset of 376 MEX-PD participants. Furthermore, a subset of 267 twins have participated in cognitive evaluations with the Creyos platform and in MRI sessions acquiring structural, functional, and spectroscopy brain imaging; comparable evaluations are planned for LupusRGMX and MEX-PD. Conclusions: The MexOMICS registries offer a valuable repository of information concerning the potential interplay of genetic and environmental factors in health conditions among the Mexican population. 2024 Reyes-Pérez, Hernández-Ledesma, Román-López, García-Vilchis, Ramírez-González, Lázaro-Figueroa, Martinez, Flores-Ocampo, Espinosa-Méndez, Tinajero-Nieto, Peña-Ayala, Morelos-Figaredo, Guerra-Galicia, Torres-Valdez, Gordillo-Huerta, Gandarilla-Martínez, Salinas-Barboza, Félix-Rodríguez, Frontana-Vázquez, Matuk-Pérez, Estrada-Bellmann, Alpizar-Rodríguez, Rodríguez-Violante, Rentería, Ruíz-Contreras, Alcauter and Medina-Rivera.","genetics; Parkinson Disease; patient registries; systemic lupus erythematosus; twins","corticosteroid; levodopa; neuromelanin; adult; Alcohol Use Disorders Identification Test; allergic rhinitis; antiphospholipid syndrome; anxiety; Article; astigmatism; atrial fibrillation; Childhood Trauma Questionnaire; cognition; cognitive defect; decision making; degenerative disease; depression; eating disorder; electroencephalography; environmental exposure; female; functional magnetic resonance imaging; gastroesophageal reflux; gene therapy; genetic correlation; genetic variability; genotyping; head injury; human; India; insomnia; insulin dependent diabetes mellitus; intellectual impairment; knowledge; male; metabolomics; Mexico; migraine; multiple sclerosis; myopia; neuroimaging; nuclear magnetic resonance imaging; nuclear magnetic resonance spectroscopy; obesity; obsessive compulsive disorder; Parkinson disease; Pittsburgh Sleep Quality Index; pregnancy; prevalence; proteomics; quality of life; questionnaire; reproductive health; Short Form 36; systemic lupus erythematosus; traumatic brain injury; Unified Parkinson Disease Rating Scale; whole genome sequencing","2673253X","","","Article","Final","All Open Access; Gold Open Access; Green Open Access","Scopus","2-s2.0-85196056045"
"Scheidt D.; Quinto-Su P.A.","Scheidt, Dennis (57951976300); Quinto-Su, Pedro A. (56002680800)","57951976300; 56002680800","Artifacts in single pixel imaging of complex light fields","2024","Proceedings of SPIE - The International Society for Optical Engineering","13149","","1314905","","","0","10.1117/12.3027019","https://www.scopus.com/pages/publications/85208629865?origin=resultslist","Instituto de Ciencias Nucleares, Universidad Nacional Autónoma de México, Apratado Postal 70-543, Cd. Mx., 04510, Mexico; Institute of Neuroscience and Medicine (INM-1), Research Centre Jülich, Jülich, D-52425, Germany","Scheidt D., Instituto de Ciencias Nucleares, Universidad Nacional Autónoma de México, Apratado Postal 70-543, Cd. Mx., 04510, Mexico, Institute of Neuroscience and Medicine (INM-1), Research Centre Jülich, Jülich, D-52425, Germany; Quinto-Su P.A., Instituto de Ciencias Nucleares, Universidad Nacional Autónoma de México, Apratado Postal 70-543, Cd. Mx., 04510, Mexico","This work demonstrates the impact of sampling basis resolution on Single Pixel Imaging's ability to accurately measure the amplitude and phase of an arbitrary complex light field. We observe that phase crosstalk occurs in the reconstructed amplitude when the sampling basis is coarser than the underlying phase distribution. To investigate this phenomenon, a spatial light modulator is employed to prepare the complex field-comprising both amplitude and phase-utilizing a phase-only hologram. The field is then sampled at various resolutions using the Hadamard basis on the same SLM with interferometric Single Pixel Imaging. Measurement of the field takes place on a single point through 3-step interferometry and a Mach-Zehnder interferometer. While the phase is correctly reconstructed for each resolution, our findings reveal distinctive attributes of the phase distribution in the reconstructed amplitude for coarser sampling resolutions. © 2024 SPIE","Complex Light Field; Resolution; Signal and Image Processing; Single Pixel Imaging; Wavefront Shaping","Electron holography; Holograms; Image coding; Image reconstruction; Image resolution; Light modulation; Modulators; Complex fields; Complex light field; Light fields; Phase distribution; Resolution; Signal and image processing; Single pixel; Single pixel imaging; Spatial light modulators; Wave front shaping; Mach-Zehnder interferometers","0277786X","978-151067958-0","PSISD","Conference paper","Final","","Scopus","2-s2.0-85208629865"
"Avendaño-Estrada A.; Olarte-Casas M.Á.; Ávila-Rodríguez M.Á.","Avendaño-Estrada, Arturo (56422413000); Olarte-Casas, Miguel Ángel (53264654000); Ávila-Rodríguez, Miguel Ángel (56002765500)","56422413000; 53264654000; 56002765500","Vectorial-based analysis of dual-tracer PET imaging: A proof of concept","2024","Computers in Biology and Medicine","168","","107705","","","0","10.1016/j.compbiomed.2023.107705","https://www.scopus.com/pages/publications/85176944570?origin=resultslist","Unidad Radiofarmacia-Ciclotrón, Facultad de Medicina, División de Investigación, Universidad Nacional Autónoma de México, Mexico; Centro de Investigación sobre el Envejecimiento, Centro de Investigación y de Estudios Avanzados Sede Sur, Mexico; Unidad PET/CT, Facultad de Medicina, División de Investigación, Universidad Nacional Autónoma de México, Mexico","Avendaño-Estrada A., Unidad Radiofarmacia-Ciclotrón, Facultad de Medicina, División de Investigación, Universidad Nacional Autónoma de México, Mexico, Centro de Investigación sobre el Envejecimiento, Centro de Investigación y de Estudios Avanzados Sede Sur, Mexico; Olarte-Casas M.Á., Unidad PET/CT, Facultad de Medicina, División de Investigación, Universidad Nacional Autónoma de México, Mexico; Ávila-Rodríguez M.Á., Unidad Radiofarmacia-Ciclotrón, Facultad de Medicina, División de Investigación, Universidad Nacional Autónoma de México, Mexico, Centro de Investigación sobre el Envejecimiento, Centro de Investigación y de Estudios Avanzados Sede Sur, Mexico","Background: The diagnosis of neurological diseases is complicated since they often share similar symptoms and occur in different severity levels. Imaging techniques such as PET molecular imaging are helpful for an early and accurate diagnosis and, staging allowing a noninvasive evaluation of the disease. The combination of two radioligands in the same patient could be valuable to achieve these diagnostic goals; nevertheless, the imaging data obtained with two radioligands is commonly interpreted independently. This novel approach to combine the PET data of two radiopharmaceuticals, separately acquired in the same subject, is to obtain new quantitative metrics. PET images of patients with Parkinson's disease (PD) and healthy controls (HC) were analyzed. Voxel-by-voxel uptake is compared by combining the imaging data. Dual-tracer PET imaging analysis was tested with [11C]DTBZ-[11C]Raclopride as proof of concept. Results: The new proposed metric based on a resultant vector is capable of efficiently discriminating healthy controls from PD patients (p < 0.0001) allowing the detection of slight changes in patients undergoing therapeutic approaches. Significant differences were found between HC and PD patients for the evaluated radiotracers. Conclusions: The resultant vector appears to deliver useful information that could be helpful to evaluate PD patients under treatment and to improve differential diagnoses. © 2023 The Authors","Parkinson disease; PET imaging; Voxelwise analysis; [<sup>11</sup>C]DTBZ; [<sup>11</sup>C]Raclopride","Humans; Parkinson Disease; Positron-Emission Tomography; Radiopharmaceuticals; Molecular imaging; Patient treatment; carbon 11; radioligand; radiopharmaceutical agent; tracer; Dual tracers; Healthy controls; Imaging data; Parkinson's disease; PET imaging; Proof of concept; Radioligands; Voxel-wise analysis; [11C]DTBZ; [11C]raclopride; adult; afterimage; aged; anterior commissure; Article; clinical article; clinical practice; controlled study; female; follow up; human; male; molecular imaging; ordered subset expectation maximization; Parkinson disease; positron emission tomography; proof of concept; radiation attenuation; diagnostic imaging; procedures; Diagnosis","00104825","","CBMDA","Article","Final","All Open Access; Hybrid Gold Open Access","Scopus","2-s2.0-85176944570"
