"Authors","Author full names","Author(s) ID","Title","Year","Source title","Volume","Issue","Art. No.","Page start","Page end","Cited by","DOI","Link","Affiliations","Authors with affiliations","Abstract","Author Keywords","Index Keywords","ISSN","ISBN","CODEN","Document Type","Publication Stage","Open Access","Source","EID"
"Daraviña G.C.; Valencia J.L.; Holguin G.A.; Quintero H.F.; Ariza E.A.; Vergara D.","Daraviña, Gian C. (59234071500); Valencia, Jorge L. (57202198378); Holguin, German A. (36561484000); Quintero, Héctor F. (54783273200); Ariza, Edwan Anderson (57204730841); Vergara, Diego (57987920300)","59234071500; 57202198378; 36561484000; 54783273200; 57204730841; 57987920300","Visual Servoing and Kalman Filter Applied to Parallel Manipulator 3-RRR","2024","Electronics (Switzerland)","13","14","2703","","","5","10.3390/electronics13142703","https://www.scopus.com/pages/publications/85199653116?origin=resultslist","Programa de Ingeniería Mecánica, Facultad de Mecánica Aplicada, Universidad Tecnológica de Pereira, Pereira, 660003, Colombia; Programa de Ingeniería Eléctrica, Facultad de Ingeniería, Universidad Nacional Autónoma de México, Mexico City, 04510, Mexico; Programa de Ingeniería Eléctrica, Facultad de Ingenierías, Universidad Tecnológica de Pereira, Pereira, 660003, Colombia; Grupo de Nuevos Materiales, Facultad de Ingeniería, Universidad del Magdalena, Santa Marta, 470004, Colombia; Technology, Instruction and Design in Engineering and Education Research Group (TiDEE.rg), Catholic University of Ávila, Ávila, 05005, Spain","Daraviña G.C., Programa de Ingeniería Mecánica, Facultad de Mecánica Aplicada, Universidad Tecnológica de Pereira, Pereira, 660003, Colombia; Valencia J.L., Programa de Ingeniería Eléctrica, Facultad de Ingeniería, Universidad Nacional Autónoma de México, Mexico City, 04510, Mexico; Holguin G.A., Programa de Ingeniería Eléctrica, Facultad de Ingenierías, Universidad Tecnológica de Pereira, Pereira, 660003, Colombia; Quintero H.F., Programa de Ingeniería Mecánica, Facultad de Mecánica Aplicada, Universidad Tecnológica de Pereira, Pereira, 660003, Colombia; Ariza E.A., Grupo de Nuevos Materiales, Facultad de Ingeniería, Universidad del Magdalena, Santa Marta, 470004, Colombia; Vergara D., Technology, Instruction and Design in Engineering and Education Research Group (TiDEE.rg), Catholic University of Ávila, Ávila, 05005, Spain","This study introduces a novel methodology integrating computer vision, visual servo control, and the Kalman Filter to precisely estimate object locations for a 3-RRR planar type parallel manipulator. Through kinematic analysis and the development of a vision system using color indicators, the research enhances the ability of the manipulator to track object trajectories, especially in cases of occlusion. Employing Eye-to-Hand visual servo control, the research further refines the visual orientation of the sensor for optimal end effector and object identification. The incorporation of the Kalman Filter as a robust estimator for occluded objects underscores the predictive accuracy of the system. Results demonstrate the effectiveness of the methodology in trajectory generation and object tracking, with potential implications for improving robotic manipulators in dynamic environments. This comprehensive approach not only advances the fields of kinematic control and visual servoing but also opens new avenues for future research in complex spatial manipulations. © 2024 by the authors.","Kalman filter; parallel manipulator 3-RRR; visual servoing","","20799292","","","Article","Final","All Open Access; Gold Open Access","Scopus","2-s2.0-85199653116"
"Núñez L.; Savage J.; Moctezuma-Flores M.; Contreras L.; Negrete M.; Okada H.","Núñez, Lorena (57960291200); Savage, Jesús (23475071900); Moctezuma-Flores, Miguel (6507299914); Contreras, Luis (55350377300); Negrete, Marco (8396365600); Okada, Hiroyuki (58911699700)","57960291200; 23475071900; 6507299914; 55350377300; 8396365600; 58911699700","Multi-View Object Recognition and Pose Sequence Estimation Using HMMs","2025","Journal of Robotics and Mechatronics","37","3","","579","593","0","10.20965/jrm.2025.p0579","https://www.scopus.com/pages/publications/105009038718?origin=resultslist","BioRobotics Laboratory, School of Engineering, National Autonomous University of Mexico, Circuito Exterior S/N, Ciudad Universitaria, Coyoacán, Mexico City, 04510, Mexico; Telecommunications Department, School of Electrical Engineering, Central University of Venezuela, Ciudad Universitaria de Caracas, Los Chaguaramos, Caracas, 1051, Venezuela; Telecommunications Department, School of Engineering, National Autonomous University of Mexico, Circuito Exterior S/N, Ciudad Universitaria, Coyoacán, Mexico City, 04510, Mexico; Advanced Intelligence & Robotics Research Center, Tamagawa University, 2-7-1 Komatsugawa, Edogawa-ku, Tokyo, 132-0034, Japan","Núñez L., BioRobotics Laboratory, School of Engineering, National Autonomous University of Mexico, Circuito Exterior S/N, Ciudad Universitaria, Coyoacán, Mexico City, 04510, Mexico, Telecommunications Department, School of Electrical Engineering, Central University of Venezuela, Ciudad Universitaria de Caracas, Los Chaguaramos, Caracas, 1051, Venezuela; Savage J., BioRobotics Laboratory, School of Engineering, National Autonomous University of Mexico, Circuito Exterior S/N, Ciudad Universitaria, Coyoacán, Mexico City, 04510, Mexico; Moctezuma-Flores M., Telecommunications Department, School of Engineering, National Autonomous University of Mexico, Circuito Exterior S/N, Ciudad Universitaria, Coyoacán, Mexico City, 04510, Mexico; Contreras L., Advanced Intelligence & Robotics Research Center, Tamagawa University, 2-7-1 Komatsugawa, Edogawa-ku, Tokyo, 132-0034, Japan; Negrete M., BioRobotics Laboratory, School of Engineering, National Autonomous University of Mexico, Circuito Exterior S/N, Ciudad Universitaria, Coyoacán, Mexico City, 04510, Mexico; Okada H., Advanced Intelligence & Robotics Research Center, Tamagawa University, 2-7-1 Komatsugawa, Edogawa-ku, Tokyo, 132-0034, Japan","This work proposes an integration of a vision system for a service robot when its gripper holds an object. Based on the particular conditions of the problem, the solution is modular and allows one to use various options to extract features and classify data. Since the robot can move the object and has information about its position, the proposed solution takes advantage of this by applying preprocessing techniques to improve the performance of classifiers that can be considered weak. In addition to being able to classify the object, it is possible to infer the sequence of movements that it carries out using hidden Markov models (HMMs). The system was tested using a public dataset, the COIL-100, as well as with a dataset of real objects using the human support robot (HSR). The results show that the proposed vision system is able to work with a low number of shots in each class. Two HMM architectures are tested. In order to enhance classification by adding information from multiple perspectives, various criteria were analyzed. A simple model is built to integrate information and infer object movements. The system also has an next best view algorithm where different parameters are tested in order to improve both accuracy in the classification of the object and its pose, especially in objects that may be similar in several of their views. The system was tested using COIL-100 dataset and with real objects in common use and a HSR robot to take the real dataset. In general, using relatively few shots of each class and a plain computer, consistent results were obtained, requiring only 8.192×10−3 MFLOPs for sequence processing using concatenated HMMs compared to 404.34 MFLOPs for CNN+LSTM. © Fuji Technology Press Ltd.","active vision; hidden Markov model; multi-view recognition; next best view; pose estimation","Classification (of information); Computer vision; Object recognition; Robots; Trellis codes; Active Vision; Hidden-Markov models; Human support robot; Multi-view object recognition; Multi-view recognition; Multi-views; Next best view; Pose-estimation; Real objects; Vision systems; Hidden Markov models","09153942","","","Article","Final","All Open Access; Gold Open Access","Scopus","2-s2.0-105009038718"
"Colín-García M.P.; Ruiz-Veloz M.; Gutiérrez-Juárez G.; Montoya-Ayala G.; Ramírez-Chavarría R.G.; Castañeda-Guzmán R.; Pérez-Pacheco A.","Colín-García, Marco P. (58660474600); Ruiz-Veloz, Misael (57225947248); Gutiérrez-Juárez, Gerardo (55993662900); Montoya-Ayala, Gonzalo (57868594400); Ramírez-Chavarría, Roberto G. (57201881228); Castañeda-Guzmán, Rosalba (6602297582); Pérez-Pacheco, Argelia (6503918538)","58660474600; 57225947248; 55993662900; 57868594400; 57201881228; 6602297582; 6503918538","Photoacoustic Tomography in Forward-Detection Mode for Monitoring Structural Changes in an Extracted Wisdom Tooth","2025","Applied Sciences (Switzerland)","15","16","9146","","","1","10.3390/app15169146","https://www.scopus.com/pages/publications/105014355818?origin=resultslist","Instituto de Ciencias Aplicadas y Tecnología, Universidad Nacional Autónoma de México, Mexico City, 04510, Mexico; División de Ciencias e Ingenierías, Universidad de Guanajuato, Guanajuato, 37150, Mexico; División de Estudios de Posgrado e Investigación de la Facultad de Odontología, Universidad Nacional Autónoma de México, Mexico City, 04510, Mexico; Instituto de Ingeniería, Universidad Nacional Autónoma de México, Mexico City, 04510, Mexico; Unidad de Investigación y Desarrollo Tecnológico (UIDT), Hospital General de México “Dr. Eduardo Liceaga”, Mexico City, 06726, Mexico","Colín-García M.P., Instituto de Ciencias Aplicadas y Tecnología, Universidad Nacional Autónoma de México, Mexico City, 04510, Mexico; Ruiz-Veloz M., División de Ciencias e Ingenierías, Universidad de Guanajuato, Guanajuato, 37150, Mexico; Gutiérrez-Juárez G., División de Ciencias e Ingenierías, Universidad de Guanajuato, Guanajuato, 37150, Mexico; Montoya-Ayala G., División de Estudios de Posgrado e Investigación de la Facultad de Odontología, Universidad Nacional Autónoma de México, Mexico City, 04510, Mexico; Ramírez-Chavarría R.G., Instituto de Ingeniería, Universidad Nacional Autónoma de México, Mexico City, 04510, Mexico; Castañeda-Guzmán R., Instituto de Ciencias Aplicadas y Tecnología, Universidad Nacional Autónoma de México, Mexico City, 04510, Mexico; Pérez-Pacheco A., Unidad de Investigación y Desarrollo Tecnológico (UIDT), Hospital General de México “Dr. Eduardo Liceaga”, Mexico City, 06726, Mexico","Photoacoustic tomography (PAT), which combines optical absorption and ultrasonic detection, enables the monitoring of dehydration-driven structural changes in extracted teeth over time. In this proof-of-concept study, 2D photoacoustic images of a wisdom tooth were generated on the same scanning plane at days 0, 1, 3, 6, 10, 15, 21, and 28 post-extraction, using day 0 as the reference. Measurements were performed in forward-detection mode with a single ultrasound transducer and a 532 nm pulsed laser. For the comparative analysis of variations between images, four metrics were used: Pearson correlation coefficient, Structural Similarity Index (SSIM), Mean Squared Error (MSE), and Peak Signal-to-Noise Ratio (PSNR). Structural changes were also examined through radial intensity profiles extracted from each image. The results revealed marked differences in the central region, evidencing progressive structural and acoustic modifications within the tooth. The most significant change occurred on day 1, followed by small but consistent variations on subsequent days. These differences are associated with dehydration-induced changes in tissue density, which affect sound propagation. This study highlights the value of PAT for noninvasive monitoring of post-extraction dental changes, with implications for diagnosis, treatment guidance, and biomaterials research in dentistry. © 2025 by the authors.","dehydration; extracted wisdom tooth; forward-detection mode; image similarity metrics; intensity profile of images; photoacoustic tomography","Acoustic wave propagation; Correlation methods; Dental materials; Dentistry; Mean square error; Photoacoustic effect; Signal detection; Tomography; Ultrasonic imaging; Ultrasonic testing; Ultrasonic transducers; Detection mode; Extracted wisdom tooth; Forward-detection mode; Image similarity; Image similarity metric; Intensity profile of image; Intensity profiles; Optical-; Photoacoustic tomography; Similarity metrics; Dehydration","20763417","","","Article","Final","All Open Access; Gold Open Access; Green Open Access","Scopus","2-s2.0-105014355818"
"García-Núñez D.; Rodrígez-Vázquez K.; Hernández C.; Galván E.","García-Núñez, Daniel (57853045600); Rodrígez-Vázquez, Katya (59165475100); Hernández, Carlos (57190253793); Galván, Edgar (15042060700)","57853045600; 59165475100; 57190253793; 15042060700","Neuroevolution-based multiobjective algorithm for feature selection and binary classification of DNA microarrays","2025","Applied Soft Computing","184","","113520","","","0","10.1016/j.asoc.2025.113520","https://www.scopus.com/pages/publications/105013511920?origin=resultslist","Naturally Inspired Computation Research Group, Department of Computer Science, Hamilton Institute, National University of Ireland Maynooth, Kildare Co., Maynooth, W23 F2H6, Ireland; Instituto de Investigaciones en Matemáticas Aplicadas y en Sistemas, Universidad Nacional Autónoma de Mexico, Ciudad de Mexico, Ciudad Universitaria, 04510, Mexico","García-Núñez D., Naturally Inspired Computation Research Group, Department of Computer Science, Hamilton Institute, National University of Ireland Maynooth, Kildare Co., Maynooth, W23 F2H6, Ireland; Rodrígez-Vázquez K., Instituto de Investigaciones en Matemáticas Aplicadas y en Sistemas, Universidad Nacional Autónoma de Mexico, Ciudad de Mexico, Ciudad Universitaria, 04510, Mexico; Hernández C., Instituto de Investigaciones en Matemáticas Aplicadas y en Sistemas, Universidad Nacional Autónoma de Mexico, Ciudad de Mexico, Ciudad Universitaria, 04510, Mexico; Galván E., Naturally Inspired Computation Research Group, Department of Computer Science, Hamilton Institute, National University of Ireland Maynooth, Kildare Co., Maynooth, W23 F2H6, Ireland","The genomes of organisms have been sequenced for many years, leading to the discovery of thousands of genes. DNA microarrays are widely used tools for simultaneously analysing numerous genes, commonly employed in detecting and identifying various diseases, including cancer. However, microarray datasets have non-relevant and redundant information, hindering their analysis. This problem is further exacerbated considering the datasets’ high dimensionality and imbalanced classes. Consequently, standard practice involves incorporating a feature selection process to identify the most relevant genes and their associations with diseases. Various methods have been employed to address this task. However, none have taken a more holistic approach that effectively handles feature selection, automatically identifies the optimal classifier configuration, and manages potential conflicting objectives simultaneously. In response, this study introduces the S-metric selection - multiobjective neuroevolution of augmenting topologies (SMS-MONEAT) algorithm, which combines the multiobjective optimisation framework from S-metric selection - evolutionary multiobjective algorithm (SMS-EMOA) and the evolutionary operators from the neuroevolution algorithm N3O, a variation from NEAT which stands for ‘3 new operators’. SMS-MONEAT algorithm was designed to perform both feature selection and optimise the configuration of artificial neural networks for classification tasks. SMS-MONEAT was evaluated against classic and state-of-the-art methods for feature selection and microarray classification. The experiments were conducted on 20 highly challenging cancer-type datasets primarily sourced from the Curated Microarray Database, and the results were investigated for statistical significance. The findings suggest that SMS-MONEAT either outperforms or achieves competitive results in terms of classification compared to the mentioned methods, while at the same time, it selects a smaller subset of features. © 2025 The Authors","DNA microarray; Feature selection; Multiobjective optimisation; Neuroevolution","Bioinformatics; Classification (of information); Diseases; DNA; Evolutionary algorithms; Genes; Microarrays; Multiobjective optimization; Neural networks; Binary classification; DNA microarray; Features selection; Microarray dataset; Multi objective; Multi objective algorithm; Multi-objectives optimization; Neuro evolutions; Neuroevolution of augmenting topologies; S-metric selection; Feature extraction","15684946","","","Article","Final","All Open Access; Hybrid Gold Open Access","Scopus","2-s2.0-105013511920"
"Arevalo-Ancona R.E.; Cedillo-Hernandez M.; Garcia-Ugalde F.J.","Arevalo-Ancona, Rodrigo Eduardo (58478737700); Cedillo-Hernandez, Manuel (25521406600); Garcia-Ugalde, Francisco Javier (55989774900)","58478737700; 25521406600; 55989774900","Robust Image Tampering Detection and Ownership Authentication Using Zero-Watermarking and Siamese Neural Networks","2024","International Journal of Advanced Computer Science and Applications","15","10","","436","446","0","10.14569/IJACSA.2024.0151046","https://www.scopus.com/pages/publications/86000672959?origin=resultslist","Instituto Politecnico Nacional, SEPI-ESIME Culhuacan, Mexico City, Mexico; Universidad Nacional Autonoma de Mexico, Facultad de Ingenieria, Mexico City, Mexico","Arevalo-Ancona R.E., Instituto Politecnico Nacional, SEPI-ESIME Culhuacan, Mexico City, Mexico; Cedillo-Hernandez M., Instituto Politecnico Nacional, SEPI-ESIME Culhuacan, Mexico City, Mexico; Garcia-Ugalde F.J., Universidad Nacional Autonoma de Mexico, Facultad de Ingenieria, Mexico City, Mexico","The development of advanced image editing tools has significantly increased the manipulation of digital images, creating a pressing need for robust tamper detection and ownership authentication systems. This paper presents a method that combines zero-watermarking with Siamese neural networks to detect image tampering and verify ownership. The approach utilizes features from the Discrete Wavelet Transform (DWT) and employs two halftone images as watermarks: one representing the owner's portrait and the other corresponding to the protected image. A feature matrix is generated from the owner's portrait using the Siamese network and securely linked to the image's halftone watermark through an XOR operation. Additionally, data augmentation enhances the model's robustness, ensuring effective learning of image features even under geometric and signal processing distortions. Experimental results demonstrate high accuracy in recovering halftone images, enabling precise tamper detection and ownership verification across different datasets and image distortions (geometric and image processing distortions). © (2024), (Science and Information Organization). All rights reserved.","neural network; ownership authentication; tampering detection; Zero-watermarking","Authentication; Digital watermarking; Image enhancement; Watermarking; Digital image; Geometric processing; Halftone images; Image editing tools; Image tampering; Neural-networks; Ownership authentication; Tamper detection; Tampering detection; Zero-watermarking; Discrete wavelet transforms","2158107X","","","Article","Final","All Open Access; Gold Open Access","Scopus","2-s2.0-86000672959"
"Sosa D.; Vázquez B.; Hevia-Montiel N.","Sosa, Daniela (60515714900); Vázquez, Blanca (55957418400); Hevia-Montiel, Nidiyare (56000866700)","60515714900; 55957418400; 56000866700","Deep learning for Chagas disease: YOLOv8-based automatic detection of amastigote nests","2025","Proceedings of the 21st International Symposium on Medical Information Processing and Analysis, SIPAIM 2025","","","","","","0","10.1109/SIPAIM67325.2025.11283341","https://www.scopus.com/pages/publications/105032958030?origin=resultslist","Ingeniería en Robótica Computacional, Universidad Politécnica de Yucatán, Yucatán, Mérida, Mexico; Unidad Académica del Instituto de Investigaciones en Matemáticas Aplicadas y en Sistemas en el estado de Yucatán, Universidad Nacional Autónoma de México, Yucatán, Mérida, Mexico","Sosa D., Ingeniería en Robótica Computacional, Universidad Politécnica de Yucatán, Yucatán, Mérida, Mexico; Vázquez B., Unidad Académica del Instituto de Investigaciones en Matemáticas Aplicadas y en Sistemas en el estado de Yucatán, Universidad Nacional Autónoma de México, Yucatán, Mérida, Mexico; Hevia-Montiel N., Unidad Académica del Instituto de Investigaciones en Matemáticas Aplicadas y en Sistemas en el estado de Yucatán, Universidad Nacional Autónoma de México, Yucatán, Mérida, Mexico","Chagas disease, caused by the Trypanosoma cruzi parasite, remains a global public health problem, with cases reported even outside its traditional endemic areas. Its primary clinical manifestation occurs at the cardiac level, characterized by the formation of amastigote nests. This work presents a deep learning algorithm for automatic detection of amastigote nests in cardiac histopathological images obtained from a murine model. For the nests’ detection, a YOLOv8-based architecture was trained on histological images performing a 5-fold cross-validation, while the final tests were carried out with data unseen by the YOLOv8 from four image groups of different post-infection days. In training stage, YOLOv8 achieved 97.9% in accuracy, 98.6±0.3% in precision, and 97.2±0.8% in recall, while in the final test, the best result identified was 78.6% in accuracy, 76.4% in precision, and 81.1% in recall on images at 100× magnification. These metrics reveal the model’s ability to generalize well and its high sensitivity to unseen data. The results of this study show that the proposed algorithm is capable of identifying amastigote nests, which may be useful in clinical areas to understand the damage caused by Trypanosoma cruzi infection. © 2025 IEEE.","biomedical imaging; Chagas disease; computer vision; deep learning; object detection; YOLOv8","Computer vision; Learning algorithms; Medical imaging; Object detection; Public health; Automatic Detection; Biomedical imaging; Chagas disease; Clinical manifestation; Deep learning; Global public health; Histopathological images; Objects detection; Trypanosoma cruzi parasites; YOLOv8; Deep learning","","979-833155456-9","","Conference paper","Final","","Scopus","2-s2.0-105032958030"
