"Authors","Author full names","Author(s) ID","Title","Year","Source title","Volume","Issue","Art. No.","Page start","Page end","Cited by","DOI","Link","Affiliations","Authors with affiliations","Abstract","Author Keywords","Index Keywords","ISSN","ISBN","CODEN","Document Type","Publication Stage","Open Access","Source","EID"
"Maldonado-Oclica A.; Rios-López R.; Beltrán-Fernández A.; Alquicira-Guevara D.; Veloz-Lucas M.; Flores-Niño R.; García-Santiago M.","Maldonado-Oclica, Adrián (59976620000); Rios-López, Regina (59975380700); Beltrán-Fernández, Adrián (59975380800); Alquicira-Guevara, Daniela (59976620100); Veloz-Lucas, Miguel (59976439600); Flores-Niño, Rashid (59976439700); García-Santiago, María (58672615800)","59976620000; 59975380700; 59975380800; 59976620100; 59976439600; 59976439700; 58672615800","AI-Based Mobile App for Segmentation and Tissue Classification on Diabetic Foot Ulcer: A Step Forward in Patient Care","2025","Lecture Notes in Computer Science","15735 LNAI","","","250","254","0","10.1007/978-3-031-95841-0_47","https://www.scopus.com/pages/publications/105009801713?origin=resultslist","Physics Department, Universidad Nacional Autónoma de México, Mexico City, Mexico; Faculty of Engineering, Universidad del Valle de México, Mexico City, Mexico; Institute of Applied Science and Technology, Universidad Nacional Autónoma de México, Mexico City, Mexico","Maldonado-Oclica A., Physics Department, Universidad Nacional Autónoma de México, Mexico City, Mexico; Rios-López R., Physics Department, Universidad Nacional Autónoma de México, Mexico City, Mexico; Beltrán-Fernández A., Physics Department, Universidad Nacional Autónoma de México, Mexico City, Mexico; Alquicira-Guevara D., Faculty of Engineering, Universidad del Valle de México, Mexico City, Mexico; Veloz-Lucas M., Institute of Applied Science and Technology, Universidad Nacional Autónoma de México, Mexico City, Mexico; Flores-Niño R., Physics Department, Universidad Nacional Autónoma de México, Mexico City, Mexico; García-Santiago M., Physics Department, Universidad Nacional Autónoma de México, Mexico City, Mexico","The World Health Organization estimates that every 30 s, a lower-limb amputation occurs due to diabetes mellitus, with studies indicating that in Mexico, nearly 50% of these amputations could be prevented through early detection and timely intervention. Classifying tissue within and around diabetic foot ulcers, as well as monitoring their size, is crucial for effective diagnosis and treatment. To address this, we propose a mobile virtual assistant that integrates artificial intelligence algorithms for the automatic segmentation of ulcers and affected tissue from images. The models were trained using the Foot Ulcer Segmentation (FUSeg) Challenge 2021 dataset from MICCAI, which includes 1,010 binary segmentation images, and the DFUTissue dataset, consisting of 110 images annotated with callus, fibrinous, and granulation tissues. The segmentation models, based on the Unet architecture, were validated using 68 images from Mexican adults aged 65-70 years with diabetic foot ulcers, collected during specialist-assisted care, achieving 96% accuracy in ulcer segmentation with a Dice coefficient close to 0.8. The developed mobile application integrates these models, providing additional metrics of interest and enabling users to track their progress over time. © The Author(s), under exclusive license to Springer Nature Switzerland AG 2025.","Deep Learning Models; Diabetic Foot Ulcers; Medical Segmentation; Mobile App Monitoring; Tissue Classification","Artificial limbs; Classification (of information); Computer aided diagnosis; Deep learning; Diseases; Medical computing; Mobile applications; Tissue; Deep learning model; Diabetic foot ulcer; Learning models; Lower-limb amputations; Medical segmentations; Mobile app; Mobile app monitoring; Patient care; Tissue classification; World Health Organization; Image segmentation","03029743","978-303195840-3","","Conference paper","Final","","Scopus","2-s2.0-105009801713"
"Arias-Carrión O.; Guerra-Crespo M.; Padilla-Godínez F.J.; Soto-Rojas L.O.; Manjarrez E.","Arias-Carrión, Oscar (56013731500); Guerra-Crespo, Magdalena (6505891376); Padilla-Godínez, Francisco J. (57219362649); Soto-Rojas, Luis O. (57204152836); Manjarrez, Elías (6603028615)","56013731500; 6505891376; 57219362649; 57204152836; 6603028615","α-Synuclein Pathology in Synucleinopathies: Mechanisms, Biomarkers, and Therapeutic Challenges","2025","International Journal of Molecular Sciences","26","11","5405","","","17","10.3390/ijms26115405","https://www.scopus.com/pages/publications/105007808963?origin=resultslist","Experimental Neurology, Instituto Nacional de Rehabilitación Luis Guillermo Ibarra Ibarra, Mexico City, 14389, Mexico; Tecnologico de Monterrey, Escuela de Medicina y Ciencias de la Salud, Mexico City, 14380, Mexico; Laboratory of Regenerative Medicine, Department of Physiology, Faculty of Medicine, National Autonomous University of Mexico, Mexico City, 04360, Mexico; Department of Mathematics and Physics, Western Institute of Technology and Higher Education, San Pedro Tlaquepaque, 45604, Mexico; Laboratory of Molecular Pathogenesis, Building A4, Medical Surgeon Career, Faculty of Higher Studies Iztacala, National Autonomous University of Mexico, Mexico City, 54090, Mexico; Instituto de Fisiología, Benemérita Universidad Autónoma de Puebla, 14 Sur 6301, Col. San Manuel, Apartado Postal 406, Puebla, 72570, Mexico","Arias-Carrión O., Experimental Neurology, Instituto Nacional de Rehabilitación Luis Guillermo Ibarra Ibarra, Mexico City, 14389, Mexico, Tecnologico de Monterrey, Escuela de Medicina y Ciencias de la Salud, Mexico City, 14380, Mexico; Guerra-Crespo M., Laboratory of Regenerative Medicine, Department of Physiology, Faculty of Medicine, National Autonomous University of Mexico, Mexico City, 04360, Mexico; Padilla-Godínez F.J., Laboratory of Regenerative Medicine, Department of Physiology, Faculty of Medicine, National Autonomous University of Mexico, Mexico City, 04360, Mexico, Department of Mathematics and Physics, Western Institute of Technology and Higher Education, San Pedro Tlaquepaque, 45604, Mexico; Soto-Rojas L.O., Laboratory of Molecular Pathogenesis, Building A4, Medical Surgeon Career, Faculty of Higher Studies Iztacala, National Autonomous University of Mexico, Mexico City, 54090, Mexico; Manjarrez E., Instituto de Fisiología, Benemérita Universidad Autónoma de Puebla, 14 Sur 6301, Col. San Manuel, Apartado Postal 406, Puebla, 72570, Mexico","Parkinson’s disease and related synucleinopathies, including dementia with Lewy bodies and multiple system atrophy, are characterised by the pathological aggregation of the α-synuclein (aSyn) protein in neuronal and glial cells, leading to cellular dysfunction and neurodegeneration. This review synthesizes knowledge of aSyn biology, including its structure, aggregation mechanisms, cellular interactions, and systemic influences. We highlight the structural diversity of aSyn aggregates, ranging from oligomers to fibrils, their strain-like properties, and their prion-like propagation. While the role of prion-like mechanisms in disease progression remains a topic of ongoing debate, these processes may contribute to the clinical heterogeneity of synucleinopathies. Dysregulation of protein clearance pathways, including chaperone-mediated autophagy and the ubiquitin–proteasome system, exacerbates aSyn accumulation, while post-translational modifications influence its toxicity and aggregation propensity. Emerging evidence suggests that immune responses and alterations in the gut microbiome are key modulators of aSyn pathology, linking peripheral processes—particularly those of intestinal origin—to central neurodegeneration. Advances in biomarker development, such as cerebrospinal fluid assays, post-translationally modified aSyn, and real-time quaking-induced conversion technology, hold promise for early diagnosis and disease monitoring. Furthermore, positron emission tomography imaging and conformation-specific antibodies offer innovative tools for visualising and targeting aSyn pathology in vivo. Despite significant progress, challenges remain in accurately modelling human synucleinopathies, as existing animal and cellular models capture only specific aspects of the disease. This review underscores the need for more reliable aSyn biomarkers to facilitate the development of effective treatments. Achieving this goal requires an interdisciplinary approach integrating genetic, epigenetic, and environmental insights. © 2025 by the authors.","alpha-synuclein; biomarkers; neurodegeneration; Parkinson’s disease; protein aggregation; synucleinopathies","alpha-Synuclein; Animals; Biomarkers; Humans; Parkinson Disease; Protein Aggregation, Pathological; Synucleinopathies; alpha synuclein; biological marker; oligomer; proteasome; ubiquitin; biological marker; cell dysfunction; cell interaction; cerebrospinal fluid; chaperone-mediated autophagy; diagnosis; diffuse Lewy body disease; disease surveillance; glia cell; gut microbiome; human; immune response; multiple system atrophy; nerve degeneration; nonhuman; Parkinson disease; positron emission tomography; protein aggregation; protein processing; review; synucleinopathy; animal; chemistry; genetics; metabolism; Parkinson disease; pathology; proteinosis; therapy","16616596","","","Review","Final","All Open Access; Gold Open Access; Green Open Access","Scopus","2-s2.0-105007808963"
"Olvera-Martinez L.; Cedillo-Hernandez M.; Diaz-Rodriguez C.; Faustinos-Morales L.","Olvera-Martinez, Luis (57224996020); Cedillo-Hernandez, Manuel (25521406600); Diaz-Rodriguez, Carlos (59454851000); Faustinos-Morales, Leonardo (59710156600)","57224996020; 25521406600; 59454851000; 59710156600","Color Image Protection via Quantum Encryption and HVS-Based Mini-Block Data Hiding","2025","2025 10th International Conference on Frontiers of Signal Processing, ICFSP 2025","","","","16","20","0","10.1109/ICFSP67350.2025.11353827","https://www.scopus.com/pages/publications/105033520704?origin=resultslist","Mecánica y Eléctrica Unidad Culhuacan, Instituto Politécnico Nacional Escuela Superior de Ingeniería, CDMX, Mexico; Universidad Nacional Autónoma de Mexico, CDMX, Mexico","Olvera-Martinez L., Mecánica y Eléctrica Unidad Culhuacan, Instituto Politécnico Nacional Escuela Superior de Ingeniería, CDMX, Mexico; Cedillo-Hernandez M., Mecánica y Eléctrica Unidad Culhuacan, Instituto Politécnico Nacional Escuela Superior de Ingeniería, CDMX, Mexico; Diaz-Rodriguez C., Mecánica y Eléctrica Unidad Culhuacan, Instituto Politécnico Nacional Escuela Superior de Ingeniería, CDMX, Mexico; Faustinos-Morales L., Universidad Nacional Autónoma de Mexico, CDMX, Mexico","With the growing demand for secure and efficient digital image processing, the integration of data hiding and encryption techniques has become essential to ensure both confidentiality and integrity of visual information. This paper proposes a hybrid approach that combines a low complexity steganographic scheme for binary and color images with a computationally efficient encryption technique inspired by quantum operators. In the data hiding component, an RGB channel of a color image is selected, and its least significant bit plane is extracted. This bit plane is then divided into suitable blocks, and HVS-based encoding tables are used to embed the information within these blocks, achieving high embedding capacity while preserving visual quality. In parallel, the encryption stage operates on color images and is based on a novel operator model that simulates quantum behaviors such as creation, exchange, and annihilation, enabling effective protection without requiring intensive mathematical processing. Experimental validation confirms the robustness of the combined approach through quality metrics such as PSNR, SSIM and entropy.  © 2025 IEEE.","Braided Quantum; Dynamic Matrices; Finite Fields; Quantum Operators","Binary images; Embeddings; Information hiding; Privacy-preserving techniques; Quantum cryptography; RGB color model; Steganography; Braided quantum; Colour image; Data-hiding; Dynamic matrix; Encryption technique; Finite fields; Image protection; matrix; Quantum encryption; Quantum operators; Mathematical operators","","979-833157442-0","","Conference paper","Final","","Scopus","2-s2.0-105033520704"
"Olivares-Vera D.A.; Ovalle-Magallanes E.; Hernández-Vázquez J.I.; Hernández-Vázquez J.O.; Gutierrez-Hernandez D.A.; Olivares-Vera A.D.P.","Olivares-Vera, Daniel Arturo (57202513779); Ovalle-Magallanes, Emmanuel (57219164003); Hernández-Vázquez, José I. (57212219517); Hernández-Vázquez, José O. (57212219518); Gutierrez-Hernandez, David A. (24724075100); Olivares-Vera, Angela del Pilar (59744139300)","57202513779; 57219164003; 57212219517; 57212219518; 24724075100; 59744139300","Performance evaluation of YOLO models for damage identification in tertiary packaging","2025","Signal, Image and Video Processing","19","6","498","","","2","10.1007/s11760-025-04088-6","https://www.scopus.com/pages/publications/105002981570?origin=resultslist","Depto. Ciencias Económicas Administrativas e Ingeniería Industrial, Instituto Tecnológico de León-TecNM., Av. Tecnológico s/n, Fracc. Industrial Julián de Obregón, Gto., León, 37290, Mexico; Dirección de Investigación y Doctorado. Fac. Ingenierías y Tecnologías, Universidad La Salle Bajío, Av. Universidad 602, Col. Lomas del Campestre, Gto., León, 37150, Mexico; Depto. Ciencias Económicas Administrativas, UNAM: Escuela Nacional de Estudios Superiores (ENES), Blv. UNAM 2011, Predio El Saucillo y Comunidad de los Tepetates, El Potrero, Gto., León, 37684, Mexico","Olivares-Vera D.A., Depto. Ciencias Económicas Administrativas e Ingeniería Industrial, Instituto Tecnológico de León-TecNM., Av. Tecnológico s/n, Fracc. Industrial Julián de Obregón, Gto., León, 37290, Mexico; Ovalle-Magallanes E., Dirección de Investigación y Doctorado. Fac. Ingenierías y Tecnologías, Universidad La Salle Bajío, Av. Universidad 602, Col. Lomas del Campestre, Gto., León, 37150, Mexico; Hernández-Vázquez J.I., Depto. Ciencias Económicas Administrativas e Ingeniería Industrial, Instituto Tecnológico de León-TecNM., Av. Tecnológico s/n, Fracc. Industrial Julián de Obregón, Gto., León, 37290, Mexico; Hernández-Vázquez J.O., Depto. Ciencias Económicas Administrativas e Ingeniería Industrial, Instituto Tecnológico de León-TecNM., Av. Tecnológico s/n, Fracc. Industrial Julián de Obregón, Gto., León, 37290, Mexico; Gutierrez-Hernandez D.A., Depto. Ciencias Económicas Administrativas e Ingeniería Industrial, Instituto Tecnológico de León-TecNM., Av. Tecnológico s/n, Fracc. Industrial Julián de Obregón, Gto., León, 37290, Mexico; Olivares-Vera A.D.P., Depto. Ciencias Económicas Administrativas, UNAM: Escuela Nacional de Estudios Superiores (ENES), Blv. UNAM 2011, Predio El Saucillo y Comunidad de los Tepetates, El Potrero, Gto., León, 37684, Mexico","This research compares the performance of the latest state-of-the-art YOLO (You Only Look Once) models, specifically YOLOv5n, YOLOv6n, YOLOv7-Tiny, and YOLOv8n. For this purpose, images of cardboard packaging with various damaged and undamaged samples were utilized. The classification and identification process considered five categories: undamaged, face damage, edge damage, corner damage, and top damage. Experimental results were obtained for each of the four models, reporting average precision, average recall, F1-score, and mAP@50, which assess the accuracy level in categorizing damage to the packaging. This study aims to provide a solution using computer vision capable of performing more effective classifications to support individuals conducting visual inspection processes based on attributes and mitigate workplace blindness. Thus, it reduces costs in reverse logistics and indirectly benefits the reduction of environmental pollution caused by various transport methods used in reverse logistics. © The Author(s), under exclusive licence to Springer-Verlag London Ltd., part of Springer Nature 2025.","Classification; Damage packaging; Deep learning; YOLO","Classification; Edge Damage; Identification; Models; Packaging; Performance; Processes; Cardboard; Cardboard packaging; Classification and identifications; Damage Identification; Damage packaging; Deep learning; Performance; Performances evaluation; Reverse logistics; State of the art; You only look once; Deep learning","18631703","","","Article","Final","","Scopus","2-s2.0-105002981570"
"Camargo-Marín L.; Guzmán-Huerta M.; Piña-Ramirez O.; Perez-Gonzalez J.","Camargo-Marín, Lisbeth (53063270000); Guzmán-Huerta, Mario (6506258294); Piña-Ramirez, Omar (24451399700); Perez-Gonzalez, Jorge (56198041400)","53063270000; 6506258294; 24451399700; 56198041400","Multimodal Early Birth Weight Prediction Using Multiple Kernel Learning","2024","Sensors","24","1","2","","","10","10.3390/s24010002","https://www.scopus.com/pages/publications/85181898996?origin=resultslist","Departamento de Medicina Traslacional, Instituto Nacional de Perinatología Isidro Espinosa de los Reyes, Montes Urales 800, Lomas de Virreyes, Miguel Hidalgo, Mexico, 11000, Mexico; Departamento de Bioinformática y Análisis Estadístico, Instituto Nacional de Perinatología Isidro Espinosa de los Reyes, Montes Urales 800, Lomas de Virreyes, Miguel Hidalgo, Mexico, 11000, Mexico; Unidad Académica del Instituto de Investigaciones en Matemáticas Aplicadas y en Sistemas, Universidad Nacional Autónoma de México, Km 4.5 Carretera Mérida-Tetiz, Yucatán, Municipio de Ucú, 97357, Mexico","Camargo-Marín L., Departamento de Medicina Traslacional, Instituto Nacional de Perinatología Isidro Espinosa de los Reyes, Montes Urales 800, Lomas de Virreyes, Miguel Hidalgo, Mexico, 11000, Mexico; Guzmán-Huerta M., Departamento de Medicina Traslacional, Instituto Nacional de Perinatología Isidro Espinosa de los Reyes, Montes Urales 800, Lomas de Virreyes, Miguel Hidalgo, Mexico, 11000, Mexico; Piña-Ramirez O., Departamento de Bioinformática y Análisis Estadístico, Instituto Nacional de Perinatología Isidro Espinosa de los Reyes, Montes Urales 800, Lomas de Virreyes, Miguel Hidalgo, Mexico, 11000, Mexico; Perez-Gonzalez J., Unidad Académica del Instituto de Investigaciones en Matemáticas Aplicadas y en Sistemas, Universidad Nacional Autónoma de México, Km 4.5 Carretera Mérida-Tetiz, Yucatán, Municipio de Ucú, 97357, Mexico","In this work, a novel multimodal learning approach for early prediction of birth weight is presented. Fetal weight is one of the most relevant indicators in the assessment of fetal health status. The aim is to predict early birth weight using multimodal maternal–fetal variables from the first trimester of gestation (Anthropometric data, as well as metrics obtained from Fetal Biometry, Doppler and Maternal Ultrasound). The proposed methodology starts with the optimal selection of a subset of multimodal features using an ensemble-based approach of feature selectors. Subsequently, the selected variables feed the nonparametric Multiple Kernel Learning regression algorithm. At this stage, a set of kernels is selected and weighted to maximize performance in birth weight prediction. The proposed methodology is validated and compared with other computational learning algorithms reported in the state of the art. The obtained results (absolute error of 234 g) suggest that the proposed methodology can be useful as a tool for the early evaluation and monitoring of fetal health status through indicators such as birth weight. © 2023 by the authors.","ensemble feature selection; fetal medicine; multimodal data; multimodal learning","Algorithms; Anthropometry; Birth Weight; Female; Fetus; Humans; Pregnancy; Prenatal Care; Anthropometry; Feature extraction; Forecasting; Birth weight; Birth weight prediction; Ensemble feature selections; Fetal medicine; Health status; Learning approach; Multi-modal; Multi-modal data; Multi-modal learning; Multiple Kernel Learning; algorithm; anthropometry; birth weight; female; fetus; human; pregnancy; prenatal care; Learning algorithms","14248220","","","Article","Final","All Open Access; Gold Open Access; Green Open Access","Scopus","2-s2.0-85181898996"
"Lavín-Delgado J.E.; Solís-Pérez J.E.; Gómez-Aguilar J.F.; Razo-Hernández J.R.; Etemad S.; Rezapour S.","Lavín-Delgado, J.E. (57210123948); Solís-Pérez, J.E. (57202962426); Gómez-Aguilar, J.F. (55389111400); Razo-Hernández, J.R. (35782446700); Etemad, Sina (56594607200); Rezapour, Shahram (55935081600)","57210123948; 57202962426; 55389111400; 35782446700; 56594607200; 55935081600","An Improved Object Detection Algorithm Based on the Hessian Matrix and Conformable Derivative","2024","Circuits, Systems, and Signal Processing","43","8","","4991","5047","9","10.1007/s00034-024-02669-3","https://www.scopus.com/pages/publications/85190698991?origin=resultslist","Universidad Politécnica del Estado de Guerrero (UPEG), Dirección de Ingeniería en Redes y Telecomunicaciones, Puente Campuzano, Carretera Federal Iguala-Taxco K.M. 105, Taxco de Alarcón, Guerrero, 40321, Mexico; Escuela Nacional de Estudios Superiores Unidad Juriquilla, Universidad Nacional Autónoma de México, Blvd. Juriquilla 3001, Querétaro, Juriquilla, 76230, Mexico; Centro de Investigación en Ingeniería y Ciencias Aplicadas (CIICAp-IICBA), Universidad Autónoma del Estado de Morelos, Av. Universidad 1001, Col. Chamilpa, Morelos, Cuernavaca, 62209, Mexico; CA-Fuentes Alternas y Calidad de la Energía Eléctrica, Departamento de Ingeniería Electromecánica, Tecnológico Nacional de México, Instituto Tecnológico Superior de Irapuato (ITESI), Carr. Irapuato-Silao km 12.5, Colonia El Copal, Irapuato, Guanajuato, 36821, Mexico; Department of Mathematics, Azarbaijan Shahid Madani University, Tabriz, Iran; Insurance Research Center, Tehran, Iran; Department of Medical Research, China Medical University Hospital, China Medical University, Taichung, Taiwan","Lavín-Delgado J.E., Universidad Politécnica del Estado de Guerrero (UPEG), Dirección de Ingeniería en Redes y Telecomunicaciones, Puente Campuzano, Carretera Federal Iguala-Taxco K.M. 105, Taxco de Alarcón, Guerrero, 40321, Mexico; Solís-Pérez J.E., Escuela Nacional de Estudios Superiores Unidad Juriquilla, Universidad Nacional Autónoma de México, Blvd. Juriquilla 3001, Querétaro, Juriquilla, 76230, Mexico; Gómez-Aguilar J.F., Centro de Investigación en Ingeniería y Ciencias Aplicadas (CIICAp-IICBA), Universidad Autónoma del Estado de Morelos, Av. Universidad 1001, Col. Chamilpa, Morelos, Cuernavaca, 62209, Mexico; Razo-Hernández J.R., CA-Fuentes Alternas y Calidad de la Energía Eléctrica, Departamento de Ingeniería Electromecánica, Tecnológico Nacional de México, Instituto Tecnológico Superior de Irapuato (ITESI), Carr. Irapuato-Silao km 12.5, Colonia El Copal, Irapuato, Guanajuato, 36821, Mexico; Etemad S., Department of Mathematics, Azarbaijan Shahid Madani University, Tabriz, Iran; Rezapour S., Department of Mathematics, Azarbaijan Shahid Madani University, Tabriz, Iran, Insurance Research Center, Tehran, Iran, Department of Medical Research, China Medical University Hospital, China Medical University, Taichung, Taiwan","In this paper, a newfangled technique for edge detection that combines the Khalil conformable derivative and the Hessian matrix is developed and experimentally validated. The following main aspects are considered: (i) to attenuate image noise a Gaussian kernel inspired by the Khalil conformable derivative was developed. (ii) The spatial derivatives of the image gray level are calculated via the Khalil derivative, which is suitable for maintaining object contours and texture information even in low-contrast and resolution images. (iii) The conformable Hessian matrix is obtained from these image derivatives, generating continuous, thicker, and brighter edges. Our operator is compared with some existing techniques. Simulation results on different test images confirm a greater robustness to noise by our operator as well as a better visual quality of the edge maps obtained. This statement is validated through a comparative analysis based on peak signal-to-noise ratio and edge-strength-similarity-based image quality. In addition, it is applied in medical image processing and analysis tasks such as mammogram images, computed tomography scans, and magnetic resonance imaging for identification tasks of middle cerebral artery aneurysms, calcifications and breast cancer, proliferative Diabetic Retinopathy, and cerebral arteriovenous malformations. According to our findings, the conformable operator allows better visual identification of the structure of these conditions, improving the accuracy of clinical diagnosis and its subsequent monitoring. © The Author(s), under exclusive licence to Springer Science+Business Media, LLC, part of Springer Nature 2024.","Conformable Gaussian Kernel; Conformable Hessian matrix; Edge detection; Khalil conformable derivative; Medical images","Biomineralization; Computerized tomography; Diagnosis; Eye protection; Image enhancement; Image quality; Image segmentation; Magnetic resonance imaging; Medical imaging; Object detection; Quality control; Signal detection; Signal to noise ratio; Textures; Conformable gaussian kernel; Conformable hessian matrix; Gaussian kernels; Hessian matrices; Image gray level; Image noise; Khalil conformable derivative; Medical image; Object detection algorithms; Spatial derivatives; Edge detection","0278081X","","CSSPE","Article","Final","","Scopus","2-s2.0-85190698991"
