"Authors","Author full names","Author(s) ID","Title","Year","Source title","Volume","Issue","Art. No.","Page start","Page end","Cited by","DOI","Link","Affiliations","Authors with affiliations","Abstract","Author Keywords","Index Keywords","ISSN","ISBN","CODEN","Document Type","Publication Stage","Open Access","Source","EID"
"Arevalo-Ancona R.E.; Haro-Mendoza D.; Cedillo-Hernandez M.; Gonzalez-Villela V.J.","Arevalo-Ancona, Rodrigo Eduardo (58478737700); Haro-Mendoza, Daniel (57205501758); Cedillo-Hernandez, Manuel (25521406600); Gonzalez-Villela, Victor J. (56013727700)","58478737700; 57205501758; 25521406600; 56013727700","Advanced Dual-Branch U-Net Decoder for Precise and Robust Surgical Instrument and Organ Segmentation","2025","Biomedical Signal Processing and Control","110","","108348","","","1","10.1016/j.bspc.2025.108348","https://www.scopus.com/pages/publications/105010414490?origin=resultslist","Instituto Politécnico Nacional SEPI ESIME Culhuacán, Av. Santa Ana 1000 Culhuacán CTM V, 04440 CDMX, Mexico; Universidad Nacional Autónoma de México, Faculty of Engineering, Department of Mechatronics, Av. Universidad, Circuito Exterior, CDMX, 04510, Mexico","Arevalo-Ancona R.E., Instituto Politécnico Nacional SEPI ESIME Culhuacán, Av. Santa Ana 1000 Culhuacán CTM V, 04440 CDMX, Mexico; Haro-Mendoza D., Universidad Nacional Autónoma de México, Faculty of Engineering, Department of Mechatronics, Av. Universidad, Circuito Exterior, CDMX, 04510, Mexico; Cedillo-Hernandez M., Instituto Politécnico Nacional SEPI ESIME Culhuacán, Av. Santa Ana 1000 Culhuacán CTM V, 04440 CDMX, Mexico; Gonzalez-Villela V.J., Universidad Nacional Autónoma de México, Faculty of Engineering, Department of Mechatronics, Av. Universidad, Circuito Exterior, CDMX, 04510, Mexico","The accurate segmentation of surgical instruments and organs is crucial for improving the safety, precision, and efficiency of laparoscopic and robot-assisted surgeries, where real-time guidance and error reduction are paramount. Surgical environments present significant challenges, such as image noise, organ deformation, and tool occlusion, making precise segmentation difficult. This paper presents a surgical image segmentation approach based on a modified U-Net model. The encoder of the neural network used residual blocks, and the decoder architecture is based on a dual-branch model to improve the segmentation performance. One branch focuses on segmenting surgical instruments, while the other on the intervened organ. This design ensures the detection of specific features from the surgical instruments and organs, improving segmentation accuracy. Experimental results evaluate the performance of the proposed neural network model using real surgical datasets. The proposed method achieved superior results, with a mean Intersection over Union (IoU) of 92% for surgical instruments segmentation and 96% for organ segmentation. These findings demonstrate the robustness of the proposed model in challenging surgical environments. © 2025 The Author(s)","Computer-assisted surgery; Deep learning for medical imaging; Dual branch network; Organ segmentation; Surgical instrument segmentation; U-Net","Decoding; Deep learning; Laparoscopy; Medical imaging; Network architecture; Neural networks; Surgical equipment; Transplantation (surgical); Computer assisted surgery; Deep learning for medical imaging; Dual branch network; Organ segmentation; Real- time; Robot-assisted surgery; Surgical environment; Surgical instrument; Surgical instrument segmentation; U-net; anatomical concepts; Article; artificial neural network; computer assisted surgery; deep learning; gated recurrent unit network; human; image noise; image processing; image segmentation; laparoscopic cholecystectomy; long short term memory network; minimally invasive surgery; recurrent neural network; Image segmentation","17468094","","","Article","Final","All Open Access; Hybrid Gold Open Access","Scopus","2-s2.0-105010414490"
"Khalak B.B.; Durmaz D.; Kulekcioglu O.; Bahsi E.; Kasap S.; Engin G.O.; Saritas E.U.; Erdem E.Y.","Khalak, Bushra B. (60401519300); Durmaz, Doruk (60401642500); Kulekcioglu, Okan (60401519400); Bahsi, Ela (60401394000); Kasap, Selin (60401032800); Engin, Guleda O. (57539208500); Saritas, Emine U. (24081552700); Erdem, Emine Y. (57196929675)","60401519300; 60401642500; 60401519400; 60401394000; 60401032800; 57539208500; 24081552700; 57196929675","Detection of Microplastic Waste by Using a Novel Microfluidic System with an Integrated Object Tracking Algorithm","2025","International Conference on Solid-State Sensors, Actuators and Microsystems, Transducers","","2025","","1287","1290","1","10.1109/Transducers61432.2025.11111451","https://www.scopus.com/pages/publications/105030243119?origin=resultslist","Yildiz Technical University, Turkey; Bilkent University, Turkey; Umram (National Magnetic Resonance Research Center), Turkey; Unam (National Nanotechnology Research Center), Turkey","Khalak B.B., Bilkent University, Turkey; Durmaz D., Bilkent University, Turkey; Kulekcioglu O., Bilkent University, Turkey; Bahsi E., Bilkent University, Turkey; Kasap S., Bilkent University, Turkey; Engin G.O., Yildiz Technical University, Turkey; Saritas E.U., Bilkent University, Turkey, Umram (National Magnetic Resonance Research Center), Turkey; Erdem E.Y., Bilkent University, Turkey, Unam (National Nanotechnology Research Center), Turkey","Over the last couple of decades, microplastics, MPs, have become a large focus for pollution evaluation and sustainability. Water has become increasingly concentrated with MPs due to waste disposal and degradation over time. This project's goal is to detect and distinguish microplastics from other materials using a novelty microfluidic design. Analysis was done using multiple novel microchannel designs and Polydimethylsiloxane, PDMS, microchips. An object tracking algorithm, OT, was used to observe MPs and record flow through the microchannel. Footage tested on the microchips with the OT found that the varying pixel area shows the deformation of a microplastic under the chosen parameters.  © 2025 IEEE.","Detection; Microplastics; Object Tracking; Pixel Area","Fluidic devices; Microchannels; Microfluidics; Microplastic; Microprocessor chips; Microsystems; Object detection; Object tracking; Pixels; Process control; Solid-state sensors; Waste disposal; Detection; Integrated object tracking; Microfluidics systems; Microplastics; Object Tracking; Object tracking algorithm; Pixel areas; Pollution evaluation; Polydimethylsiloxane(PDMS); Project goals; Error detection","21670013","","","Conference paper","Final","","Scopus","2-s2.0-105030243119"
"Azuara-Dominguez R.O.; Olveres J.; Escalante-Ramirez B.; Vallejo E.","Azuara-Dominguez, Ruben Omar (59996314200); Olveres, Jimena (35797425500); Escalante-Ramirez, Boris (6701369474); Vallejo, Enrique (55993766000)","59996314200; 35797425500; 6701369474; 55993766000","Deep Learning Approach for Aortic Valve Localization, Detection and Segmentation in Computed Tomography Volumes","2025","Proceedings - IEEE Symposium on Computer-Based Medical Systems","","","","280","283","0","10.1109/CBMS65348.2025.00063","https://www.scopus.com/pages/publications/105010579214?origin=resultslist","Universidad Nacional Autónoma de México, Posgrado de Ingeniería Eléctrica, Mexico City, Mexico; Universidad Nacional Autónoma de México, Facultad de Ingeniería, Mexico City, Mexico; Centro Médico ABC, Mexico city, Mexico","Azuara-Dominguez R.O., Universidad Nacional Autónoma de México, Posgrado de Ingeniería Eléctrica, Mexico City, Mexico; Olveres J., Universidad Nacional Autónoma de México, Facultad de Ingeniería, Mexico City, Mexico; Escalante-Ramirez B., Universidad Nacional Autónoma de México, Facultad de Ingeniería, Mexico City, Mexico; Vallejo E., Centro Médico ABC, Mexico city, Mexico","Standard view cardiac computed tomography (CT) images are of great importance in clinical practice due to the valuable diagnostic information they provide. However, navigating these (3D) medical images to identify such a view can represent a time-consuming process, subject to inter-operator variability. This study presents an approach using a Multiscale Vision Transformer (MViT) to infer the rotation parameters required to obtain standard views and subsequently focus on extracting the left ventricular outflow tract (LVOT) view. Once this view is obtained, the aortic valve is detected and segmented using well-known convolutional neural networks (CNNs), specifically ResNet18 for detection and U-Net for segmentation. The methodology used for its training is detailed, along with the metrics employed to evaluate their performance. Finally, the results obtained for each stage are presented. This approach provides a clear understanding of the performance of each model, from rotation parameter prediction to aortic valve detection and segmentation. © 2025 IEEE.","3D volume Cardiac CT; Attention; Deep Learning; Regression; Rotation matrix; Segmentation","Blood vessels; Computerized tomography; Convolutional neural networks; Diagnosis; Medical image processing; 3d volume cardiac computed tomography; Aortic valves; Attention; Cardiac-computed tomography; Deep learning; Performance; Regression; Rotation parameters; Rotations matrix; Segmentation; Deep learning; Image segmentation","10637125","979-833152610-8","","Conference paper","Final","","Scopus","2-s2.0-105010579214"
"Hernández-Rodríguez M.; Mera Jiménez E.; Nicolás-Vázquez M.I.; Miranda-Ruvalcaba R.","Hernández-Rodríguez, Maricarmen (55701796200); Mera Jiménez, Elvia (6506272169); Nicolás-Vázquez, María Inés (55840364900); Miranda-Ruvalcaba, Rene (57205335983)","55701796200; 6506272169; 55840364900; 57205335983","Dihydroergotamine Increases Histamine Brain Levels and Improves Memory in a Scopolamine-Induced Amnesia Model","2024","International Journal of Molecular Sciences","25","7","3710","","","3","10.3390/ijms25073710","https://www.scopus.com/pages/publications/85190375717?origin=resultslist","Laboratorio de Cultivo Celular, Neurofarmacología y Conducta, Escuela Superior de Medicina, Instituto Politécnico Nacional, Plan de San Luis y Díaz Mirón s/n, Ciudad de México, 11340, Mexico; Departamento de Ciencias Químicas, Facultad de Estudios Superiores Cuautitlán Campo 1, Universidad Nacional Autónoma de México, Avenida 1o de Mayo s/n, Colonia Santa María las Torres, Cuautitlán Izcalli, 54740, Mexico","Hernández-Rodríguez M., Laboratorio de Cultivo Celular, Neurofarmacología y Conducta, Escuela Superior de Medicina, Instituto Politécnico Nacional, Plan de San Luis y Díaz Mirón s/n, Ciudad de México, 11340, Mexico; Mera Jiménez E., Laboratorio de Cultivo Celular, Neurofarmacología y Conducta, Escuela Superior de Medicina, Instituto Politécnico Nacional, Plan de San Luis y Díaz Mirón s/n, Ciudad de México, 11340, Mexico; Nicolás-Vázquez M.I., Departamento de Ciencias Químicas, Facultad de Estudios Superiores Cuautitlán Campo 1, Universidad Nacional Autónoma de México, Avenida 1o de Mayo s/n, Colonia Santa María las Torres, Cuautitlán Izcalli, 54740, Mexico; Miranda-Ruvalcaba R., Departamento de Ciencias Químicas, Facultad de Estudios Superiores Cuautitlán Campo 1, Universidad Nacional Autónoma de México, Avenida 1o de Mayo s/n, Colonia Santa María las Torres, Cuautitlán Izcalli, 54740, Mexico","The beneficial effects of increasing histamine levels on memory have acquired special interest due to their applicability to psychiatric conditions that cause memory impairments. In addition, by employing drug repurposing approaches, it was demonstrated that dihydroergotamine (DHE), an FDA drug approved to treat migraines, inhibits Histamine N Methyl Transferase (HNMT), the enzyme responsible for the inactivation of histamine in the brain. For this reason, in the present work, the effect of DHE on histamine levels in the hippocampus and its effects on memory was evaluated, employing the scopolamine-induced amnesia model, the Novel Object Recognition (NOR) paradigm, and the Morris Water Maze (MWM). Furthermore, the role of histamine 1 receptor (H1R) and histamine 2 receptor (H2R) antagonists in the improvement in memory produced by DHE in the scopolamine-induced amnesia model was evaluated. Results showed that the rats that received DHE (10 mg/kg, i.p.) showed increased histamine levels in the hippocampus after 1 h of administration but not after 5 h. In behavioral assays, it was shown that DHE (1 mg/kg, i.p.) administered 20 min before the training reversed the memory impairment produced by the administration of scopolamine (2 mg/kg, i.p.) immediately after the training in the NOR paradigm and MWM. Additionally, the effects in memory produced by DHE were blocked by pre-treatment with pyrilamine (20 mg/kg, i.p.) administered 30 min before the training in the NOR paradigm and MWM. These findings allow us to demonstrate that DHE improves memory in a scopolamine-induced amnesia model through increasing histamine levels at the hippocampus due to its activity as an HNMT inhibitor. © 2024 by the authors.","dihydroergotamine; histamine; Morris water maze; novel object recognition","Amnesia; Animals; Brain; Dihydroergotamine; Histamine; Histamine H2 Antagonists; Memory Disorders; Rats; Scopolamine; dihydroergotamine; famotidine; histamine; histamine H1 receptor; histamine H2 receptor; mepyramine; metodiclorofen; piracetam; scopolamine; dihydroergotamine; histamine; histamine H2 receptor antagonist; adult; animal experiment; animal model; Article; brain level; controlled study; drug effect; drug structure; escape latency; hippocampus; histamine blood level; male; memory; memory disorder; Morris water maze test; nonhuman; novel object recognition test; rat; scopolamine-induced memory impairment; spatial learning; Wistar rat; amnesia; animal; brain; memory disorder","16616596","","","Article","Final","All Open Access; Gold Open Access; Green Open Access","Scopus","2-s2.0-85190375717"
"Pérez-Reyes V.; Cabral-Lares R.M.; Canche-Tello J.G.; Rentería-Villalobos M.; González-Sánchez G.; Carmona-Lara B.P.; Hernández-Herrera C.; Faudoa-Gómez F.; Rodríguez-Guerra Y.; Vázquez-Olvera G.; Carrillo-Flores J.; Reyes-Cortés I.A.; Hernández-Cruz D.; Loredo-Portales R.; Montero-Cabrera M.E.","Pérez-Reyes, Victoria (59531494700); Cabral-Lares, Rocio M. (58348631900); Canche-Tello, Jesús G. (56431046000); Rentería-Villalobos, Marusia (6507758189); González-Sánchez, Guillermo (59121882700); Carmona-Lara, Blanca P. (59532171900); Hernández-Herrera, Cristina (59532172000); Faudoa-Gómez, Fabián (59003496700); Rodríguez-Guerra, Yair (59003365300); Vázquez-Olvera, Gregorio (6504453600); Carrillo-Flores, Jorge (8230669100); Reyes-Cortés, Ignacio A. (6503854614); Hernández-Cruz, Daniel (15059019200); Loredo-Portales, René (55582099400); Montero-Cabrera, María E. (6603500231)","59531494700; 58348631900; 56431046000; 6507758189; 59121882700; 59532171900; 59532172000; 59003496700; 59003365300; 6504453600; 8230669100; 6503854614; 15059019200; 55582099400; 6603500231","Uranium Mineral Transport in the Peña Blanca Desert: Dissolution or Fragmentation? Simulation in Sediment Column Systems","2025","Applied Sciences (Switzerland)","15","2","609","","","3","10.3390/app15020609","https://www.scopus.com/pages/publications/85216192443?origin=resultslist","Advanced Materials Research Center, Complejo Industrial Chihuahua, Miguel de Cervantes 120, Chihuahua, 31136, Mexico; Faculty of Animal Science and Ecology, Autonomous University of Chihuahua, Perif. R. Almada km 1, Chihuahua, 31453, Mexico; Faculty of Engineering, Autonomous University of Chihuahua, Circuito Universitario Campus II, Chihuahua, 31125, Mexico; Faculty of Engineering, Autonomous University of Chiapas, Blvd. Belisario Domínguez km 1081, Tuxtla Gutiérrez, 29050, Mexico; Instituto de Geología Estación Regional del Noreste, Universidad Nacional Autónoma de México, Luis Donaldo Colosio s/n, Los Arcos, Hermosillo, 83250, Mexico","Pérez-Reyes V., Advanced Materials Research Center, Complejo Industrial Chihuahua, Miguel de Cervantes 120, Chihuahua, 31136, Mexico; Cabral-Lares R.M., Advanced Materials Research Center, Complejo Industrial Chihuahua, Miguel de Cervantes 120, Chihuahua, 31136, Mexico; Canche-Tello J.G., Advanced Materials Research Center, Complejo Industrial Chihuahua, Miguel de Cervantes 120, Chihuahua, 31136, Mexico; Rentería-Villalobos M., Faculty of Animal Science and Ecology, Autonomous University of Chihuahua, Perif. R. Almada km 1, Chihuahua, 31453, Mexico; González-Sánchez G., Advanced Materials Research Center, Complejo Industrial Chihuahua, Miguel de Cervantes 120, Chihuahua, 31136, Mexico; Carmona-Lara B.P., Advanced Materials Research Center, Complejo Industrial Chihuahua, Miguel de Cervantes 120, Chihuahua, 31136, Mexico; Hernández-Herrera C., Advanced Materials Research Center, Complejo Industrial Chihuahua, Miguel de Cervantes 120, Chihuahua, 31136, Mexico; Faudoa-Gómez F., Advanced Materials Research Center, Complejo Industrial Chihuahua, Miguel de Cervantes 120, Chihuahua, 31136, Mexico; Rodríguez-Guerra Y., Advanced Materials Research Center, Complejo Industrial Chihuahua, Miguel de Cervantes 120, Chihuahua, 31136, Mexico; Vázquez-Olvera G., Advanced Materials Research Center, Complejo Industrial Chihuahua, Miguel de Cervantes 120, Chihuahua, 31136, Mexico; Carrillo-Flores J., Advanced Materials Research Center, Complejo Industrial Chihuahua, Miguel de Cervantes 120, Chihuahua, 31136, Mexico; Reyes-Cortés I.A., Faculty of Engineering, Autonomous University of Chihuahua, Circuito Universitario Campus II, Chihuahua, 31125, Mexico; Hernández-Cruz D., Faculty of Engineering, Autonomous University of Chiapas, Blvd. Belisario Domínguez km 1081, Tuxtla Gutiérrez, 29050, Mexico; Loredo-Portales R., Instituto de Geología Estación Regional del Noreste, Universidad Nacional Autónoma de México, Luis Donaldo Colosio s/n, Los Arcos, Hermosillo, 83250, Mexico; Montero-Cabrera M.E., Advanced Materials Research Center, Complejo Industrial Chihuahua, Miguel de Cervantes 120, Chihuahua, 31136, Mexico","The Sierra Peña Blanca (SPB) region in Chihuahua, Mexico contains a significant uranium deposit representing about 40% of the country’s reserves. Common uranium minerals in this area include uranophane, schoepite, and weeksite/boltwoodite, with several superficial occurrences. Mining activities in the 1980s left unprocessed uranium ore exposed to weathering, with potential transport towards Laguna del Cuervo. This study presents an experimental simulation of uranium transport in SPB sediments using three approaches: (i) a batch experiment to evaluate the ideal adsorption of (UO2)2+ by fine sediment; (ii) a column system fed with 569 mgU L−1 UO2(NO3)2 to simulate adsorption by different sediment particle sizes; (iii) a column system with an upper horizon of uranophane from the area, fed with deionized water, to simulate uranium weathering and transport in particulate material, determined by liquid scintillation counting, revealed that the clay fraction had the highest adsorption capacity for U. X-ray Absorption Fine Structure (XAFS) analysis at the U L3 edge confirmed the U(IV) oxidation state and the fittings of the extended XAFS spectra confirmed the presence of the uranophane group of minerals. X-ray tomography further corroborated the distribution of particulate minerals along the column. The results suggest that the primary transport mechanism in SPB involves the fragmentation of uranium minerals, accompanied by eventual dissolution and subsequent adsorption of U onto sediments. © 2025 by the authors.","particles; Sierra Peña Blanca; uranium; X-ray tomography; XAFS","Experimental mineralogy; Extended X ray absorption fine structure spectroscopy; Gamma rays; Radioactive waste transportation; Uranium deposits; Uranium metallography; Uranium mines; Uranium powder metallurgy; X ray absorption; Column systems; Me-xico; Particle; Sediment column; Sierra pena blanca; UO 2; Uranium minerals; Uranophane; X ray absorption fine structures; X-ray tomography; Uranium dioxide","20763417","","","Article","Final","All Open Access; Gold Open Access; Green Open Access","Scopus","2-s2.0-85216192443"
"Santiago-Andres Y.; Aquiles A.; Taniguchi-Ponciano K.; Salame L.; Guinto G.; Mercado M.; Fiordelisio T.","Santiago-Andres, Yorgui (57217073384); Aquiles, Ana (58190828100); Taniguchi-Ponciano, Keiko (55506200000); Salame, Latife (57194704872); Guinto, Gerardo (6701800898); Mercado, Moises (55989777400); Fiordelisio, Tatiana (6506470274)","57217073384; 58190828100; 55506200000; 57194704872; 6701800898; 55989777400; 6506470274","Association between Intracellular Calcium Signaling and Tumor Recurrence in Human Non-Functioning Pituitary Adenomas","2024","International Journal of Molecular Sciences","25","7","3968","","","1","10.3390/ijms25073968","https://www.scopus.com/pages/publications/85190368182?origin=resultslist","Laboratorio de Neuroendocrinología Comparada, Facultad de Ciencias, Universidad Nacional Autónoma de México, Ciudad Universitaria, Ciudad de Mexico, 04510, Mexico; Posgrado en Ciencias Biológicas, Unidad de Posgrado, Edificio D, 1° Piso, Circuito de Posgrados, Ciudad Universitaria, Ciudad de Mexico, 04510, Mexico; Instituto de Neurobiología, Universidad Nacional Autónoma de México, Campus Juriquilla, Querétaro, 76230, Mexico; Unidad de Investigación Médica en Enfermedades Endocrinas, Hospital de Especialidades, Centro Médico Nacional Siglo XXI, Instituto Mexicano del Seguro Social, Ciudad de Mexico, 06720, Mexico; Centro Neurológico, Centro Médico ABC, Ciudad de México, 05370, Mexico","Santiago-Andres Y., Laboratorio de Neuroendocrinología Comparada, Facultad de Ciencias, Universidad Nacional Autónoma de México, Ciudad Universitaria, Ciudad de Mexico, 04510, Mexico, Posgrado en Ciencias Biológicas, Unidad de Posgrado, Edificio D, 1° Piso, Circuito de Posgrados, Ciudad Universitaria, Ciudad de Mexico, 04510, Mexico; Aquiles A., Instituto de Neurobiología, Universidad Nacional Autónoma de México, Campus Juriquilla, Querétaro, 76230, Mexico; Taniguchi-Ponciano K., Unidad de Investigación Médica en Enfermedades Endocrinas, Hospital de Especialidades, Centro Médico Nacional Siglo XXI, Instituto Mexicano del Seguro Social, Ciudad de Mexico, 06720, Mexico; Salame L., Unidad de Investigación Médica en Enfermedades Endocrinas, Hospital de Especialidades, Centro Médico Nacional Siglo XXI, Instituto Mexicano del Seguro Social, Ciudad de Mexico, 06720, Mexico; Guinto G., Centro Neurológico, Centro Médico ABC, Ciudad de México, 05370, Mexico; Mercado M., Unidad de Investigación Médica en Enfermedades Endocrinas, Hospital de Especialidades, Centro Médico Nacional Siglo XXI, Instituto Mexicano del Seguro Social, Ciudad de Mexico, 06720, Mexico; Fiordelisio T., Laboratorio de Neuroendocrinología Comparada, Facultad de Ciencias, Universidad Nacional Autónoma de México, Ciudad Universitaria, Ciudad de Mexico, 04510, Mexico","Clinically non-functioning pituitary adenomas (CNFPAs) are the second most frequent sellar tumor among studies on community-dwelling adults. They are characterized by the absence of hormonal hypersecretion syndrome, and patients present with compressive symptoms, such as a headache and visual field defects. Immunohistochemically, most CNFPAs are of gonadotrope differentiation, with only a few of them being truly null cell adenomas. Although these tumors express receptors for one or more hypothalamic releasing hormones, to what extent this has an impact on the biological and clinical behavior of these neoplasms remains to be defined. In this research, we evaluated the basal and hypothalamic secretagogue-stimulated intracellular calcium mobilization in 13 CNFPAs, trying to correlate this response to the phenotypic features of the patients. Our results indicate that the recurrence of a CNFPA correlates positively with cellular responsiveness, as measured by spontaneous intracellular calcium activity and the ability to respond to multiple hypothalamic secretagogues. We conclude that this finding may be a useful tool for predicting the clinicopathologic behavior of CNFPAs, by testing the variation of cellular responsiveness to hypothalamic secretagogues. © 2024 by the authors.","calcium; cell signaling; CNFPA; endocrine disruption; hormone secretion; non-secreting pituitary adenoma; PitNET; silent pituitary adenoma","cabergoline; corticotropin; follitropin; growth hormone; luteinizing hormone; prolactin; protein nr5a1; protein tbx19; secretagogue; temozolomide; thyrotropin; transcription factor; transcription factor Pit 1; unclassified drug; ACTH secreting adenoma; adult; Article; calcium cell level; calcium signaling; cancer radiotherapy; cavernous sinus; cell activity; chromophobe adenoma; clinical article; controlled study; corticotropin deficiency; female; gene expression profiling; gonadotroph adenoma; growth hormone secreting adenoma; human; human cell; human tissue; hydrocortisone blood level; hypogonadism; hypophysis cell; hypopituitarism; hypothyroidism; immunohistochemistry; male; middle aged; nonfunctioning pituitary adenoma; nuclear magnetic resonance imaging; pituitary macroadenoma; postoperative care; prolactinoma; secondary hypothyroidism; single cell analysis; skull surgery; thyrotropin secreting adenoma; transcranial surgery; transsphenoidal surgery; tumor invasion; tumor recurrence; tumor volume","16616596","","","Article","Final","All Open Access; Gold Open Access; Green Open Access","Scopus","2-s2.0-85190368182"
