longDBName,shortDBName,an,title,abstract,publicationDate,contributors,docTypes,pubTypes,coverDate,peerReviewed,source,subjects,isiType,doids,isbns,issns,publisherLocations,identifiers,isOpenAccess,bookEdition,language,publisher,pageEnd,pageStart,pageCount,volume,issue,doi,notes,mid,degreeLevel,plink,articleType,citedByCount,retracted,retractionNote,Afiliacion1,Afiliacion2
Academic Search Ultimate,asn,174816137,Read/write fence-free work-stealing with multiplicity.,"It has been shown that any nonblocking algorithm for work-stealing in the standard asynchronous shared memory model of computation must use expensive Read-After-Write synchronization patterns or atomic Read-Modify-Write instructions. Algorithms for relaxations of work-stealing have been proposed, which only partially avoid this impossibility result. In restricted models of computation, work-stealing algorithms have been designed that avoid Read-After-Write patterns and atomic Read-Modify-Write instructions. This paper considers work-stealing with multiplicity , a relaxation in which every task is taken by at least one process, and any process can take any task at most once. We study two variants of the relaxation, for each variant designing a Read / Write wait-free algorithm in the standard asynchronous shared memory model. The two algorithms are devoid of Read-After-Write synchronization patterns in all their operations, and additionally, the algorithm for the second variant has constant step complexity and is fence-free. Namely, no specific ordering among the algorithm's instructions is required beyond what is implied by data dependence. To our knowledge, these are the first algorithms for relaxations of work-stealing possessing all these properties. The algorithms are also solutions to relaxed versions of single-enqueuer multi-dequeuer queues. The theoretical results are complemented with an experimental evaluation showing that the benefits of relaxed work-stealing vary depending on the application, concretely on the complexity of the work associated with each task. • We present two asynchronous work-stealing algorithms with relaxation, work-stealing with multiplicity and weak-multiplicity. • In the first one, tasks are taken by at least one operation and if taken by several operations, they must be pairwise concurrent. • In the second one, Take/Steal operations extracting the same task may not be concurrent, however, each process extracts tasks at most once. • The algorithms are wait-free, read/write, and devoid of read-after-write synchronization patterns. • The proposed algorithms outperform standard work-stealing algorithms and exhibit similar or better performance than known relaxed algorithms in some practical settings.",20240401,"Castañeda, Armando ; Piña, Miguel",Article,Academic Journal,Apr2024,true,Journal of Parallel & Distributed Computing,Multiplicity (Mathematics) ; Algorithms ; Synchronization,JOUR,,,0743-7315,,,,,eng,Academic Press Inc.,N.PAG,N.PAG,,186,,10.1016/j.jpdc.2023.104816,,L0I,,https://research.ebsco.com/plink/0908a181-42a6-3761-abd8-c645cca43986,,,,,"Armando Castañeda — Institute of Mathematics, National Autonomous University of Mexico (UNAM) | Miguel Piña — Ph.D. Candidate in Computer Science and Engineering at the National Autonomous University of Mexico (UNAM)",
Academic Search Ultimate,asn,185868360,Physics-Informed Neural Networks for Higher-Order Nonlinear Schrödinger Equations: Soliton Dynamics in External Potentials.,"This review summarizes the application of physics-informed neural networks (PINNs) for solving higher-order nonlinear partial differential equations belonging to the nonlinear Schrödinger equation (NLSE) hierarchy, including models with external potentials. We analyze recent studies in which PINNs have been employed to solve NLSE-type evolution equations up to the fifth order, demonstrating their ability to obtain one- and two-soliton solutions, as well as other solitary waves with high accuracy. To provide benchmark solutions for training PINNs, we employ analytical methods such as the nonisospectral generalization of the AKNS scheme of the inverse scattering transform and the auto-Bäcklund transformation. Finally, we discuss recent advancements in PINN methodology, including improvements in network architecture and optimization techniques.",20250601,"Serkin, Leonid ; Belyaeva, Tatyana L.",Article,Academic Journal,Jun2025,true,Mathematics (2227-7390),Inverse scattering transform ; Nonlinear differential equations ; Partial differential equations ; Evolution equations ; Mathematical optimization,JOUR,,,2227-7390,,,,,eng,MDPI,,1882,,13,11,10.3390/math13111882,,HE2O,,https://research.ebsco.com/plink/ce3db56c-609f-38d6-9472-64804cffbefd,,,,,"Leonid Serkin — Facultad de Ciencias, Universidad Nacional Autónoma de México, Ciudad Universitaria, Circuito Exterior s/n, Coyoacán, Mexico City 04510, Mexico | Tatyana L. Belyaeva — Universidad Autónoma del Estado de México, Av. Instituto Literario 100, Toluca 50000, Mexico",
Academic Search Ultimate,asn,185648576,Jet transport applications to the preliminary orbit determination problem.,"The typical angles-only orbit determination (OD) process first fits a Keplerian preliminary orbit to a set of topocentric right ascension and declination measurements and then refines it via a nonlinear least squares minimization procedure. Yet, modern sky surveys dedicated to near-Earth objects (NEOs) often produce tracklets comprising few observations in a relatively short time span, known as too short arcs, that cannot be handled properly by the classical methods for preliminary OD. In this work, we adapt Gauss method for solving the preliminary OD problem to leverage jet transport techniques, i.e., we exploit high-order polynomial expansions around nominal parameters based on automatic differentiation techniques. Next, we introduce a new method based on minimizing a target function over the manifold of variations, which allows naturally to incorporate more realistic dynamical models beyond the two-body approximation as well as observational uncertainties. The latter serves both as a refinement procedure for an a priori orbit and as an alternative, to established statistical and systematic ranging methods, to compute a preliminary orbit. Further, we extend the nonlinear least squares step for OD to the framework of jet transport. This approach allows us to use second-order least squares optimization methods, like Newton method, in addition to the standard differential corrections method. We present results for individual NEOs, as well as tests based on larger samples of NEOs, showing the efficiency of the algorithms. Finally, we discuss the importance of properly handling outlier observations.",20250601,"Ramírez-Montoya, Luis Eduardo ; Pérez-Hernández, Jorge A. ; Benet, Luis",Article,Academic Journal,Jun2025,true,Celestial Mechanics & Dynamical Astronomy,Orbit determination ; Jet transports ; Automatic differentiation ; Near-Earth objects ; Newton-Raphson method,JOUR,,,0923-2958,,,,,eng,Springer Nature,23,1,23,137,3,10.1007/s10569-025-10246-2,,OE1,,https://research.ebsco.com/plink/2774ed05-bc57-315e-803a-00803ba3d14b,,,,,"Luis Eduardo Ramírez-Montoya — Instituto de Ciencias Físicas, Universidad Nacional Autónoma de México, Av. Universidad s/n, Col. Chamilpa, Cuernavaca, 62210, Mexico | Jorge A. Pérez-Hernández — Telespazio Germany GmbH, Europaplatz 5, 64293, Darmstadt, Germany | Luis Benet — Instituto de Ciencias Físicas, Universidad Nacional Autónoma de México, Av. Universidad s/n, Col. Chamilpa, Cuernavaca, 62210, Mexico",
Academic Search Ultimate,asn,188331165,Validation of the New TLANESY Thermal–Hydraulic Code with Data from the QUENCH-01 Experiment.,"Hydrogen generation and the correct simulation of severe accidents have been of utmost importance since the Fukushima Dai-ichi accident. QUENCH experiments are quite useful for validating mathematical models implemented in system codes for early-phase severe accidents, where hydrogen generation, fuel rod temperature, and their deterioration during these conditions are of vital importance. This paper presents a new system code, TLANESY, designed for the simulation of thermal–hydraulic systems with two-phase flow (mainly water) and with application in the analysis of severe accidents during the early phase. The computational implementation consists of fast-running numerical methods and their validation with experimental data from the QUENCH-01 experiment. The results showed an error with respect to the total hydrogen generation of approximately 0.6%. A stand-alone sensitivity analysis was also performed with some parameters related to the cladding, where it was shown that variation in the thermal conductivity by 15% can alter the total hydrogen generation by up to 5%, indicating that impurities in this material can have a significant impact on this Figure of Merit.",20250901,"Contreras-Pérez, Nahum ; Sánchez-Mora, Heriberto ; Quezada-García, Sergio ; Gómez Torres, Armando Miguel ; Cázares Ramírez, Ricardo Isaac",Article,Academic Journal,Sep2025,true,Journal of Nuclear Engineering (JNE),Interstitial hydrogen generation ; Simulation methods & models ; Sensitivity analysis ; Numerical analysis ; Two-phase flow ; Fukushima-ken (Japan),JOUR,,,2673-4362,,,,,eng,MDPI,,32,,6,3,10.3390/jne6030032,,MSNY,,https://research.ebsco.com/plink/a0194b9c-4abc-38d9-8715-130cce5ab370,,,,,"Nahum Contreras-Pérez — Facultad de Ingeniería, Universidad Nacional Autónoma de México, Ciudad de México 04510, Mexico | Heriberto Sánchez-Mora — Departamento de Ingeniería de Procesos e Hidráulica, Universidad Autónoma Metropolitana-Iztapalapa, Ciudad de México 09310, Mexico | Sergio Quezada-García — Facultad de Ingeniería, Universidad Nacional Autónoma de México, Ciudad de México 04510, Mexico | Armando Miguel Gómez Torres — Instituto Nacional de Investigaciones Nucleares, Carretera México-Toluca, La Marquesa s/n, Ocoyoacac, Ciudad de México 52750, Mexico | Ricardo Isaac Cázares Ramírez — Facultad de Ingeniería, Universidad Nacional Autónoma de México, Ciudad de México 04510, Mexico",
Academic Search Ultimate,asn,185965408,Three-dimensional joint inversion of potential field datasets constrained by cross-gradient and depth weighting.,"A three-dimensional cross-gradient joint inversion algorithm for potential datasets is presented. For the necessary forward gravity and magnetic modeling, the gravitational attraction and the total-field anomaly produced by a three-dimensional volume constituted by rectangular prisms is computed. Due to the imposition of a cross-gradient constraint on our joint inversion strategy, we use a slightly modified version of the nonlinear conjugate gradient methodology to solve for the model parameters. In order to counteract the natural decay implicit in the model responses, we impose a depth weighting on our objective function. To test the proposed algorithm, we first develop the individual and joint inversion of synthetic gravity and magnetic datasets. Finally, we carry out individual and joint inversions of potential field data acquired at La Primavera Geothermal Field, Jalisco, México. Our results show stable minimization processes of our objective function. Additionally, the calculated models reproduce their respective geophysical data for both individual and joint inversion experiments.",20250801,"León-Sánchez, Adrián Misael ; Flores-Márquez, Elsa Leticia ; Tejero-Andrade, Andrés",Article,Academic Journal,Aug2025,true,Acta Geophysica,Artificial joints ; Magnetics ; Gravity ; Prisms ; Algorithms ; Commercial and service industry machinery manufacturing ; Optical Instrument and Lens Manufacturing,JOUR,,,1895-6572,,,,,eng,Springer Nature,3404,3385,20,73,4,10.1007/s11600-025-01561-1,,3BWA,,https://research.ebsco.com/plink/5259b489-4a0a-3a3b-b56a-8b3beebdeb3e,,,,,"Adrián Misael León-Sánchez — Departamento de Geomagnetismo y Exploración, Instituto de Geofísica, Universidad Nacional Autónoma de México, Circuito de la Investigación Científica s/n, Ciudad Universitaria, 04510, Coyoacán, Ciudad de México, México | Elsa Leticia Flores-Márquez — Departamento de Geomagnetismo y Exploración, Instituto de Geofísica, Universidad Nacional Autónoma de México, Circuito de la Investigación Científica s/n, Ciudad Universitaria, 04510, Coyoacán, Ciudad de México, México | Andrés Tejero-Andrade — Departamento de Geofísica, Facultad de Ingeniería, Universidad Nacional Autónoma de México, Avenida Universidad 3000, Ciudad Universitaria, 04510, Coyoacán, Ciudad de México, México",
Academic Search Ultimate,asn,185773797,FEM for 1D-problems involving the logarithmic Laplacian: Error estimates and numerical implementation.,"We present the numerical analysis of a finite element method (FEM) for one-dimensional Dirichlet problems involving the logarithmic Laplacian (the pseudo-differential operator that appears as a first-order expansion of the fractional Laplacian as the exponent s → 0 +). Our analysis exhibits new phenomena in this setting; in particular, using recently obtained regularity results, we prove rigorous error estimates and provide a logarithmic order of convergence in the energy norm using suitable log -weighted spaces. Moreover, we show that the stiffness matrix of logarithmic problems can be obtained as the derivative of the fractional stiffness matrix evaluated at s = 0. Lastly, we investigate the relationship between the discrete eigenvalue problem and its convergence to the continuous one.",20250815,"Hernández-Santamaría, Víctor ; Jarohs, Sven ; Saldaña, Alberto ; Sinsch, Leonard",Article,Academic Journal,Aug2025,true,Computers & Mathematics with Applications,Pseudodifferential operators ; Finite element method ; Numerical analysis ; Dirichlet problem ; Eigenvalues,JOUR,,,0898-1221,,,,,eng,Elsevier B.V.,211,189,23,192,,10.1016/j.camwa.2025.05.013,,JC0,,https://research.ebsco.com/plink/407a8ce5-d2e1-303e-aeff-44ed9105408a,,,,,"Víctor Hernández-Santamaría — Instituto de Matemáticas, Universidad Nacional Autónoma de México, Circuito Exterior, Ciudad Universitaria, 04510 Coyoacán, Ciudad de México, Mexico | Sven Jarohs — Institut für Mathematik, Goethe-Universität Frankfurt, Robert-Mayer-Str. 10, D-60629 Frankfurt am Main, Germany | Alberto Saldaña — Instituto de Matemáticas, Universidad Nacional Autónoma de México, Circuito Exterior, Ciudad Universitaria, 04510 Coyoacán, Ciudad de México, Mexico | Leonard Sinsch — Institut für Mathematik, Goethe-Universität Frankfurt, Robert-Mayer-Str. 10, D-60629 Frankfurt am Main, Germany",
