Title,Author,Author affiliation,Source,Sponsor,Publisher/Repository,Volume and Issue,Pages,Issue date,Monograph title,Publication year,ISSN,E-ISSN,ISBN13,DOI,Conference name,Conference date,Conference location,Abstract,Number of references,Main Heading,Controlled/Subject terms,Uncontrolled terms,Classification code,IPC code,Treatment,Funding details,Funding text,Open Access type(s),Database,Copyright,Data Provider
"Estimation of the Performance of Photovoltaic Cells by Means of an Adaptative Neural Fuzzy Inference Model","Mateo-Romero, Hector Felipe (1); Dela Rosa, Mario Eduardo Carbonó (2); Hernández-Callejo, Luis (1); González-Rebollo, Miguel Ángel (1); Cardeñoso-Payo, Valentín (1); Alonso-Gómez, Victor (1); Martínez-Sacristán, Óscar (1); Gallardo-Saavedra, Sara (1) ","(1) Universidad de Valladolid, Valladolid, Spain (2) Universidad Nacional Autónoma de México, Mexico City, Mexico ","Communications in Computer and Information Science","","Springer Science and Business Media Deutschland GmbH","v 1938 CCIS","p 174-188","2024","Smart Cities - 6th Ibero-American Congress, ICSC-Cities 2023, Revised Selected Papers","2024","18650929","18650937","9783031525162","10.1007/978-3-031-52517-9_12","6th Ibero-American Congress on Smart Cities, ICSC-Cities 2023","November 13, 2023 - November 17, 2023","","This paper presents an Adaptive Neuro-fuzzy Inference System capable of predicting the output power of photovoltaic cells using their electroluminescence image and their IV curve. The input consists of 3 different features: the number of black pixels, grey pixels and white pixels. ANFIS combines the learning capabilities of Artificial Neural Networks with the comprehensible rules of Fuzzy Logic, being optimal for this problem, as demonstrated by the metrics of MAE of 0.064 and MSE of 0.009, which are better than the performance of other tested methods such as Support Vector Machines or Linear Regressor. © The Author(s), under exclusive license to Springer Nature Switzerland AG 2024.","17","Support vector machines","Adversarial machine learning - Electroluminescence - Fuzzy neural networks","Adaptive neuro-fuzzy inference - ANFIS - Fuzzy inference modeling - Fuzzy-Logic - Machine-learning - Neural fuzzy - Neuro-fuzzy inference systems - Output power - Performance - Photovoltaics","701.1 Electricity: Basic Concepts and Phenomena - 741 Light, Optics and Optical Devices - 1101 Artificial Intelligence - 1101.2 Machine Learning","",,"Number: -, Acronym: UVA, Sponsor: Universidad de Valladolid; Number: PID2020-113533RB-C33, Acronym: MCIN, Sponsor: Ministerio de Ciencia e Innovaci&oacute;n; Number: -, Acronym: MCIN, Sponsor: Ministerio de Ciencia e Innovaci&oacute;n; Number: KA-107, Acronym: -, Sponsor: Erasmus+; Number: -, Acronym: -, Sponsor: Erasmus+; ","The Universidad de Valladolid supported this study with the predoctoral contracts of 2020, co-funded by Santander Bank. This work has been financed also by the Spanish Ministry of Science and Innovation, under project PID2020-113533RB-C33. The Universidad de Valladolid also supported this study with ERASMUS+ KA-107. Finally, we have to thank the MOVILIDAD DE DOCTORAN-DOS Y DOCTORANDAS UVa 2023 from the University of Valladolid.","All Open Access, Green","Compendex","Compilation and indexing terms, Copyright 2026 Elsevier Inc.","Engineering Village"
"Terrestrial and Martian space weather: A complex systems approach","Chian, A. (1, 2); Miranda, R. (3); Bertucci, C. (4); Blanco-Cano, X. (8); Borovsky, J. (5); Dasso, S. (4); Echer, E. (2); Franco, A. (6); Girgis, K.M. (7); González-Esparza, J.A. (8); Hada, T. (7); Hasegawa, H. (9); Hsieh, S.-Y. (10); Kajdič, P. (8); Mazelle, C. (11); Rempel, E. (2, 12); Rojas-Castillo, D. (8); Sánchez-Cano, B. (13); Sibeck, D. (14); Stepanova, M. (15); Valdés-Galicia, J. (8); Valdivia, J. (16) ","(1) University of Adelaide, Adelaide, SA, Australia (2) National Institute for Space Research, Brazil (3) University of Brasília, Brazil (4) University of Buenos Aires, Argentina (5) Space Science Institute, Boulder, CO, United States (6) Federal University of Southern and Southeastern Pará (UNIFESSPA), Brazil (7) Kyushu University, Japan (8) National Autonomous University of Mexico, Mexico (9) Japan Aerospace Exploration Agency, Institute of Space and Astronautical Science, Japan (10) Johns Hopkins University, Applied Physics Laboratory, Laurel, MD, United States (11) Université de Toulouse, Institut de Recherche en Astrophysique et Planétologie, France (12) Aeronautics Institute of Technology, Brazil (13) University of Leicester, School of Physics and Astronomy, United Kingdom (14) NASA/GSFC, Greenbelt, MD, United States (15) University of Santiago, Chile (16) University of Chile, Chile ","Journal of Atmospheric and Solar-Terrestrial Physics","","Elsevier B.V., Netherlands","v 259","106253","2024","","","1879-1824","","","10.1016/j.jastp.2024.106253","","","","A comparative overview of Terrestrial and Martian space weather is presented, with emphasis on applying the tools of complexity and nonlinear dynamics to study the spatiotemporal dynamics and structures of sun-Earth and sun-Mars space environment. The following topics are reviewed: (1) complex systems approach to solar atmosphere and solar wind; (2) complex systems approach to planetary bow shock and magnetosphere-ionosphere; (3) Martian space weather, bow shock, and magnetosphere-ionosphere; (4) imaging planetary magnetosphere-ionosphere. All rights reserved Elsevier.","402",,"magnetosphere - Mars - planetary atmospheres - solar wind","nonlinear dynamics - spatiotemporal dynamics - sun-Mars space environment","A9460Q Solar wind interaction with Moon, planets, satellites, and comets - A9460G Solar wind plasma - A9630G Mars and satellites - A9635K Planetary ionospheres; magnetospheres","","Bibliography (BIB); Theoretical or Mathematical (THR)",,,"All Open Access, Hybrid Gold","Inspec","Copyright 2024, The Institution of Engineering and Technology","Engineering Village"
"Finding ϵ-locally optimal solutions for multiobjective multimodal optimization","Hernandezcastellanos, A.E. (1); Schapermeier, L. (2); Hernandez, C. (3); Kerschke, P. (2); Trautmann, H. (4, 5); Schutze, O. (1) ","(1) National Polytechnic Institute, Department of Computer Science, Mexico (2) Technische Universitat Dresden, Big Data Analytics in Transportation, Germany (3) Universidad Nacional Autonoma de Mexico, Instituto de Investigaciones en Matematicas Aplicadas y Sistemas, Mexico (4) Universitat Paderborn, Department of Machine Learning and Optimisation, Germany (5) Universiteit Twente, Data Management and Biometrics Group, Netherlands ","IEEE Transactions on Evolutionary Computation","","IEEE, USA","v 29, n 5","2019-31","Oct 2025","","","1941-0026","","","10.1109/TEVC.2024.3458855","","","","In this article, we address the problem of computing all locally optimal solutions of a given multiobjective problem whose images are sufficiently close to the Pareto front. Such ϵ-locally optimal solutions are particularly interesting in the context of multiobjective multimodal optimization (MMO). To accomplish this task, we first define a new set of interest, LQ,ϵ, that is strongly related to the recently proposed set of ϵ-acceptable solutions. Next, we propose a new unbounded archiver, ArchiveUpdateLQ,ϵ, aiming to capture LQ,ϵ in the limit. This archiver can in principle be used in combination with any multiobjective evolutionary algorithm (MOEA). Further, we equip numerous MOEAs with ArchiveUpdateLQ,ϵ, investigate their performances across several benchmark functions, and compare the enhanced MOEAs with their archive-free coun- terparts. For our experiments, we utilize the well-established metrics HV, IGDX, and Δp. Additionally, we propose and use a new performance indicator, IEDR, which results in comparable performances but which is applicable to problems defined in higher dimensions (in particular in decision variable space).","0",,"evolutionary computation - Pareto optimisation","MMO - MOEA - multiobjective evolutionary algorithm - multiobjective multimodal optimization - Pareto front - ϵ-acceptable solutions - ϵ-locally optimal solutions","E0210G Optimisation - B0260 Optimisation techniques - C1180 Optimisation techniques","","Bibliography (BIB); Theoretical or Mathematical (THR)",,,,"Inspec","Copyright 2025, The Institution of Engineering and Technology","Engineering Village"
"A Technique of Distributed Missions Assignment Problem Solving in Heterogeneous Groups of Aerial Rescue Robots","Klimenko, A. (1); Barinov, A. (2) ","(1) State University, 25/2 Kirovogradskaya St., Russia (2) Trapeznikov Institute of Control Sciences, 65 Profsoyuznaya St., Russia ","Interactive Collaborative Robotics: 9th International Conference, ICR 2024, Proceedings. Lecture Notes in Computer Science, Lecture Notes in Artificial Intelligence (14898)","","Springer Nature, Berlin, Germany","","392-406","2024","","","","","978-3-031-71360-6","10.1007/978-3-031-71360-6_30","International Conference on Interactive Collaborative Robotics","2024","Mexico City, Mexico","This research considers a problem of distributed missions assignment in the heterogeneous group of aerial rescue robots, which function without obstacles on plain landscape. A new technique of distributed missions assignment problem solving is proposed, based on the metaheuristic optimization algorithms independent runs, which are launched on robots in a distributed manner. The novelty of the technique is that metaheuristics instances with varying computational complexities are formed and distributed through the heterogeneous robotic group with the usage of efficient algorithms for the block size forming and assignment. Computational complexities of metaheuristics instances are formed with two contradictory criteria: the first one is the minimization of the makespan of the missions assignment problem solving via independent runs, the second one is the metaheuristic instance maximization because of the solution quality degrading in case of small number of algorithm iterations. This improves the makespan of distributed missions assignment problem solving significantly without considerable degrading of the overall missions assignment result. Selected simulation results demonstrate the improvement of overall mission assignment time up to 2 times with the mission assignment solution degrading less than 26% in the worst case and without degrading in the best case.","32",,"computational complexity - metaheuristics - mobile robots - multi-robot systems - optimisation - rescue robots - search problems","aerial rescue robots - block size - distributed missions assignment problem solving - heterogeneous group - heterogeneous robotic group - metaheuristic optimization algorithms independent runs - metaheuristics instances - mission assignment solution - mission assignment time up to 2 times - missions assignment result","B0260 Optimisation techniques - C1180 Optimisation techniques - C3390C Mobile robots - C4240C Computational complexity","G05D1/00","Practical (PRA); Theoretical or Mathematical (THR)",,,,"Inspec","Copyright 2024, The Institution of Engineering and Technology","Engineering Village"
"Uncertainty Quantification of the Hypervolume for Evolutionary Multi-Objective Reinforcement Learning","Millán, A.M. (1); Hernández Castellanos, C.I. (1) ","(1) IIMAS-UNAM, Mexico ","GECCO '25 Companion: Proceedings of the Genetic and Evolutionary Computation Conference Companion","SIGEVO","ACM, New York, NY, USA","","399-402","2025","","","","","979-8-4007-1464-1","10.1145/3712255.3726775","GECCO '25 Companion: Genetic and Evolutionary Computation Conference Companion","2025","Malaga, Spain","Many real-world problems involve optimizing multiple conflicting objectives simultaneously, often by a series of decisions. Multi-objective reinforcement learning addresses these challenges by training agents to learn policies that balance multiple reward signals from the environment.In recent years, the community has increasingly paid attention to these problems. However, the necessity for more effective solutions persists. In this context, we propose a methodology for approximating optimal policies using evolutionary algorithms.Our approach enhances the search process by leveraging uncertainty quantification in the hypervolume computation of candidate solutions. We adapt the classical evolutionary process, changing the evaluation of agents to prioritize those contributing more to the hypervolume and using uncertainty quantification as a guiding metric.Further, we analyzed four evolutionary algorithms under different uncertainty measures and tested them in diverse multi-objective reinforcement learning environments with up to four objectives. The work revealed that the expected improvement was the most effective uncertainty quantification for guiding the search across all algorithms.",,,"evolutionary computation - learning (artificial intelligence) - optimisation - reinforcement learning","balance multiple reward signals - classical evolutionary process - different uncertainty measures - diverse multiobjective reinforcement - effective solutions persists - effective uncertainty quantification - evolutionary algorithms - evolutionary multiobjective reinforcement learning - hypervolume computation - multiple conflicting objectives - optimal policies - search process - using uncertainty quantification","B0260 Optimisation techniques - C1180 Optimisation techniques - C6263 Reinforcement learning","G06N20/00","Theoretical or Mathematical (THR)",,,,"Inspec","Copyright 2025, The Institution of Engineering and Technology","Engineering Village"
"Optimization of the safety margins of the major insulation on oil-immersed transformers","Espino-Rojas, L.M. (1); Ocon-Valdez, R. (2); Espino-Cortes, F.P. (1); Ortiz-Villanueva, M.C. (1) ","(1) Instituto Politécnico Nacional, Mexico (2) Universidad Nacional Autonoma de Mexico, Electrical-Electronic Engineering, Mexico ","2025 IEEE Electrical Insulation Conference (EIC)","","IEEE, Piscataway, NJ, USA","","1-4","2025","","","","","979-8-3315-2608-5","10.1109/EIC63069.2025.11123232","2025 IEEE Electrical Insulation Conference (EIC)","2025","South Padre Island, TX, USA","The performance of the insulation system is directly linked to transformer life. Therefore, achieving the best insulation system is a key objective during the transformer design. Over the years, many dielectric design criteria have been developed, such as the Weidmann® reference curves and safety margin calculation. This work focuses on optimizing computed safety margins of oil gaps related to the probability of inception of partial discharges in transformer oil without increasing the overall dimensions of the active part of the original transformer design. These margins must be adequate to guarantee that the equipment supports test levels and the dielectric stresses to which it will be subjected during its useful life. An optimization methodology based on genetic algorithms (GA) is developed to maximize safety margins in the major insulation arrangements of a power transformer, considering barriers, oil duct dimensions, and dielectric material properties for mineral or natural esters. The results show that the genetic algorithm yielded considerable improvements in the design of the insulation system of a 20 MVA transformer based on its insulation safety margins, calculated considering the applied potential and impulse voltage test voltages.",,,"dielectric materials - genetic algorithms - power transformer insulation - power transformers - transformer oil","20 MVA transformer - apparent power 20.0 MVA - computed safety margins - dielectric design criteria - dielectric material properties - genetic algorithm - insulation arrangements - insulation safety margins - insulation system - oil duct dimensions - oil gaps - oil-immersed transformers - optimization methodology - original transformer design - power transformer - safety margin calculation - transformer life - transformer oil - Weidmann® reference curves","C1180 Optimisation techniques - B2810D Dielectric breakdown and discharges - B2830C Organic insulation - B8350 Transformers and reactors","H01F27/00 - H01B3/18","Practical (PRA); Theoretical or Mathematical (THR)",,,,"Inspec","Copyright 2025, The Institution of Engineering and Technology","Engineering Village"
"Solution Algorithms for the Capacitated Location Tree Problem with Interconnections","Mendoza-Andrade, N. (1); Ruiz-Y-Ruiz, E. (2); Rodriguez-Romo, S. (3) ","(1) Universidad Nacional Autonoma de Mexico, Mexico (2) National Technological Institute of Mexico, Instituto Tecnológico de Saltillo, Mexico (3) UNAM Facultad de Estudios Superiores Cuautitlán, Mexico ","Algorithms","","MDPI, Switzerland","v 18, n 1","50 (24 pp.)","26 Dec 2024","","","1999-4893","","","10.3390/a18010050","","","","This paper addresses the Capacitated Location Tree Problem with Interconnections, a new combinatorial optimization problem with applications in network design. In this problem, the required facilities picked from a set of potential facilities must be opened to serve customers using a tree-shaped network. Costs and capacities are associated with the opening of facilities and the establishment of network links. Customers have a given demand that must be satisfied while respecting the facilities and link capacities. The problem aims to minimize the total cost of designing a distribution network while considering facility opening costs, demand satisfaction, capacity constraints, and the creation of interconnections to enhance network resilience. A valid mixed-integer programming was proposed and an exact solution method based on the formulation was used to solve small- and medium-sized instances. To solve larger instances two metaheuristic approaches were used. A specific decoder procedure for the metaheuristic solution approaches was also proposed and used to help find solutions, especially for large instances. Computational experiments and results using the three solution approaches are also presented. Finally, a case study on the design of electrical transportation systems was presented and solved.","66",,"combinatorial mathematics - integer programming - metaheuristics - transportation - trees (mathematics)","capacitated location tree problem with interconnections - capacity constraints - combinatorial optimization problem - decoder procedure - demand satisfaction - distribution network - electrical transportation system - exact solution method - facility opening costs - link capacities - metaheuristic solution approaches - mixed-integer programming - network design - network links - network resilience - tree-shaped network","C1160 Combinatorial mathematics - C1180 Optimisation techniques - C1290H Systems theory applications in transportation","","Bibliography (BIB); Theoretical or Mathematical (THR)",,,"All Open Access, Gold","Inspec","Copyright 2025, The Institution of Engineering and Technology","Engineering Village"
"Reactor System Design Optimization using the ASME Plant Systems Design Standard (PSD-1)","Castillo-Hernández, Orestes (1); Quintanar-Gago, David (2); Nelson, Pamela F. (2); Grantom, C.R. (3); Hill, Ralph S. (4) ","(1) CNSNS, Mexico (2) UNAM, Mexico City, Mexico (3) CRG LLC, Huffman; TX, United States (4) Hill Eng Solutions LLC, Boise; ID, United States ","Proceedings of the 19th International Conference on Probabilistic Safety Assessment and Analysis, PSA 2025","","American Nuclear Society","","p 169-178","2025","Proceedings of the 19th International Conference on Probabilistic Safety Assessment and Analysis, PSA 2025","2025","","","9780894482250","10.13182/PSA2025-46889","19th International Conference on Probabilistic Safety Assessment and Analysis, PSA 2025","June 15, 2025 - June 18, 2025","","An ASME Plant Systems Design (PSD-1) standard is being developed for design of facilities with potential for significant hazards to the health and safety of the public, the worker, and the environment. The standard includes requirements and guidance for design organizations to incorporate risk informed probabilistic design methodologies with traditional deterministic design methods, using reliability and availability targets. The overall approach of PSD-1 improves the integration of risk evaluations with design by setting availability targets to achieve a design that complies to the owner's HSE and production goals. This paper presents a multi-objective optimization method based on the NSGA-III algorithm, to satisfy the goals while minimizing costs and system unavailability. By setting system-level unavailability targets that comply with regulatory safety thresholds, the method decomposes complex plant-level problems into manageable subproblems, improving computational efficiency and result interpretation. The approach is applied to the emergency boron injection system of a Pressurized Water Reactor, considering various design alternatives for each component with specific cost and failure probability values. The optimization identifies the Pareto Front, representing optimal solutions that balance cost and unavailability while meeting regulatory limits. The results demonstrate how strategic design adjustments can reduce costs without compromising safety, providing valuable insights for informed decision-making in critical infrastructure projects. © Proceedings of the 19th International Conference on Probabilistic Safety Assessment and Analysis, PSA 2025. All rights reserved.","14","Computational efficiency","Decision making - Design - Health hazards - Multiobjective optimization - Nuclear reactors - Pareto principle - Systems analysis","Design optimization - Design standard - Health and safety - Nuclear reactor design - Plant system design - Reactor systems - Reliability allocation - Unavailability allocation - Unavailability target - Workers'","102.1.2 Health Science - 904 Design - 912.2 Management - 961 Systems Science - 1001.2 Nuclear Reactors - 1102.1 Computer Theory, Includes Computational Logic, Automata Theory, Switching Theory, Programming Theory - 1201.7 Optimization Techniques","",,"Number: -, Acronym: ASME, Sponsor: Association for the Study of Medical Education; Number: -, Acronym: -, Sponsor: Aspect Medical Systems; ","Thanks to ASME STLLC for supporting the Research Project 200: Target Reliability for Mechanical Fluid Systems.",,"Compendex","Compilation and indexing terms, Copyright 2026 Elsevier Inc.","Engineering Village"
"Generalising the team orienteering problem through multi-constraining and multi-objectives","Gross, R. (1); Montero, E. (2); Gálvez Ramírez, N. (1); Menchaca-Méndez, A. (3) ","(1) Universidad Tecnica Federico Santa Maria, Chile (2) Universidad Tecnica Federico Santa Maria, Chile (3) Universidad Nacional Autonoma de Mexico, Mexico ","GECCO '25 Companion: Proceedings of the Genetic and Evolutionary Computation Conference Companion","SIGEVO","ACM, New York, NY, USA","","219-22","2025","","","","","979-8-4007-1464-1","10.1145/3712255.3726719","GECCO '25 Companion: Genetic and Evolutionary Computation Conference Companion","2025","Malaga, Spain","Among all combinatorial optimization challenges, the class of routing represents a well-known set of problems whose optimized solutions can significantly improve overall solution quality. Within this set, the Orienteering Problem presents a complex challenge: finding a set of Hamiltonian paths from a selected subset of objective points within a given time frame to maximize a global score. In this paper, the Multi-constrained Team Orienteering Problem is addressed by incorporating time windows and constraints on the maximum number of categories. The inclusion of an additional objective to balance route sizes is also explored. The problem is solved by adapting the NSGA-II algorithm, incorporating an integer-based solution representation and a set of transformation operators to achieve high-quality, densely populated Pareto fronts with reduced computation times compared to complete solvers.","0",,"combinatorial mathematics - genetic algorithms - mathematical operators - Pareto optimisation","combinatorial optimization - Hamiltonian paths - integer-based solution representation - multiconstrained team orienteering problem - multiobjectives - NSGA-II algorithm - objective points - Pareto fronts - reduced computation times - route sizes - solution quality - time frame - time windows - transformation operators","E0210G Optimisation - E0210E Combinatorial mathematics - B0250 Combinatorial mathematics - B0260 Optimisation techniques - C1160 Combinatorial mathematics - C1180 Optimisation techniques","","Theoretical or Mathematical (THR)",,,,"Inspec","Copyright 2025, The Institution of Engineering and Technology","Engineering Village"
