Title,Author,Author affiliation,Source,Sponsor,Publisher/Repository,Volume and Issue,Pages,Issue date,Monograph title,Publication year,ISSN,E-ISSN,ISBN13,DOI,Conference name,Conference date,Conference location,Abstract,Number of references,Main Heading,Controlled/Subject terms,Uncontrolled terms,Classification code,IPC code,Treatment,Funding details,Funding text,Open Access type(s),Database,Copyright,Data Provider
"Secondary mirrors for homogenization of parabolic trough radiative flux distributions on cylindrical receivers","Martinez-Manuel, L. (1); Cordova-Gallegos, J. (1); Santos, A. (2); Riveros-Rosas, D. (3); Canavarro, D. (2); Horta, P. (2); Arancibia-Bulnes, C.A. (1) ","(1) Universidad Nacional Autonoma de Mexico, Instituto de Energías Renovables, Privada Xochicalco s/n, Temixco, Mexico (2) University of Evora, Portugal (3) Universidad Nacional Autonoma de Mexico, Instituto de Geofisica, Av. Universidad 3000, Mexico ","Solar Energy","","Elsevier B.V., Netherlands","v 287","113209","Feb 2025","","","1471-1257","","","10.1016/j.solener.2024.113209","","","","For high-pressure applications, like direct steam generation or hydrothermal liquefaction, homogenizing the radiative flux on the tubular receiver of the parabolic trough concentrators can help avoid thermal stresses and potential material degradation. In the present study Monte Carlo ray tracing is used to analyze different secondary mirrors to enhance the flux uniformity level over the receiver tube of four parabolic troughs with different rim angles. Elliptical, V-shaped, Lambda-shaped (inverted V), and Compound Elliptical Concentrator (CEC) mirrors are considered. The design of these mirrors is optimized for each case using a Differential Evolution Algorithm. Solutions are sought with the maximum possible uniformity while keeping high optical efficiency. Results of the optical modeling show reductions in peak flux over the tube wall by approximately 60% when secondary mirrors are implemented with PTC systems. Furthermore, optical efficiencies of 90% and flux uniformity levels of 86.6% can be achieved by integrating the Elliptical and Lambda-shaped geometries as secondary mirrors. The effect of the secondary mirrors on the PTC efficiency for off-normal incidence was also studied. CECs are very good at increasing off-normal rays' acceptance, followed by V-shaped mirrors, but at the cost of a worsened overall performance. All rights reserved Elsevier.","51",,"evolutionary computation - geometry - liquefaction - mirrors - Monte Carlo methods - ray tracing - receivers - solar absorber-convertors - solar energy concentrators - steam power stations","CEC mirrors - compound elliptical concentrator mirrors - cylindrical receivers - differential evolution algorithm - direct steam generation - elliptical geometries - flux uniformity level - flux uniformity levels - homogenization process - hydrothermal liquefaction - Lambda-shaped geometries - Monte Carlo ray tracing - optical efficiency - optimisation method - parabolic trough concentrators - parabolic trough radiative flux distributions - parabolic troughs - peak flux - PTC systems - receiver tube - rim angles - secondary mirrors - tubular receiver","B0240G Monte Carlo methods - A0240 Geometry, differential geometry, and topology - B0250 Combinatorial mathematics - A0250 Probability theory, stochastic processes, and statistics - B0260 Optimisation techniques - A4280Y Solar collectors, concentrators and control films: optical aspects - A4280A Optical lenses and mirrors - B8230E Steam power stations and plants - B8250 Solar power stations and photovoltaic power systems - B8460 Other direct energy conversion - A8610K Solar energy - A8630S Photothermal conversion","F24S20/00","Practical (PRA); Theoretical or Mathematical (THR)",,,"All Open Access, Hybrid Gold","Inspec","Copyright 2025, The Institution of Engineering and Technology","Engineering Village"
"The Equivalent Inertia at Load Buses","Ramirez, Juan M.M. (1); Arrieta-Paternina, Mario R. (2); Sanchez-Ocampo, Alexander (1) ","(1) Department of Electrical Engineering, CINVESTAV, Jal, Guadalajara; 45019, Mexico (2) National Autonomous University of Mexico, Mexico; 04510, Mexico ","SSRN","","SSRN","","","May 15, 2024","","2024","15565068","","","10.2139/ssrn.4829075","","","","This paper proposes a method to assign an inertia value to load centres in a power grid, similar to generators. Inertia reflects the system's ability to resist frequency changes, crucial for stability and operation. Such equivalent inertia benefits various aspects of power grids: stability, planning and operation, and impact studies predicting and preventing stability issues. Likewise, it influences generation reserve requirements, system protection schemes, and transient analysis.Thus, the paper highlights the importance of assigning an oscillation equation to load buses. This equation captures the dynamic behaviour of loads (which may not be static) and considers factors like load inertia, damping, and frequency dependence.Then, assigning equivalent inertia and oscillation equations to load buses is essential for understanding the entire dynamic behaviour of the power grid, ensuring stability, designing control strategies, mitigating oscillations, and improving overall grid planning and operation. © 2024, The Authors. All rights reserved.","10","Transient analysis","Buses - Electric equipment protection - Electric power system control - Electric power system planning - Electric power system protection - Electric power system stability - Particle swarm optimization (PSO)","Dynamic behaviors - Frequency - Frequency changes - Inertia of load bus - Load centers - Optimisations - Oscillating equation - Particle swarm optimizers - Power grid planning - Power grids","663.1 Heavy Duty Motor Vehicles - 704.2 Electric Equipment - 706.1 Electric Power Systems - 723 Computer Software, Data Handling and Applications - 731.2 Control System Applications - 912.2 Management - 921.5 Optimization Techniques","",,,,,"Compendex","Compilation and indexing terms, Copyright 2026 Elsevier Inc.","Engineering Village"
"Iterated local search for the label printing problem","Alonso-Pecina, Federico (1); Romero, David (2); Cruz-Chávez, Marco Antonio (3) ","(1) Universidad Autónoma del Estado de Morelos, Morelos, Cuernavaca, Mexico (2) Universidad Nacional Autónoma de México, Mexico City, Mexico (3) CIICAP, Universidad Autónoma del Estado de Morelos, Morelos, Cuernavaca, Mexico ","Journal of the Operational Research Society","","Taylor and Francis Ltd.","v 75, n 1","p 39-48","2024","","2024","01605682","14769360","","10.1080/01605682.2023.2174053","","","","In the label printing problem (LPP), a set of labels must be printed in specified quantities, using n templates to be defined. Each template can accommodate a fixed number of printing plates. The LPP consists of determining: (1) an n-partition of the labels, where each block defines the labels that share a template, (2) for each label the number of identical printing plates to place in one of the n templates, and (3) the number of imprints to make with each template. The objective is to satisfy the labels’ demand while minimising total waste. Since the LPP is NP-Hard, to solve it, we propose here an Iterated Local Search heuristic that, once tested on all the instances available to us, it improved many of the best known results or find the optimum, when it is known. © Operational Research Society 2023.","25","Integer programming","Combinatorial optimization - Heuristic algorithms - Local search (optimization)","Fixed numbers - Heuristic - Integer Program- ming - Iterated local search - Label printing - Local search heuristics - Metaheuristic - NP-hard - Printing problems","723.1 Computer Programming - 921.4 Combinatorial Mathematics, Includes Graph Theory, Set Theory - 921.5 Optimization Techniques","",,,,,"Compendex","Compilation and indexing terms, Copyright 2026 Elsevier Inc.","Engineering Village"
"Adaptive Fast Terminal Sliding Mode (FTSM) Control and High Gain Observer (HGO) for Multi-motor Web Transport Systems","Van Tuyên, T. (1); Xuan Tinh, T. (2); Krestovnikov, K. (3) ","(1) Le Quy Don Technical University, Viet Nam (2) Air Defence - Air Force Academy of Vietnam, Viet Nam (3) St. Petersburg Federal Research Center of the Russian Academy of Sciences (SPC RAS), 39, 14Th Line V.O, St. Petersburg, Russia ","Interactive Collaborative Robotics: 9th International Conference, ICR 2024, Proceedings. Lecture Notes in Computer Science, Lecture Notes in Artificial Intelligence (14898)","","Springer Nature, Berlin, Germany","","131-43","2024","","","","","978-3-031-71360-6","10.1007/978-3-031-71360-6_10","International Conference on Interactive Collaborative Robotics","2024","Mexico City, Mexico","The research object of the article is the web winding system, which has a complex MIMO structure, has variable parameters and is affected by noise. In reality today, the controllers of this system mainly use linear control methods. However, linear control methods do not always provide the desired quality. Therefore, research, development and application of nonlinear algorithms to improve system quality is essential. A substantial amount of developments in the field of regulators for complex systems with variable parameters has been realized in the field of robotics and manipulation systems. This paper presents the results of synthesizing the adaptive fast terminal sliding controller based on the neural network for the web winding system for elastic material. The survey and evaluation results by simulation on Matlab-Simulink software show that this controller ensures the quality requirements even when the system is affected by random input noise and model parameters change. The application of the developed solutions in robotics will improve the quality of control and increase the efficiency of mechanical systems.","12",,"nonlinear control systems - observers - variable structure systems - winding (process)","adaptive fast terminal - complex MIMO structure - complex systems - control methods - desired quality - manipulation systems - mechanical systems - model parameters change - multimotor web transport systems - quality requirements - system quality - web winding system","C1310 Control system analysis and synthesis methods - C1320 Stability in control theory - C1340K Nonlinear control systems - C1340B Multivariable control systems - E1550 Control technology and theory (production)","G05B17/00 - B65H54/00 - B21C47/02","Practical (PRA); Theoretical or Mathematical (THR)",,,,"Inspec","Copyright 2024, The Institution of Engineering and Technology","Engineering Village"
"A R2 Based Multi-objective Reinforcement Learning Algorithm","Borrel Miller, Sofia Magdalena (1); Hernández Castellanos, Carlos Ignacio (1) ","(1) Universidad Nacional Autónoma de México, Mexico City, Mexico ","Lecture Notes in Computer Science (including subseries Lecture Notes in Artificial Intelligence and Lecture Notes in Bioinformatics)","","Springer Science and Business Media Deutschland GmbH","v 14990 LNCS","p 285-289","2025","Learning and Intelligent Optimization - 18th International Conference, LION 18, Revised Selected Papers","2025","03029743","16113349","9783031756221","10.1007/978-3-031-75623-8_22","18th International Conference on Learning and Intelligent Optimization, LION 2024","June 9, 2024 - June 13, 2024","","In many real-world problems, one faces the problem of having to make decisions considering several conflicting objectives. In such problems, the solution is a set of policies rather than a single one. This leads to multi-objective reinforcement learning problems (MORL) which have not received much attention until recent years by the reinforcement learning community. In this work, we propose coupling the R2 indicator with Pareto Q-learning. The R2 indicator has been successfully used for multi-objective optimization problems making it a good candidate for MORL. We tested our approach on several problems from MO Gymnasium and compared it with HB-MORL, which uses the hypervolume indicator. Our preliminary results show that the novel algorithm obtains competitive results and that could be an interesting alternative when dealing with MORL problems. © The Author(s), under exclusive license to Springer Nature Switzerland AG 2025.","8","Contrastive Learning","Adversarial machine learning - Consensus algorithm - Deep reinforcement learning - Federated learning - Optimization algorithms","Conflicting objectives - Learning community - Learning problem - Multi objective - Multi-objective reinforcement learning - Performance indicators - R2 indicator - Real-world problem - Reinforcement learning algorithms - Reinforcement learnings","1101.2 Machine Learning - 1101.2.1 Deep Learning - 1103.3 Data Communication, Equipment and Techniques - 1105.3 Blockchain Technology - 1106.1 Computer Programming - 1201.7 Optimization Techniques","",,"Number: IA102923, Acronym: -, Sponsor: -; ","The first and second authors acknowledge the funding from CONAHCyT\u2019s scholarship and project PAPIIT no. IA102923 respectively.",,"Compendex","Compilation and indexing terms, Copyright 2026 Elsevier Inc.","Engineering Village"
"Academic Achievement of Higher-Middle Education Students in Chihuahua: A Pre and Post COVID-19 Pandemic Analysis","Céspedes-González, Yaimara (1); Escobar, Alma Delia Otero (1); Molero-Castillo, Guillermo (2) ","(1) Universidad Veracruzana, Veracruz, Xalapa, Mexico (2) Universidad Nacional Autónoma de México, Mexico City, Mexico ","Lecture Notes in Networks and Systems","","Springer Science and Business Media Deutschland GmbH","v 1285 LNNS","p 554-571","2025","Advances in Information and Communication - Proceedings of the 2025 Future of Information and Communication Conference FICC","2025","23673370","23673389","9783031844591","10.1007/978-3-031-84460-7_35","Future of Information and Communication Conference, FICC 2025","April 28, 2025 - April 29, 2025","","The education has a crucial role in the society; therefore, it is important to have quality education systems. However, the COVID-19 pandemic influenced education. Therefore, it is interesting to know to what extent education was affected due to this health crisis. In this sense, the academic achievement of students is an indicator that allows knowing the quality of educational systems. One way to measure this indicator is through the analysis of standardized test results, like PLANEA in Mexico. This research paper presents the analysis of academic achievement in mathematics of higher-middle education students, before and after the COVID-19 pandemic, in the state of Chihuahua, using an approach based on computational intelligence. To reach the goal, an unsupervised learning approach based on K-means was used, an algorithm that models a set of input variables and assigns elements (data vectors) with similar characteristics to certain clusters. The solution method consisted of four stages: data acquisition, variable selection, algorithm application, and number of clusters definition. As a result, a differentiated segmentation was obtained for the evaluated periods (2017 and 2022). Furthermore, based on this segmentation, some characteristics were identified for each level of academic achievement reached by the students: deficient, elementary, satisfactory, and outstanding. © The Author(s), under exclusive license to Springer Nature Switzerland AG 2025.","36","Algebra","Computational methods - Geometry - Learning algorithms - Set theory - Students - Teaching","Academic achievements - Academic performance - Education systems - Educational systems - Health crisis - High-middle education - Me-xico - Quality education - Research papers - Standardized tests","901.2 Education - 1101.2 Machine Learning - 1201.1 Algebra and Number Theory - 1201.5 Computational Mathematics - 1201.8 Discrete Mathematics and Combinatorics, Includes Graph Theory, Set Theory - 1201.14 Geometry and Topology","",,,,,"Compendex","Compilation and indexing terms, Copyright 2026 Elsevier Inc.","Engineering Village"
"Unlocking the power of membrane biophysics: enhancing the study of antimicrobial peptides activity and selectivity","Bertrand, B. (1); Munoz-Garay, C. (1) ","(1) Universidad Nacional Autonoma de Mexico, Instituto de Ciencias Fisicas, Avenida Universidad 2001, Chamilpa, Morelos, Mexico ","Biophysical Reviews","","Springer Nature, Germany","v 17, n 2","605-25","April 2025","","","1867-2469","","","10.1007/s12551-025-01312-y","","","","The application of membrane-active antimicrobial peptides (AMPs) is considered to be a viable alternative to conventional antibiotics for treating infections caused by multidrug-resistant pathogenic microorganisms. In vitro and in silico biophysical approaches are indispensable for understanding the underlying molecular mechanisms of membrane-active AMPs. Lipid bilayer models are widely used to mimic and study the implication of various factors affecting these bio-active molecules, and their relationship with the physical parameters of the different membranes themselves. The quality and resemblance of these models to their target is crucial for elucidating how these AMPs work. Unfortunately, over the last few decades, no notable efforts have been made to improve or refine membrane mimetics, as it pertains to the elucidation of AMPs molecular mechanisms. In this review, we discuss the importance of improving the quality and resemblance of target membrane models, in terms of lipid composition and distribution, which ultimately directly influence physical parameters such as charge, fluidity, and thickness. In conjunction, membrane and peptide properties determine the global effect of selectivity, activity, and potency. It is therefore essential to define these interactions, and to do so, more refined lipid models are necessary. In this review, we focus on the significant advancements in promoting biomimetic membranes that closely resemble native ones, for which thorough biophysical characterization is key. This includes utilizing more complex lipid compositions that mimic various cell types. Additionally, we discuss important considerations to be taken into account when working with more complex systems.","174",,"antibacterial activity - biochemistry - biomedical materials - biomembranes - biomimetics - cellular biophysics - drugs - lipid bilayers - microorganisms - molecular biophysics - nanomedicine - proteins","AMPs molecular mechanisms - AMPs work - antimicrobial peptides activity - bio-active molecules - biomimetic membranes - biophysical approaches - biophysical characterization - complex lipid compositions - conventional antibiotics - different membranes - lipid bilayer models - lipid composition - membrane biophysics - membrane mimetics - membrane-active AMPs - membrane-active antimicrobial peptides - multidrug-resistant pathogenic microorganisms - peptide properties - physical parameters - refined lipid models - resemblance - target membrane models - underlying molecular mechanisms","A0130R Reviews and tutorial papers; resource letters - A8715K Biomolecular interactions, charge transfer complexes - A8715H Biomolecular dynamics, molecular probes, molecular pattern recognition - A8715D Physical chemistry of biomolecular solutions and condensed states - A8715B Biomolecular structure, configuration, conformation, and active sites - A8720E Natural and artificial biomembranes - A8725F Physics of subcellular structures - A8725 Cellular biophysics - A8770M Biomedical materials - A8770G Patient care and treatment","","Bibliography (BIB); Experimental (EXP)",,,"All Open Access, Hybrid Gold","Inspec","Copyright 2025, The Institution of Engineering and Technology","Engineering Village"
"The statistical physics of single cell genomics","Hernandez-Lemus, E. (1, 2) ","(1) National Institute of Genomic Medicine, Computational Genomics Division, Mexico (2) Universidad Nacional Autonoma de Mexico, Center for Complexity Sciences, Mexico ","Molecular Physics. An International Journal at the Interface Between Chemistry and Physics","","Taylor & Francis, UK","v 122, n 19-20","e2297818 (11 pp.)","2024","","","1362-3028","","","10.1080/00268976.2023.2297818","","","","The fields of statistical physics and single-cell genomics have traditionally evolved independently, each contributing unique insights to their respective domains. However, recent advances have unveiled intriguing parallels between these seemingly disparate disciplines. This paper delves into the remarkable similarities underlying the fundamental principles governing both systems, shedding light on their shared mathematical frameworks, information processing dynamics and emergent behaviours. We explore how energy landscapes in statistical physics correspond to gene expression landscapes, and how the study of disordered phenomena may shed light on the cellular heterogeneity observed in gene expression profiles. Some parallels between phase transitions and critical transitions in cellular differentiation processes are discussed. Emergent behaviours and collective phenomena, central to both fields, offer opportunities for cross-disciplinary insights. By examining these similarities, we can potentially transfer analytical tools and methodologies between these domains. In summary, this paper underscores some unexpected yet profound parallels between statistical physics and single-cell genomics. By embracing the shared mathematical and conceptual frameworks, researchers can unlock new avenues for discovery, enriching our understanding of complex systems ranging from the microscopic world of molecules to the intricate processes governing cellular behaviour.","134",,"bioinformatics - cellular biophysics - genetics - genomics - reviews - statistical analysis","cellular behaviour - cellular differentiation processes - cellular heterogeneity - critical transitions - cross-disciplinary insights - disordered phenomena - gene expression profiles - information processing dynamics - mathematical frameworks - phase transitions - single-cell genomics - statistical physics","A0130R Reviews and tutorial papers; resource letters - A0250 Probability theory, stochastic processes, and statistics - C1140Z Other topics in statistics - C7330 Biology and medical computing - A8725F Physics of subcellular structures - A8780S Genomic techniques","G16B","Bibliography (BIB); General or Review (GEN)",,,,"Inspec","Copyright 2025, The Institution of Engineering and Technology","Engineering Village"
