longDBName,shortDBName,an,title,abstract,publicationDate,contributors,docTypes,pubTypes,coverDate,peerReviewed,source,subjects,isiType,doids,isbns,issns,publisherLocations,identifiers,isOpenAccess,bookEdition,language,publisher,pageEnd,pageStart,pageCount,volume,issue,doi,notes,mid,degreeLevel,plink,articleType,citedByCount,retracted,retractionNote
Academic Search Ultimate,asn,176120305,Intraoperative ultrasound for surgical resection of high-grade glioma and glioblastoma: a meta-analysis of 732 patients.,"Purpose: Here, we conducted a meta-analysis to explore the use of intraoperative ultrasound (iUS)-guided resection in patients diagnosed with high-grade glioma (HGG) or glioblastoma (GBM). Our aim was to determine whether iUS improves clinical outcomes compared to conventional neuronavigation (CNN). Methods: Databases were searched until April 21, 2023 for randomized controlled trials (RCTs) and observational cohort studies that compared surgical outcomes for patients with HGG or GBM with the use of either iUS in addition to standard approach or CNN. The primary outcome was overall survival (OS). Secondary outcomes include volumetric extent of resection (EOR), gross total resection (GTR), and progression-free survival (PFS). Outcomes were analyzed by determining pooled relative risk ratios (RR), mean difference (MD), and standardized mean difference (SMD) using random-effects model. Results: Of the initial 867 articles, only 7 articles specifically met the inclusion criteria (1 RCT and 6 retrospective cohorts). The analysis included 732 patients. Compared to CNN, the use of iUS was associated with higher OS (SMD = 0.26,95%CI=[0.12,0.39]) and GTR (RR = 2.02; 95% CI=[1.31,3.1]) for both HGG and GBM. There was no significant difference in PFS or EOR. Conclusion: The use of iUS in surgical resections for HGG and GBM can improve OS and GTR compared to CNN, but it did not affect PFS. These results suggest that iUS reduces mortality associated with HGG and GBM but not the risk of recurrence. These results can provide valuable cost-effective interventions for neurosurgeons in HGG and GBM surgery.",20240318,"Pichardo-Rojas, Pavel S. ; Zarate, Carlos ; Arguelles-Hernández, Julieta ; Barrón-Lomelí, Aldo ; Sanchez-Velez, Roberto ; Hjeala-Varas, Amir ; Gutierrez-Herrera, Ernesto ; Tandon, Nitin ; Esquenazi, Yoshua",Article,Academic Journal,3/18/2024,true,Neurosurgical Review,Gliomas ; Surgical excision ; Glioblastoma multiforme ; Ultrasonic imaging ; Randomized controlled trials ; Craniotomy,JOUR,,,0344-5607,,,,,eng,Springer Nature,12,1,12,47,1,10.1007/s10143-024-02354-8,,0FU,,https://research.ebsco.com/plink/c3a1e1ea-e58e-3ef2-b28d-57ef7f4da2ec,,,,
Academic Search Ultimate,asn,99052424,Human Viruses and Cancer.,"The first human tumor virus was discovered in the middle of the last century by Anthony Epstein, Bert Achong and Yvonne Barr in African pediatric patients with Burkitt's lymphoma. To date, seven viruses -EBV, KSHV, high-risk HPV, MCPV, HBV, HCV and HTLV1- have been consistently linked to different types of human cancer, and infections are estimated to account for up to 20% of all cancer cases worldwide. Viral oncogenic mechanisms generally include: generation of genomic instability, increase in the rate of cell proliferation, resistance to apoptosis, alterations in DNA repair mechanisms and cell polarity changes, which often coexist with evasion mechanisms of the antiviral immune response. Viral agents also indirectly contribute to the development of cancer mainly through immunosuppression or chronic inflammation, but also through chronic antigenic stimulation. There is also evidence that viruses can modulate the malignant properties of an established tumor. In the present work, causation criteria for viruses and cancer will be described, as well as the viral agents that comply with these criteria in human tumors, their epidemiological and biological characteristics, the molecular mechanisms by which they induce cellular transformation and their associated cancers.",20141001,"Morales-Sánchez, Abigail ; Fuentes-Pananá, Ezequiel M.",Article,Academic Journal,Oct2014,true,Viruses (1999-4915),Viruses ; Cancer diagnosis ; Tumors ; DNA repair ; Cell proliferation ; Patients,JOUR,,,1999-4915,,,,,eng,MDPI,4079,4047,33,6,10,10.3390/v6104047,,B0FE,,https://research.ebsco.com/plink/d04b98a5-bc01-3b05-a7d1-d9f3119e118a,,,,
Academic Search Ultimate,asn,149401564,Knowledge extraction for assisted curation of summaries of bacterial transcription factor properties.,"Transcription factors (TFs) play a main role in transcriptional regulation of bacteria, as they regulate transcription of the genetic information encoded in DNA. Thus, the curation of the properties of these regulatory proteins is essential for a better understanding of transcriptional regulation. However, traditional manual curation of article collections to compile descriptions of TF properties takes significant time and effort due to the overwhelming amount of biomedical literature, which increases every day. The development of automatic approaches for knowledge extraction to assist curation is therefore critical. Here, we show an effective approach for knowledge extraction to assist curation of summaries describing bacterial TF properties based on an automatic text summarization strategy. We were able to recover automatically a median 77% of the knowledge contained in manual summaries describing properties of 177 TFs of Escherichia coli K-12 by processing 5961 scientific articles. For 71% of the TFs, our approach extracted new knowledge that can be used to expand manual descriptions. Furthermore, as we trained our predictive model with manual summaries of E. coli , we also generated summaries for 185 TFs of Salmonella enterica serovar Typhimurium from 3498 articles. According to the manual curation of 10 of these Salmonella typhimurium summaries, 96% of their sentences contained relevant knowledge. Our results demonstrate the feasibility to assist manual curation to expand manual summaries with new knowledge automatically extracted and to create new summaries of bacteria for which these curation efforts do not exist. Database URL: The automatic summaries of the TFs of E. coli and Salmonella and the automatic summarizer are available in GitHub (https://github.com/laigen-unam/tf-properties-summarizer.git).",20200101,"Méndez-Cruz, Carlos-Francisco ; Blanchet, Antonio ; Godínez, Alan ; Arroyo-Fernández, Ignacio ; Gama-Castro, Socorro ; Martínez-Luna, Sara Berenice ; González-Colín, Cristian ; Collado-Vides, Julio",Article,Academic Journal,2020,true,Database: The Journal of Biological Databases & Curation,Salmonella enterica serovar typhimurium ; Transcription factors ; Salmonella enterica ; Salmonella typhimurium ; Genetic transcription,JOUR,,,1758-0463,,,,,eng,Oxford University Press / USA,13,1,13,2020,,10.1093/database/baaa109,,8ONH,,https://research.ebsco.com/plink/8f98fd5b-f7e7-3c78-a82a-c4737fd36599,,,,
Academic Search Ultimate,asn,156861500,U19-Net: a deep learning approach for obstacle detection in self-driving cars.,"Development of self-driving cars aims to drive safely from one point to another in a coordinated system where an on-board system should react and possibly alert drivers about the driving environments and possible collisions that may arise between drivers and obstacles. There are many deep learning approaches available for obstacle detection especially convolutional neural networks (CNNs) with improvement accuracy, and encoder–decoder networks are CNNs with a current attraction for researchers mainly because these models provide better results than classical statistical models for image segmentation and object classification tasks. This work proposes U19-Net an encoder–decoder deep model that explores the deep layers of a VGG19 model as an encoder following a symmetrical approach with an U-Net decoder designed for pixel-wise classifications. The U19-Net has end-to-end learning successfully effectiveness for the vehicle and pedestrian detection within the open-source Udacity dataset showing an IoU score of 87.08 and 78.18%, respectively. The proposed U19-Net is compared with five recent CNN networks using the AP metric, obtaining near results (less than 5%) for the faster R-CNN, one of the most commonly used networks for object detection.",20220601,"Cervera-Uribe, Albert Aarón ; Méndez-Monroy, Paul Erick",Article,Academic Journal,Jun2022,true,"Soft Computing - A Fusion of Foundations, Methodologies & Applications",Deep learning ; Driverless cars ; Object recognition (Computer vision) ; Convolutional neural networks ; Image segmentation,JOUR,,,1432-7643,,,,,eng,Springer Nature,5207,5195,13,26,11,10.1007/s00500-022-06980-6,,O1F,,https://research.ebsco.com/plink/87381fc5-bcb2-32f7-b583-b505e366369a,,,,
Academic Search Ultimate,asn,192969432,The spheroidal bulge of the Milky Way: Chemodynamically distinct from the inner-thick disc and bar.,"Studying the composition and origin of the inner region of our Galaxy—the ""Galactic bulge""—is crucial for understanding the formation and evolution of the Milky Way and other galaxies. We present new observational constraints based on a sample of around 18 000 stars in the inner Galaxy, combining Gaia DR3 RVS and APOGEE DR17 spectroscopy. Gaia-RVS complements APOGEE by improving the sampling of the metallicity, [Fe/H], in the −2.0 to −0.5 dex range. This work marks the first application of Gaia-RVS spectroscopy to the bulge region, enabled by a novel machine learning approach (hybrid-CNN) that derives stellar parameters from intermediate-resolution spectra with precision comparable to APOGEE's infrared data. We performed full orbit integrations using a barred Galactic potential and applied orbital frequency analysis to disentangle the stellar populations in the inner Milky Way. For the first time, we are able to robustly identify the long-sought pressure-supported bulge traced by the field stars. We show this stellar population to be chemically and kinematically distinct from the other main components co-existing in the same region. The spheroidal bulge has a metallicity distribution function (MDF) peak at around −0.70 dex extending to solar values. It is dominated by a high-[α∕Fe] population with almost no dependency on metallicity, consistent with very rapid early formation predating the thick disc and the bar. We find evidence that the bar has influenced the dynamics of the spheroidal bulge, introducing a mild triaxiality and radial extension. We identify a group of stars on X<sub>4</sub> orbits, likely native to the early spheroid, as this population mimics the chemistry of the spheroidal bulge, with a minor contamination from the more metal-poor ([Fe∕H]< −1.0) halo. We find the inner thick disc to be kinematically hotter (V<sub>φ</sub> ≈ 125 km s<sup>−1</sup>) than the local thick disc. The disc, chemically distinct from the spheroidal bulge and bar, is predominantly metal-poor with an MDF peak at [Fe/H] ≈ −0.45 dex and includes a high fraction of stars with sub-solar [Fe/H] and intermediate [α/Fe]. In contrast to the spheroidal bulge, the [α/Fe] disc shows a steeper decline with [Fe/H], consistent with smaller star formation efficiency than that of the spheroidal bulge. Both the thick disc and the spheroidal bulge present vertical metallicity gradients. We find that the Galactic bar contains both metal-rich and metal-poor stars, as well as high and low [α/Fe] in nearly equal measure. However, their relative contributions vary significantly across different orbital families. The bar shows no strong metallicity trends in orbital extent or velocity dispersions and maintains a consistent elongated shape across all metallicities, indicating that it is a well-mixed dynamical structure. Despite their spatial overlap, the spheroidal bulge, thick disc, and bar occupy distinct regions in both phase space and chemical abundance, indicating separate formation pathways. The stars with [Fe/H]< −1.0 and crossing the Galactic bulge are comprised by accreted populations primarily (70%) belonging to the Gaia-Enceladus/Sausage (GES) merger with an MDF peak at −1.30 dex and possibly a secondary merger remnant with an MDF peak at −1.80 dex.",20260301,"Nepal, S. ; Chiappini, C. ; Pérez-Villegas, A. ; Queiroz, A. B. ; Souza, S. ; Steinmetz, M. ; Anders, F. ; Khalatyan, A. ; Barbuy, B. ; Guiglion, G.",Article,Academic Journal,2026,true,Astronomy & Astrophysics / Astronomie et Astrophysique,Galactic bulges ; Chemical properties ; Disk galaxies ; Kinematics ; Milky Way ; Stellar density (Stellar population) ; Stellar populations,JOUR,,,0004-6361,,,,,eng,EDP Sciences,32,1,32,707,,10.1051/0004-6361/202556326,,NC8,,https://research.ebsco.com/plink/703086c5-3013-368a-b1dd-926f8910a91f,,,,
Academic Search Ultimate,asn,114572163,"A generalized frame of reference for the incorporation of, multi-terminal VSC-HVDC systems in power flow solutions.","This paper introduces a new and general frame-of-reference for true unified, iterative solutions of AC/DC power flows using the Newton-Raphson method. The emphasis is placed on the so-called multi-terminal VSC-HVDC systems. This frame-of-reference accommodates quite naturally any number of AC/DC sub-networks generated by an arbitrary number of VSC converters. Besides, each AC sub-network may contain any number of FACTS devices. The modeling approach adopted for the multi-terminal VSC-HVDC systems is incremental in nature. An AC system of arbitrary configuration is connected to the high-voltage side of the VSC's LTC transformer. In turn, the DC side of each pairing VSC is linked to a DC system of arbitrary configuration. The new model represents a paradigm shift in the way the fundamental frequency, positive sequence modeling of VSC-HVDC links are modeled, where the VSCs are not treated as idealized, controllable voltage sources but rather as compound transformer devices with which key control properties of the PWM-based converters are linked. In contrast to other contemporary approaches, the power flow iterative solutions carried out using the reference frame put forward in this paper exhibits a true quadratic convergence characteristic – in most credible cases, convergence to a tight power mismatch tolerance of e −12 would be achieved in five or less iterations.",20160701,"Acha, Enrique ; Castro, Luis M.",Article,Academic Journal,Jul2016,true,Electric Power Systems Research,High-voltage direct current transmission ; Electric power transmission ; Newton-Raphson method ; Electric power conversion ; Electric potential ; Electric Bulk Power Transmission and Control,JOUR,,,0378-7796,,,,,eng,Elsevier B.V.,424,415,10,136,,10.1016/j.epsr.2016.03.009,,3KE,,https://research.ebsco.com/plink/bce39432-bae3-301e-bd6c-020aa424e1af,,,,
Academic Search Ultimate,asn,27438024,Anticoccidial vaccine effect on physiological and immunological parameters in broiler chickens.,"The effect of an anticoccidial vaccine on broiler chickens challenged at 21st day of age with 6.0 x 10<sup>4</sup> E. acervulina: 5.0 x 10<sup>3</sup> E. maxima: and 4.0 x 10<sup>4</sup> E. tenella sporulated oocysts/bird, was evaluated. Four groups of 20 chicks each, one day old, were randomly assigned to: 1) unvaccinated, unchallenged control (UUC); 2) unvaccinated, challenged control (UCC): 3) vaccinated, challenged (VC); and 4) vaccinated, unchallenged (VU). All birds were weekly weighed. At 7 days post challenged (PC), weight gain % (WG), intestinal pH (IpH), gut weight (GW), intestinal IgA concentration (IgAC), gut lesion score (GLS), oocyst output (OO) and percentage of specific coccidia species (SCS) in feces were recorded. At 14 and 26 days, gastrointestinal passage time (GPT) was measured. At 21 days of age, body weight from groups VC (544.8 ± 105) and VU (504.9 ± 88) were lower (P < 0.05) than group UUC (615.6 ± 100) At 28 days, group UUC was the heaviest (923.3 ± 126), and with the highest WG (49.97%). Group UCC had the lowest WG (24.60%), and at 26 days, it had the lowest GSF (212.4 ± 311, different (P < 0.05) from group VU with 43.81% of WG and 158.4 ± 52 for GSF. Both, IpH and GW did not differ among groups. The lowest IgAC was seen in ceca from group UUC. Group UCC had the highest GLS, whereas groups UUC and VU had the lowest GLS. Group VC showed higher GL5 for E. maxima and E. tenella than groups UUC and VU. At 28 days, group UCC elicit higher OO; however, group VC showed higher OO than groups UUC and VU. At 7th day PC, the E. acervulina SAC for group VC was lower than groups UCC and VU, even though E. maxima and E. tenella SAC s for this group (VC) had increased. Molecular characterization for field strains and their comparison with commercial vaccines must be held forward to understanding antigenic differences.",20070701,"Estrada, Marco Antonio Juárez ; Morales, Gerardo Manuel Nava ; Guzmán, Rubén Merino",Article,Academic Journal,jul-sep2007,true,Veterinaria México,Veterinary vaccines ; Veterinary physiology ; Veterinary immunology ; Broiler chicken diseases ; Coccidiosis in animals ; Vaccination ; Administration of Public Health Programs ; Veterinary Services ; Broilers and Other Meat Type Chicken Production,JOUR,,,0301-5092,,,,,eng,Facultad de Medicina Veterinaria y Zootecnia UNAM,318,303,16,38,3,,,7LD,,https://research.ebsco.com/plink/1473c734-a0bc-3da0-abfc-de7d66db2e86,,,,
Academic Search Ultimate,asn,131664639,Improved non-invasive inverse problem method for the balancing of nonlinear squeeze-film damped rotordynamic systems.,"Abstract A non-invasive inverse problem method for rotor balancing relies on casing vibration readings and prior knowledge of the structure. Such a method is important for rotors that are inaccessible under operating conditions. This paper introduces a method for solving the quasi-implicit inverse problem that arises when identifying the required balancing correction for a rotor with only one weak linear connection to the casing, apart from the nonlinear connections. This is typical of aero-engine designs that use a retainer spring with only one of the nonlinear squeeze-film damper (SFD) bearings that support the rotor within the casing. The SFD journal displacements are estimated from casing vibration readings using identified inverse SFD models based on Recurrent Neural Networks (RNNs). The information from these is then used to enhance the condition of the explicit inverse problem set up in previous research for simpler configurations. The methodology is validated using simulated casing vibration readings. The reliability of the RNN inverse SFD models is first demonstrated. The second part of the validation shows that the novel enhanced explicit inverse problem method is essential for effective balancing of this previously unconsidered system. Repeatability and robustness to noise/model uncertainty are satisfactorily demonstrated and limitations discussed.",20190215,"Torres Cedillo, Sergio Guillermo ; Al-Ghazal, Ghaith Ghanim ; Bonello, Philip ; Cortés Pérez, Jacinto",Article,Academic Journal,Feb2019,true,Mechanical Systems & Signal Processing,Inverse problems ; Squeeze films (Coatings) ; Rotor dynamics ; Recurrent neural networks ; Statistical reliability,JOUR,,,0888-3270,,,,,eng,Academic Press Inc.,593,569,25,117,,10.1016/j.ymssp.2018.07.032,,L0O,,https://research.ebsco.com/plink/9220b506-2fb3-3408-a752-d078350697f6,,,,
Academic Search Ultimate,asn,148478113,Automatic ear detection and feature extraction using Geometric Morphometrics and convolutional neural networks.,"Accurate gathering of phenotypic information is a key aspect in several subject matters, including biometrics, biomedical analysis, forensics, and many other. Automatic identification of anatomical structures of biometric interest, such as fingerprints, iris patterns, or facial traits, are extensively used in applications like access control and anthropological research, all having in common the drawback of requiring intrusive means for acquiring the required information. In this regard, the ear structure has multiple advantages. Not only the ear's biometric markers can be easily captured from the distance with non intrusive methods, but also they experiment almost no changes over time, and are not influenced by facial expressions. Here we present a new method based on Geometric Morphometrics and Deep Learning for automatic ear detection and feature extraction in the form of landmarks. A convolutional neural network was trained with a set of manually landmarked examples. The network is able to provide morphometric landmarks on ears' images automatically, with a performance that matches human landmarking. The feasibility of using ear landmarks as feature vectors opens a novel spectrum of biometrics applications.",20170501,"Cintas, Celia ; Quinto‐Sánchez, Mirsha ; Acuña, Victor ; Paschetta, Carolina ; de Azevedo, Soledad ; Cesar Silva de Cerqueira, Caio ; Ramallo, Virginia ; Gallo, Carla ; Poletti, Giovanni ; Bortolini, Maria Catira ; Canizales‐Quinteros, Samuel ; Rothhammer, Francisco ; Bedoya, Gabriel ; Ruiz‐Linares, Andres ; Gonzalez‐José, Rolando ; Delrieux, Claudio",Article,Academic Journal,May2017,true,IET Biometrics (Wiley-Blackwell),,JOUR,,,2047-4938,,,,,eng,Wiley-Blackwell,223,211,13,6,3,10.1049/iet-bmt.2016.0002,,MMHM,,https://research.ebsco.com/plink/9414f0cd-e11a-35b0-9e14-96ee92646a67,,,,
Academic Search Ultimate,asn,190592499,Type Genomics: A Framework for Integrating Genomic Data into Biodiversity and Taxonomic Research.,"Name-bearing type specimens have a fundamental role in characterizing biodiversity, as these objects represent the physical link between a scientific name and the biological organism. Type specimens are usually deposited in natural history collections, which provide key infrastructure for research on essential biological structures and processes, while preserving records of biodiversity for future generations. Modern systematics increasingly depends on genetic and genomic data to differentiate and characterize species. While the results of genome sequencing are often connected to a physical voucher specimen, they are rarely derived from the ultimate taxonomic reference for a species, that is, the name-bearing type specimens. This is a known but underappreciated problem for ensuring the replicability of findings, especially those that affect the interpretation of biodiversity distributions and phylogenetic relationships. Destructive sampling of museum specimens, particularly of type material, often carries a high risk of sequencing failure, and thus the cost of damage to the specimen may outweigh the resulting benefit. Both taxonomic work and genome sequencing require specialist skills, and there are often communication gaps between the respective experts. A new, harmonized approach, maximizing information extraction while minimizing risk to type specimens, is a critical step forward toward linking disciplines across biodiversity research and promoting a better taxonomic and systematic understanding of eukaryotic diversity. The genetic makeup of a type specimen is a fundamental part of its biological information, which can and should be made freely and digitally available through type genomics. Here, we describe guidelines for the use of nomenclatural types in genome sequencing approaches, considering different kinds of types in different stages of preservation and different data types.",20251101,"Letsch, Harald ; Greve, Carola ; Hundsdoerfer, Anna K ; Irisarri, Iker ; Moore, Jenna M ; Espeland, Marianne ; Wanke, Stefan ; Arifin, Umilaela ; Blom, Mozes P K ; Corrales, Carolina",Article,Academic Journal,Nov2025,true,Systematic Biology,Biodiversity ; Genomics ; Collection & preservation of biological specimens ; Herbaria ; Molecular phylogeny ; Biological classification ; Museums,JOUR,,,1063-5157,,,,,eng,Oxford University Press / USA,1044,1029,16,74,6,10.1093/sysbio/syaf040,,2F3,,https://research.ebsco.com/plink/8afca8f6-3ffd-36ac-a6d2-79c3e7971d15,,,,
Academic Search Ultimate,asn,116661766,Analysis of Intertextual Distances Using Multidimensional Scaling in the Context of Authorship Attribution.,"Four distance functions were evaluated in order to determine which one better represents two types of style markers (named as static and dynamic) commonly used for authorship attribution tasks. Intertextual distances were analysed from different authors and evaluated if the closest text to another was written by the same author. Classic multidimensional scaling was used to visualize intertextual distances because we consider that this is a method that allows the judges to better understand and visualize the results. The outcome of this paper is that selecting different distance functions considering the type of style marker improves the clustering of texts from the same author. We concluded that while for static features Canberra distance is recomendable, the dynamic features must depend on the style of each author.",20160501,"López-Escobedo, Fernanda ; Solorzano-Soto, Julián ; Sierra Martínez, Gerardo",Article,Academic Journal,May2016,true,Journal of Quantitative Linguistics,Attribution of authorship ; Intertextual analysis ; Multidimensional scaling ; Psychometrics ; Intertextuality,JOUR,,,0929-6174,,,,,eng,Taylor & Francis Ltd,176,154,23,23,2,10.1080/09296174.2016.1142324,,EI7,,https://research.ebsco.com/plink/5b0c3620-96d5-3033-a874-b8527d0faac2,,,,
