longDBName,shortDBName,an,title,abstract,publicationDate,contributors,docTypes,pubTypes,coverDate,peerReviewed,source,subjects,isiType,doids,isbns,issns,publisherLocations,identifiers,isOpenAccess,bookEdition,language,publisher,pageEnd,pageStart,pageCount,volume,issue,doi,notes,mid,degreeLevel,plink,articleType,citedByCount,retracted,retractionNote
Academic Search Ultimate,asn,186342252,MRI based early Temporal Lobe Epilepsy detection using DGWO based optimized HAETN and Fuzzy-AAL Segmentation Framework (FASF).,"This work aims to promote early and accurate diagnosis of Temporal Lobe Epilepsy (TLE) by developing state-of-the-art deep learning techniques, with the goal of minimizing the consequences of epilepsy on individuals and society. Current approaches for TLE detection have drawbacks, including applicability to particular MRI sequences, moderate ability to determine the side of the onset zones, and weak cross-validation with different patient groups, which hampers their practical use. To overcome these difficulties, a new Hybrid Attention-Enhanced Transformer Network (HAETN) is introduced for early TLE diagnosis. This approach uses newly developed Fuzzy-AAL Segmentation Framework (FASF) which is a combination of Fuzzy Possibilistic C-Means (FPCM) algorithm for segmentation of tissue and AAL labelling for labelling of tissues. Furthermore, an effective feature selection method is proposed using the Dipper- grey wolf optimization (DGWO) algorithm to improve the performance of the proposed model. The performance of the proposed method is thoroughly assessed by accuracy, sensitivity, and F1-score. The performance of the suggested approach is evaluated on the Temporal Lobe Epilepsy-UNAM MRI Dataset, where it attains an accuracy of 98.61%, a sensitivity of 99.83%, and F1-score of 99.82%, indicating its efficiency and applicability in clinical practice.",20250702,"Khan, Hasim ; Alutaibi, Ahmed Ibrahim ; Tejani, Ghanshyam G. ; Sharma, Sunil Kumar ; Khan, Ahmad Raza ; Ahmad, Fuzail ; Mousavirad, Seyed Jalaleddin",Article,Academic Journal,7/2/2025,true,PLoS ONE,Temporal lobe epilepsy ; Temporal lobe ; Early diagnosis ; Magnetic resonance imaging ; Epilepsy ; Deep learning ; Diagnostic Imaging Centers,JOUR,,,1932-6203,,,,,eng,Public Library of Science,30,1,30,20,7,10.1371/journal.pone.0325126,,78BE,,https://research.ebsco.com/plink/341c0b97-7153-36a4-abb5-ebc646ab1de1,,,,
Academic Search Ultimate,asn,148800592,Detection of nearby UAVs using a multi-microphone array on board a UAV.,"In this work, we address the problem of UAV detection flying nearby another UAV. Usually, computer vision could be used to face this problem by placing cameras onboard the patrolling UAV. However, visual processing is prone to false positives, sensible to light conditions and potentially slow if the image resolution is high. Thus, we propose to carry out the detection by using an array of microphones mounted with a special array onboard the patrolling UAV. To achieve our goal, we convert audio signals into spectrograms and used them in combination with a CNN architecture that has been trained to learn when a UAV is flying nearby, and when it is not. Clearly, the first challenge is the presence of ego-noise derived from the patrolling UAV itself through its propellers and motor's noise. Our proposed CNN is based on Google's Inception v.3 network. The Inception model is trained with a dataset created by us, which includes examples of when an intruder UAV flies nearby and when it does not. We conducted experiments for off-line and on-line detection. For the latter, we manage to generate spectrograms from the audio stream and process it with the Nvidia Jetson TX2 mounted onboard the patrolling UAV.",20200101,"Cabrera-Ponce, Aldrich A ; Martinez-Carranza, J ; Rascon, Caleb",Article,Academic Journal,Jan-Dec2020,true,International Journal of Micro Air Vehicles,"Microphones ; High resolution imaging ; Streaming audio ; Computer vision ; Drone aircraft ; Microphone arrays ; Spectrograms ; Audio and Video Equipment Manufacturing ; Data Processing, Hosting, and Related Services",JOUR,,,1756-8293,,,,,eng,Sage Publications Inc.,10,1,10,,,10.1177/1756829320925748,,8NKP,,https://research.ebsco.com/plink/84ba3f08-d101-3c13-86ea-36b740b9a5bd,,,,
Academic Search Ultimate,asn,135444222,Classifying the large-scale structure of the universe with deep neural networks.,"We present the first application of deep neural networks to the semantic segmentation of cosmological filaments and walls in the large-scale structure of the universe. Our results are based on a deep convolutional neural network (CNN) with a U-Net architecture trained using an existing state-of-the-art manually guided segmentation method. We successfully trained and tested a U-Net with a Voronoi model and an N-body simulation. The predicted segmentation masks from the Voronoi model have a Dice coefficient of 0.95 and 0.97 for filaments and masks, respectively. The predicted segmentation masks from the N-body simulation have a Dice coefficient of 0.78 and 0.72 for walls and filaments, respectively. The relatively lower Dice coefficient in the filament mask is the result of filaments that were predicted by the U-Net model but were not present in the original segmentation mask. Our results show that for a well-defined data set such as the Voronoi model the U-Net has excellent performance. In the case of the N-body data set, the U-Net produced a filament mask of higher quality than the segmentation mask obtained from a state-of-the art method. The U-Net performs better than the method used to train it, being able to find even the tenuous filaments that the manually guided segmentation failed to identify. The U-Net presented here can process a 512<sup>3</sup> volume in a few minutes and without the need of complex pre-processing. Deep CNN have great potential as efficient and accurate analysis tools for the next generation large-volume computer N-body simulations and galaxy surveys.",20190430,"Aragon-Calvo, M A",Article,Academic Journal,Apr2019,true,Monthly Notices of the Royal Astronomical Society,Convolutional neural networks ; Artificial neural networks ; Lunar craters ; Image segmentation ; Fibers ; Architecture ; Other Construction Material Merchant Wholesalers ; Universe,JOUR,,,0035-8711,,,,,eng,Oxford University Press / USA,5784,5771,14,484,4,10.1093/mnras/stz393,,81Z,,https://research.ebsco.com/plink/6be89fc0-4684-3f21-b046-fa41eee3190c,,,,
Academic Search Ultimate,asn,115244540,Experimental evaluation of a membrane contactor unit used as a desorber/condenser with water/Carrol mixture for absorption heat transformer cycles.,"A conventional desorber in the Absorption Heat Transformer (AHT) cycle requires a constant heat flux and vacuum pressure conditions to boil the working mixture and separate the working fluid. In this paper, an Air Gap Membrane Distillation (AGMD) unit was adapted as desorber/condenser with water/Carrol mixture in order to demonstrate the feasibility of the desorption process at atmospheric pressure conditions. Two membranes with 0.22 and 0.45 μm pore sizes were used and three temperature levels were tested. The maximum increase in the concentration (Δ X ) was 1.54% w/w (from 60.63 to 62.17% w/w) with a membrane with pore size up to 0.45 μm and a solution temperature of 82.7 °C. The maximum thermal process effectiveness was 17.7% (on average) with a membrane with pore size up to 0.22 μm and a solution temperature of 84.4 °C. Due to the corrosion process, a fouling particle by iron oxide was found on the membrane; this fouling layer could promote the “wetting” process in the membrane after a long operating time.",20160901,"Ibarra – Bahena, J. ; Dehesa – Carrasco, U. ; Montiel – González, M. ; Romero, R.J. ; Basurto – Pensado, M.A. ; Hernández – Cristóbal, O.",Article,Academic Journal,Sep2016,true,Experimental Thermal & Fluid Science,Condensers (Vapors & gases) ; Thermodynamic cycles ; Heat radiation & absorption ; Heat flux ; Membrane distillation ; Fouling,JOUR,,,0894-1777,,,,,eng,Elsevier B.V.,204,193,12,76,,10.1016/j.expthermflusci.2016.03.022,,JF1,,https://research.ebsco.com/plink/ef7e866e-d2ea-3fcf-abda-c1ddb33473e4,,,,
Academic Search Ultimate,asn,178888487,"Enactive behaviour settings: situating agency, normativity and transformation.","Behaviour settings are sociocultural places defined by three main ecological aspects: the affordances of material structures, typical patterns of skilful action and socially situated norms. These aspects explain the observed regularities of human behaviour associated with the material characteristics of places. However, the focus of ecological theories on how individual agents attune their actions to the pre-established order of behaviour settings neglects the agents' active role in sustaining or motivating transformations in this order. We therefore propose an alternative enactive approach to behaviour settings that accounts for the role of agents as active supporters and transformers of behaviour settings. Based on the enactive concepts of agency, normativity and dialectics, we argue that agents, as participants of behaviour settings, simultaneously respond to multiple normative dimensions (e.g. biological, sensorimotor and interactive). To sustain the order of behaviour settings, agents sometimes need to inhibit other normative responses of their bodies, which sometimes is detrimental to one or many aspects of their lives. Nonetheless, agents can collectively trigger the transformation of behaviour settings. This transformation can occur dialectically as tensions between two or more norms to which human bodies respond are resolved, even if new tensions arise and the process of changing behaviour setting continues. This article is part of the theme issue 'People, places, things and communities: expanding behaviour settings theory in the twenty-first century'.",20240923,"Sepúlveda-Pedro, Miguel A. ; Mojica, Laura",Article,Academic Journal,9/23/2024,true,Philosophical Transactions of the Royal Society B: Biological Sciences,Human behavior ; Twenty-first century ; Set theory ; Normativity (Ethics) ; Human body,JOUR,,,0962-8436,,,,,eng,Royal Society,7,1,7,379,1910,10.1098/rstb.2023.0286,,GVY,,https://research.ebsco.com/plink/244e5402-4e7a-31c9-a910-f88182617b6c,,,,
Academic Search Ultimate,asn,129387738,The Synaptic Properties of Cells Define the Hallmarks of Interval Timing in a Recurrent Neural Network.,"Extensive research lias described two key features of interval timing, the bias property is associated with accuracy and implies that time is overestimated for short intervals and underestimated for long intervals. The scalar property is linked to precision and states that the variability of interval estimates increases as a function of interval duration. The neural mechanisms behind these properties are not well understood. Here we implemented a recurrent neural network that mimics a cortical ensemble and includes cells that show paired-pulse facilitation and slow inhibitory synaptic currents. The network produces interval selective responses and reproduces both bias and scalar properties when a Bayesian decoder reads its activity. Notably, the interval-selectivity, timing accuracy, and precision of the network showed complex changes as a function of the decay time constants of the modeled synaptic properties and the level of background activity of the cells. These findings suggest that physiological values of the time constants for paired-pulse facilitation and GABAb, as well as the internal state of the network, determine the bias and scalar properties of interval timing.",20180425,"Pérez, Oswaldo ; Merchant, Hugo",Article,Academic Journal,4/25/2018,true,Journal of Neuroscience,Recurrent neural networks ; Artificial neural networks ; Biological neural networks ; Neuroplasticity ; Neural circuitry,JOUR,,,0270-6474,,,,,eng,Society for Neuroscience,4199,4186,14,38,17,10.1523/JNEUROSCI.2651-17.2018,,1Z2,,https://research.ebsco.com/plink/bc300778-9f1f-39df-944d-9be9aa5cd63c,,,,
Academic Search Ultimate,asn,138760065,The Hubble Sequence at z ∼ 0 in the IllustrisTNG simulation with deep learning.,"We analyse the optical morphologies of galaxies in the IllustrisTNG simulation at z ∼ 0 with a convolutional neural network trained on visual morphologies in the Sloan Digital Sky Survey. We generate mock SDSS images of a mass complete sample of |$\sim 12\, 000$| galaxies in the simulation using the radiative transfer code SKIRT and include PSF and noise to match the SDSS r -band properties. The images are then processed through the exact same neural network used to estimate SDSS morphologies to classify simulated galaxies in four morphological classes (E, S0/a, Sab, Scd). The CNN model classifies simulated galaxies in one of the four main classes with the same uncertainty as for observed galaxies. The mass–size relations of the simulated galaxies divided by morphological type also reproduce well the slope and the normalization of observed relations which confirms a reasonable diversity of optical morphologies in the TNG suite. However we find a weak correlation between optical morphology and Sersic index in the TNG suite as opposed to SDSS which might require further investigation. The stellar mass functions (SMFs) decomposed into different morphologies still show some discrepancies with observations especially at the high-mass end. We find an overabundance of late-type galaxies (⁠|$\sim 50{{\ \rm per\ cent}}$| versus |$\sim 20{{\ \rm per\ cent}}$|⁠) at the high-mass end [log(M <sub>*</sub>/M<sub>⊙</sub>) > 11] of the SMF as compared to observations according to the CNN classifications and a lack of S0 galaxies (⁠|$\sim 20{{\ \rm per\ cent}}$| versus |$\sim 40{{\ \rm per\ cent}}$|⁠) at intermediate masses. This work highlights the importance of detailed comparisons between observations and simulations in comparable conditions.",20191030,"Huertas-Company, Marc ; Rodriguez-Gomez, Vicente ; Nelson, Dylan ; Pillepich, Annalisa ; Bottrell, Connor ; Bernardi, Mariangela ; Domínguez-Sánchez, Helena ; Genel, Shy ; Pakmor, Ruediger ; Snyder, Gregory F ; Vogelsberger, Mark",Article,Academic Journal,Oct2019,true,Monthly Notices of the Royal Astronomical Society,Deep learning ; Astronomical surveys ; Radiative transfer ; Stellar mass ; Visual training ; Image processing ; Sloan Digital Sky Survey ; Photofinishing Laboratories (except One-Hour) ; One-Hour Photofinishing,JOUR,,,0035-8711,,,,,eng,Oxford University Press / USA,1879,1859,21,489,2,10.1093/mnras/stz2191,,81Z,,https://research.ebsco.com/plink/f29f7a8b-d2b5-3b70-b5f7-2006ef0b2517,,,,
Academic Search Ultimate,asn,163143386,Evaluation of a rough-surface evaporator applied to an absorption heat transformer for water desalination.,"The purpose of this work is to evaluate the performance of a rough-textured evaporator applied to a single-stage absorption heat transformer for water desalination (SAHT-WD). The stainless-steel evaporator was subjected to an abrasive material release treatment (sandblast texture) to provide a texture that fosters phase change heat transfer compared to a smooth surface. To determine the performance of the evaporator, the evaluation has been divided into an experimental and a theoretical analysis. The experimental analysis focused on determining the operating conditions that favor the performance of the evaporator and the SAHT-WD. For the theoretical analysis, a mathematical model was developed to predict the wetting efficiency and the heat-transfer coefficients of the evaporator. To quantify the improvement in the performance of the rough-surface evaporator, the experimental results were compared with those reported in a reference work. The results indicate that the sandblasted texture improved the performance of the evaporator as well as that of the SAHT-WD. The results of the mathematical model suggest that the rough tube improved the wetting efficiency of the evaporator.",20230401,"Romero, David Juárez ; Rivera, Irán Ortiz ; Canela Sánchez, Isaac Justine ; Ortega Mojica, Nancy Isamar ; Huicochea, Armando ; Gonzaga, Javier Delgado",Article,Academic Journal,Apr2023,true,International Journal of Chemical Reactor Engineering,Heat radiation & absorption ; Evaporators ; Heat transfer ; Waste heat ; Saline water conversion,JOUR,,,1542-6580,,,,,eng,De Gruyter,547,537,11,21,4,10.1515/ijcre-2022-0113,,3EAA,,https://research.ebsco.com/plink/2562a7c9-72ea-3121-b55b-1e2e6c162d79,,,,
Academic Search Ultimate,asn,188220786,Multistable bimodal perceptual coding within the ventral premotor cortex.,"How neurons in the ventral premotor cortex (VPC) integrate and process multimodal sensory information remains unclear. We recorded VPC neuronal activity in two monkeys performing a tactile or acoustic bimodal detection task (BDT). Single-cell analyses revealed purely tactile, purely acoustic, bimodal, and decision-mnemonic responses. Population analyses of the VPC network and a recurrent neural network trained on the BDT uncovered notably similar latent dynamics. In both networks, neural trajectories diverged sharply from rest along modality-specific directions during stimulus presentation, while remained at rest during stimulus-absent trials. Subsequently, trajectories rotated toward a mnemonic subspace, where perceptual decisions (acoustic, tactile, and absent) were maintained in three distinctly different stable attractors. Using low-dimensional modeling, we propose a universal mechanism for the transition from sensory processing to memory retention explaining both biological and artificial latent neural dynamics in a simple dynamical motif. These results show that VPC neurons encode bimodal information, can integrate competing sensory inputs, and maintain multimodal perceptual decisions.",20250919,"Andrade-Ortega, Bernardo ; Díaz, Héctor ; Bayones, Lucas ; Alvarez, Manuel ; Zainos, Antonio ; Natsuko Rivera-Yoshida ; Franci, Alessio ; Romo, Ranulfo ; Rossi-Pool, Román",Article,Academic Journal,9/19/2025,true,Science Advances,Recurrent neural networks ; Premotor cortex ; Sensory memory ; Sensorimotor integration ; Neurons,JOUR,,,2375-2548,,,,,eng,American Association for the Advancement of Science,17,1,17,11,38,10.1126/sciadv.adw5500,,KB9Z,,https://research.ebsco.com/plink/926a7935-8d49-3829-ac21-28ad409ac06f,,,,
Academic Search Ultimate,asn,193716029,Data-Driven Probabilistic Forecasting of Voltage Quality in Distribution Transformers Using Gaussian Processes.,"A probabilistic data-driven framework for voltage quality forecasting in distribution transformers based on Gaussian process regression and high-resolution field measurements is presented. Voltage time series acquired under real operating conditions were modeled using composite covariance functions designed to capture long-term trends and stochastic multi-scale fluctuations. The proposed approach enables simultaneous prediction and uncertainty quantification, allowing direct compliance assessment with voltage quality standards. The additive Gaussian process models achieved coefficients of determination above 0.75 and produced statistically uncorrelated residuals, indicating an adequate representation of the intrinsic temporal structure. However, the predictive intervals exhibit a certain level of undercoverage, indicating that, while uncertainty is effectively quantified, there is still room for improvement in calibration. The selected kernel structures revealed distinct physical regimes in the voltage dynamics, including smooth steady operation, moderately irregular behavior associated with localized disturbances, and multi-scale stochastic variability. For benchmarking purposes, results were compared with those obtained from a stochastic damped harmonic oscillator with restoring force, a naive model, a seasonal naive model and an Autoregressive Integrated Moving Average model. The oscillator model, the naive model, the seasonal naive model, and the Autoregressive Integrated Moving Average model generated strongly autocorrelated residuals, whereas the Gaussian process models yielded consistent white-noise residuals that outperformed all the other models. These findings demonstrate that probabilistic Gaussian process modeling provides an interpretable, scalable, and uncertainty-aware alternative for predictive voltage quality assessment in modern distribution systems.",20260501,"Mondragón-García, Efraín ; Jesús, Ángel Marroquín de ; García-García, Raúl ; Salazar-Flores, Yuri ; Díaz-Hernández, Adán ; Vallejo-Castañeda, Emmanuel",Article,Academic Journal,May2026,true,Energies (19961073),,JOUR,,,1996-1073,,,,,eng,MDPI,,2133,,19,9,10.3390/en19092133,,B1V5,,https://research.ebsco.com/plink/5ae68dcb-155d-31d6-8c57-4a1cb04f4b04,,,,
Academic Search Ultimate,asn,178686921,Determining the time before or after a galaxy merger event.,"Aims. This work aims to reproduce the time before or after a merger event of merging galaxies from the IllustrisTNG cosmological simulation using machine learning. Methods. Images of merging galaxies were created in the u, g, r, and i bands from IllustrisTNG. The merger times were determined using the time difference between the last simulation snapshot where the merging galaxies were tracked as two galaxies and the first snapshot where the merging galaxies were tracked as a single galaxy. This time was then further refined using simple gravity simulations. These data were then used to train a residual network (ResNet50), a Swin Transformer (Swin), a convolutional neural network (CNN), and an autoencoder (using a single latent neuron) to reproduce the merger time. The full latent space of the autoencoder was also studied to see if it reproduces the merger time better than the other methods. This was done by reducing the latent space dimensions using Isomap, linear discriminant analysis (LDA), neighbourhood components analysis, sparse random projection, truncated singular value decomposition, and uniform manifold approximation and projection. Results. The CNN is the best of all the neural networks. The performance of the autoencoder was close to the CNN, with Swin close behind the autoencoder. ResNet50 performed the worst. The LDA dimensionality reduction performed the best of the six methods used. The exploration of the full latent space produced worse results than the single latent neuron of the autoencoder. For the test data set, we found a median error of 190 Myr, comparable to the time separation between snapshots in IllustrisTNG. Galaxies more than ≈625 Myr before a merger have poorly recovered merger times, as well as galaxies more than ≈125 Myr after a merger event.",20240715,"Pearson, W. J. ; Rodriguez-Gomez, V. ; Kruk, S. ; Margalef-Bentabol, B.",Article,Academic Journal,7/15/2024,true,Astronomy & Astrophysics / Astronomie et Astrophysique,Convolutional neural networks ; Fisher discriminant analysis ; Transformer models ; Singular value decomposition ; Galactic evolution ; Galaxy mergers,JOUR,,,0004-6361,,,,,eng,EDP Sciences,16,1,16,687,,10.1051/0004-6361/202449532,,NC8,,https://research.ebsco.com/plink/846102b7-77b4-31db-8ad1-b624f8eb4a5b,,,,
Academic Search Ultimate,asn,190470050,Enhancing Cytosolic Internalization of [ 177 Lu]Lu–iPSMA in Prostate Cancer Cells: The Effect of Conjugating a GRP78 Inhibitor to the Radiotherapeutic Molecule.,"Castration-resistant prostate cancer presents radiotherapeutic challenges, especially in optimizing the cytosolic internalization of therapeutic radiopharmaceuticals. This research aimed to design and evaluate in vitro, a new dimeric radiopharmaceutical, [<sup>177</sup>Lu]Lu–iPSMA–iGRP78, which combines PSMA and GRP78 inhibitors in a heterodimeric radioligand to improve the radionuclide internalization and cytotoxicity efficacy. Molecular docking showed that the dimer iPSMA–iGRP78 presents a higher affinity for GRP78 (CNN-docking score: −14.0 kcal·mol<sup>−1</sup>, pKi: 10) and for PSMA (CNN-docking score: −17.0 kcal·mol<sup>−1</sup>, pKi: 11.5) compared to the monomers iGRP78 (CNN-docking score: −11.0 kcal·mol<sup>−1</sup>, pKi: 9.4) and iPSMA (CNN-docking score: −13.9 kcal·mol<sup>−1</sup>, pKi: 10.2). The saturation binding assay using LNCaP cells (PSMA+, CS-GRP78+) showed an affinity (K<sub>d</sub>) of 1.883 nM for [<sup>177</sup>Lu]Lu–iPSMA–iGRP78 and 2.245 nM for [<sup>177</sup>Lu]Lu–iPSMA. The dimeric radiopharmaceutical achieved 10.44 ± 2.43% cytosolic internalization and 4.81 ± 0.94% nuclear internalization, while the [<sup>177</sup>Lu]Lu–iPSMA monomer showed 6.45 ± 0.60% cytosolic internalization and no uptake in the cell nucleus. In PC3 cells (PSMA–, CS-GRP78–), [<sup>177</sup>Lu]Lu–iPSMA–iGRP78 uptake was negligible, demonstrating specificity. Treatment with the dimeric radiopharmaceutical reduced cell viability (69.93 ± 4.85% of dead cells) significantly more than [<sup>177</sup>Lu]Lu–iPSMA (38.63 ± 6.13% of dead cells). In conclusion, conjugation of a GRP78 inhibitor to [<sup>177</sup>Lu]Lu–iPSMA improves the radionuclide internalization and cytotoxicity in prostate cancer cells, suggesting that the bispecific radiopharmaceutical is a promising strategy in prostate cancer treatment.",20251215,"Azorín-Vega, Erika ; García-Arce, Daniel ; Luna-Gutiérrez, Myrna ; Ocampo-García, Blanca ; Trujillo-Benítez, Diana ; Vidal-Limon, Abraham ; Rodríguez-Martínez, Griselda ; Durán-Pastén, María Luisa ; Meléndez-Alafort, Laura ; Ferro-Flores, Guillermina",Article,Academic Journal,Dec2025,true,International Journal of Molecular Sciences,Castration-resistant prostate cancer ; Radiopharmaceuticals ; Cytotoxins ; Radiotherapy complications ; Prostate-specific membrane antigen ; Protoplasm,JOUR,,,1661-6596,,,,,eng,MDPI,,11783,,26,24,10.3390/ijms262411783,,1CRL,,https://research.ebsco.com/plink/af86ff33-6952-3c38-8e64-45058fa91445,,,,
