"Document Title",Authors,"Author Affiliations","Publication Title",Date Added To Xplore,"Publication Year","Volume","Issue","Start Page","End Page","Abstract","ISSN",ISBNs,"DOI",Funding Information,PDF Link,"Author Keywords","IEEE Terms","Mesh_Terms",Article Citation Count,Patent Citation Count,"Reference Count","License",Online Date,Issue Date,"Meeting Date","Publisher",Document Identifier
"Forging Pathways: Quantum Computing Initiatives in Mexico","A. Maldonado-Romo; C. Zendejas-Morales; B. Escalante-Ramírez; J. Olveres; I. Pedraza; J. Maldonado-Romo; J. Y. Montiel-Pérez","Centro de Investigación en Computación, Instituto Politécnico Nacional, Mexico City, Mexico; Facultad de Ciencias, Universidad Nacional Autónoma de México, Mexico City, Mexico; Facultad de Ingeniería, Universidad Nacional Autónoma de México, Mexico City, Mexico; Facultad de Ingeniería, Universidad Nacional Autónoma de México, Mexico City, Mexico; Centro Interdisciplinario de Investigación y Enseñanza de la Ciencia, Benemérita Universidad Autónoma de Puebla, Puebla, Mexico; Institute of Advanced Materials for Sustainable Manufacturing, Tecnologico de Monterrey, Monterrey, NL, Mexico; Centro de Investigación en Computación, Instituto Politécnico Nacional, Mexico City, Mexico",2024 IEEE International Conference on Quantum Computing and Engineering (QCE),"10 Jan 2025","2024","03","","104","111","This work presents establishing a nationwide university network to address the relevance of quantum computing, where challenges and opportunities for industry and academia focus from undergraduate to doctoral levels. The network comprises a series of talks on opportunities in the quantum computing ecosystem and potential collaborations and development opportunities aimed at Latin American countries. A total of 240 Spanish speakers registered, with 30% identifying themselves as introductory level and 4% as experts in quantum computing. The outcome underscores the importance of creating opportunities across various domains of the quantum computing ecosystem for a country showing initial interest in this field. Additionally, the current work presents the educational levels of the participants, including their proficiency levels in quantum computing, their areas of interest within this field, and the topics and trends they consider relevant when engaging in quantum computing. The event was hosted by the Center for Computing Research of the National Polytechnic Institute (CIC-IPN) and organized by a consortium of institutions including CIC-IPN, the National Autonomous University of Mexico (UNAM), the Superior School of Computing (ESCOM), the Interdisciplinary Professional Unit in Engineering and Advanced Technologies (UPIITA), the Center of Studies in Advanced Computing of UNAM (CECAv), Institute of Advanced Materials for Sustainable Manufacturing of the Technological Institute of Monterrey, Benemérita Autonomous University of Puebla (BUAP), Tecmilenio University, Superior School of Mechanical and Electrical Engineering Unit (ESIME) Zacatenco, and Quantum Universal Education. The event was made possible through collaboration with industry partners such as IBM Quantum, Xanadu, Haiqu, Unitary Fund, qBraid, Oak Ridge National Laboratory, Kipu Quantum, Pasqal, Quantinuum, Womanium, and BQB, each contributing their unique expertise and resources to the event.","","979-8-3315-4137-8","10.1109/QCE60285.2024.20465","","https://ieeexplore.ieee.org/stamp/stamp.jsp?arnumber=10821124","quantum education;quantum computing;networking;Spanish;quantum career","Industries;Training;Quantum computing;Social networking (online);Ecosystems;Quantum mechanics;Collaboration;Quality of service;Medical services;Market research","","","","17","IEEE","10 Jan 2025","15-20 Sept. 2024","15-20 Sept. 2024","IEEE","IEEE Conferences"
"Convolutional Neural Network Trained with Heatmaps for Segmentation and Measurement of the Femur in Fetal Ultrasound","J. C. A. Ortíz; F. A. Cosío; J. Pérez-González; N. O. C. Díaz; R. V. Cristerna; V. M. Bañuelos; L. C. Marín; M. G. Huerta","Unidad Académica del Instituto de Investigaciones en Matemáticas Aplicadas y en Sistemas en el Estado de Yucatán, Universidad Nacional Autónoma de México, Mérida, México; Unidad Académica del Instituto de Investigaciones en Matemáticas Aplicadas y en Sistemas en el Estado de Yucatán, Universidad Nacional Autónoma de México, Mérida, México; Unidad Académica del Instituto de Investigaciones en Matemáticas Aplicadas y en Sistemas en el Estado de Yucatán, Universidad Nacional Autónoma de México, Mérida, México; Laboratorio de Investigación en Neuroimagenología, Universidad Autónoma Metropolitana Unidad Iztapalapa, Ciudad de México, México; Laboratorio de Investigación en Neuroimagenología, Universidad Autónoma Metropolitana Unidad Iztapalapa, Ciudad de México, México; Laboratorio de Investigación en Neuroimagenología, Universidad Autónoma Metropolitana Unidad Iztapalapa, Ciudad de México, México; Departamento de Obstetricia, Instituto Nacional de Perinatología, Ciudad de México, México; Departamento de Obstetricia, Instituto Nacional de Perinatología, Ciudad de México, México",2025 21st International Symposium on Biomedical Image Processing and Analysis (SIPAIM),"18 Dec 2025","2025","","","1","5","Fetal femur length measurement via ultrasound, alongside abdominal circumference, biparietal diameter, and cranial circumference assessments, are key components of prenatal screening, as they enable the estimation of fetal weight and the evaluation of intrauterine development. Currently, this procedure still heavily relies on manual intervention by expert radiologists or sonographers, who must identify anatomical landmarks to perform the measurements. This dependence on specialized human expertise limits diagnostic accessibility in remote areas far from major urban centers. In this work, we propose a novel convolutional neural network trained on binary masks and heatmaps of femur endpoints. The model achieves robust performance, segmenting the femur with an 88% Dice coefficient, and measuring its length with only a 2.515% error margin. This work is part of a broader machine learning based system for fetal weight estimation, aiming to expand diagnostic capabilities to healthcare centers with limited human resources.","","979-8-3315-5456-9","10.1109/SIPAIM67325.2025.11283319","","https://ieeexplore.ieee.org/stamp/stamp.jsp?arnumber=11283319","","Heating systems;Ultrasonic imaging;Ultrasonic variables measurement;Measurement uncertainty;Estimation;Medical services;Manuals;Biomedical measurement;Length measurement;Convolutional neural networks","","","","12","IEEE","18 Dec 2025","18-21 Nov. 2025","18-21 Nov. 2025","IEEE","IEEE Conferences"
"Deep Learning Approach for Aortic Valve Localization, Detection and Segmentation in Computed Tomography Volumes","R. O. Azuara-Domínguez; J. Olveres; B. Escalante-Ramírez; E. Vallejo","Posgrado de Ingeniería Eléctrica, Universidad Nacional Autónoma de México, Mexico City, Mexico; Facultad de Ingeniería, Universidad Nacional Autónoma de México, Mexico City, Mexico; Facultad de Ingeniería, Universidad Nacional Autónoma de México, Mexico City, Mexico; Centro Médico ABC, Mexico city, Mexico",2025 IEEE 38th International Symposium on Computer-Based Medical Systems (CBMS),"4 Jul 2025","2025","","","1","4","Standard view cardiac computed tomography (CT) images are of great importance in clinical practice due to the valuable diagnostic information they provide. However, navigating these (3D) medical images to identify such a view can represent a time-consuming process, subject to inter-operator variability. This study presents an approach using a Multiscale Vision Transformer (MViT) to infer the rotation parameters required to obtain standard views and subsequently focus on extracting the left ventricular outflow tract (LVOT) view. Once this view is obtained, the aortic valve is detected and segmented using well-known convolutional neural networks (CNNs), specifically ResNet18 for detection and U-Net for segmentation. The methodology used for its training is detailed, along with the metrics employed to evaluate their performance. Finally, the results obtained for each stage are presented. This approach provides a clear understanding of the performance of each model, from rotation parameter prediction to aortic valve detection and segmentation.","2372-9198","979-8-3315-2610-8","10.1109/CBMS65348.2025.00063","","https://ieeexplore.ieee.org/stamp/stamp.jsp?arnumber=11058708","3D volume Cardiac CT;Deep Learning;Regression;Segmentation;Rotation matrix;Attention","Deep learning;Image segmentation;Three-dimensional displays;Computed tomography;Computational modeling;Pipelines;Predictive models;Valves;Data models;Standards","","","","12","IEEE","4 Jul 2025","18-20 June 2025","18-20 June 2025","IEEE","IEEE Conferences"
"Automatic Segmentation of the Left Ventricle Through the Cardiac Cycle in Pediatric Echocardiography Videos Using SegFormer Architecture","M. Mateu; J. Olveres; B. Escalante-Ramírez; M. -J. Raboisson; J. Miró; L. Duong","Department of Software and IT, École de Technologie Supérieure, Montreal, Canada; Department of Electrical Engineering, Universidad Nacional Autónoma de México (UNAM), Mexico City, Mexico; Department of Electrical Engineering, Universidad Nacional Autónoma de México (UNAM), Mexico City, Mexico; Department of Cardiology, Centre Hospitalier Universitaire Sainte-Justine, Montreal, Canada; Department of Cardiology, Centre Hospitalier Universitaire Sainte-Justine, Montreal, Canada; Department of Software and IT, École de Technologie Supérieure, Montreal, Canada",2025 47th Annual International Conference of the IEEE Engineering in Medicine and Biology Society (EMBC),"3 Dec 2025","2025","","","1","5","Echocardiography generates real-time results, aiding in examination and diagnosis. It is widely used for detecting congenital heart disease (CHD), evaluating risk, and guiding treatment strategies in pediatric cardiology. However, the complexity of these images makes their interpretation and analysis challenging, often leading to inter-observer variability. This research aims to develop an automated left ventricle (LV) segmentation method throughout the full cardiac cycle for pediatric echocardiography videos using a semantic Transformer model known as SegFormer. The goal is to support the analysis of clinical imaging techniques. In recent years, semantic Transformers have demonstrated significant effectiveness in segmentation tasks, making them highly suitable choice for this application. To achieve accurate LV segmentation through the cardiac cycle, the SegFormer model is trained using the EchoNet-Peds dataset, which consists of annotated pediatric echocardiography videos. The initial training phase includes segmenting the left ventricle images at the end of systole and the end of diastole, with performance evaluated based on accuracy, mean absolute error (MAE), recall and Dice score metrics to compare with other pediatric segmentation methods. As a final result, this research produces segmented left ventricle videos throughout the cardiac cycle for different pediatric echocardiography videos.Clinical RelevanceBy applying a semantic Transformer to pediatric echocardiography for automated LV segmentation, the quantification of key cardiac parameters such as ejection fraction, end of diastole, and end of systole is improved, leading to greater accuracy and providing more valuable information for medical staff. Consequently, a tool capable of efficiently processing large volumes of data can significantly facilitate and support the diagnosis process for pediatric patients","2694-0604","979-8-3315-8618-8","10.1109/EMBC58623.2025.11253506","","https://ieeexplore.ieee.org/stamp/stamp.jsp?arnumber=11253506","","Heart;Measurement;Image segmentation;Accuracy;Echocardiography;Semantics;Computer architecture;Transformers;Videos;Diseases","Humans;Heart Ventricles;Echocardiography;Child;Algorithms;Image Processing, Computer-Assisted;Automation;Video Recording","","","17","IEEE","3 Dec 2025","14-18 July 2025","14-18 July 2025","IEEE","IEEE Conferences"
"Detection of Optimal Echocardiographic Video Segments Using Deep Learning","I. Perez-Ruiz; J. Perez-Gonzalez; A. Carrera-Pinzón; R. E.; R. H.; B. Y.; A. C. F.",Instituto de Investigaciones en Matemáticas Aplicadas y en Sistemas-UNAM; Instituto de Investigaciones en Matemáticas Aplicadas y en Sistemas-UNAM; Universidad Nacional de Colombia; Universidad Nacional de Colombia; Hospital Universitario Nacional de Colombia; Hospital Universitario Nacional de Colombia; Instituto de Investigaciones en Matemáticas Aplicadas y en Sistemas-UNAM,2025 21st International Symposium on Biomedical Image Processing and Analysis (SIPAIM),"18 Dec 2025","2025","","","1","4","The identification of optimal echocardiographic video segments is a critical initial step for reliable cardiac function assessment. This study focuses on the development and evaluation of deep learning models for the automated classification of correct versus incorrect echocardiographic planes in a video sequence, specifically for Subcostal Four-Chamber (S4C) views. A dataset comprising 10 S4C studies was used, from which frames were extracted and preprocessed. Preprocessing included metadata removal, resizing to 224×224 pixels, and data augmentation. The resulting images were divided into training (2068 images per class), validation (517 images per class), and test (200 images per class) sets. Two convolutional neural network architectures, VGG-16 and Vision Transformer (ViT), were trained and evaluated. The VGG-16 model, trained for 30 epochs, achieved a test accuracy of 0.98 and an Area Under the ROC Curve (AUC) of 1.00. The Vision Transformer, trained for 30 epochs, yielded a test accuracy of 0.89 and an AUC of 0.97. These preliminary results demonstrate the potential of deep learning models, particularly VGG-16, to accurately identify optimal frames in echocardiographic video sequences.","","979-8-3315-5456-9","10.1109/SIPAIM67325.2025.11283345","","https://ieeexplore.ieee.org/stamp/stamp.jsp?arnumber=11283345","","Deep learning;Training;Computer vision;Accuracy;Video sequences;Metadata;Transformers;Data augmentation;Reliability;Videos","","","","15","IEEE","18 Dec 2025","18-21 Nov. 2025","18-21 Nov. 2025","IEEE","IEEE Conferences"
