"Physical Layer Service Fairness of 200-Gbps TDM-NOMA Coherent Passive Optical Networks Within Single Timeslot","Z. Wei; J. Zhang; W. Li; C. St-Arnault; S. Bernal; M. Khalil; R. Gutiérrez-Castrejón; L. R. Chen; D. V. Plant","Department of Electrical and Computer Engineering, McGill University, Montreal, QC, Canada; Department of Electrical and Computer Engineering, McGill University, Montreal, QC, Canada; Department of Electrical and Computer Engineering, McGill University, Montreal, QC, Canada; Department of Electrical and Computer Engineering, McGill University, Montreal, QC, Canada; Department of Electrical and Computer Engineering, McGill University, Montreal, QC, Canada; Department of Electrical and Computer Engineering, McGill University, Montreal, QC, Canada; Department of Electrical and Computer Engineering, McGill University, Montreal, QC, Canada; Department of Electrical and Computer Engineering, McGill University, Montreal, QC, Canada; Department of Electrical and Computer Engineering, McGill University, Montreal, QC, Canada",Journal of Lightwave Technology,"26 Sep 2024","2024","42","19","6774","6787","As coverage increases or network topology becomes more complex, the optical path loss difference between any two access points in tree-like passive optical networks (PON) is uneven, causing service fairness problems at the physical layer. The service fairness of the far-near user access in 200-Gbps coherent PON with various user cases is discussed in this work. A fairness allocation mechanism based on time division multiplexing (TDM) non-orthogonal multiple access (NOMA) in the time-power domain is proposed theoretically to provide fair transmission between the arbitrary two optical network units (ONUs) with the best and the worst performance within single timeslots. Then, a series of subsequent experiments are performed with different path loss and split ratios (SR) to prove the effectiveness and practicality of the proposed NOMA scheme, totally including 12 subcases. Any sub-experiment proves that by optimizing power allocation, the signal-to-interference noise ratio (SINR) or bit-error rate (BER) on the physical layer can be approximated to the same value. The Jain's fairness index at a fixed and flexible hard-decision forward error correction (HD-FEC) standard, and modified fairness index are used to evaluate service fairness in different cases. This TDM-NOMA scheme may address the service fairness issue in next-generation coherent PON with wide coverage.","1558-2213","","10.1109/JLT.2024.3413581","Dirección General de Asuntos del Personal Académico UNAM for PAPIIT(grant numbers:IG100724); Fonds de recherche du Québec - Nature et Technologies(grant numbers:319934,319965); ","https://ieeexplore.ieee.org/stamp/stamp.jsp?arnumber=10555167","200-Gbps coherent PON;dynamic power allocation;network topology;non-orthogonal multiple access;service fairness","Optical network units;Passive optical networks;Resource management;Topology;Physical layer;Bandwidth;Adaptive optics","","2","","45","IEEE","12 Jun 2024","1 Oct.1, 2024","","IEEE","IEEE Journals"
"Demonstration of High Sensitivity Detection and High Precision Localization of Vibrations in Bidirectional Coherent Transmission Systems Enabled by Carrier Laser Phase Noise Retrieval","Y. Hu; K. Zhang; M. E. Mousa-Pasandi; R. Gutiérrez-Castrejón; M. O'Sullivan; F. Kong; B. Buscaino; J. Zhang; S. Bernal; C. St-Arnault; D. V. Plant","Photonic Systems Group, Department of Electrical and Computer Engineering, McGill University, Montréal, QC, Canada; Photonic Systems Group, Department of Electrical and Computer Engineering, McGill University, Montréal, QC, Canada; Ciena Corporation, Ottawa, ON, Canada; Photonic Systems Group, Department of Electrical and Computer Engineering, McGill University, Montréal, QC, Canada; Ciena Corporation, Ottawa, ON, Canada; Ciena Corporation, Ottawa, ON, Canada; Ciena Corporation, Ottawa, ON, Canada; Photonic Systems Group, Department of Electrical and Computer Engineering, McGill University, Montréal, QC, Canada; Photonic Systems Group, Department of Electrical and Computer Engineering, McGill University, Montréal, QC, Canada; Photonic Systems Group, Department of Electrical and Computer Engineering, McGill University, Montréal, QC, Canada; Photonic Systems Group, Department of Electrical and Computer Engineering, McGill University, Montréal, QC, Canada",Journal of Lightwave Technology,"27 Aug 2025","2025","43","18","8637","8646","We demonstrate a method for mitigating the effects of laser phase noise on the detection and localization of vibrations in a bidirectional coherent optical fiber transmission system. By introducing a relative delay between the two frequency tones generated at the transmitter, we retrieve an estimate of the transmitter laser phase noise at the coherent receiver. We demonstrate 200 Gbps, 16 QAM error-free transmission over 80 km while simultaneously detecting and localizing a 3 kHz vibration with 24 rad peak-to-peak phase swing. Compared to conventional methods, our method results in a reduction of localization error by 58%, from 102 m to 43 m, and a reduction in standard deviation of estimated locations by 81%, from 355 m to 67 m.","1558-2213","","10.1109/JLT.2025.3593142","","https://ieeexplore.ieee.org/stamp/stamp.jsp?arnumber=11098460","Fiber sensing;integrated sensing and communication;laser phase noise;optical communication","Vibrations;Lasers;Perturbation methods;Laser noise;Location awareness;Sensors;Laser modes;Signal to noise ratio;Phase noise;Optical reflection","","4","","12","IEEE","28 Jul 2025","15 Sept.15, 2025","","IEEE","IEEE Journals"
"XR for educational anatomy: an Immersive human atlas with chatbot","J. -F. Uhl; P. Reyes; C. Quihuis; P. Belchior; J. Jorge","Director of the UNESCO Chair of Digital Anatomy, Paris Cité University, Paris, France; Universidad Nacional Autónoma de México, México City, México; Instituto Tecnológico y de Estudios Superiores de Monterrey, Mexico City, México; INESC-ID, Tagus Park, Porto Salvo, Portugal; UNESCO Chair on AI & VR, Instituto Superior Técnico, Av Rovisco Pais, Lisboa, Portugal",2025 IEEE Conference on Virtual Reality and 3D User Interfaces Abstracts and Workshops (VRW),"24 Apr 2025","2025","","","1016","1020","Immersive reality has emerged as a groundbreaking and promising approach for teaching anatomy, providing unique learning experiences while complementing traditional educational methods. Existing immersive software, such as Organon® and HoloLens®, offer valuable tools but remain limited in anatomical detail and interactivity. We present a novel educational approach: an immersive human atlas that integrates anatomical slices from the Visible Korean Human dataset (male and female) into a 3D environment. This platform enhances anatomical visualization and incorporates a Large Language Model (LLM) to support user interaction and understanding. By combining precise anatomical slices within the 3D model, the atlas provides an enriched and comprehensive learning experience for medical education.","","979-8-3315-1484-6","10.1109/VRW66409.2025.00205","Fundação para a Ciência e a Tecnologia; ","https://ieeexplore.ieee.org/stamp/stamp.jsp?arnumber=10972851","Extended Reality;Immersive Environments;Anatomy Education;Large Language Models;Cross Computing","Visualization;Solid modeling;Three-dimensional displays;Extended reality;Large language models;Conferences;Education;User interfaces;Software;Anatomy","","","","18","IEEE","24 Apr 2025","8-12 March 2025","8-12 March 2025","IEEE","IEEE Conferences"
"Human-robot physical interaction system as a tool for neurocognitive stimulation in children with ADHD in Mexico","J. Aparicio-Juarez; O. A. Dominguez-Ramirez; G. Sepulveda-Cervantes; J. Garcia-Blancas; J. D. Ramirez-Zamora; E. A. Escotto-Cordova; I. Reyes-Hernandez","Autonomous University of the State of Hidalgo, Hidalgo, Mexico; Autonomous University of the State of Hidalgo, Hidalgo, Mexico; Center for Technological Innovation and Development in Computing, National Polytechnic Institute, CDMX, Mexico; Autonomous University of the State of Hidalgo, Hidalgo, Mexico; Autonomous University of the State of Hidalgo, Hidalgo, Mexico; Faculty of Higher Studies Zaragoza, National Autonomous University of Mexico, CDMX, Mexico; Autonomous University of the State of Hidalgo, Pachuca, Hidalgo, Mexico",2024 XXVI Robotics Mexican Congress (COMRob),"12 Dec 2024","2024","","","39","46","This research work promotes the use of an interactive virtual environment, with the purpose of strengthening neurocognitive stimulation in children with ADHD (Attention Deficit Hyperactivity Disorder), through a human-robot physical interaction system (HRpI); as well as establishing the conditions that allow the application of supervised and unsupervised machine learning techniques that favor diagnosis. Clinical evaluation strategies in care and treatment centers for neurodivergent children are based on the Diagnostic and Statistical Manual of Mental Disorders (DSM-5); however, not using integrated technological platforms with biofeedback and neurophysiological stimulation associated with each case study, which contributes to the improvement of the clinical procedure. The proposed HRpI system is constituted by a haptic device with the human operator (patient) in the control loop. The movement instructions are designed based on a clinical protocol that evaluates hand-eye coordination, based on virtual mazes to navigate with one or two upper limbs. The platform is configured with strategies: i) passive haptic guidance and ii) active haptic exploration. In the first case, the robot guides the human in the optimal solution, correcting the interactive forces that condition the presence of disturbances, and shape the required energy; and in the second case, the human voluntarily solves the maze, which implies that the velocity and instantaneous position are variable. Kinesthetic force feedback is based on a viscoelasticity model (spring-damper system) in both haptic interaction strategies. During the development of the task, the instrumentation of brain waves are correlated with the state of the robotic system (position, velocity, energy and instantaneous errors); all this for the evaluation of performance metrics that contribute to the diagnosis. The expected result corresponds to determining the engram in terms of duration and frequency in brain plasticity for self-regulation purposes of the neurodivergent patient; as well as its impact as a value proposition to the Continuous Improvement School Program (PEMC) of basic education institutions in Mexico.","","979-8-3315-3339-7","10.1109/COMRob64055.2024.10777441","","https://ieeexplore.ieee.org/stamp/stamp.jsp?arnumber=10777441","ADHD;Biofeedback;HRpI;Neurophysiological Stimulation;Engram","Training;Visualization;Protocols;Navigation;Shape;Robot kinematics;Virtual environments;Robot sensing systems;User experience;Biomedical monitoring","","1","","28","IEEE","12 Dec 2024","13-15 Nov. 2024","13-15 Nov. 2024","IEEE","IEEE Conferences"
"On the Privacy Guarantees of Differentially Private Stochastic Gradient Descent","S. Asoodeh; M. Diaz","Department of Computing and Software, McMaster University, Canada; IIMAS, Universidad Nacional Autónoma de México, Mexico",2024 IEEE International Symposium on Information Theory (ISIT),"19 Aug 2024","2024","","","380","385","Differentially Private Stochastic Gradient Descent (DP-SGD) is a widely adopted algorithm for privately training machine learning models. An inherent feature of this algorithm is the incorporation of gradient clipping to counteract the influence of individual samples during training. Nevertheless, the introduction of gradient clipping also introduces non-convexity into the problem, rendering it challenging to derive upper bounds on the privacy loss. In this paper, we establish effective upper bounds for the privacy loss of both projected DP-SGD and regularized DP-SGD, without relying on convexity or smoothness assumptions regarding the loss function. Our approach involves a direct analysis of the hockey-stick divergence between coupled stochastic processes through the application of nonlinear data processing inequalities.","2157-8117","979-8-3503-8284-6","10.1109/ISIT57864.2024.10619520","","https://ieeexplore.ieee.org/stamp/stamp.jsp?arnumber=10619520","","Training;Privacy;Upper bound;Machine learning algorithms;Stochastic processes;Machine learning;Rendering (computer graphics)","","","","17","IEEE","19 Aug 2024","7-12 July 2024","7-12 July 2024","IEEE","IEEE Conferences"
"Keep it Simple: Understanding Natural Language Commands for General-Purpose Service Robots","S. Ortuno-Chanelo; L. Contreras; J. Savage; H. Okada","Biorobotics Laboratory, School of Engineering, National Autonomous University of Mexico; Advance Intelligence and Robotics Research Center, Tamagawa University; Biorobotics Laboratory, School of Engineering, National Autonomous University of Mexico; Advance Intelligence and Robotics Research Center, Tamagawa University",2024 IEEE/SICE International Symposium on System Integration (SII),"9 Feb 2024","2024","","","1320","1325","Service robots are designed to perform useful tasks for humans, which involve managing and combining a variety of skills in the form of global and local plans to solve any given task. In this work, we propose a framework to process natural language commands for general-purpose service robots where the robot should perform an arbitrary spoken command requested by a non-expert operator. Our system uses a Natural Language Processing (NLP) parser and a Conceptual Dependency (CD) builder to create CD structures that an expert system can employ to generate a global plan that the robot will execute. An extra simplification step using Large Language Models (LLM) was tested and evaluated in order to improve the accuracy of the system. Finally, our system has been tested in challenging environments in robot competitions and we have achieved promising results.","2474-2325","979-8-3503-1207-2","10.1109/SII58957.2024.10417341","","https://ieeexplore.ieee.org/stamp/stamp.jsp?arnumber=10417341","","Service robots;System integration;Syntactics;Natural language processing;Generators;Task analysis;Expert systems","","3","","21","IEEE","9 Feb 2024","8-11 Jan. 2024","8-11 Jan. 2024","IEEE","IEEE Conferences"
"EEG-based Estimation of Cognitive Workload Across Multiple Tasks","A. S. Mathews; N. Hirachan; C. Joseph; M. Ghahramani; J. Lopez-Aparicio; R. F. Rojas","Human-Centred Technology Research Centre, Faculty of Science and Technology, University of Canberra, Canberra, ACT, Australia; Human-Centred Technology Research Centre, Faculty of Science and Technology, University of Canberra, Canberra, ACT, Australia; Human-Centred Technology Research Centre, Faculty of Science and Technology, University of Canberra, Canberra, ACT, Australia; Human-Centred Technology Research Centre, Faculty of Science and Technology, University of Canberra, Canberra, ACT, Australia; Faculty of Science, National Autonomous University of Mexico, Mexico City, Mexico; Human-Centred Technology Research Centre, Faculty of Science and Technology, University of Canberra, Canberra, ACT, Australia",2024 46th Annual International Conference of the IEEE Engineering in Medicine and Biology Society (EMBC),"17 Dec 2024","2024","","","1","4","Key to the efficacy of working in high-risk environments is the reliable estimation of the human’s cognitive state for improving safety and to maintain high performance longer. In this study, we developed an experimental protocol in which participants completed three cognitive tasks under two different levels (High, Low) of workload. We then evaluated the effect of the different cognitive activities on EEG signals and its accuracy in predicting respective cognitive load. The analysis was conducted using well-known machine learning algorithms such as SVM, RF, and KNN. An average accuracy of 82.75% was obtained through the proposed SVM model to identify the participant’s cognitive workload level. The results obtained through this study indicated the efficacy of the EEG features in predicting the level of cognitive load irrespective of the activity. The proposed set of EEG features represents the cognitive indicators that form the basis for developments of augmented cognition systems in our future works.","2694-0604","979-8-3503-7149-9","10.1109/EMBC53108.2024.10782830","","https://ieeexplore.ieee.org/stamp/stamp.jsp?arnumber=10782830","","Support vector machines;Radio frequency;Accuracy;Protocols;Estimation;Nearest neighbor methods;Cognitive load;Electroencephalography;Safety;Reliability","Humans;Electroencephalography;Cognition;Workload;Male;Algorithms;Machine Learning;Adult;Female;Young Adult;Task Performance and Analysis;Support Vector Machine;Signal Processing, Computer-Assisted","1","","10","IEEE","17 Dec 2024","15-19 July 2024","15-19 July 2024","IEEE","IEEE Conferences"
"Detection of Optimal Echocardiographic Video Segments Using Deep Learning","I. Perez-Ruiz; J. Perez-Gonzalez; A. Carrera-Pinzón; R. E.; R. H.; B. Y.; A. C. F.",Instituto de Investigaciones en Matemáticas Aplicadas y en Sistemas-UNAM; Instituto de Investigaciones en Matemáticas Aplicadas y en Sistemas-UNAM; Universidad Nacional de Colombia; Universidad Nacional de Colombia; Hospital Universitario Nacional de Colombia; Hospital Universitario Nacional de Colombia; Instituto de Investigaciones en Matemáticas Aplicadas y en Sistemas-UNAM,2025 21st International Symposium on Biomedical Image Processing and Analysis (SIPAIM),"18 Dec 2025","2025","","","1","4","The identification of optimal echocardiographic video segments is a critical initial step for reliable cardiac function assessment. This study focuses on the development and evaluation of deep learning models for the automated classification of correct versus incorrect echocardiographic planes in a video sequence, specifically for Subcostal Four-Chamber (S4C) views. A dataset comprising 10 S4C studies was used, from which frames were extracted and preprocessed. Preprocessing included metadata removal, resizing to 224×224 pixels, and data augmentation. The resulting images were divided into training (2068 images per class), validation (517 images per class), and test (200 images per class) sets. Two convolutional neural network architectures, VGG-16 and Vision Transformer (ViT), were trained and evaluated. The VGG-16 model, trained for 30 epochs, achieved a test accuracy of 0.98 and an Area Under the ROC Curve (AUC) of 1.00. The Vision Transformer, trained for 30 epochs, yielded a test accuracy of 0.89 and an AUC of 0.97. These preliminary results demonstrate the potential of deep learning models, particularly VGG-16, to accurately identify optimal frames in echocardiographic video sequences.","","979-8-3315-5456-9","10.1109/SIPAIM67325.2025.11283345","","https://ieeexplore.ieee.org/stamp/stamp.jsp?arnumber=11283345","","Deep learning;Training;Computer vision;Accuracy;Video sequences;Metadata;Transformers;Data augmentation;Reliability;Videos","","","","15","IEEE","18 Dec 2025","18-21 Nov. 2025","18-21 Nov. 2025","IEEE","IEEE Conferences"
"An Affordable Robotic Manipulation Platform with Flexible Gripper and Vision for AI-Driven Control","I. Lopez-Juarez; K. I. Lopez-Valadez; R. Osorio-Comparan; L. A. Castillo-Barrientos; D. Arreguin-Jasso","Mechatronics Department, Autonomous University of Yucatan (UADY), Merida, Mexico; Computer Systems Department, TecNM-Conkal, Merida, Mexico; DISCA IIMAS-UNAM, CDMX, Mexico; Consulting, IBM, Guadalajara, Mexico; Mechatronics Department, ITESM, Saltillo, Mexico","2025 IEEE CHILEAN Conference on Electrical, Electronics Engineering, Information and Communication Technologies (CHILECON)","20 Apr 2026","2025","","","1","5","This paper presents the design and implementation of a low-cost, vision-guided robotic system for automated object recognition and manipulation. The platform integrates a MyCobot 280 Pi robotic arm with a custom 3D-printed, stepperactuated gripper featuring compliant TPU fingers. A fixed overhead camera provides real-time visual feedback, enabling HSV-based color segmentation and homographic transformation for accurate object localization within a $400 \text{mm} \times 400 \text{mm}$ workspace. Experimental results validate the system's ability to reliably detect, grasp, and relocate colored objects. Designed for flexibility and extensibility, the prototype supports research in AI-enhanced robotics, including one-shot learning with large language models (lLMs), tactile sensing, and closed-loop control strategies. Potential application areas include educational robotics, lab automation, light manufacturing, and AI-driven manipulation research.","2832-1537","979-8-3503-5736-3","10.1109/CHILECON66915.2025.11475973","","https://ieeexplore.ieee.org/stamp/stamp.jsp?arnumber=11475973","Robotic Manipulation;Flexible Gripper;Object Recognition;MyCobot 280 Pi;Computer Vision;Low-Cost Robotics","Payloads;Military aircraft;Space technology;Feeds;Feedback;Filtering;Circuits;Filters;Programmable logic arrays;Circuits and systems","","1","","6","IEEE","20 Apr 2026","28-30 Oct. 2025","28-30 Oct. 2025","IEEE","IEEE Conferences"
"Development of a Remote-Controlled Boat for Real-Time Water Quality Monitoring, Bathymetry, In-Situ Sampling in Dams and Lakes of Mexico","R. I. Villalobos-Martínez; J. F. Más; A. Pérez-Vega; A. R. Verdú; R. Páez Bistrain; L. M. M. Manilla; I. A. Mariscal; R. V. Martínez","Center for Environmental Geography Research (CIGA), Universidad Autonoma de México (UNAM), Morelia, México; Center for Environmental Geography Research (CIGA), Universidad Autonoma de México (UNAM), Morelia, México; Department of Geomatics and Hydraulic Engineering (DIGH), University of Guanajuato (UG), Guanajuato, México; Image Processing Laboratory (IPL), University of Valencia (UV), Valencia, España; Center for Environmental Geography Research (CIGA), Universidad Autonoma de México (UNAM), Morelia, México; Laboratorio Universitario de Drones (LUD) Universidad Autonoma de México (UNAM), Morelia, México; University Drone Laboratory (LUD) Universidad Autonoma de México (UNAM), Morelia, México; Department of Basic Sciences (DBS), National Polytechnic Institute (IPN), CDMX, México","2025 5th International Conference on Electrical, Computer and Energy Technologies (ICECET)","9 Apr 2026","2025","","","1","6","Water quality monitoring has gained significant importance in recent years due to the increasing number of factors contaminating water resources. In response to this issue, real-time and automated water quality monitoring has sparked considerable interest for its potential to enhance accuracy, efficiency, and minimize manual effort. This study proposes a technically feasible and practically applicable device for real-time water quality monitoring using an automated smart boat equipped with sensors and an on-site sample collection system. The developed prototype will integrate sensors for pH, water temperature, turbidity, TDS, dissolved oxygen, conductivity, GPS, relative humidity, ambient temperature, atmospheric pressure, a camera to monitor floating debris and navigation, and sonar for bathymetric measurements. The prototype weighs less than 30 kg and measures 100 cm × 100 cm × 51 cm. Its cost is under $2000 USD (excluding the multiparametric sensor). Tests of the sonar, temperature sensor, and sample collection systems were conducted at Cointzio Dam (Morelia, Michoacán, Mexico) and Mata Dam (Guanajuato, Guanajuato, Mexico).","","979-8-3315-3559-9","10.1109/ICECET63943.2025.11472041","","https://ieeexplore.ieee.org/stamp/stamp.jsp?arnumber=11472041","Unmanned Surface Vehicle;Autonomous Surface Vehicle;remote sensing;water quality monitoring;boat;sampling;bathymetry","Sonar;Payloads;Aerospace and electronic systems;Sonar measurements;Sensor systems;Echo sounders;Military aircraft;Space technology;Satellite broadcasting;Broadcasting","","","","25","IEEE","9 Apr 2026","3-6 July 2025","3-6 July 2025","IEEE","IEEE Conferences"
"Impact of the Gain Recovery Time of a QD-SOA on Transmission System Amplification","C. St-Arnault; S. Bernal; R. Cutiérrez-Castrejón; E. Berikaa; Z. Wei; J. Rautert; S. V. Poltavtsev; A. E. Gubenko; V. V. Belykh; V. S. Mikhrin; A. R. Kovsh; D. V. Plant","Dept. of Electrical and Computer Engineering, McGill University, Montreal, QC, Canada; Dept. of Electrical and Computer Engineering, McGill University, Montreal, QC, Canada; Dept. of Electrical and Computer Engineering, McGill University, Montreal, QC, Canada; Dept. of Electrical and Computer Engineering, McGill University, Montreal, QC, Canada; Dept. of Electrical and Computer Engineering, McGill University, Montreal, QC, Canada; Innolume GmbH, Dortmund, Germany; Innolume GmbH, Dortmund, Germany; Innolume GmbH, Dortmund, Germany; Innolume GmbH, Dortmund, Germany; Innolume GmbH, Dortmund, Germany; Alfalume Inc, Los Gatos, CA, USA; Dept. of Electrical and Computer Engineering, McGill University, Montreal, QC, Canada",2024 Conference on Lasers and Electro-Optics (CLEO),"29 Oct 2024","2024","","","1","2","We experimentally evaluate the influence of the gain recovery time of a QD-SOA on IM/DD in the O-band and establish a way to estimate the gain recovery time of an SOA.","2160-8989","979-8-3503-6931-1","","","https://ieeexplore.ieee.org/stamp/stamp.jsp?arnumber=10728840","","Lasers and electrooptics;Electro-optical waveguides","","1","","3","","29 Oct 2024","5-10 May 2024","5-10 May 2024","IEEE","IEEE Conferences"
