"Quasi-PT Symmetry: A Pathway to Better Laser Performance","B. Olyaeefar; E. Karabey; E. Şeker; R. El-Ganainy; A. Demir","UNAM - Institute of Materials Science and Nanotechnology, Bilkent University, Ankara, Turkey; UNAM - Institute of Materials Science and Nanotechnology, Bilkent University, Ankara, Turkey; UNAM - Institute of Materials Science and Nanotechnology, Bilkent University, Ankara, Turkey; Department of Electrical and Computer Engineering, Saint Louis University, Saint Louis, MO, USA; UNAM - Institute of Materials Science and Nanotechnology, Bilkent University, Ankara, Turkey",2025 Conference on Lasers and Electro-Optics Europe & European Quantum Electronics Conference (CLEO/Europe-EQEC),"15 Aug 2025","2025","","","1","1","Semiconductor laser diodes (LDs) are key enablers in various applications, including optical communication, material processing, and healthcare, because of their compact size, efficiency, and ease of integration. However, increasing LD output power while preserving spatial and spectral beam quality remains a challenge, often limited by nonlinear effects and filamentation. Established solutions, such as photonic crystals in VCSELs or tapered/antiguiding designs in EELDs, boost power and beam quality but inflate fabrication complexity and cost, hindering widespread adoption. [1]. Recently, non-Hermitian photonics has emerged as a paradigm for engineering the spatial distribution of optical gain and loss. Parity-time-symmetric (PTS) lasers, in particular, can achieve single-mode operation in both longitudinal and transverse directions. More advanced approaches, combining non-Hermitian engineering, supersymmetry, and topological physics, have been proposed for large-area laser arrays, yet realistic power levels and high beam quality remain elusive, often relying on pulsed pumping or exhibiting spurious passive-waveguide emission [2], [3]. Here, we present a systematic theoretical and experimental comparison of PTS and quasi-PTS (q-PTS) EELDs (see Fig. 1). Although both architectures achieve comparable output powers under similar pumping conditions, only q-PTS lasers maintain excellent beam quality (M2 < 1.5) at power levels near 0.5 W, surpassing PTS devices (M2 ≈ 4). Moreover, power conversion efficiency remains unaffected in q-PTS structures, indicating a minimal trade-off between filtering higher-order modes and preserving overall device efficiency. Equally important, these benefits are achieved without adding complexity or additional fabrication steps beyond a conventional EELD process. These findings challenge the prevailing notion that spatial filtering must be enforced by PTS, which can introduce side lobes that degrade beam quality. Instead, q-PTS leverages stronger coupling among higher-order modes while leaving the fundamental mode unperturbed, striking an optimal balance between mode selectivity and practicality. Our results, therefore, offer a roadmap for large-area single-mode EELDs that deliver both high power and high beam quality, translating non-Hermitian concepts from proof-of-concept to real-world impact.","2833-1052","979-8-3315-1252-1","10.1109/CLEO/Europe-EQEC65582.2025.11110189","TUBITAK(grant numbers:117F361,123F158); ","https://ieeexplore.ieee.org/stamp/stamp.jsp?arnumber=11110189","","Laser theory;Filtering;Power lasers;Laser modes;Laser excitation;Complexity theory;Laser beams;Vertical cavity surface emitting lasers;Pump lasers;Power generation","","","","3","IEEE","15 Aug 2025","23-27 June 2025","23-27 June 2025","IEEE","IEEE Conferences"
"A Real Time Strategy for Detecting Intertum Short-Circuit Faults in PMSM Using Vold-Kalman Filter","M. A. Mazzoletti; O. M. Simonovets; G. R. Bossio; F. R. Gentile","UDEE-F1, UNaM, Oberá, Argentina; UDEE-F1, UNaM-CONICET, Oberá, Argentina; GEA-IITEMA, UNRC-CONICET, Río Cuarto, Argentina; FI-UBA, Instituto de Ingenierta Biomedica, Buenos Aires, Argentina",2025 XXI Workshop on Information Procesing and Control (RPIC),"27 Nov 2025","2025","","","1","6","This paper presents a strategy for detecting interturn short-circuit (ITSC) faults in permanent magnet synchronous machines (PMSM) based on tracking the fundamental component of a residual voltage using the Vold-Kalman filter (VKF). The vector models of the voltages at the midpoint of the phase windings for a faulty PMSM are presented. In addition, the orthogonal vector (OV) model of the VKF algorithm used to compute the magnitude and phase shift from the measured voltage is described. Experimental results for a PMSM with ITSC of varying severity under both no-load and full-load conditions are presented. It is demonstrated that a ITSC fault can be reliably detected from 1 % fault severity, and the corresponding faulty winding can be accurately identified.","","979-8-3315-5702-7","10.1109/RPIC67987.2025.11260834","Fondo para la Investigación Científica y Tecnológica; ","https://ieeexplore.ieee.org/stamp/stamp.jsp?arnumber=11260834","Fault diagnosis;Permanent magnet synchronous motor;Turn-to-turn short-circuit faults;Vold-Kalman filter","Fault diagnosis;Analytical models;Voltage measurement;Magnetic separation;Computational modeling;Windings;Stator windings;Prototypes;Vectors;Real-time systems","","","","19","IEEE","27 Nov 2025","17-19 Sept. 2025","17-19 Sept. 2025","IEEE","IEEE Conferences"
"Usage of Novel Co-MOF for Mode-Locked Pulse Generation Near 2 μm","H. Ahmad; J. W. Chiam; M. Z. Samion; M. F. Ismail; S. Mutlu; V. Filiz; S. Savaskan Yılmaz; N. Arsu; M. K. A. Zaini; K. Thambiratnam; L. Bayang; S. Sun; B. Ortaç","the Department of Physics, and the Faculty of Science, Photonics Research Centre, Universiti Malaya, Kuala Lumpur, Malaysia; Photonics Research Centre, Universiti Malaya, Kuala Lumpur, Malaysia; Photonics Research Centre, Universiti Malaya, Kuala Lumpur, Malaysia; Photonics Research Centre, Universiti Malaya, Kuala Lumpur, Malaysia; Department of Chemistry, Karadeniz Technical University, Trabzon, Türkiye; Helmholtz-Zentrum Hereon, Institute of Membrane Research, Geesthacht, Germany; Department of Chemistry, Karadeniz Technical University, Trabzon, Türkiye; Department of Chemistry, Davutpasa Campus, Yildiz Technical University, Istanbul, Türkiye; Photonics Research Centre, Universiti Malaya, Kuala Lumpur, Malaysia; Department of Physics, Kuliyyah of Science, iPQC, International Islamic University Malaysia, Bandar Indera Makhota, Kuantan, Malaysia; Photonics Research Centre, Universiti Malaya, Kuala Lumpur, Malaysia; Collaborative Innovation Center for Green Intelligent Laser Manufacturing Technology and Equipment of Shandong Province, School of Mechanical and Automotive Engineering, Qingdao University of Technology, Qingdao, China; National Nanotechnology Research Center (UNAM) and the Institute of Materials Science Nanotechnology, Bilkent University, Ankara, Türkiye",IEEE Journal of Quantum Electronics,"2 Jul 2025","2025","61","3","1","7","In this work, we investigated unprecedented laser-induced rapid synthesis (LIRS) cobalt-based metal-organic framework (Co-MOF) saturable absorber (SA) to generate a conventional soliton pulse in a thulium-doped fiber laser (TDFL). The Co-MOF was drop-casted onto a side-polished fiber (SPF) to prepare the saturable absorber (SA). It exhibited a high modulation depth of 14% and a saturation intensity of 20.7MW/cm2. The pulse produced had a pulse width and center wavelength of 1.34 ps and 1974.2 nm, respectively. The repetition rate of the output was 13.09 MHz, which gives a pulse interval of about 76.4 ps. The beam output reached an average power of 6.56 mW and pulse energy of about 501 pJ before breaking, achieving a maximum peak power of 374 W.","1558-1713","","10.1109/JQE.2025.3574132","Universiti Malaya(grant numbers:RU001-2025A); ","https://ieeexplore.ieee.org/stamp/stamp.jsp?arnumber=11017470","Fiber laser;mode-locking;thulium-doped fiber laser;saturable absorber;metal-organic framework","Fiber lasers;Optical pulses;Modulation;Optical pumping;Optical polarization;Optical fiber dispersion;Optical solitons;Optical fiber polarization;Optical fiber couplers;Laser mode locking","","","","59","IEEE","29 May 2025","June 2025","","IEEE","IEEE Journals"
"WiFi-CSI Sensing for Human Presence and Machine Activity in Industrial Environments","E. De Armas; G. Díaz; I. Sobron; J. M. Matías; I. Eizmendi","UNAM: Dept. Telecommunications, Mexico City, Mexico; UPV/EHU: Dept. Communication Engineering, Bilbao, Spain; UPV/EHU: Dept. of Computer Languages and Systems, Bilbao, Spain; UNAM: Dept. Telecommunications, Mexico City, Mexico; UPV/EHU: Dept. Communication Engineering, Bilbao, Spain",2025 IEEE 21st International Conference on Factory Communication Systems (WFCS),"16 Jul 2025","2025","","","1","8","The fields of human presence detection (HPD) and people counting (PC) from WiFi-Channel State Information (CSI) represent constantly evolving areas of research within the scientific community. This study aims to expand the research frontiers by exploring the application of HPD and PC in an industrial environment characterized by its considerable dimensions, the presence of obstacles and machines, and harsh propagation channel conditions. Using a convolutional neural network (CNN) incorporating CSI measurements, we demonstrated the ability to distinguish between human presence and industrial machine activity with the same model, achieving an accuracy of over 99%. In addition, a study was conducted to count up to three people, even when machines were on, with an accuracy of over 92%. Another experiment was conducted with the objective of assessing not only the feasibility of PC in a naturally challenging environment but also the impact of the WiFi channel bandwidth in this particular application. The results of this study highlight the potential of WiFi-CSI sensing to address a significant challenge in human activity detection and estimation: its application in industrial environments.","2835-8414","979-8-3315-3005-1","10.1109/WFCS63373.2025.11077659","","https://ieeexplore.ieee.org/stamp/stamp.jsp?arnumber=11077659","WiFi sensing;channel state information;human presence detection;people counting;deep learning;industrial environments","Productivity;Legged locomotion;Accuracy;Bandwidth;Production facilities;Sensors;Safety;Convolutional neural networks;Wireless fidelity;Testing","","1","","32","IEEE","16 Jul 2025","10-13 June 2025","10-13 June 2025","IEEE","IEEE Conferences"
"Power System Coherency via Taylor-Fourier Modal Extraction and Elbow-Based Clustering on Merging Costs","J. Ortiz-Bejar; J. Ortiz-Bejar; A. Zamora; M. R. A. Paternina; E. S. Tellez","INFOTEC, Aguascalientes, Mexico; Universidad Michoacana de San Nicolas de Hidalgo, Morelia, Mexico; Universidad Michoacana de San Nicolas de Hidalgo, Morelia, Mexico; UNAM, Mexico City; INFOTEC, Aguascalientes, Mexico","2025 IEEE International Autumn Meeting on Power, Electronics and Computing (ROPEC)","3 Feb 2026","2025","9","","1","6","This paper addresses power system coherency by extracting oscillatory modal characteristics, which in turn inform a hierarchical agglomerative clustering (HAC) technique. The phase of the slower frequency modes is extracted from rotor speed measurements after a large disturbance occurs using a set of FIR filters built with the discrete-time Taylor-Fourier transform (DTTFT). These are clustered using the hierarchical agglomerative clustering (HAC) technique, with a subsequent optimal determination of the number of clusters guided by a customized Elbow heuristic, constructed explicitly over the HAC cluster merging distance/cost curve. Finally, the attained results demonstrate that the DTTFT’s noise tolerance under polluted conditions and the effectiveness of the HAC for properly clustering generating units in the 10-machine and 39-bus benchmark power grid.","2573-0770","979-8-3315-7673-8","10.1109/ROPEC68163.2025.11353970","","https://ieeexplore.ieee.org/stamp/stamp.jsp?arnumber=11353970","Coherency;oscillatory modes;discrete time Taylor-Fourier transform;hierarchical agglomerative clustering;Elbow method","Finite impulse response filters;Merging;Rotors;Transforms;Benchmark testing;Power grids;Power electronics;Proposals;Velocity measurement;Elbow","","","","24","IEEE","3 Feb 2026","12-14 Nov. 2025","12-14 Nov. 2025","IEEE","IEEE Conferences"
"Measurement and Analysis of the Inrush Current in a 60 MVA Power Transformer","M. Vazquez; V. Torres-García; L. N. Rueda-Can; N. Solís-Ramos; S. Ramirez-Zavala","Funken/UNAM; TecNM/Instituto Tecnológico de Morelia; TecNM/Instituto Tecnológico de Morelia; CFE, Comisión Federal de Electricidad; Universidad Michoacana de San Nicolás de Hidalgo","2024 IEEE PES Generation, Transmission and Distribution Latin America Conference and Industrial Exposition (GTDLA)","14 Mar 2025","2024","","","1","6","Electrical power transformers play a crucial role in the electrical power system, as they are responsible for increasing voltage levels to transmit electrical energy from generating plants and subsequently reducing them to the required levels for consumers. However, when a transformer is energized, a transient phenomenon known as Inrush current occurs due to the saturation of the core. A key characteristic of this phenomenon is that the current can reach a magnitude several times greater than the transformer’s nominal current, which may cause false trips in the breakers. Also, The current waveform associated with this phenomenon is asymmetric, dampens over time, and is predominantly composed of the second harmonic component. This work analyzes the harmonic current content observed during the energization of a real 60 MVA transformer. The recorded currents of two cases were analyzed using the Discrete Fourier Transform DFT, showing that the second harmonic is representative of this type of phenomenon.","","979-8-3315-3054-9","10.1109/GTDLA61236.2024.10913729","","https://ieeexplore.ieee.org/stamp/stamp.jsp?arnumber=10913729","Inrush Current;Power Transformer;Differential Protection","Discrete Fourier transforms;Surge protection;Power system harmonics;Transformer cores;Harmonic analysis;Power transformers;Circuit faults;Transient analysis;Protection;Inrush current","","","","0","IEEE","14 Mar 2025","11-13 Nov. 2024","11-13 Nov. 2024","IEEE","IEEE Conferences"
"Developing 3D-CMUT for Ultrasonic Guided Wave-Based Damage Imaging Applications: A Comprehensive Theory and Simulation Study","W. Lu; G. Ma; C. Liu; R. Wang; G. Zhang; W. Zhang; M. Yilmaz; S. Zhang","School of Machinery and Transportation, Changzhou Vocational Institute of Industry Technology, Changzhou, China; School of Machinery and Transportation, Changzhou Vocational Institute of Industry Technology, Changzhou, China; Institute of Acoustics, School of Physics Science and Engineering, Tongji University, Shanghai, China; State Key Laboratory of Dynamic Testing Technology, North University of China, Taiyuan, China; State Key Laboratory of Dynamic Testing Technology, North University of China, Taiyuan, China; State Key Laboratory of Dynamic Testing Technology, North University of China, Taiyuan, China; National Nanotechnology Research Center (UNAM), Bilkent University, Ankara, Turkey; Institute of Ultrasonic Testing, Jiangsu University, Zhenjiang, China",IEEE Sensors Journal,"17 Dec 2024","2024","24","24","40494","40506","It is widely recognized that the use of multimode ultrasonic guided waves holds the potential for a comprehensive evaluation of structural damages, including their locations, sizes, and types, in the realm of damage imaging. Recently, a micro-electromechanical system (MEMS) sensor, named 3-D capacitive micromachined ultrasonic transducer (3D-CMUT), has emerged as a promising candidate for detecting 3-D vibrations of multimode ultrasonic guided waves. In this work, 3D-CMUT is introduced for the first time in ultrasonic guided wave-based damage imaging. Initially, for analytical convenience, an idealized design of 3D-CMUT is substituted with a simplified configuration comprising a piston-type cell (sensing z-directional signals) and two orthogonally positioned identical comb-type cells (sensing x- and y-directional signals). Subsequently, finite element method (FEM) simulations are employed to establish models of “a damaged aluminum plate with a circular through-hole” and “an undamaged aluminum plate.” By using the transfer function-based effective method, 3-D scattered signals captured by an array of 3D-CMUTs are rapidly extracted to characterize the circular through-hole. Ultimately, the scattered data are transformed into intuitive damage images using the decomposition of the time-reversal operator and multiple signal classification (DORT-MUSIC) algorithm. The results not only affirm the viability of applying 3D-CMUT in damage imaging but also underscore the advantages of integrating 3-D ultrasonic guided wave information for a more accurate assessment of structural damages. This research may contribute significantly to advancing the applications of 3D-CMUT in nondestructive testing (NDT).","1558-1748","","10.1109/JSEN.2024.3482471","National Natural Science Foundation of China(grant numbers:62271235,62071205,12404534); Foundation of State Key Laboratory of Dynamic Testing Technology(grant numbers:2022-SYSJJ-10); Open Fund of State Key Laboratory of Acoustics(grant numbers:SKLA202313); ","https://ieeexplore.ieee.org/stamp/stamp.jsp?arnumber=10733824","3-D capacitive micromachined ultrasonic transducers (3D-CMUTs);damage imaging;ultrasonic guided waves","Acoustics;Sensors;Three-dimensional displays;Imaging;Electrodes;Finite element analysis;Testing;Springs;Air gaps;Sensitivity","","2","","47","IEEE","23 Oct 2024","15 Dec.15, 2024","","IEEE","IEEE Journals"
"Oscillation Source Location Assisted by the O-splines Filter","R. Dominguez-Navarrete; A. Zamora; J. Ortiz-Bejar; M. R. A. Paternina","Universidad Michoacana de San Nicolás de Hidalgo, Morelia, Mexico; Universidad Michoacana de San Nicolás de Hidalgo, Morelia, Mexico; Universidad Michoacana de San Nicolás de Hidalgo, Morelia, Mexico; UNAM, Mexico City","2025 IEEE International Autumn Meeting on Power, Electronics and Computing (ROPEC)","3 Feb 2026","2025","9","","1","6","In this paper, an efficient filtering process is proposed to improve the location of oscillation sources in power systems. The proposed method is based on the multiresolution discrete-time Taylor–Fourier transform (DTTFT) designed with O-splines. This multiresolution approach employs a specific design of bandpass filters for the precise extraction of oscillatory components from measured synchrophasor signals. This allows the integration of the Taylor-Fourier filter-bank with O-splines into the well-known dissipating energy flow (DEF) method for oscillation source location, which conventionally uses the Butterworth bandpass filter. The proposed O-splines filter, combined with the DEF method, has been validated considering different scenarios of forced oscillations, where four test cases were created from the well-known Kundur two-area power system to validate the proposal. The attained results confirm that the proposal’s advantages compared with the Butterworth filter, since it exhibits an outstanding oscillation source location performance, especially at the beginning of the disturbance.","2573-0770","979-8-3315-7673-8","10.1109/ROPEC68163.2025.11354047","","https://ieeexplore.ieee.org/stamp/stamp.jsp?arnumber=11354047","","Band-pass filters;Filtering;Energy resolution;Position measurement;Power electronics;Phasor measurement units;Power systems;Proposals;Oscillators;Signal resolution","","","","22","IEEE","3 Feb 2026","12-14 Nov. 2025","12-14 Nov. 2025","IEEE","IEEE Conferences"
"Adsorption of Malachite Green on CaO-ZnFe2O4 Composite Derived from Agro-industrial Waste","O. Reyes-Vallejo; R. M. Sánchez-Albores; R. Escobar-Velázquez; C. López-Aguilar; F. J. Cano; A. Ashok; J. Escorcia-García; P. Bartolo-Pérez","Sección de Electrónica de Estado Sólido- Ingeniería eléctrica (SEES), CINVESTAV-IPN, Ciudad de México, México; Escuela de Ciencias Químicas, Universidad Autónoma de Chiapas (UNACH), Chiapas, México; Escuela de Ciencias Químicas, Universidad Autónoma de Chiapas (UNACH), Chiapas, México; Escuela de Ciencias Químicas, Universidad Autónoma de Chiapas (UNACH), Chiapas, México; Institute of Molecules & Materials of Le Mans (IMMM) - Le Mans, France Programa de Nanociencias y Nanotecnología, CINVESTAV-IPN, Ciudad de México, México; Departamento de materia condensada, Instituto de Física, UNAM, Ciudad de México, México; CINVESTAV-IPN Unidad, Saltillo, Coahuila, México; CINVESTAV-IPN Unidad, Merida, Yucatán, México","2024 21st International Conference on Electrical Engineering, Computing Science and Automatic Control (CCE)","4 Dec 2024","2024","","","1","6","This study focuses on the synthesis of a CaO-ZnFe2O4 composite derived from waste materials such as eggshell CaO and ZnFe2O4 via a combustion process using orange peel as fuel. The composite was prepared by mechanical milling, sonication in ethanol, and annealing. Structural, morphological, and surface characterizations were carried out using X-ray diffraction (XRD), scanning electron microscopy (SEM), Fourier transform infrared spectroscopy (FTIR), and Brunauer-Emmett- Teller (BET) analysis, which confirmed the successful formation of the composite. The material was shown to be highly effective in removing malachite green dye through adsorption studies, demonstrating a significant capacity for dye removal. Kinetic modeling based on the pseudo-second-order equation indicated that the adsorption process was driven by chemisorption. In addition, the adsorption process was found to be endothermic, as the removal of malachite green increased with increasing solution temperature.","2642-3766","979-8-3503-7754-5","10.1109/CCE62852.2024.10770930","","https://ieeexplore.ieee.org/stamp/stamp.jsp?arnumber=10770930","Adsorption;Malachite Green dye;composite;CaO-ZnFe2O4;green chemistry","Scanning electron microscopy;Waste materials;X-ray scattering;Adsorption;Green products;Milling;X-ray diffraction;Mathematical models;Kinetic theory;Surface treatment","","3","","26","IEEE","4 Dec 2024","23-25 Oct. 2024","23-25 Oct. 2024","IEEE","IEEE Conferences"
