Title,Author,Author affiliation,Source,Sponsor,Publisher/Repository,Volume and Issue,Pages,Issue date,Monograph title,Publication year,ISSN,E-ISSN,ISBN13,DOI,Article number,Conference name,Conference date,Conference location,Abstract,Number of references,Main Heading,Controlled/Subject terms,Uncontrolled terms,Classification code,IPC code,Treatment,Funding details,Funding text,Open Access type(s),Database,Copyright,Data Provider
"Cloud Detection using Night Sky Background Light at the Pierre Auger Observatory","Abdul Halim, A. (13); Abreu, P. (70); Aglietta, M. (51, 53); Allekotte, I. (1); Almeida Cheminant, K. (77, 78); Almela, A. (7, 12); Aloisio, R. (44, 45); Alvarez-Muñiz, J. (76); Ambrosone, A. (44); Ammerman Yebra, J. (76); Anastasi, G.A. (46, 57); Anchordoqui, L. (83); Andrada, B. (7); Andrade Dourado, L. (44, 45); Andringa, S. (70); Apollonio, L. (48, 58); Aramo, C. (49); Arnone, E. (51, 62); Arteaga Velázquez, J.C. (66); Assis, P. (70); Avila, G. (11); Avocone, E. (45, 56); Bakalova, A. (31); Barbato, F. (44, 45); Bartz Mocellin, A. (82); Bellido, J.A. (13); Berat, C. (35); Bertaina, M.E. (51, 62); Bianciotto, M. (51, 62); Biermann, P.L. (88); Binet, V. (5); Bismark, K. (7, 38); Bister, T. (77, 78); Biteau, J. (36, 95); Blazek, J. (31); Blümer, J. (40); Boháčová, M. (31); Boncioli, D. (45, 56); Bonifazi, C. (8); Bonneau Arbeletche, L. (22); Borodai, N. (68); Brack, J. (93); Brichetto Orchera, P.G. (7, 40); Briechle, F.L. (41); Bueno, A. (75); Buitink, S. (15); Buscemi, M. (46, 57); Büsken, M. (7, 38); Bwembya, A. (77, 78); Caballero-Mora, K.S. (65); Cabana-Freire, S. (76); Caccianiga, L. (48, 58); Campuzano, F. (6); Caraça-Valente, J. (82); Caruso, R. (46, 57); Castellina, A. (51, 53); Catalani, F. (19); Cataldi, G. (47); Cazon, L. (76); Cerda, M. (10); Čermáková, B. (40); Cermenati, A. (44, 45); Chinellato, J.A. (22); Chudoba, J. (31); Chytka, L. (32); Clay, R.W. (13); Cobos Cerutti, A.C. (6); Colalillo, R. (49, 59); Conceição, R. (70); Consolati, G. (48, 54); Conte, M. (47, 55); Convenga, F. (44, 45); Correia dosSantos, D. (27); Costa, P.J. (70); Covault, C.E. (81); Cristinziani, M. (43); Cruz Sanchez, C.S. (3); Dasso, S. (2, 4); Daumiller, K. (40); Dawson, B.R. (13); de Almeida, R.M. (27); de Boone, E.-T. (43); de Errico, B. (27); de Jesús, J. (7); de Jong, S.J. (77, 78); de Mello Neto, J.R.T. (27); De Mitri, I. (44, 45); de Oliveira, J. (18); de Oliveira Franco, D. (42); de Palma, F. (47, 55); de Souza, V. (20); De Vito, E. (47, 55); Del Popolo, A. (46, 57); Deligny, O. (33); Denner, N. (31); Deval, L. (51, 53); di Matteo, A. (51); Dobrigkeit, C. (22); D’Olivo, J.C. (67); Domingues Mendes, L.M. (16, 70); Dorosti, Q. (43); dos Anjos, J.C. (16); dos Anjos, R.C. (26); Ebr, J. (31); Ellwanger, F. (40); Engel, R. (38, 40); Epicoco, I. (47, 55); Erdmann, M. (41); Etchegoyen, A. (7, 12); Evoli, C. (44, 45); Falcke, H. (77, 78, 79); Farrar, G. (85); Fauth, A.C. (22); Fehler, T. (43); Feldbusch, F. (39); Fernandes, A. (70); Fernandez, M. (14); Fick, B. (84); Figueira, J.M. (7); Filip, P. (7, 38); Filipčič, A. (73, 74); Fitoussi, T. (40); Flaggs, B. (87); Fodran, T. (77); Franco, A. (47); Freitas, M. (70); Fujii, T. (86); Fuster, A. (7, 12); Galea, C. (77); García, B. (6); Gaudu, C. (37); Ghia, P.L. (33); Giaccari, U. (47); Gobbi, F. (10); Gollan, F. (7); Golup, G. (1); Gómez Berisso, M. (1); Gómez Vitale, P.F. (11); Gongora, J.P. (11); González, J.M. (1); González, N. (7); Góra, D. (68); Gorgi, A. (51, 53); Gottowik, M. (40) ","(1) Centro Atómico Bariloche, Instituto Balseiro (CNEA-UNCuyo-CONICET), San Carlos de Bariloche, Argentina (2) Departamento de Física, Departamento de Ciencias de la Atmósfera y los Océanos, FCEyN, Universidad de Buenos Aires, CONICET, Buenos Aires, Argentina (3) IFLP, Universidad Nacional de La Plata, CONICET, La Plata, Argentina (4) Instituto de Astronomía y Física del Espacio (IAFE, CONICET-UBA), Buenos Aires, Argentina (5) Instituto de Física de Rosario (IFIR), CONICET, U.N.R., Facultad de Ciencias Bioquímicas y Farmacéuticas U.N.R., Rosario, Argentina (6) Instituto de Tecnologías en Detección y Astropartículas (CNEA, CONICET, UNSAM), Universidad Tecnológica Nacional, Facultad Regional Mendoza (CONICET/CNEA), Mendoza, Argentina (7) Instituto de Tecnologías en Detección y Astropartículas (CNEA, CONICET, UNSAM), Buenos Aires, Argentina (8) International Center of Advanced Studies, Instituto de Ciencias Físicas, ECyT-UNSAM, CONICET, Campus Miguelete – San Martín, Buenos Aires, Argentina (9) Laboratorio Atmósfera, Departamento de Investigaciones en Láseres y sus Aplicaciones, UNIDEF (CITEDEFCONICET), Argentina (10) Observatorio Pierre Auger, Malargüe, Argentina (11) Observatorio Pierre Auger and Comisión Nacional de Energía Atómica, Malargüe, Argentina (12) Universidad Tecnológica Nacional, Facultad Regional Buenos Aires, Buenos Aires, Argentina (13) University of Adelaide, Adelaide; SA, Australia (14) Université Libre de Bruxelles (ULB), Brussels, Belgium (15) Vrije Universiteit Brussels, Brussels, Belgium (16) Centro Brasileiro de Pesquisas Fisicas, RJ, Rio de Janeiro, Brazil (17) Centro Federal de Educação Tecnológica Celso Suckow da Fonseca, Petropolis, Brazil (18) Instituto Federal de Educação, Ciência e Tecnologia do Rio de Janeiro (IFRJ), Brazil (19) Universidade de São Paulo, Escola de Engenharia de Lorena, SP, Lorena, Brazil (20) Universidade de São Paulo, Instituto de Física de São Carlos, SP, São Carlos, Brazil (21) Universidade de São Paulo, Instituto de Física, SP, São Paulo, Brazil (22) Universidade Estadual de Campinas (UNICAMP), IFGW, SP, Campinas, Brazil (23) Universidade Estadual de Feira de Santana, Feira de Santana, Brazil (24) Universidade Federal de Campina Grande, Centro de Ciencias e Tecnologia, Campina Grande, Brazil (25) Universidade Federal do ABC, SP, Santo André, Brazil (26) Universidade Federal do Paraná, Setor Palotina, Palotina, Brazil (27) Universidade Federal do Rio de Janeiro, Instituto de Física, RJ, Rio de Janeiro, Brazil (28) Universidad de Medellín, Medellín, Colombia (29) Universidad Industrial de Santander, Bucaramanga, Colombia (30) Charles University, Faculty of Mathematics and Physics, Institute of Particle and Nuclear Physics, Prague, Czech Republic (31) Institute of Physics of the Czech Academy of Sciences, Prague, Czech Republic (32) Palacky University, Olomouc, Czech Republic (33) CNRS, IN2P3, IJCLab, Université Paris-Saclay, Orsay, France (34) Laboratoire de Physique Nucléaire et de Hautes Energies (LPNHE), Sorbonne Université, Université de Paris, CNRSIN2P3, Paris, France (35) Univ. Grenoble Alpes, CNRS, Grenoble Institute of Engineering Univ. Grenoble Alpes, LPSC-IN2P3, Grenoble; 38000, France (36) Université Paris-Saclay, CNRS, IN2P3, IJCLab, Orsay, France (37) Bergische Universität Wuppertal, Department of Physics, Wuppertal, Germany (38) Karlsruhe Institute of Technology (KIT), Institute for Experimental Particle Physics, Karlsruhe, Germany (39) Karlsruhe Institute of Technology (KIT), Institut für Prozessdatenverarbeitung und Elektronik, Karlsruhe, Germany (40) Karlsruhe Institute of Technology (KIT), Institute for Astroparticle Physics, Karlsruhe, Germany (41) RWTH Aachen University, III. Physikalisches Institut A, Aachen, Germany (42) Universität Hamburg, II. Institut für Theoretische Physik, Hamburg, Germany (43) Universität Siegen, Department Physik – Experimentelle Teilchenphysik, Siegen, Germany (44) Gran Sasso Science Institute, L’Aquila, Italy (45) INFN Laboratori Nazionali del Gran Sasso, L’Aquila, Assergi, Italy (46) INFN, Sezione di Catania, Catania, Italy (47) INFN, Sezione di Lecce, Lecce, Italy (48) INFN, Sezione di Milano, Milano, Italy (49) INFN, Sezione di Napoli, Napoli, Italy (50) INFN, Sezione di Roma 'Tor Vergata', Roma, Italy (51) INFN, Sezione di Torino, Torino, Italy (52) Istituto di Astrofisica Spaziale e Fisica Cosmica di Palermo (INAF), Palermo, Italy (53) Osservatorio Astrofisico di Torino (INAF), Torino, Italy (54) Politecnico di Milano, Dipartimento di Scienze e Tecnologie Aerospaziali, Milano, Italy (55) Università del Salento, Dipartimento di Matematica e Fisica 'E. De Giorgi', Lecce, Italy (56) Università dell’Aquila, Dipartimento di Scienze Fisiche e Chimiche, L’Aquila, Italy (57) Università di Catania, Dipartimento di Fisica e Astronomia 'Ettore Majorana', Catania, Italy (58) Università di Milano, Dipartimento di Fisica, Milano, Italy (59) Università di Napoli 'Federico II', Dipartimento di Fisica 'Ettore Pancini', Napoli, Italy (60) Università di Palermo, Dipartimento di Fisica e Chimica 'E. Segrè', Palermo, Italy (61) Università di Roma 'Tor Vergata', Dipartimento di Fisica, Roma, Italy (62) Università Torino, Dipartimento di Fisica, Torino, Italy (63) Benemérita Universidad Autónoma de Puebla, Puebla, Mexico (64) Unidad Profesional Interdisciplinaria en Ingeniería y Tecnologías Avanzadas del Instituto Politécnico Nacional (UPIITA-IPN), D.F., México, Mexico (65) Universidad Autónoma de Chiapas, Chiapas, Tuxtla Gutiérrez, Mexico (66) Universidad Michoacana de San Nicolás de Hidalgo, Michoacán, Morelia, Mexico (67) Universidad Nacional Autónoma de México, D.F., México, Mexico (68) Institute of Nuclear Physics PAN, Krakow, Poland ","Proceedings of Science","","Sissa Medialab Srl","v 501","","December 30, 2025","ICRC 2025 - 39th International Cosmic Ray Conference","2025","","18248039","","10.22323/1.501.0408","408","39th International Cosmic Ray Conference, ICRC 2025","July 15, 2025 - July 24, 2025","","Rejection of cloud-contaminated data is a complex and important process at the Pierre Auger Observatory, one which combines information from several sources, including IR cameras, lidars, and satellite imaging. With the deteriorating quality of the IR cameras and challenges in using other sources, we propose a new method. We use continuous detector monitoring measurements to build a large database of night sky background fluxes for each pixel across 27 telescopes. Using this database, we generate the expected background flux and define cloud rejection thresholds. Through a straightforward analysis we construct boolean cloud-contamination masks. We demonstrate some results of the analysis, including comparisons with cloud detected using infra-red observations. © Copyright owned by the author(s)","8","Augers","Cameras - Image processing - Observatories - Satellite imagery","Background light - Cloud detection - Detector monitoring - IR camera - Large database - Monitoring measurements - Pierre Auger observatory - Rejection threshold - Satellite imaging - Sky background","502 Mines and Quarry Equipment and Operations - 655.1 Satellites - 656.2 Space Research - 742.2 Photographic and Video Equipment - 1106.3.1 Image Processing","",,,,"All Open Access, Gold, Green","Compendex","Compilation and indexing terms, Copyright 2026 Elsevier Inc.","Engineering Village"
"A Comparison of Algorithms to Estimate Heart and Respiratory Rate from Face Video Processing","Ruíz-Espinosa, Gilberto (1); Jimenez-Angeles, Luis (1); Guzman, Didier Torres (1); Rojas-Arce, Jorge L. (1); Marmolejo-Saucedo, Jose Antonio (2) ","(1) Department of Biomedical Systems, Engineering Faculty, Universidad Nacional Autonoma de Mexico, Mexico City, Mexico (2) Universidad Nacional Autonoma de Mexico, Ciudad de Mexico, Mexico ","EAI/Springer Innovations in Communication and Computing","","Springer Science and Business Media Deutschland GmbH","","p 241-250","2024","7th EAI International Conference on Computer Science and Engineering in Health Services - COMPSE 2023","2024","25228595","25228609","9783031674396","10.1007/978-3-031-67440-2_19","","7th EAI International Conference on Computer Science and Engineering in Health Services, COMPSE 2023","November 16, 2023 - November 17, 2023","","The growing importance of remote monitoring of heart rate (HR) and respiratory rate (RR) has heightened the relevance of noncontact measurement methods. In this chapter, we compare the performance of independent component analysis (ICA) method and Green–Red Differences (GRD) method in extracting the remote photoplethysmography (rPPG) signal from both simulated and real images captured by a webcam and compute the instantaneous values of HR and RR using the processed signals. In all cases, the best algorithm was GRD with Fourier analysis, so this method should be analyzed in greater depth to propose improvements in its performance and make it a reliable method for the estimation of HR and RR. © The Author(s), under exclusive license to Springer Nature Switzerland AG 2024.","20","Photoplethysmography","Fourier analysis - Image enhancement - Remote patient monitoring - Video analysis - Video signal processing","Analysis method - Heart-rate - Independent components analysis - Measurement methods - Noncontact measurements - Performance - Remote monitoring - Remote photoplethysmography - Respiratory rate - Video processing","102.1 Medicine - 102.1.2.1 Health Care - 716.4 Television Systems and Equipment - 746 Imaging Techniques - 1106.3.1 Image Processing - 1201.2 Calculus and Analysis - 1201.3 Mathematical Transformations","",,"","This work is supported by UNAM-DGAPA-PAPIME "PE103323: Herramientas de enseñanza para el desarrollo de dispositivos médicos basados en inteligencia artificial."",,"Compendex","Compilation and indexing terms, Copyright 2026 Elsevier Inc.","Engineering Village"
"Remote quality control in digital mammography. Two experiences","Sabino-Campechano, J. (1); Ruiz-Trejo, C. (1); Espejo-Fonseca, R. (2); Trujillo-Zamudio, F.E. (3) ","(1) Universidad Nacional Autonoma de Mexico, Physics Institute, Mexico (2) Salud Digna' A.C, Mexico (3) Hospital Regional de Alta Especialidad de Oaxaca, Mexico ","AIP Conference Proceedings","","AIP Publishing, USA","v 3391, n 1","040014 (5 pp.)","22 Dec 2025","","","1551-7616","","","10.1063/5.0309607","","EIGHTEENTH MEXICAN SYMPOSIUM ON MEDICAL PHYSICS","2024","Guanajuato, Mexico","The objective was to explore the feasibility to implement a remote quality control program in two digital mammography services in Mexico. Remote quality control was performed using an IAEA phantom to evaluate image quality quantitatively with digital metrics. To evaluate image quality quantitatively, mammograms are required to be in 'for Processing' DICOM format. Testing was attempted on two mammography systems. Test data were sent to a reference center located at UNAM Physics Institute using Internet and free Google Drive & One Drive storage. Image evaluation was performed using ATIA and Image J software. Results showed that it was not always possible to perform a remote quality control agreement with the IAEA methodology. Nevertheless, it was possible to assess image quality qualitatively and remotely using ACR methodology. [The copyright for the referenced work is owned by Author(s). Copies of full-text articles should only be made or obtained from the publisher or authorized sources.]","8",,"Internet - mammography - medical image processing - phantoms - quality control","digital mammography services - digital metrics - free Google Drive & One Drive storage - Image evaluation - Image J software - image quality - mammography systems - remote quality control agreement - remote quality control program","E1610 Inspection and quality control - C5260B Computer vision and image processing techniques - B6135 Optical, image and video signal processing - C7330 Biology and medical computing - B7510P X-ray techniques: radiography and computed tomography (biomedical imaging/measurement) - A8760J X-rays and particle beams (medical uses) - A8770E Patient diagnostic methods and instrumentation","G01N33/48 - G16B - G06T","Practical (PRA)",,,,"Inspec","Copyright 2026, The Institution of Engineering and Technology","Engineering Village"
"CFDA-CSF: A multi-modal domain adaptation method for cross-subject emotion recognition","Jimenez-Guarneros, M. (1); Fuentes-Pineda, G. (1) ","(1) Universidad Nacional Autonoma de Mexico, Department of Computer Science, Mexico ","IEEE Transactions on Affective Computing","","IEEE Computer Society, USA","v 15, n 3","1502-13","2024","","","1949-3045","","","10.1109/TAFFC.2024.3357656","","","","","Multi-modal classifiers for emotion recognition have become prominent, as the emotional states of subjects can be more comprehensively inferred from Electroencephalogram (EEG) signals and eye movements. However, existing classifiers experience a decrease in performance due to the distribution shift when applied to new users. Unsupervised domain adaptation (UDA) emerges as a solution to address the distribution shift between subjects by learning a shared latent feature space. Nevertheless, most UDA approaches focus on a single modality, while existing multi-modal approaches do not consider that fine-grained structures should also be explicitly aligned and the learned feature space must be discriminative. In this paper, we propose Coarse and Fine-grained Distribution Alignment with Correlated and Separable Features (CFDA-CSF), which performs a coarse alignment over the global feature space, and a fine-grained alignment between modalities from each domain distribution. At the same time, the model learns intra-domain correlated features, while a separable feature space is encouraged on new subjects. We conduct an extensive experimental study across the available sessions on three public datasets for multi-modal emotion recognition: SEED, SEED-IV, and SEED-V. Our proposal effectively improves the recognition performance in every session, achieving an average accuracy of 93.05%, 85.87% and 91.20% for SEED; 85.72%, 89.60%, and 86.88% for SEED-IV; and 88.49%, 91.37% and 91.57% for SEED-V.","0",,"bioelectric potentials - deep learning (artificial intelligence) - electroencephalography - emotion recognition - feature extraction - medical signal processing - signal classification","CFDA-CSF - coarse-and-fine-grained distribution alignment-with-correlated-and-separable features - cross-subject emotion recognition - fine-grained structures - global feature space - intradomain correlated features - learned feature space - multimodal classifiers - multimodal domain adaptation method - multimodal emotion recognition - SEED-IV - SEED-V","C5260 Digital signal processing - B6140 Signal processing and detection - C6264 Neural nets - C7330 Biology and medical computing - B7510D Bioelectric signals - A8730C Electrical activity in neurophysiological processes - A8770F Electrodiagnostics and other electrical measurement techniques","G01N33/48 - G06N3/02 - G16B - G06N20/00 - A61B5/00","Practical (PRA); Theoretical or Mathematical (THR); Experimental (EXP)",,,,"Inspec","Copyright 2024, The Institution of Engineering and Technology","Engineering Village"
"Evaluation of commercial and custom-made phantoms for quality control in contrast-enhanced mammography","Ramírez, D.I. (1); Castillo, J.P. (2); Galván, H.A. (2); Brandan, M.E. (3) ","(1) Universidad Nacional Autonoma de Mexico, School of Sciences, Mexico (2) National Institute of Cancerology, Mexico (3) Universidad Nacional Autonoma de Mexico, Physics Institute, Mexico ","AIP Conference Proceedings","","AIP Publishing, USA","v 3391, n 1","030004 (6 pp.)","22 Dec 2025","","","1551-7616","","","10.1063/5.0310005","","EIGHTEENTH MEXICAN SYMPOSIUM ON MEDICAL PHYSICS","2024","Guanajuato, Mexico","Commercial and custom-made phantoms for Quality Control (QC) in Contrast-Enhanced Mammography (CEM) are available. The aim of this work was to evaluate four different phantoms in a CEM quality control program at the National Institute of Cancerology (INCan). Three of the phantoms were commercially produced, while the fourth was a custom-made PMMA phantom. The evaluation was succesfully performed on all phantoms. The PMMA phantom demonstrated consistent quantification performance, while the commercial phantom excelled in visualization. Finally, reference and tolerance values for the iodine signal were established for various nominal iodine concentrations. [The copyright for the referenced work is owned by Author(s). Copies of full-text articles should only be made or obtained from the publisher or authorized sources.]","5",,"diagnostic radiography - iodine - mammography - medical image processing - phantoms - quality control","CEM quality control program - commercial phantom - contrast-enhanced mammography - custom- - different phantoms - PMMA phantom","B7510P X-ray techniques: radiography and computed tomography (biomedical imaging/measurement) - A8760J X-rays and particle beams (medical uses) - A8770E Patient diagnostic methods and instrumentation","G01N33/48","Practical (PRA)",,,,"Inspec","Copyright 2026, The Institution of Engineering and Technology","Engineering Village"
"Color Image Protection via Quantum Encryption and HVS-Based Mini-Block Data Hiding","Olvera-Martinez, Luis (1); Cedillo-Hernandez, Manuel (1); Diaz-Rodriguez, Carlos (1); Faustinos-Morales, Leonardo (2) ","(1) Mecánica y Eléctrica Unidad Culhuacan, Instituto Politécnico Nacional Escuela Superior de Ingeniería, CDMX, Mexico (2) Universidad Nacional Autónoma de Mexico, CDMX, Mexico ","2025 10th International Conference on Frontiers of Signal Processing, ICFSP 2025","","Institute of Electrical and Electronics Engineers Inc.","","p 16-20","2025","2025 10th International Conference on Frontiers of Signal Processing, ICFSP 2025","2025","","","9798331574420","10.1109/ICFSP67350.2025.11353827","","10th International Conference on Frontiers of Signal Processing, ICFSP 2025","September 10, 2025 - September 12, 2025","","With the growing demand for secure and efficient digital image processing, the integration of data hiding and encryption techniques has become essential to ensure both confidentiality and integrity of visual information. This paper proposes a hybrid approach that combines a low complexity steganographic scheme for binary and color images with a computationally efficient encryption technique inspired by quantum operators. In the data hiding component, an RGB channel of a color image is selected, and its least significant bit plane is extracted. This bit plane is then divided into suitable blocks, and HVS-based encoding tables are used to embed the information within these blocks, achieving high embedding capacity while preserving visual quality. In parallel, the encryption stage operates on color images and is based on a novel operator model that simulates quantum behaviors such as creation, exchange, and annihilation, enabling effective protection without requiring intensive mathematical processing. Experimental validation confirms the robustness of the combined approach through quality metrics such as PSNR, SSIM and entropy. © 2025 IEEE.","17","Mathematical operators","Binary images - Embeddings - Information hiding - Privacy-preserving techniques - Quantum cryptography - RGB color model - Steganography","Braided quantum - Colour image - Data-hiding - Dynamic matrix - Encryption technique - Finite fields - Image protection - matrix - Quantum encryption - Quantum operators","741.1 Light/Optics - 1101 Artificial Intelligence - 1101.2 Machine Learning - 1106.3.1 Image Processing - 1106.9 Computer Software - 1108.2 Cryptography - 1201 Mathematics","",,"Number: -, Acronym: IPN, Sponsor: Instituto Polit&eacute;cnico Nacional; ","This article is funded by Instituto Polit\u00E9cnico Nacional.",,"Compendex","Compilation and indexing terms, Copyright 2026 Elsevier Inc.","Engineering Village"
