Title,Author,Author affiliation,Source,Sponsor,Publisher/Repository,Volume and Issue,Pages,Issue date,Monograph title,Publication year,ISSN,E-ISSN,ISBN13,DOI,Article number,Conference name,Conference date,Conference location,Abstract,Number of references,Main Heading,Controlled/Subject terms,Uncontrolled terms,Classification code,IPC code,Treatment,Funding details,Funding text,Open Access type(s),Database,Copyright,Data Provider
"Camera-Based Navigation: Convolutional Neural Networks vs Rule-Based Approaches","Boes, S. (1); Algorri, M.-E. (1); Köhn, H. (1) ","(1) TH Köln - University of Applied Sciences, Germany ","Interactive Collaborative Robotics: 9th International Conference, ICR 2024, Proceedings. Lecture Notes in Computer Science, Lecture Notes in Artificial Intelligence (14898)","","Springer Nature, Berlin, Germany","","171-85","2024","","","","","978-3-031-71360-6","10.1007/978-3-031-71360-6_13","","International Conference on Interactive Collaborative Robotics","2024","Mexico City, Mexico","We compare the performance of rule-based image processing algorithms for autonomous navigation with that of a Convolutional Neural Network approach based on an Nvidia CNN architecture. We detail our implementation of Hough-Transform-based and pixel-based navigation algorithms and discuss their advantages and disadvantages, including a quantitative comparison of their navigation performance in terms of speed, stability and reliability. We describe how rule-based algorithms can be used to train Convolutional Neural Networks that result in enhanced navigation with high speed, stability and reliability. We discuss the advantages of training Convolutional Neural Networks with binary images instead of colour images and the resulting enhanced performance. We present our experiments on autonomous navigation with model cars racing on unknown tracks using the different algorithms and conclude with some recommendations for the use of each algorithm.","15",,"cameras - convolutional neural nets - Hough transforms - image processing - knowledge based systems - navigation - neural net architecture","autonomous navigation - binary images - camera-based navigation - colour images - Convolutional Neural Network approach - enhanced navigation - Hough-Transform-based navigation algorithms - model cars - navigation performance - Nvidia CNN architecture - pixel-based navigation algorithms - quantitative comparison - resulting enhanced performance - rule-based approaches - rule-based image processing algorithms","C5260B Computer vision and image processing techniques - B6135 Optical, image and video signal processing - C6264 Neural nets","G06T - G06N3/02 - G03B17/00 - G03B19/00 - G01C21/00","Practical (PRA)",,,,"Inspec","Copyright 2025, The Institution of Engineering and Technology","Engineering Village"
"A 4D Soil-Structure Interaction Model Testing Apparatus","Riccio, T. (1); Romero, T. (2); Previtali, M. (1); Mánica, M. (2); Ciantia, M. (1, 3) ","(1) University of Dundee, School of Science and Engineering, United Kingdom (2) National Autonomous University of Mexico, Institute of Engineering, Mexico (3) University of Milano Bicocca, Department of Earth and Environmental Sciences, Italy ","Geotechnical Testing Journal","","ASTM International, USA","v 47, n 6","1181-1204","2024","","","1945-7545","","","10.1520/GTJ20230581","","","","","A new three-axis loading frame has been developed to enable real-time visualization of in situ soil and rock structure interactions via X-ray tomography during small-scale model testing. The constructed frame is capable of performing a wide range of small-scale 1g tests and can accommodate monotonic and cyclic actuation under both load and displacement control. The compact size of the system enables remote multi-axis operation from within an X-ray cone-beam scanning bay, a capability which is owed to a comprehensive design process. Design and fabrication involved a blend of physical and numerical experiments to assess suitable construction materials and performance. In this scope, the new equipment is discussed and its capability is showcased.","87",,"computerised tomography - design engineering - geotechnical engineering - rocks - soil - structural engineering","4d soil-structure interaction model testing apparatus - comprehensive design process - constructed frame - cyclic actuation - displacement control - mass 1.0 g - monotonic actuation - real-time visualization - remote multiaxis operation - rock structure interactions - situ soil - small-scale model testing - suitable construction materials - three-axis loading frame - X-ray cone-beam scanning bay - X-ray tomography","E1400 Design - E1630 Testing - E1710 Engineering materials - E2110D Geotechnical structures - E2180A Elasticity (mechanical engineering) - E3030 Construction industry - A8760J X-rays and particle beams (medical uses)","A61B6/03","Practical (PRA); Theoretical or Mathematical (THR)",,,,"Inspec","Copyright 2024, The Institution of Engineering and Technology","Engineering Village"
"Unveiling neutrino masses: Insights from a robust BOSS and eBOSS data analysis and prospects for DESI and beyond","Noriega, H.E. (1); Aviles, A. (1) ","(1) Universidad Nacional Autonoma de Mexico, Instituto de Ciencias Fisicas, Cuernavaca, Mexico ","Physical Review D","","APS - American Physical Society, USA","v 111, n 6","L061307 (8 pp.)","15 March 2025","","","2470-0029","","","10.1103/PhysRevD.111.L061307","","","","","Recent findings from DESI BAO combined with Planck CMB data have set an upper limit on the total neutrino mass of ΣmνeV (95% confidence level), ruling out the inverted hierarchy. Indeed, methods that rely on the background expansion of the Universe tend to suggest negative neutrino masses. In this work, we contribute to the quest for accurately constraining neutrino mass using cosmological probes. By conducting a full-shape analysis on data from BOSS, eBOSS, and synthetic power spectra, we showed that projection effects can significantly influence constraints on neutrino mass, rendering these measurements largely unreliable. Our results highlight the need for better techniques to measure the neutrino mass accurately. Based on the large-scale structure suppression, we identified a critical blind spot in the full-shape analysis. By splitting the galaxy power spectrum into broadband and wiggles, we noticed that information on neutrino mass is primarily extracted from the relative amplitude of the BAO wiggles rather than broadband suppression. This opens the possibility of developing alternative methods based only on the wiggles of the power spectrum that can be more robust than those heavily reliant on background evolution.","83",,"cosmology - data analysis - neutrino mass - radiofrequency cosmic radiation - red shift","DESI BAO - eBOSS data analysis - electron volt energy 0.072 eV - full-shape analysis - galaxy power spectrum - negative neutrino masses - Planck CMB data - synthetic power spectra - total neutrino mass","A1460G Neutrinos - A9870V Background cosmic radiations - A9880L Observational cosmology - A9880B Origin and early evolution of the Universe - A9880D Theoretical cosmology","","Theoretical or Mathematical (THR); Experimental (EXP)",,,,"Inspec","Copyright 2025, The Institution of Engineering and Technology","Engineering Village"
"Method for Maximizing the Number of Detected Keypoints on Homogeneous Underlying Surfaces","Egorov, A. (1); Astapova, M. (1); Uzdiaev, M. (1) ","(1) FGBUN Sankt-Peterburgskij Federal'nyj issledovatel'skij centr Rossijskoj akademii nauk, St. Petersburg Federal Research Center of the Russian Academy of Sciences (SPC RAS), 39, 14th Line V.O., St. Petersburg, Russia ","Interactive Collaborative Robotics: 9th International Conference, ICR 2024, Proceedings. Lecture Notes in Computer Science, Lecture Notes in Artificial Intelligence (14898)","","Springer Nature, Berlin, Germany","","240-50","2024","","","","","978-3-031-71360-6","10.1007/978-3-031-71360-6_18","","International Conference on Interactive Collaborative Robotics","2024","Mexico City, Mexico","The developing area of unmanned aerial vehicle (UAV) applications states an urgent problem of positioning in the case of Global Satellite Positioning System (GNSS) or Gyro-Peak Navigation System (GNS) absence. The widespread visual SLAM positioning algorithms are based on the based on keypoints detection algorithms that process in most cases RGB images. However, in the case of processing images of homogeneous underlying surfaces (e.g., forests, deserts, water spaces, etc.), RGB data could be insufficient in terms of the small number of possible detecting keypoints. In this case, multispectral data that contain more electromagnetic radiation wavelengths bands, as well as spectral indices computed using combinations of spectral bands could be essential for effective processing of homogenous areas of the underlying surfaces in terms of keypoints detection. This paper is devoted to developing a novel method of search for a combination of spectral channels that provides the maximum number of detecting keypoints using pretrained DARKFEAT deep neural network on the image of homogeneous underlying surface. The results of the experiments have shown that the number of detected keypoints on average increased 1.44 times in the calculated index images compared to RGB images and, in turn, resulted in an average 1.592-fold increase in the number of keypoint matches in the current and previous images.","28",,"autonomous aerial vehicles - deep learning (artificial intelligence) - feature extraction - geophysical image processing - image colour analysis - image matching - mobile robots - robot vision - satellite navigation - SLAM (robots)","calculated index images - cases RGB images - detected keypoints - developing area - effective processing - electromagnetic radiation wavelengths bands - homogeneous underlying surface - homogenous areas - keypoint matches - keypoints detection algorithms that process - possible detecting keypoints - RGB data - spectral bands - underlying surfaces - unmanned aerial vehicle - widespread visual SLAM positioning algorithms","C3390T Telerobotics - C3390C Mobile robots - C5260B Computer vision and image processing techniques - B6135E Image recognition - B6135 Optical, image and video signal processing - C6264 Neural nets - A9385 Instrumentation and techniques for geophysical, hydrospheric and lower atmosphere research","G06T - G05D1/00 - G01V - G06N3/02 - G06N20/00 - G01S5/02 - G01S19/00","Practical (PRA); Theoretical or Mathematical (THR)",,,,"Inspec","Copyright 2024, The Institution of Engineering and Technology","Engineering Village"
"Cloud Detection using Night Sky Background Light at the Pierre Auger Observatory","Tairli, Fedor (1); Halim, A. Abdul (14); Abreu, P. (71); Aglietta, M. (52, 54); Allekotte, I. (2); Cheminant, K. Almeida (78, 79); Almela, A. (8, 13); Aloisio, R. (45, 46); Alvarez-Muñiz, J. (77); Ambrosone, A. (45); Yebra, J. Ammerman (77); Anastasi, G.A. (47, 58); Anchordoqui, L. (84); Andrada, B. (8); Dourado, L. Andrade (45, 46); Andringa, S. (71); Apollonio, L. (49, 59); Aramo, C. (50); Arnone, E. (52, 63); Velázquez, J.C. Arteaga (67); Assis, P. (71); Avila, G. (12); Avocone, E. (46, 57); Bakalova, A. (32); Barbato, F. (45, 46); Mocellin, A. Bartz (83); Bellido, J.A. (14); Berat, C. (36); Bertaina, M.E. (52, 63); Bianciotto, M. (52, 63); Biermann, P.L. (89); Binet, V. (6); Bismark, K. (8, 39); Bister, T. (78, 79); Biteau, J. (37, 95); Blazek, J. (32); Blümer, J. (41); Boháčová, M. (32); Boncioli, D. (46, 57); Bonifazi, C. (9); Arbeletche, L. Bonneau (23); Borodai, N. (69); Brack, J. (93); Orchera, P.G. Brichetto (8, 41); Briechle, F.L. (42); Bueno, A. (76); Buitink, S. (16); Buscemi, M. (47, 58); Büsken, M. (8, 39); Bwembya, A. (78, 79); Caballero-Mora, K.S. (66); Cabana-Freire, S. (77); Caccianiga, L. (49, 59); Campuzano, F. (7); Caraça-Valente, J. (83); Caruso, R. (47, 58); Castellina, A. (52, 54); Catalani, F. (20); Cataldi, G. (48); Cazon, L. (77); Cerda, M. (11); Čermáková, B. (41); Cermenati, A. (45, 46); Chinellato, J.A. (23); Chudoba, J. (32); Chytka, L. (33); Clay, R.W. (14); Cerutti, A.C. Cobos (7); Colalillo, R. (50, 60); Conceição, R. (71); Consolati, G. (49, 55); Conte, M. (48, 56); Convenga, F. (45, 46); dos Santos, D. Correia (28); Costa, P.J. (71); Covault, C.E. (82); Cristinziani, M. (44); Sanchez, C.S. Cruz (4); Dasso, S. (3, 5); Daumiller, K. (41); Dawson, B.R. (14); de Almeida, R.M. (28); de Boone, E.-T. (44); de Errico, B. (28); de Jesús, J. (8); de Jong, S.J. (78, 79); de Mello Neto, J.R.T. (28); De Mitri, I. (45, 46); de Oliveira, J. (19); de Oliveira Franco, D. (43); de Palma, F. (48, 56); de Souza, V. (21); De Vito, E. (48, 56); Del Popolo, A. (47, 58); Deligny, O. (34); Denner, N. (32); Deval, L. (52, 54); di Matteo, A. (52); Dobrigkeit, C. (23); D’Olivo, J.C. (68); Domingues Mendes, L.M. (17, 71); Dorosti, Q. (44); dos Anjos, J.C. (17); dos Anjos, R.C. (27); Ebr, J. (32); Ellwanger, F. (41); Engel, R. (39, 41); Epicoco, I. (48, 56); Erdmann, M. (42); Etchegoyen, A. (8, 13); Evoli, C. (45, 46); Falcke, H. (78, 79, 80); Farrar, G. (86); Fauth, A.C. (23); Fehler, T. (44); Feldbusch, F. (40); Fernandes, A. (71); Fernandez, M. (15); Fick, B. (85); Figueira, J.M. (8); Filip, P. (8, 39); Filipčič, A. (74, 75); Fitoussi, T. (41); Flaggs, B. (88); Fodran, T. (78); Franco, A. (48); Freitas, M. (71); Fujii, T. (87); Fuster, A. (8, 13); Galea, C. (78); García, B. (7); Gaudu, C. (38); Ghia, P.L. (34); Giaccari, U. (48); Gobbi, F. (11); Gollan, F. (8); Golup, G. (2); Gómez Berisso, M. (2); Gómez Vitale, P.F. (12); Gongora, J.P. (12); González, J.M. (2); González, N. (8); Góra, D. (69); Gorgi, A. (52, 54); Gottowik, M. (41) ","(1) School of Physics, Chemistry & Earth Sciences, University of Adelaide, Adelaide, Australia (2) Centro Atómico Bariloche, Instituto Balseiro (CNEA-UNCuyo-CONICET), San Carlos de Bariloche, Argentina (3) Departamento de Física, Departamento de Ciencias de la Atmósfera y los Océanos, FCEyN, Universidad de Buenos Aires and CONICET, Buenos Aires, Argentina (4) IFLP, Universidad Nacional de La Plata and CONICET, La Plata, Argentina (5) Instituto de Astronomía y Física del Espacio (IAFE, CONICET-UBA), Buenos Aires, Argentina (6) Instituto de Física de Rosario (IFIR), CONICET/U.N.R. and Facultad de Ciencias Bioquímicas y Farmacéuticas U.N.R., Rosario, Argentina (7) Instituto de Tecnologías en Detección y Astropartículas (CNEA, CONICET, UNSAM), Universidad Tecnológica Nacional – Facultad Regional Mendoza (CONICET/CNEA), Mendoza, Argentina (8) Instituto de Tecnologías en Detección y Astropartículas (CNEA, CONICET, UNSAM), Buenos Aires, Argentina (9) International Center of Advanced Studies, Instituto de Ciencias Físicas, ECyT-UNSAM and CONICET, Campus Miguelete – San Martín, Buenos Aires, Argentina (10) Laboratorio Atmósfera, Departamento de Investigaciones en Láseres y sus Aplicaciones – UNIDEF (CITEDEFCONICET), Argentina (11) Observatorio Pierre Auger, Malargüe, Argentina (12) Observatorio Pierre Auger and Comisión Nacional de Energía Atómica, Malargüe, Argentina (13) Universidad Tecnológica Nacional – Facultad Regional Buenos Aires, Buenos Aires, Argentina (14) University of Adelaide, Adelaide; SA, Australia (15) Université Libre de Bruxelles (ULB), Brussels, Belgium (16) Vrije Universiteit Brussels, Brussels, Belgium (17) Centro Brasileiro de Pesquisas Fisicas, RJ, Rio de Janeiro, Brazil (18) Centro Federal de Educação Tecnológica Celso Suckow da Fonseca, Petropolis, Brazil (19) Instituto Federal de Educação, Ciência e Tecnologia do Rio de Janeiro (IFRJ), Brazil (20) Universidade de São Paulo, Escola de Engenharia de Lorena, SP, Lorena, Brazil (21) Universidade de São Paulo, Instituto de Física de São Carlos, SP, São Carlos, Brazil (22) Universidade de São Paulo, Instituto de Física, SP, São Paulo, Brazil (23) Universidade Estadual de Campinas (UNICAMP), IFGW, SP, Campinas, Brazil (24) Universidade Estadual de Feira de Santana, Feira de Santana, Brazil (25) Universidade Federal de Campina Grande, Centro de Ciencias e Tecnologia, Campina Grande, Brazil (26) Universidade Federal do ABC, SP, Santo André, Brazil (27) Universidade Federal do Paraná, Setor Palotina, Palotina, Brazil (28) Universidade Federal do Rio de Janeiro, Instituto de Física, RJ, Rio de Janeiro, Brazil (29) Universidad de Medellín, Medellín, Colombia (30) Universidad Industrial de Santander, Bucaramanga, Colombia (31) Charles University, Faculty of Mathematics and Physics, Institute of Particle and Nuclear Physics, Prague, Czech Republic (32) Institute of Physics, the Czech Academy of Sciences, Prague, Czech Republic (33) Palacky University, Olomouc, Czech Republic (34) CNRS/IN2P3, IJCLab, Université Paris-Saclay, Orsay, France (35) Laboratoire de Physique Nucléaire et de Hautes Energies (LPNHE), Sorbonne Université, Université de Paris, CNRSIN2P3, Paris, France (36) Univ. Grenoble Alpes, CNRS, Grenoble Institute of Engineering Univ. Grenoble Alpes, LPSC-IN2P3, Grenoble; 38000, France (37) Université Paris-Saclay, CNRS/IN2P3, IJCLab, Orsay, France (38) Bergische Universität Wuppertal, Department of Physics, Wuppertal, Germany (39) Karlsruhe Institute of Technology (KIT), Institute for Experimental Particle Physics, Karlsruhe, Germany (40) Karlsruhe Institute of Technology (KIT), Institut für Prozessdatenverarbeitung und Elektronik, Karlsruhe, Germany (41) Karlsruhe Institute of Technology (KIT), Institute for Astroparticle Physics, Karlsruhe, Germany (42) RWTH Aachen University, III. Physikalisches Institut A, Aachen, Germany (43) Universität Hamburg, II. Institut für Theoretische Physik, Hamburg, Germany (44) Universität Siegen, Department Physik – Experimentelle Teilchenphysik, Siegen, Germany (45) Gran Sasso Science Institute, L’Aquila, Italy (46) INFN Laboratori Nazionali del Gran Sasso, Assergi, L’Aquila, Italy (47) INFN, Sezione di Catania, Catania, Italy (48) INFN, Sezione di Lecce, Lecce, Italy (49) INFN, Sezione di Milano, Milano, Italy (50) INFN, Sezione di Napoli, Napoli, Italy (51) INFN, Sezione di Roma 'Tor Vergata', Roma, Italy (52) INFN, Sezione di Torino, Torino, Italy (53) Istituto di Astrofisica Spaziale e Fisica Cosmica di Palermo (INAF), Palermo, Italy (54) Osservatorio Astrofisico di Torino (INAF), Torino, Italy (55) Politecnico di Milano, Dipartimento di Scienze e Tecnologie Aerospaziali, Milano, Italy (56) Università del Salento, Dipartimento di Matematica e Fisica 'E. De Giorgi', Lecce, Italy (57) Università dell’Aquila, Dipartimento di Scienze Fisiche e Chimiche, L’Aquila, Italy (58) Università di Catania, Dipartimento di Fisica e Astronomia 'Ettore Majorana', Catania, Italy (59) Università di Milano, Dipartimento di Fisica, Milano, Italy (60) Università di Napoli 'Federico II', Dipartimento di Fisica 'Ettore Pancini', Napoli, Italy (61) Università di Palermo, Dipartimento di Fisica e Chimica'E. Segrè', Palermo, Italy (62) Università di Roma 'Tor Vergata', Dipartimento di Fisica, Roma, Italy (63) Università Torino, Dipartimento di Fisica, Torino, Italy (64) Benemérita Universidad Autónoma de Puebla, Puebla, Mexico (65) Unidad Profesional Interdisciplinaria en Ingeniería y Tecnologías Avanzadas del Instituto Politécnico Nacional (UPIITA-IPN), D.F., México, Mexico (66) Universidad Autónoma de Chiapas, Chiapas, Tuxtla Gutiérrez, Mexico (67) Universidad Michoacana de San Nicolás de Hidalgo, Michoacán, Morelia, Mexico (68) Universidad Nacional Autónoma de México, D.F., México, Mexico ","arXiv","","arXiv","","","September 8, 2025","","2025","","23318422","","10.48550/arXiv.2509.06343","","","","","Rejection of cloud-contaminated data is a complex and important process at the Pierre Auger Observatory, one which combines information from several sources, including IR cameras, lidars, and satellite imaging. With the deteriorating quality of the IR cameras and challenges in using other sources, we propose a new method. We use continuous detector monitoring measurements to build a large database of night sky background fluxes for each pixel across 27 telescopes. Using this database, we generate the expected background flux and define cloud rejection thresholds. Through a straightforward analysis we construct boolean cloud-contamination masks. We demonstrate some results of the analysis, including comparisons with cloud detected using infra-red observations. Copyright © 2025, The Authors. All rights reserved.","8","Observatories","Augers - Cameras - Image processing - Satellite imagery","Background light - Cloud detection - Detector monitoring - IR camera - Large database - Monitoring measurements - Pierre Auger observatory - Rejection threshold - Satellite imaging - Sky background","502 Mines and Quarry Equipment and Operations - 655.1 Satellites - 656.2 Space Research - 742.2 Photographic and Video Equipment - 1106.3.1 Image Processing","",,,,,"Compendex","Compilation and indexing terms, Copyright 2026 Elsevier Inc.","Engineering Village"
"A Deep (Learning) Dive Into Bacterial Classification","Fuentes-Villegas, Alberto Daniel (1); Hernández, Haydee O. (1); Olveres, Jimena (2, 3); Escalante-Ramírez, Boris (2, 3) ","(1) Universidad Nacional Autónoma de México, Mexico City, Mexico (2) Facultad de Ingeniería, Universidad Nacional Autónoma de México, Mexico City, Mexico (3) Centro de Estudios en Computación Avanzada, Universidad Nacional Autónoma de México, Mexico City, Mexico ","Proceedings of SPIE - The International Society for Optical Engineering","The Society of Photo-Optical Instrumentation Engineers (SPIE)","SPIE","v 12998","","2024","Optics, Photonics, and Digital Technologies for Imaging Applications VIII","2024","0277786X","1996756X","9781510673144","10.1117/12.3017349","129981G","Optics, Photonics, and Digital Technologies for Imaging Applications VIII 2024","April 9, 2024 - April 11, 2024","","Most bacteria classifiers created by neural networks and/or image processing methods are unable to generalize when used with different data bases of images acquired with the same type of acquisition systems, even if the sample preparation is similar. In this work, we introduce an ensemble of deep neural networks designed for the classification of bacteria in a broad context. We use a dataset comprising Actinomyces, Escherichia, Staphylococcus, Lactobacillus, and Micrococcus bacteria with Gram staining, which was acquired through brightfield microscopy from various sources. To normalize diversity of image characteristics, we applied domain generalization and adaptation techniques. Subsequently, we used phenotypic characteristics, such as the color reaction to Gram staining and morphology, to classify the bacteria. © 2024 SPIE.","17","Bacteria","Deep neural networks","Acquisition systems - Actinomyces - Bacterial classifications - Data base - Deep learning - Ensemble - Gram-staining - Image processing - methods - Neural-networks - Sample preparation","461.4 Ergonomics and Human Factors Engineering","",,"Number: -, Acronym: CZI, Sponsor: Chan Zuckerberg Initiative; Number: 1226728, Acronym: Conahcyt, Sponsor: Consejo Nacional de Humanidades, Ciencias y Tecnolog&iacute;as; Number: -, Acronym: Conahcyt, Sponsor: Consejo Nacional de Humanidades, Ciencias y Tecnolog&iacute;as; Number: IT101624,IN108624,2020-225643, Acronym: UNAM, Sponsor: Universidad Nacional Aut&oacute;noma de M&eacute;xico; Number: -, Acronym: UNAM, Sponsor: Universidad Nacional Aut&oacute;noma de M&eacute;xico; ","CONAHCYT for the received fellowship 1226728 to study the masters on Pogrado en Ciencias e Ingenier\u00EDa de la Computaci\u00F3n, Universidad Nacional Aut\u00F3noma de M\u00E9xico (UNAM). UNAM PAPIIT grants IT101624 and IN108624. Grant number 2020-225643 from the Chan Zuckerberg Initiative DAF.",,"Compendex","Compilation and indexing terms, Copyright 2026 Elsevier Inc.","Engineering Village"
