Title,Author,Author affiliation,Source,Sponsor,Publisher/Repository,Volume and Issue,Pages,Issue date,Monograph title,Publication year,ISSN,E-ISSN,ISBN13,DOI,Article number,Conference name,Conference date,Conference location,Abstract,Number of references,Main Heading,Controlled/Subject terms,Uncontrolled terms,Classification code,IPC code,Treatment,Funding details,Funding text,Open Access type(s),Database,Copyright,Data Provider
"Investigating the relationship between acoustic sound and wood anatomy by coupling computed tomography and ultrasonic wave propagation","Espinoza-Herrera, R. (1); Olmos, L. (2); Arreola-Garcia, E. (1); Carrillo-Gomez, M.I. (3); Murillo-Sanchez, I.E. (4); Arteaga, D. (5) ","(1) Universidad Michoacana de San Nicolas de Hidalgo, Facultad de Ingenieria en Tecnologia de la Madera, Michoacan, Mexico (2) Universidad Michoacana de San Nicolas de Hidalgo, INICIT, Michoacan, Mexico (3) Universidad Michoacana de San Nicolas de Hidalgo, Facultad de Arquitectura, Michoacan, Mexico (4) Instituto Nacional de Bellas Artes y Literatura, Escuela de Lauderia, Mexico (5) Universidad Nacional Autonoma de Mexico, Centro de Geociencias, Mexico ","MRS Advances","","Springer Nature, Germany","v 10, n 5","683-7","May 2025","","","2059-8521","","","10.1557/s43580-025-01216-9","","","","","Picea abies is the most commonly used wood species for making soundboards for high-quality stringed musical instruments. This work performs for the first time an analysis of the propagation velocity of ultrasonic waves by coupling experimental measurements with numerical flow simulations on the 3D real microstructure of Picea abies wood. X-ray microtomography allows to determine a 3D anatomical characteristics as well as to simulate fluid through the anatomical structure of Picea abies wood in its three main directions: longitudinal, tangential, and radial. Results showed that ultrasonic wave's propagation is anisotropic in the three main directions because the anatomical characteristics of woody tissue strongly influences their path. Longitudinal direction had the highest velocity values, then tangential direction and finally the lowest propagation was in the Radial one. These differences agreed with the flow numerical simulations, generated from the data provided by computed tomography.","22",,"computerised tomography - flow simulation - medical image processing - musical acoustics - musical instruments - numerical analysis - ultrasonic propagation - ultrasonic waves - wood","acoustic sound - anatomical characteristics - anatomical structure - commonly used wood species - computed tomography - flow numerical simulations - high-quality stringed musical instruments - longitudinal direction - lowest propagation - numerical flow simulations - Picea abies wood - propagation velocity - simulate fluid - tangential direction - ultrasonic wave propagation - ultrasonic waves - wood anatomy","A0260 Numerical approximation and analysis - E3614 Wood processing industry - A4375 Music and musical instruments - A4710 General fluid dynamics theory, simulation and other computational methods - C7330 Biology and medical computing - A8770E Patient diagnostic methods and instrumentation","B27 - G10 - G16B - G01N33/48","Theoretical or Mathematical (THR)",,,,"Inspec","Copyright 2025, The Institution of Engineering and Technology","Engineering Village"
"Minimal FCN for image segmentation","Ramos, R. (1); Olveres, J. (1); Escalante-Ramírez, B. (1) ","(1) UNAM, Facultad de Ingenierıa, Mexico ","Proceedings of SPIE","","SPIE, USA","v 12998","1299808 (12 pp.)","2024","","","1996-756X","","","10.1117/12.3022259","","Optics, Photonics, and Digital Technologies for Imaging Applications VIII","2024","Strasbourg, France","Research on interpretable CNN classifiers, involves comparing semantic segmentation masks with heat maps designed as visual explanations. A robust explanation accurately identifies or approximates the segmentation of an object. Our focus is on CNN classifiers with enhanced explainability, particularly in the middle layers. To explore this, we propose testing an encoder, trimmed to a medium layer, within a Fully Convolutional Network (FCN). Semantic segmentation is a pivotal task in computer vision preceding object recognition, and demands efficiency to optimize performance, energy consumption, and hardware costs. While various lightweight FCN proposals exist for distinct semantic segmentation tasks, their designs often introduce additional complexity compared to the more basic FCN design we advocate. Our goal is to see how well a minimal FCN works in a simple semantic segmentation task using medical images and how its accuracy changes when the training dataset is shrunk. The study involves characterizing and comparing our minimal FCN against other lightweight deep segmentation models and analyzing accuracy curves concerning the quantity of training data. Utilizing chest CT imaging, we focus on segmenting the lungs. We highlight the importance of data consumption and model size as decisive factors in selecting an architecture, especially when differences in predictive accuracy are marginal. Characterizing deep architectures based on their data requirements, allows for a thorough comparison fostering a deeper understanding of their suitability for specific applications.","11",,"computer vision - computerised tomography - convolutional neural nets - deep learning (artificial intelligence) - feature extraction - image classification - image segmentation - lung - medical image processing - object recognition","accuracy changes - analyzing accuracy curves - basic FCN design - computer vision - data consumption - demands efficiency - distinct semantic segmentation tasks - energy consumption - enhanced explainability - Fully Convolutional Network - hardware costs - heat maps - image segmentation - interpretable CNN classifiers - lightweight deep segmentation models - lightweight FCN proposals - medical images - medium layer - middle layers - minimal FCN works - object recognition - pivotal task - robust explanation - semantic segmentation masks - simple semantic segmentation task - training data - utilizing chest CT imaging - visual explanations","C5260B Computer vision and image processing techniques - B6135E Image recognition - B6135 Optical, image and video signal processing - C6264 Neural nets - C7330 Biology and medical computing - B7510P X-ray techniques: radiography and computed tomography (biomedical imaging/measurement) - A8760J X-rays and particle beams (medical uses) - A8770E Patient diagnostic methods and instrumentation","G06N3/02 - G16B - G06T - G01N33/48 - G06N20/00 - A61B6/03","Practical (PRA)",,,,"Inspec","Copyright 2024, The Institution of Engineering and Technology","Engineering Village"
"Comparative analysis of surface coil performance for metamaterial-enhanced traveling-wave magnetic resonance imaging at 7 T","Solís-Nájera, S.E. (1); Rivera, S. (1); Vazquez, F. (1); Lazovic, J. (2); Ruiz, R. (3); Rodriguez, A.O. (4) ","(1) Universidad Nacional Autonoma de Mexico, Departamento de Fisica, Mexico (2) Max Planck Institute for Intelligent Systems, Department of Physical Intelligence, Germany (3) Universidad Nacional Autonoma de Mexico, Mexico (4) Universidad Autonoma Metropolitana - Iztapalapa, Department of Electrical Engineering, Mexico ","AIP Conference Proceedings","","AIP Publishing, USA","v 3391, n 1","040013 (4 pp.)","22 Dec 2025","","","1551-7616","","","10.1063/5.0309623","","EIGHTEENTH MEXICAN SYMPOSIUM ON MEDICAL PHYSICS","2024","Guanajuato, Mexico","Traveling-wave Magnetic Resonance Imaging (tw-MRI) utilizing a parallel-plate waveguide presents a compelling alternative for obtaining images at ultrahigh fields without encountering resonant frequency restrictions. In this approach, both the transmission and reception of the radiofrequency signal are typically facilitated by a surface coil in conjunction with a parallel-plate waveguide. The waveguide is loaded with a saline solution and a metamaterial, strategically incorporated to enhance overall image quality. In our experimental investigation, we conducted a comparative analysis of two surface coils: a bio-inspired coil and a standard circular coil. Phantom images were acquired using both surface coils, with the metamaterial inserted into the waveguide and filled with a saline solution. To assess performance, we measured the image signal-to-noise ratio, and uniformity profiles were computed. The results unequivocally demonstrated that the bio-inspired coil outperformed the conventional circular coil in terms of both image quality and uniformity. [The copyright for the referenced work is owned by Author(s). Copies of full-text articles should only be made or obtained from the publisher or authorized sources.]","5",,"biomedical MRI - coils - magnetic resonance imaging - medical image processing - microwave metamaterials - phantoms","bio-inspired coil - comparative analysis - conventional circular coil - image quality - image signal-to-noise ratio - metamaterial-enhanced traveling-wave magnetic resonance imaging - parallel-plate waveguide - phantom images - resonant frequency restrictions - saline solution - standard circular coil - surface coil performance","B1305M Metamaterials and structures (microwave) - B1310 Waveguides and microwave transmission lines - C5260B Computer vision and image processing techniques - B6135 Optical, image and video signal processing - C7330 Biology and medical computing - B7510N Biomedical magnetic resonance imaging and spectroscopy - A8740 Biomagnetism - A8760I Medical magnetic resonance imaging and spectroscopy - A8770E Patient diagnostic methods and instrumentation","G06T - H01P3/00 - G01N33/48 - G16B - H01F5/00 - H01F27/28 - A61B5/055","Practical (PRA); Theoretical or Mathematical (THR); Experimental (EXP)",,,,"Inspec","Copyright 2026, The Institution of Engineering and Technology","Engineering Village"
"Venous Air Embolism: Case Series of a Complication of Computed Tomography Pulmonary Angiography (CTPA) in the Emergency Department of Medicine","Cueto-Robledo, Guillermo (1, 2, 3); Gonzalez-Hermosillo, Leslie-Marisol (4); Palacios-Moguel, Paul (2); Roldan-Valadez, Ernesto (5, 6) ","(1) Cardiorespiratory Emergencies, General Hospital of Mexico 'Dr Eduardo Liceaga', Mexico City; 06720, Mexico (2) Pulmonary Circulation Clinic, General Hospital of Mexico 'Dr. Eduardo Liceaga', Mexico City; 06720, Mexico (3) Faculty of Medicine, National Autonomous University of Mexico, Mexico City, Mexico (4) National Autonomous University of Mexico, Mexico City; 04510, Mexico (5) Directorate of Research, General Hospital of Mexico 'Dr. Eduardo Liceaga,', Mexico City; 06720, Mexico (6) I.M. Sechenov First Moscow State Medical University (Sechenov University), Department of Radiology, Moscow; 119992, Russia ","Current Medical Imaging","","Bentham Science Publishers","v 20","","2024","","2024","15734056","18756603","","10.2174/1573405620666230825113429","e250823220365","","","","Introduction: Venous air embolism (VAE) consists of air entering vascular structures due to a pressure gradient generated during medical-surgical procedures. Most cases of VAE are iatrogenic. Case Reports: Three hospitalised patients aged 23 to 86 years underwent venous air embolism (VAE) in the right heart system after performing CTPA. One of the patients died from a complication of venous thromboembolic disease (PE, coronary sinus thrombosis, mesenteric venous thrombosis). Conclusion: CTPA is a procedure that a priori seems innocuous, but it can be a potential cause of death or serious consequences for patients undergoing radiological procedures where the administration of contrast and the use of an injector could be counterproductive. Radiologists and physicians responsible for the patient should be aware of vascular gas embolism after contrast injection in patients undergoing CTPA. © 2024 The Author(s).","22","Angiography","Computerized tomography - Diseases","Air embolisms - Computed tomography - Emergency departments - HRCT - Pulmonary angiography - Right heart - Surgical procedures - Vascular structures - Venoi air embolism - Venoi thromboembolic disease","461.6 Medicine and Pharmacology - 723.5 Computer Applications - 746 Imaging Techniques","",,"Number: -, Acronym: CONACYT, Sponsor: Consejo Nacional de Ciencia y Tecnolog&iacute;a; Number: 1272497, Acronym: UNAM, Sponsor: Universidad Nacional Aut&oacute;noma de M&eacute;xico; Number: -, Acronym: UNAM, Sponsor: Universidad Nacional Aut&oacute;noma de M&eacute;xico; ","Leslie-Marisol Gonzalez-Hermosillo is a doctoral student from the Programa de Doctorado en Ciencias Biomédicas, Universidad Nacional Autónoma de México (UNAM) and has received a fellowship (1272497) from CONACYT, México.","All Open Access, Hybrid Gold","Compendex","Compilation and indexing terms, Copyright 2026 Elsevier Inc.","Engineering Village"
"Generating a database for deep learning-based applications in multimodal tomography of the human brain","Osorio-Durán, R. (1, 2); Adame-Ocampo, G.A. (2); Martínez-Gudiño, M.D.L. (2); Rodríguez-Villafuerte, M. (1); Moncada-Gutiérrez, F. (1); Martínez-Dávalos, A. (1) ","(1) Universidad Nacional Autonoma de Mexico, Physica Institute, Mexico (2) National Institute of Phsychiatry 'Ramón de la Fuente Muñiz', Mexico ","AIP Conference Proceedings","","AIP Publishing, USA","v 3391, n 1","040018 (6 pp.)","22 Dec 2025","","","1551-7616","","","10.1063/5.0308438","","EIGHTEENTH MEXICAN SYMPOSIUM ON MEDICAL PHYSICS","2024","Guanajuato, Mexico","We present a preliminary database of human brain studies of 25 adult subjects (age range 18 to 72 years, 8 men and 17 women). The images were obtained at Instituto Nacional de Psiquiatría 'Ramón de la Fuente Muñiz' (INPRFM). All subjects underwent brain perfusion imaging using Tc99m-ECD, an X-ray CT scan, and magnetic resonance imaging at T1-weighted, T2-weighted, and FLAIR. The images were passed through visual inspection of expert nuclear medicine radiologists. The specific acquisition parameters and the image processing chain, which included anonymization, removal of the table in CT images, co-registration, and spatial and intensity normalization, are described. The database was compiled in two different formats: DICOM for unprocessed data, and NIfTI for co-registered multimodal images. Results on the application of neural networks in the process of generating attenuation-corrected SPECT images, and synthetic CT images generated from T1 MRI images are presented. Permission was obtained from the INPRFM Ethics Committee to use the images in the database. [The copyright for the referenced work is owned by Author(s). Copies of full-text articles should only be made or obtained from the publisher or authorized sources.]","11",,"biomedical MRI - brain - deep learning (artificial intelligence) - image reconstruction - image segmentation - medical image processing - single photon emission computed tomography - technetium","acquisition parameters - age 18.0 year to 72.0 year - attenuation-corrected SPECT images - brain perfusion imaging - co-registered multimodal images - deep learning-based applications - DICOM - expert nuclear medicine radiologists - FLAIR - human brain studies - image processing chain - INPRFM ethics committee - intensity normalization - magnetic resonance imaging - multimodal tomography - neural networks - NIfTI - synthetic CT images - T1 MRI images - T2-weighted - Tc99m-ECD - visual inspection - X-ray CT scan","C1250M Image recognition - A2980F Programming for nuclear information processing - C5260B Computer vision and image processing techniques - B6135 Optical, image and video signal processing - C6160 Database management systems (DBMS) - C6264 Neural nets - C7330 Biology and medical computing - B7510R Nuclear medicine, emission tomography - B7510P X-ray techniques: radiography and computed tomography (biomedical imaging/measurement) - B7510N Biomedical magnetic resonance imaging and spectroscopy - A8730 Biophysics of neurophysiological processes - A8760J X-rays and particle beams (medical uses) - A8760I Medical magnetic resonance imaging and spectroscopy - A8760K Nuclear medicine, emission tomography - A8770E Patient diagnostic methods and instrumentation","G06F16/00 - G01T - G01T1/164 - G06T - G16B - G01N33/48 - G06N3/02 - A61B5/055 - G06N20/00","Practical (PRA); Experimental (EXP)",,,,"Inspec","Copyright 2026, The Institution of Engineering and Technology","Engineering Village"
"Federated Learning for Enhanced Medical Image Analysis","Lakrouni, S. (1); Bah, S. (1); Sebgui, M. (1) ","(1) University Mohammed V in Rabat, Smart Communication Research Team Mohamedia School of Engineers, Morocco ","Networked Systems: 12th International Conference, NETYS 2024, Proceedings. Lecture Notes in Computer Science (14783)","","Springer Nature, Berlin, Germany","","157-70","2024","","","","","978-3-031-67321-4","10.1007/978-3-031-67321-4_10","","International Conference on Networked Systems","2024","Rabat, Morocco","As artificial intelligence (AI) algorithms continue to advance, researchers have leveraged deep neural networks to address a range of challenges in the medical field. These models require a large-scale dataset and high-quality annotated data for model generalization, which is a major challenge in imaging data due to their limited availability in healthcare institutions. Additionally, it is primarily challenging to work with private patient data and share it with an external entity due to the privacy concerns. These challenges of the traditional centralized learning have led to a more efficient decentralized approach. This approach involves training with a diverse range of data from various domains, which are required to enhance model performance. Hence, many researchers have adopted Federated learning as an emerging paradigm to collaboratively train a machine learning model among multiple healthcare institutions without sharing their local private data. However, medical datasets are sourced from different medical institutions; hence they are often acquired by different protocols, scanner types, data modalities, and from different patient populations. Thus, it is inherently heterogeneous which degrades the global model performance in the federated setting. In this paper, we explore the key motivation for using federated learning in the healthcare field and discuss the challenges posed by the diversity and data heterogeneity of medical data from various institutions. Additionally, we present recent works that help mitigate the non-iid data issue in federated learning. Furthermore, we empirically evaluate the federated learning algorithms alongside centralized learning and one site learning using a benchmark medical dataset. Our analysis demonstrates that the adoption of advanced methods in FL enables us to effectively mitigate the data heterogeneity issue while leveraging data privacy and large-scale datasets within the medical domain.","26",,"data privacy - deep learning (artificial intelligence) - health care - medical image processing - medical information systems","artificial intelligence algorithms - benchmark medical dataset - data heterogeneity issue - data issue - data modalities - deep neural networks - different medical institutions - different patient populations - enhanced medical image analysis - federated learning - federated learning algorithms - federated setting - healthcare field - large-scale datasets - leveraging data privacy - local private data - machine learning model - medical data - medical datasets - medical domain - medical field - model generalization - multiple healthcare institutions - private patient data - traditional centralized learning","C5260B Computer vision and image processing techniques - C6130S Data security - B6135 Optical, image and video signal processing - C6260 Machine learning (artificial intelligence) - C6264 Neural nets - C7140 Medical administration - C7330 Biology and medical computing - B7510 Biomedical measurement and imaging - A8760 Medical and biomedical uses of fields, radiations, and radioactivity; health physics - A8770E Patient diagnostic methods and instrumentation","G01N33/48 - G06T - G06F21/00 - G06N20/00 - G06N3/02 - G06Q50/22 - G16H10/60 - G16B","Practical (PRA)",,,,"Inspec","Copyright 2025, The Institution of Engineering and Technology","Engineering Village"
"Intelligent MRI diagnosis of neurological alterations in infants from 4 to 12 months","Calderon-Uribe, S. (1); Morales-Hernandez, L.A. (1); De Leo-Jimenez, J.O. (2); Resendiz-Ochoa, E. (1); Toledano-Ayala, M. (3); Cruz-Albarran, I.A. (1) ","(1) Autonomous University of Queretaro, Laboratory of Artificial Vision and Thermography, Mexico (2) National Autonomous University of Mexico, Neurodevelopment Research Unit of the Institute of Neurobiology, Mexico (3) Autonomous University of Queretaro, Research and Postgraduate Division, Mexico ","International Journal of Imaging Systems and Technology","","Wiley, USA","v 34, n 3","e23074 (17 pp.)","2024","","","1098-1098","","","10.1002/ima.23074","","","","","Magnetic resonance imaging is an essential tool for the identification of neurological problems since it provides relevant information on brain development. The aim of the present work was the detection of neurological alterations in newborns from 4 to 12 months of age by segmentation and analysis of lateral ventricles in magnetic resonance images. For this purpose, an automated deep approach based on U-net is proposed to segment the cerebral ventricles of the newborn. Subsequently, for these regions, features were extracted based on the patient's clinical history and on the shape (area, roundness, normalized central moment, among others) and pixel intensity (mean gray value, contrast level, among others). Once the features were extracted, different types of intelligent models (Logistic Regression, k-Nearest Neighbors (kNN), and a Convolutional Neural Network) were assessed to detect the presence of neurological alterations. The segmentation phase of the system was tested on 50 patients and the classification phase on 28 patients (11 healthy, 17 with neurological changes). The results show a DICE similarity coefficient of 0.89 and a volume ratio of 1.05 for the segmentation stage and an accuracy of 98%, precision of 100%, sensitivity of 92%, and specificity of 100% for the classification stage using kNN. The last one proved to be the most computationally feasible model, due to the time required for training and inference (0.36 s and 35.2e-4 s, respectively), as well as the consumption of computational resources (0.1 GB RAM CPU). In conclusion, it is possible to detect neurological alterations in newborns aged 4 to 12 months by segmenting and classifying the lateral ventricles in magnetic resonance images, using image processing techniques, the U-net, as well as the kNN algorithm. This proposed methodology could play an important role in the early diagnosis and treatment of neurological disorders. © 2024 Wiley Periodicals, LLC.","75",,"biomedical MRI - brain - convolutional neural nets - feature extraction - image segmentation - logistic regression - medical disorders - medical image processing - neurophysiology","intelligent MRI diagnosis - lateral ventricles - magnetic resonance images - magnetic resonance imaging - neurological alterations - neurological disorders - neurological problems - newborns - segmentation phase - segmentation stage","B0240V Regression analysis - C1140V Regression analysis - C5260B Computer vision and image processing techniques - B6135E Image recognition - C6264 Neural nets - C7330 Biology and medical computing - B7510N Biomedical magnetic resonance imaging and spectroscopy - A8730 Biophysics of neurophysiological processes - A8760I Medical magnetic resonance imaging and spectroscopy - A8770E Patient diagnostic methods and instrumentation","G01N33/48 - G06T - G06N3/02 - G16B - A61B5/055","Practical (PRA); Theoretical or Mathematical (THR)",,,,"Inspec","Copyright 2024, The Institution of Engineering and Technology","Engineering Village"
