"Authors","Author full names","Author(s) ID","Title","Year","Source title","Volume","Issue","Art. No.","Page start","Page end","Cited by","DOI","Link","Affiliations","Authors with affiliations","Abstract","Author Keywords","Index Keywords","ISSN","ISBN","CODEN","Document Type","Publication Stage","Open Access","Source","EID"
"Aguilar-Rodríguez J.A.; Rivera-García P.; Cervantes-Sandoval A.; Perales-Avila A.J.","Aguilar-Rodríguez, Jesús Alexis (59918330200); Rivera-García, Patricia (58992788900); Cervantes-Sandoval, Armando (6504321040); Perales-Avila, Alejandro Josué (59917607400)","59918330200; 58992788900; 6504321040; 59917607400","Artificial intelligence as a resource for teaching mathematics. Integral calculus as a specific case; [Inteligencia artificial como recurso para la enseñanza de las matemáticas. El cálculo integral como caso específico]","2024","LatIA","2","","96","","","1","10.62486/latia202496","https://www.scopus.com/pages/publications/105006821714?origin=resultslist","Facultad de Estudios Superiores Zaragoza, Laboratorio de Aplicaciones Computacionales, Universidad Nacional Autónoma de México (UNAM), Mexico","Aguilar-Rodríguez J.A., Facultad de Estudios Superiores Zaragoza, Laboratorio de Aplicaciones Computacionales, Universidad Nacional Autónoma de México (UNAM), Mexico; Rivera-García P., Facultad de Estudios Superiores Zaragoza, Laboratorio de Aplicaciones Computacionales, Universidad Nacional Autónoma de México (UNAM), Mexico; Cervantes-Sandoval A., Facultad de Estudios Superiores Zaragoza, Laboratorio de Aplicaciones Computacionales, Universidad Nacional Autónoma de México (UNAM), Mexico; Perales-Avila A.J., Facultad de Estudios Superiores Zaragoza, Laboratorio de Aplicaciones Computacionales, Universidad Nacional Autónoma de México (UNAM), Mexico","The use of artificial intelligence, AI, has increased in recent years, offering tools to generate content and solve problems in different areas of knowledge. Questioning their relevance in areas such as integral calculus, 11 AI tools were tested to solve from basic to advanced integrals, described in different ways such as natural language or images. The results were compared with the solutions given in the literature, analyzing precision, number of steps, clarity of explanations and ease of use. Finding that the Chat GPT-Wolfram Alpha partnership stood out for its ability to identify appropriate integration techniques and offer detailed and understandable explanations; While Copilot is more complex to understand if you do not use the LaTeX language, the rest present some problems when interpreting instructions and images. Although these tools are not designed to solve mathematical problems, they proved to be effective in most cases, promoting an interactive space to clarify doubts in real time and generate debate; however, their effectiveness depends on the use given to them, since either as support in the classroom to deepen the analysis of the problem or simply use it as a black box to obtain quick answers. © 2024; Los autores.","Artificial Intelligence; Comparison; Integral Calculus; Tools","","3046403X","","","Article","Final","All Open Access; Gold Open Access; Green Open Access","Scopus","2-s2.0-105006821714"
"Azuara-Dominguez R.O.; Olveres J.; Escalante-Ramirez B.; Vallejo E.","Azuara-Dominguez, Ruben Omar (59996314200); Olveres, Jimena (35797425500); Escalante-Ramirez, Boris (6701369474); Vallejo, Enrique (55993766000)","59996314200; 35797425500; 6701369474; 55993766000","Deep Learning Approach for Aortic Valve Localization, Detection and Segmentation in Computed Tomography Volumes","2025","Proceedings - IEEE Symposium on Computer-Based Medical Systems","","","","280","283","0","10.1109/CBMS65348.2025.00063","https://www.scopus.com/pages/publications/105010579214?origin=resultslist","Universidad Nacional Autónoma de México, Posgrado de Ingeniería Eléctrica, Mexico City, Mexico; Universidad Nacional Autónoma de México, Facultad de Ingeniería, Mexico City, Mexico; Centro Médico ABC, Mexico city, Mexico","Azuara-Dominguez R.O., Universidad Nacional Autónoma de México, Posgrado de Ingeniería Eléctrica, Mexico City, Mexico; Olveres J., Universidad Nacional Autónoma de México, Facultad de Ingeniería, Mexico City, Mexico; Escalante-Ramirez B., Universidad Nacional Autónoma de México, Facultad de Ingeniería, Mexico City, Mexico; Vallejo E., Centro Médico ABC, Mexico city, Mexico","Standard view cardiac computed tomography (CT) images are of great importance in clinical practice due to the valuable diagnostic information they provide. However, navigating these (3D) medical images to identify such a view can represent a time-consuming process, subject to inter-operator variability. This study presents an approach using a Multiscale Vision Transformer (MViT) to infer the rotation parameters required to obtain standard views and subsequently focus on extracting the left ventricular outflow tract (LVOT) view. Once this view is obtained, the aortic valve is detected and segmented using well-known convolutional neural networks (CNNs), specifically ResNet18 for detection and U-Net for segmentation. The methodology used for its training is detailed, along with the metrics employed to evaluate their performance. Finally, the results obtained for each stage are presented. This approach provides a clear understanding of the performance of each model, from rotation parameter prediction to aortic valve detection and segmentation. © 2025 IEEE.","3D volume Cardiac CT; Attention; Deep Learning; Regression; Rotation matrix; Segmentation","Blood vessels; Computerized tomography; Convolutional neural networks; Diagnosis; Medical image processing; 3d volume cardiac computed tomography; Aortic valves; Attention; Cardiac-computed tomography; Deep learning; Performance; Regression; Rotation parameters; Rotations matrix; Segmentation; Deep learning; Image segmentation","10637125","979-833152610-8","","Conference paper","Final","","Scopus","2-s2.0-105010579214"
"Valdez-Valenzuela A.; Gómez-Adorno H.","Valdez-Valenzuela, Andric (58679842400); Gómez-Adorno, Helena (55641734200)","58679842400; 55641734200","Team iimasnlp at PAN: Leveraging Graph Neural Networks and Large Language Models for Generative AI Authorship Verification","2024","CEUR Workshop Proceedings","3740","","","2923","2929","1","","https://www.scopus.com/pages/publications/85201621906?origin=resultslist","Posgrado en Ciencia e Ingeniería de la Computación, Universidad Nacional Autónoma de México, CDMX, Mexico","Valdez-Valenzuela A., Posgrado en Ciencia e Ingeniería de la Computación, Universidad Nacional Autónoma de México, CDMX, Mexico; Gómez-Adorno H., Posgrado en Ciencia e Ingeniería de la Computación, Universidad Nacional Autónoma de México, CDMX, Mexico","Large language models (LLMs) have led to a surge in machine-generated content across various platforms, posing a challenge for humans to distinguish between machine-generated and human-written text. To address this, there is an urgent need for automated systems that can identify machine-generated content and mitigate related risks. In response, the PAN@CLEF, in collaboration with the Voight-Kampff Task (ELOQUENT Lab) [1][2][3], proposed the Generative AI Authorship Verification task. This study presents a novel model architecture integrating Graph Neural Networks (GNNs), pre-trained Language Models (LLMs), and stylometric features to classify text documents as human-generated or machine-generated. Our approach employs a two-path structure: the first path processes text documents through data augmentation, transforming them into co-occurrence graphs for GNN processing, while the second path extracts and fine-tunes embeddings using a BERT-BASE model along with stylometric features. These embeddings are combined to enhance classification accuracy and robustness. We also detail our data stratification strategy, which involves augmenting human-generated texts to balance the dataset. The effectiveness of our model is demonstrated through extensive evaluation metrics, achieving superior performance over baseline methods. © 2024 Copyright for this paper by its authors.","Generative AI; Graph Neural Networks; Large Language Models; Text Graph Representation; Text2graphAPI","Generative adversarial networks; Graph embeddings; Neural network models; Authorship verification; Generative AI; Graph neural networks; Graph representation; Language model; Large language model; Stylometric features; Text document; Text graph representation; Text2graphapi; Graph neural networks","16130073","","","Conference paper","Final","","Scopus","2-s2.0-85201621906"
"Sánchez-Montero A.; Bel-Enguix G.; Ojeda-Trueba S.-L.","Sánchez-Montero, Alec (59700616900); Bel-Enguix, Gemma (56635745900); Ojeda-Trueba, Sergio-Luis (57223270174)","59700616900; 56635745900; 57223270174","Evaluating the Development of Linguistic Metaphor Annotation in Mexican Spanish Popular Science Tweets","2024","FigLang 2024 - 4th Workshop on Figurative Language Processing, Proceedings of the Workshop","","","","59","64","1","","https://www.scopus.com/pages/publications/105000833875?origin=resultslist","Universidad Nacional Autónoma de México, Mexico","Sánchez-Montero A., Universidad Nacional Autónoma de México, Mexico; Bel-Enguix G., Universidad Nacional Autónoma de México, Mexico; Ojeda-Trueba S.-L., Universidad Nacional Autónoma de México, Mexico","Following previous work on metaphor annotation and automatic metaphor processing, this study presents the evaluation of an initial phase in the novel area of linguistic metaphor detection in Mexican Spanish popular science tweets. Specifically, we examine the challenges posed by the annotation process stemming from disagreement among annotators. During this phase of our work, we conducted the annotation of a corpus comprising 3733 Mexican Spanish popular science tweets. This corpus was divided into two halves and each half was then assigned to two different pairs of native Mexican Spanish-speaking annotators. Despite rigorous methodology and continuous training, inter-annotator agreement as measured by Cohen’s kappa was found to be low, slightly above chance levels, although the concordance percentage exceeded 60%. By elucidating the inherent complexity of metaphor annotation tasks, our evaluation emphasizes the implications of these findings and offers insights for future research in this field, with the aim of creating a robust dataset for machine learning in the future. © 2024 Association for Computational Linguistics.","","Inherent complexity; Initial phasis; Machine-learning; Processes stemming; Rigorous methodologies; Computational linguistics","","979-889176110-0","","Conference paper","Final","","Scopus","2-s2.0-105000833875"
"Arauco Ballesteros M.A.; Martínez Miranda E.A.","Arauco Ballesteros, Mónica Andrea (59409201600); Martínez Miranda, Elio Agustín (53563969900)","59409201600; 53563969900","Stock Market Forecasting Using a Neural Network Through Fundamental Indicators, Technical Indicators and Market Sentiment Analysis","2025","Computational Economics","66","2","","1715","1745","12","10.1007/s10614-024-10711-4","https://www.scopus.com/pages/publications/85208965743?origin=resultslist","Department of Systems Engineering, Universidad Nacional Autónoma de México, Mexico City, Mexico","Arauco Ballesteros M.A., Department of Systems Engineering, Universidad Nacional Autónoma de México, Mexico City, Mexico; Martínez Miranda E.A., Department of Systems Engineering, Universidad Nacional Autónoma de México, Mexico City, Mexico","The objective of this research is to provide evidence that it is possible to obtain a prediction that better aligns with the future performance of a stock if a neural network model is trained with stock market analysis variables and qualitative variables. As a case study, thirty-three companies’ representative of the S&P 500 are selected, and a multilayer perceptron artificial neural network is built and trained with input parameter indicators of fundamental analysis, technical analysis, and market sentiment. By incorporating the latter as an additional variable, the model's accuracy increases by 1.5% for 66% of the companies analyzed. The results confirm the crucial role played by the selection of the neural network model and its variables depending on the type of company to be analyzed. The main contributions of this research are the identification of the best variables combination to train a neural network model depending on the market sector to be analyzed, likewise it is demonstrated that, by using market sentiment, it is possible obtain a high accuracy or increase the accuracy to an existing model. © The Author(s) 2024.","Artificial intelligence; Investment decisions; Market sentiment; Neural network; Portfolio management; Stock market","","09277099","","","Article","Final","All Open Access; Hybrid Gold Open Access","Scopus","2-s2.0-85208965743"
"Rodriguez-Tenorio J.C.; Borja V.; Ramírez-Reivich A.C.","Rodriguez-Tenorio, J. Carlos (57452661100); Borja, Vicente (57203684556); Ramírez-Reivich, Alejandro C. (56013842500)","57452661100; 57203684556; 56013842500","Data-Driven Decision-Making for Product Design: A Descriptive Feedback and Physiological Metadata Analysis","2024","EAI/Springer Innovations in Communication and Computing","","","","73","87","0","10.1007/978-3-031-67440-2_6","https://www.scopus.com/pages/publications/85208445986?origin=resultslist","Universidad Nacional Autónoma de México, Mexico City, Mexico","Rodriguez-Tenorio J.C., Universidad Nacional Autónoma de México, Mexico City, Mexico; Borja V., Universidad Nacional Autónoma de México, Mexico City, Mexico; Ramírez-Reivich A.C., Universidad Nacional Autónoma de México, Mexico City, Mexico","This chapter presents the results regarding the data analysis made for studying the user’s perception and experience when giving descriptive feedback within the product design process. It also includes metadata analysis regarding current trends and technology used for gathering body parameters such as temperature, heart rate, pH, sweat, and accelerations to quantify and compare user interactions during the development of a new product. The data analysis tools used were Pandas, Matplotlib, Numpy, spaCy, and the Natural Language Toolkit (NLTK) for sentiment analysis. For exploratory analysis, word clouds were created. A total of 536 sentences were analyzed, with an average length of 12 words per sentence. Among these, 52% of the total words were classified as verbs, nouns, adjectives, or adverbs, providing information regarding user experience, while the remaining words served to link sentences and give structure. The sentiment analysis showcased that 54.8% of the sentences provided a positive or negative connotation regarding the user’s experience. In comparison, 45.2% were neutral sentences, providing no information regarding the user’s perception. It is up to the design team to map and classify these comments into engineering requirements based on their experience. The metadata analysis showed the most studied physiological measurements for human activity recognition (HAR) and how the combination of these variables has been studied to quantify user feedback and improve the design process. Human data collection and study of two or more of these variables is helpful for providing designers with an additional tool for descriptive feedback that could improve decision-making. © The Author(s), under exclusive license to Springer Nature Switzerland AG 2024.","Data analysis; Descriptive feedback; Human activity recognition; Natural language; NLTK; Physiological variables; Product design","Data consistency; Decision making; Human engineering; Metadata; Physiological models; Data driven decision; Decisions makings; Descriptive feedback; Human activity recognition; Metadata analysis; Natural language toolkit; Natural languages; Physiological variable; Sentiment analysis; Design for manufacturability","25228595","978-303167439-6","","Conference paper","Final","","Scopus","2-s2.0-85208445986"
"Miranda L.A.H.; Vázquez-Osorio J.; Juárez-Pérez A.; Sierra G.; Bel-Enguix G.","Miranda, Luis A.H. (57932590400); Vázquez-Osorio, Jesús (59341971800); Juárez-Pérez, Adrián (60145813700); Sierra, Gerardo (57206286445); Bel-Enguix, Gemma (56635745900)","57932590400; 59341971800; 60145813700; 57206286445; 56635745900","GIL_UNAM_Iztacala at Touché: Benchmarking Classical Models for Multilingual Political Stance and Power Classification","2025","CEUR Workshop Proceedings","4038","","","4680","4691","2","","https://www.scopus.com/pages/publications/105019043059?origin=resultslist","Grupo de Ingeniería Lingüística - UNAM, Instituto de Ingeniería, Circuito Escolar -, Mexico City, 04510, Mexico; Universidad Nacional Autónoma de México, Facultad de Estudios Superiores Iztacala, Avenida de los Barrios 1,Estado de , México, 54090, Mexico; Posgrado en Ciencia e Ingeniería de la Computación - UNAM, Circuito Escolar, Mexico City, 04510, Mexico","Miranda L.A.H., Universidad Nacional Autónoma de México, Facultad de Estudios Superiores Iztacala, Avenida de los Barrios 1,Estado de , México, 54090, Mexico; Vázquez-Osorio J., Posgrado en Ciencia e Ingeniería de la Computación - UNAM, Circuito Escolar, Mexico City, 04510, Mexico; Juárez-Pérez A., Grupo de Ingeniería Lingüística - UNAM, Instituto de Ingeniería, Circuito Escolar -, Mexico City, 04510, Mexico; Sierra G., Grupo de Ingeniería Lingüística - UNAM, Instituto de Ingeniería, Circuito Escolar -, Mexico City, 04510, Mexico; Bel-Enguix G., Grupo de Ingeniería Lingüística - UNAM, Instituto de Ingeniería, Circuito Escolar -, Mexico City, 04510, Mexico","In this article, we present a methodology developed to address the challenges of the Touché shared task on Ideology and Power Identification in Parliamentary Debates, which consists of three sub-tasks: determining the ideological orientation of a speaker’s party, identifying whether the party is in government or opposition, and classifying the party’s stance on the populist–pluralist spectrum. To tackle these tasks, we implemented a comprehensive pipeline to train, evaluate, and compare several classical machine learning models, including Bernoulli Naive Bayes, Logistic Regression, Support Vector Machines, and Random Forest. Our results show strong and consistent performance in Sub-tasks 1 and 2 across multiple languages, with macro F1-scores indicating reliable generalization. However, Sub-task 3 presented greater challenges, with lower and more variable performance, suggesting the increased complexity involved in modeling populism in multilingual parliamentary discourse. © 2025 Copyright for this paper by its authors.","Machine learning; Multilingual text classification; Political discourse; Political NLP","Barium compounds; Decision trees; Learning systems; Logistic regression; Random forests; Support vector regression; Text processing; Classical modeling; Machine-learning; Multilingual text classification; Multilingual texts; Political discourse; Political NLP; Power; Spectra's; Subtask; Text classification; Classification (of information)","16130073","","","Conference paper","Final","","Scopus","2-s2.0-105019043059"
"Uhl J.-F.; Reyes P.; Quihuis C.; Belchior P.; Jorge J.","Uhl, Jean-François (35445977900); Reyes, Pablo (59899122500); Quihuis, Carlos (59898126700); Belchior, Pedro (57217201816); Jorge, Joaquim (22333907900)","35445977900; 59899122500; 59898126700; 57217201816; 22333907900","XR for educational anatomy: An Immersive human atlas with chatbot","2025","Proceedings - 2025 IEEE Conference on Virtual Reality and 3D User Interfaces Abstracts and Workshops, VRW 2025","","","","1016","1020","0","10.1109/VRW66409.2025.00205","https://www.scopus.com/pages/publications/105005141430?origin=resultslist","Paris Cité University, Unesco Digital Anatomy, 45 rue des Saints Pères, Paris, 75006, France; Universidad Nacional Autónoma de México, México City, Mexico; Instituto Tecnológico y de Estudios Superiores de Monterrey, Mexico City, Mexico; INESC-ID, Tagus Park, Porto Salvo, Portugal; Instituto Superior Técnico, Unesco Ai & Vr, Av Rovisco Pais, Lisboa, Portugal","Uhl J.-F., Paris Cité University, Unesco Digital Anatomy, 45 rue des Saints Pères, Paris, 75006, France; Reyes P., Universidad Nacional Autónoma de México, México City, Mexico; Quihuis C., Instituto Tecnológico y de Estudios Superiores de Monterrey, Mexico City, Mexico; Belchior P., INESC-ID, Tagus Park, Porto Salvo, Portugal; Jorge J., Instituto Superior Técnico, Unesco Ai & Vr, Av Rovisco Pais, Lisboa, Portugal","Immersive reality has emerged as a groundbreaking and promising approach for teaching anatomy, providing unique learning experiences while complementing traditional educational methods. Existing immersive software, such as Organon® and HoloLens®, offer valuable tools but remain limited in anatomical detail and interactivity. We present a novel educational approach: an immersive human atlas that integrates anatomical slices from the Visible Korean Human dataset (male and female) into a 3D environment. This platform enhances anatomical visualization and incorporates a Large Language Model (LLM) to support user interaction and understanding. By combining precise anatomical slices within the 3D model, the atlas provides an enriched and comprehensive learning experience for medical education.  © 2025 IEEE.","Anatomy Education; Cross Computing; Extended Reality; Immersive Environments; Large Language Models","3D modeling; Teaching; Anatomy educations; Chatbots; Cross computing; Extended reality; Immersive; Immersive environment; Interactivity; Language model; Large language model; Learning experiences; Medical education","","979-833151484-6","","Conference paper","Final","","Scopus","2-s2.0-105005141430"
"Gomez-Adorno H.; Bel-Enguix G.; Sierra G.; Barajas J.-C.; Álvarez W.","Gomez-Adorno, Helena (55641734200); Bel-Enguix, Gemma (56635745900); Sierra, Gerardo (57206286445); Barajas, Juan-Carlos (59189054700); Álvarez, William (57219779944)","55641734200; 56635745900; 57206286445; 59189054700; 57219779944","Machine Learning and Deep Learning Sentiment Analysis Models: Case Study on the SENT-COVID Corpus of Tweets in Mexican Spanish","2024","Informatics","11","2","24","","","7","10.3390/informatics11020024","https://www.scopus.com/pages/publications/85196891584?origin=resultslist","Instituto de Investigaciones en Matemáticas Aplicadas y en Sistemas, Universidad Nacional Autónoma de México, Mexico City, 04510, Mexico; Instituto de Ingeniería, Universidad Nacional Autónoma de México, Mexico City, 04510, Mexico; Facultad de Ciencias, Universidad Nacional Autónoma de México, Mexico City, 04510, Mexico","Gomez-Adorno H., Instituto de Investigaciones en Matemáticas Aplicadas y en Sistemas, Universidad Nacional Autónoma de México, Mexico City, 04510, Mexico; Bel-Enguix G., Instituto de Ingeniería, Universidad Nacional Autónoma de México, Mexico City, 04510, Mexico; Sierra G., Instituto de Ingeniería, Universidad Nacional Autónoma de México, Mexico City, 04510, Mexico; Barajas J.-C., Facultad de Ciencias, Universidad Nacional Autónoma de México, Mexico City, 04510, Mexico; Álvarez W., Instituto de Investigaciones en Matemáticas Aplicadas y en Sistemas, Universidad Nacional Autónoma de México, Mexico City, 04510, Mexico","This article presents a comprehensive evaluation of traditional machine learning and deep learning models in analyzing sentiment trends within the SENT-COVID Twitter corpus, curated during the COVID-19 pandemic. The corpus, filtered by COVID-19 related keywords and manually annotated for polarity, is a pivotal resource for conducting sentiment analysis experiments. Our study investigates various approaches, including classic vector-based systems such as word2vec, doc2vec, and diverse phrase modeling techniques, alongside Spanish pre-trained BERT models. We assess the performance of readily available sentiment analysis libraries for Python users, including TextBlob, VADER, and Pysentimiento. Additionally, we implement and evaluate traditional classification algorithms such as Logistic Regression, Naive Bayes, Support Vector Machines, and simple neural networks like Multilayer Perceptron. Throughout the research, we explore different dimensionality reduction techniques. This methodology enables a precise comparison among classification methods, with BETO-uncased achieving the highest accuracy of 0.73 on the test set. Our findings underscore the efficacy and applicability of traditional machine learning and deep learning models in analyzing sentiment trends within the context of low-resource Spanish language scenarios and emerging topics like COVID-19. © 2024 by the authors.","COVID-19; machine learning; sentiment analysis; social media; Spanish","","22279709","","","Article","Final","All Open Access; Gold Open Access","Scopus","2-s2.0-85196891584"
