"Authors","Author full names","Author(s) ID","Title","Year","Source title","Volume","Issue","Art. No.","Page start","Page end","Cited by","DOI","Link","Affiliations","Authors with affiliations","Abstract","Author Keywords","Index Keywords","ISSN","ISBN","CODEN","Document Type","Publication Stage","Open Access","Source","EID"
"Valdés-Souto F.; Gomar-Dawson R.H.; Méndez-Uzcátegui D.A.","Valdés-Souto, Francisco (57190186512); Gomar-Dawson, Rafael Harry (60035279000); Méndez-Uzcátegui, Diego Alejandro (60035740400)","57190186512; 60035279000; 60035740400","Comparative Analysis of Information Extraction Techniques in the Mexican Legal System","2025","Lecture Notes in Networks and Systems","1449 LNNS","","","179","188","0","10.1007/978-3-031-93103-1_18","https://www.scopus.com/pages/publications/105012925261?origin=resultslist","Universidad Nacional Autónoma de México, Facultad de Ciencias, Ciudad de México, 04510, Mexico; Instituto Tecnológico Autónomo de México, Río Hondo 1, Ciudad de México, 01080, Mexico","Valdés-Souto F., Universidad Nacional Autónoma de México, Facultad de Ciencias, Ciudad de México, 04510, Mexico; Gomar-Dawson R.H., Instituto Tecnológico Autónomo de México, Río Hondo 1, Ciudad de México, 01080, Mexico; Méndez-Uzcátegui D.A., Instituto Tecnológico Autónomo de México, Río Hondo 1, Ciudad de México, 01080, Mexico","In recent years, Natural Language Processing (NLP) has rapidly advanced, with sophisticated language models paving the way toward improved information extraction (IE) methods. Despite these advancements, the application of modern NLP techniques within the Mexican legal system (Spanish-Mexico) remains underexplored. This study investigates whether BERT-based models can effectively and dynamically extract legal references within this challenging framework. A comprehensive comparison was conducted between traditional methods—regular expressions and rule-based approaches—and contemporary transformer-based techniques. The experiments encompass four critical tasks: Article Segmentation, Law Reference Extraction, Article Mention Detection, and Entity Linking. Results indicate that while regular expressions and rule-based methods achieve high precision in structured texts, BERT-based NER models demonstrate superior adaptability and recall, particularly in handling unstructured and diverse legal documents. However, for tasks demanding stringent accuracy, such as Entity Linking, traditional rule-based approaches outperform Relation Extraction (RE) models due to their higher precision. This duality underscores the potential of integrating both traditional and modern NLP techniques to optimize legal text processing in Mexico. Our findings contribute to the expanding field of legal NLP by addressing unique challenges within the Mexican legal system and providing a foundational framework for future research efforts aimed at enhancing IE processes in complex legal environments. © The Author(s), under exclusive license to Springer Nature Switzerland AG 2025.","Information Extraction; Legal Text Processing; Named Entity Recognition; Natural Language Processing; Relation Extraction","Computational linguistics; Data mining; Information retrieval; Laws and legislation; Text processing; Information extraction; Language processing; Legal system; Legal text processing; Legal texts; Named entity recognition; Natural language processing; Natural languages; Relation extraction; Text-processing; Natural language processing systems","23673370","978-303193102-4","","Conference paper","Final","","Scopus","2-s2.0-105012925261"
"Urquiza-Yllescas J.F.; Mendoza S.; Sánchez-Adame L.M.; Rodríguez J.; Decouchant D.","Urquiza-Yllescas, José Fidel (57219960372); Mendoza, Sonia (13105758700); Sánchez-Adame, Luis Martín (57203842913); Rodríguez, José (14023450800); Decouchant, Dominique (6602352648)","57219960372; 13105758700; 57203842913; 14023450800; 6602352648","Educational Chatbots: A Systematic Mapping Study","2025","Journal of Intelligent and Fuzzy Systems","49","4","","960","990","0","10.1177/18758967251356870","https://www.scopus.com/pages/publications/105017150989?origin=resultslist","Computer Science Department, Cinvestav, Mexico City, Mexico; Design and Building Division, FES-Acatlán, UNAM, State of Mexico, Mexico; Information Technologies Department, UAM-Cuajimalpa, Mexico City, Mexico","Urquiza-Yllescas J.F., Computer Science Department, Cinvestav, Mexico City, Mexico; Mendoza S., Computer Science Department, Cinvestav, Mexico City, Mexico; Sánchez-Adame L.M., Design and Building Division, FES-Acatlán, UNAM, State of Mexico, Mexico; Rodríguez J., Computer Science Department, Cinvestav, Mexico City, Mexico; Decouchant D., Information Technologies Department, UAM-Cuajimalpa, Mexico City, Mexico","Chatbots, text or voice software entities, are consolidating their position in the education sector, as they have gone from being rustic tools to systems that can take an active role in the teaching and learning process. That is why we decide to elaborate a Systematic Mapping Study of works that have been published on educational chatbots in the last years. Our analysis has four objectives: 1) to know the purpose of chatbots; 2) to identify the educational levels in which the chatbots are employed; 3) to examine which interaction mechanisms are implemented by chatbots; and 4) to explore which technologies and software architectures predominate in the development of educational chatbots. Following solid methodologies for systematic reviews, we compiled 104 papers. Through the analysis of these works, we obtained an overview that can be useful for both specialists and newcomers to the domain, as it helps them understand the existing trends in these applications. Additionally, the discussion extends into the disruptive impact of generative AI and outlines critical open research questions that guide future investigations in educational chatbot development. © The Author(s) 2025","chatbot classification; educational chatbots; software architecture; systematic mapping study; teaching/learning process","Chatbots; Classification (of information); Educational robots; Learning systems; Mapping; Teaching; Chatbot classification; Chatbots; Education sectors; Educational chatbot; Software entities; Systematic mapping studies; Teaching and learning; Teaching process; Teaching-learning process; Software architecture","10641246","","","Article","Final","","Scopus","2-s2.0-105017150989"
"Urbina S.M.; Patiño A.M.; Archundia E.R.; Rodríguez E.A.; Marco Vinicio Chávez B.; María Del Carmen García R.; Javier A. Rodríguez H.","Urbina, Sergio Mier (59670222300); Patiño, Arturo Méndez (8571695400); Archundia, Enrique Reyes (36646633900); Rodríguez, Ernesto Aguilar (60526203300); Marco Vinicio Chávez, B. (59670222400); María Del Carmen García, R. (60526431400); Javier A. Rodríguez, H. (60525295700)","59670222300; 8571695400; 36646633900; 60526203300; 59670222400; 60526431400; 60525295700","Automatic Classification of Synthetic Jovian Radio Emissions Using Spectrogram Analysis and Machine Learning","2025","Proceedings of the 2025 IEEE International Autumn Meeting on Power, Electronics and Computing, ROPEC 2025","","","","","","0","10.1109/ROPEC68163.2025.11353979","https://www.scopus.com/pages/publications/105033694991?origin=resultslist","Tecnológico Nacional de México, Instituto Tecnólogico de Morelia, Depi, Morelia, Mexico; Universidad Nacional Autónoma de México, Instituto de Geofisica Unidad Morelia, Morelia, Mexico","Urbina S.M., Tecnológico Nacional de México, Instituto Tecnólogico de Morelia, Depi, Morelia, Mexico; Patiño A.M., Tecnológico Nacional de México, Instituto Tecnólogico de Morelia, Depi, Morelia, Mexico; Archundia E.R., Tecnológico Nacional de México, Instituto Tecnólogico de Morelia, Depi, Morelia, Mexico; Rodríguez E.A., Universidad Nacional Autónoma de México, Instituto de Geofisica Unidad Morelia, Morelia, Mexico; Marco Vinicio Chávez B., Tecnológico Nacional de México, Instituto Tecnólogico de Morelia, Depi, Morelia, Mexico; María Del Carmen García R., Tecnológico Nacional de México, Instituto Tecnólogico de Morelia, Depi, Morelia, Mexico; Javier A. Rodríguez H., Tecnológico Nacional de México, Instituto Tecnólogico de Morelia, Depi, Morelia, Mexico","This paper presents a machine learning approach for the automatic classification of synthetic Jovian radio emissions using spectrogram analysis. As a continuation of previous work involving the design of a dipole antenna and the development of a Python-based acquisition system centered at 20.1 MHz, this study focuses on generating a synthetic dataset that replicates the Io-A, Io-B and Io-C radio emissions of Jupiter. Each class was modeled using Python scripts that incorporated variability in position, intensity, shape and noise within the 16-24Mhz frequency range. Two classification models were trained and evaluated: a convolutional neural network (efficientNet-B0) and a vision transformer (ViT Tiny Patch16-224). Both models were tested using a 70/15/15 train-validation-test split and validated with 5-fold cross-validation. The ViT model achieved up to 100% classification accuracy across all folds, outperforming the CNN in consistency and generalization. This synthetic classification framework serves as a preparatory phase for future work involving the training and validation of these models using real labeled spectrograms extracted from the Juno/Waves database, which includes emission records from 2016 to 2023. © 2025 IEEE.","CNN; cross-validation; Jovian emissions; Machine learning; spectrogram; synthetic data; ViT","C (programming language); Classification (of information); Computer software; Dipole antennas; Learning systems; Machine learning; Neural networks; Partial discharges; Python; Software design; Acquisition systems; Automatic classification; Cross validation; Jovian emission; Machine learning approaches; Machine-learning; Radio emission; Spectrograms; Synthetic data; ViT; Spectrographs","","979-833157673-8","","Conference paper","Final","","Scopus","2-s2.0-105033694991"
"Ramirez-Rueda R.; Benitez-Guerrero E.; Mezura-Godoy C.; Barcenas E.","Ramirez-Rueda, Rolando (57208923504); Benitez-Guerrero, Edgard (15755550600); Mezura-Godoy, Carmen (22735015300); Barcenas, Everardo (35182396600)","57208923504; 15755550600; 22735015300; 35182396600","Transforming Software Development: A Study on the Integration of Multi-Agent Systems and Large Language Models for Automatic Code Generation","2024","Proceedings - 2024 12th International Conference in Software Engineering Research and Innovation, CONISOFT 2024","","","","11","20","2","10.1109/CONISOFT63288.2024.00013","https://www.scopus.com/pages/publications/85216782621?origin=resultslist","Universidad veracruzana, Facultad de Estadística e Informática, Xalapa, Mexico; Universidad Nacional Autónoma de México, Facultad de Ingeniería, Ciudad de México, Mexico","Ramirez-Rueda R., Universidad veracruzana, Facultad de Estadística e Informática, Xalapa, Mexico; Benitez-Guerrero E., Universidad veracruzana, Facultad de Estadística e Informática, Xalapa, Mexico; Mezura-Godoy C., Universidad veracruzana, Facultad de Estadística e Informática, Xalapa, Mexico; Barcenas E., Universidad Nacional Autónoma de México, Facultad de Ingeniería, Ciudad de México, Mexico","This paper explores the integration of Multi-Agent Systems (MAS) and Large Language Models (LLMs) for auto-matic code generation, addressing the limitations of traditional manual coding. By conducting a comprehensive review of existing literature and analyzing a practical case study, we demonstrate how MAS and LLMs can collaboratively enhance software development processes. The research focuses on the technical and theoretical challenges of this integration, highlighting the potential for improved productivity, adaptability, and quality in code generation. The findings contribute to AI-based software engineering by revealing new research directions in collective intelligence and automated programming.  © 2024 IEEE.","Generative AI; LLM; Multi-Agent; Software Development","Automatic programming; Intelligent agents; Software quality; Automatic code generations; Case-studies; Codegeneration; Generative AI; Language model; Large language model; Manual coding; Multi agent; Multiagent systems (MASs); Software development process; Software design","","979-833153211-6","","Conference paper","Final","","Scopus","2-s2.0-85216782621"
"Hernandez-Robles I.A.; Gonzalez-Ramirez X.; Olivares-Galvan J.C.; Escarela-Perez R.; Ocon-Valdez R.","Hernandez-Robles, Ivan A. (57188961692); Gonzalez-Ramirez, Xiomara (57193736871); Olivares-Galvan, Juan C. (24081213500); Escarela-Perez, Rafael (6701841506); Ocon-Valdez, Rodrigo (35174791700)","57188961692; 57193736871; 24081213500; 6701841506; 35174791700","Analysing and Computing the Impact of Geometric Asymmetric Coils on Transformer Stray Losses","2024","Applied System Innovation","7","2","26","","","1","10.3390/asi7020026","https://www.scopus.com/pages/publications/85191723656?origin=resultslist","Departamento Ingeniería Eléctrica, Universidad de Guanajuato, CP, Guanajuato, 36885, Mexico; Departamento de Energía, Universidad Autónoma Metropolitana, CP, Mexico City, 02120, Mexico; Ingeniería Eléctrica y Electrónica, Universidad Nacional Autónoma de Mexico, FES Aragón, CP, Mexico City, 57171, Mexico","Hernandez-Robles I.A., Departamento Ingeniería Eléctrica, Universidad de Guanajuato, CP, Guanajuato, 36885, Mexico; Gonzalez-Ramirez X., Departamento Ingeniería Eléctrica, Universidad de Guanajuato, CP, Guanajuato, 36885, Mexico; Olivares-Galvan J.C., Departamento de Energía, Universidad Autónoma Metropolitana, CP, Mexico City, 02120, Mexico; Escarela-Perez R., Departamento de Energía, Universidad Autónoma Metropolitana, CP, Mexico City, 02120, Mexico; Ocon-Valdez R., Ingeniería Eléctrica y Electrónica, Universidad Nacional Autónoma de Mexico, FES Aragón, CP, Mexico City, 57171, Mexico","Designing and manufacturing transformers often involves variations in heights and thicknesses of windings. However, such geometric asymmetry introduces a significant impact on the magnitude of stray transformer losses. This study examines the effects of asymmetric coils on the generation of stray losses within core clamps and transformer tank walls. A model has been introduced to ascertain the dispersion magnetic field’s value at a specific distance from the coil. The analysis extends to characterising the dispersion magnetic field reaching the tank walls by using electromagnetic simulation by a finite element method. It explores strategies to diminish stray losses, including the placement of magnetic shunts as protective shields for the tank walls. It delves into the efficacy of employing a transformer shell-type configuration to mitigate the magnetic dispersion field. The findings revealed that achieving greater symmetry in transformer coils can minimise stray losses. Specifically, the incorporation of magnetic shunts has the potential to reduce additional losses by 40%, while the adoption of a shell-type configuration alone can lead to a 14% reduction. This work provides valuable insights into optimising transformer designs, contributes a user-friendly tool for estimating additional tank losses, thereby enhancing the knowledge base for transformer manufacturers. © 2024 by the authors.","electromagnetic simulation; geometric asymmetric coils; magnetic shunts; stray magnetic flux; transformers","","25715577","","","Article","Final","All Open Access; Gold Open Access; Green Open Access","Scopus","2-s2.0-85191723656"
"Méndez-Cruz C.-F.; Rodríguez-Herrera J.; Varela-Vega A.; Mateo-Estrada V.; Castillo-Ramírez S.","Méndez-Cruz, Carlos-Francisco (50262483600); Rodríguez-Herrera, Joel (58023351800); Varela-Vega, Alfredo (58022700400); Mateo-Estrada, Valeria (57205372535); Castillo-Ramírez, Santiago (18435742200)","50262483600; 58023351800; 58022700400; 57205372535; 18435742200","Unsupervised learning and natural language processing highlight research trends in a superbug","2024","Frontiers in Artificial Intelligence","7","","1336071","","","1","10.3389/frai.2024.1336071","https://www.scopus.com/pages/publications/85189312620?origin=resultslist","Programa de Genómica Computacional, Centro de Ciencias Genómicas, Universidad Nacional Autónoma de México, Cuernavaca, Mexico; Programa de Genómica Evolutiva, Centro de Ciencias Genómicas, Universidad Nacional Autónoma de México, Cuernavaca, Mexico","Méndez-Cruz C.-F., Programa de Genómica Computacional, Centro de Ciencias Genómicas, Universidad Nacional Autónoma de México, Cuernavaca, Mexico; Rodríguez-Herrera J., Programa de Genómica Computacional, Centro de Ciencias Genómicas, Universidad Nacional Autónoma de México, Cuernavaca, Mexico; Varela-Vega A., Programa de Genómica Computacional, Centro de Ciencias Genómicas, Universidad Nacional Autónoma de México, Cuernavaca, Mexico; Mateo-Estrada V., Programa de Genómica Evolutiva, Centro de Ciencias Genómicas, Universidad Nacional Autónoma de México, Cuernavaca, Mexico; Castillo-Ramírez S., Programa de Genómica Evolutiva, Centro de Ciencias Genómicas, Universidad Nacional Autónoma de México, Cuernavaca, Mexico","Antibiotic-resistance Acinetobacter baumannii is a very important nosocomial pathogen worldwide. Thousands of studies have been conducted about this pathogen. However, there has not been any attempt to use all this information to highlight the research trends concerning this pathogen. Here we use unsupervised learning and natural language processing (NLP), two areas of Artificial Intelligence, to analyse the most extensive database of articles created (5,500+ articles, from 851 different journals, published over 3 decades). K-means clustering found 113 theme clusters and these were defined with representative terms automatically obtained with topic modelling, summarising different research areas. The biggest clusters, all with over 100 articles, are biased toward multidrug resistance, carbapenem resistance, clinical treatment, and nosocomial infections. However, we also found that some research areas, such as ecology and non-human infections, have received very little attention. This approach allowed us to study research themes over time unveiling those of recent interest, such as the use of cefiderocol (a recently approved antibiotic) against A. baumannii. In a broader context, our results show that unsupervised learning, NLP and topic modelling can be used to describe and analyse the research themes for important infectious diseases. This strategy should be very useful to analyse other ESKAPE pathogens or any other pathogens relevant to Public Health. Copyright © 2024 Méndez-Cruz, Rodríguez-Herrera, Varela-Vega, Mateo-Estrada and Castillo-Ramírez.","Acinetobacter baumannii; antibiotic resistance; ESKAPE pathogens; natural language processing; nosocomial pathogens; text mining; topic modelling","","26248212","","","Article","Final","All Open Access; Gold Open Access; Green Open Access","Scopus","2-s2.0-85189312620"
"Samardžić T.; Gutierrez X.; Bentz C.; Moran S.; Pelloni O.","Samardžić, Tanja (55747222000); Gutierrez, Ximena (58952298000); Bentz, Christian (55818976300); Moran, Steven (55901459600); Pelloni, Olga (58130572400)","55747222000; 58952298000; 55818976300; 55901459600; 58130572400","A Measure for Transparent Comparison of Linguistic Diversity in Multilingual NLP Data Sets","2024","Findings of the Association for Computational Linguistics: NAACL 2024 - Findings","","","","3367","3382","7","10.18653/v1/2024.findings-naacl.213","https://www.scopus.com/pages/publications/85197948717?origin=resultslist","Language and Space Lab, University of Zurich, Switzerland; CEIICH, Universidad Nacional Autónoma de México, Mexico; Dept. of General Linguistics, Eberhard-Karls-Universität Tübingen, Germany; Laboratory of Language Evolution, University of Neuchâtel, Switzerland; Telepathy Labs GmbH, Zurich, Switzerland","Samardžić T., Language and Space Lab, University of Zurich, Switzerland; Gutierrez X., CEIICH, Universidad Nacional Autónoma de México, Mexico; Bentz C., Dept. of General Linguistics, Eberhard-Karls-Universität Tübingen, Germany; Moran S., Laboratory of Language Evolution, University of Neuchâtel, Switzerland; Pelloni O., Telepathy Labs GmbH, Zurich, Switzerland","Typologically diverse benchmarks are increasingly created to track the progress achieved in multilingual NLP. Linguistic diversity of these data sets is typically measured as the number of languages or language families included in the sample, but such measures do not consider structural properties of the included languages. In this paper, we propose assessing linguistic diversity of a data set against a reference language sample as a means of maximising linguistic diversity in the long run. We represent languages as sets of features and apply a version of the Jaccard index (Jmm) suitable for comparing sets of measures. In addition to the features extracted from typological data bases, we propose an automatic text-based measure, which can be used as a means of overcoming the well-known problem of data sparsity in manually collected features. Our diversity score is interpretable in terms of linguistic features and can identify the types of languages that are not represented in a data set. Using our method, we analyse a range of popular multilingual data sets (UD, Bible100, mBERT, XTREME, XGLUE, XNLI, XCOPA, TyDiQA, XQuAD). In addition to ranking these data sets, we find, for example, that (poly)synthetic languages are missing in almost all of them. © 2024 Association for Computational Linguistics.","","Computational linguistics; Data base; Data set; Data sparsity; Jaccard index; Linguistic diversity; Linguistic features; Sets of features; Text-based measures; Natural language processing systems","","979-889176119-3","","Conference paper","Final","All Open Access; Gold Open Access","Scopus","2-s2.0-85197948717"
"Ortiz-Barajas J.-G.; Bel-Enguix G.; Gómez-Adorno H.","Ortiz-Barajas, Jesus-German (57929571900); Bel-Enguix, Gemma (56635745900); Gómez-Adorno, Helena (55641734200)","57929571900; 56635745900; 55641734200","MBZUAI-UNAM at SemEval-2024 Task 1: Sentence-CROBI, a Simple Cross-Bi-Encoder-Based Neural Network Architecture for Semantic Textual Relatedness","2024","SemEval 2024 - 18th International Workshop on Semantic Evaluation, Proceedings of the Workshop","","","","1071","1079","0","10.18653/v1/2024.semeval-1.155","https://www.scopus.com/pages/publications/85215529203?origin=resultslist","Mohamed Bin Zayed University of Artificial Intelligence, United Arab Emirates; Instituto de Ingeniería, Universidad Nacional Autónoma de México, Mexico; IIMAS, Universidad Nacional Autónoma de México, Mexico","Ortiz-Barajas J.-G., Mohamed Bin Zayed University of Artificial Intelligence, United Arab Emirates; Bel-Enguix G., Instituto de Ingeniería, Universidad Nacional Autónoma de México, Mexico; Gómez-Adorno H., IIMAS, Universidad Nacional Autónoma de México, Mexico","The Semantic Textual Relatedness (STR) shared task aims at detecting the degree of semantic relatedness between pairs of sentences on low-resource languages from Afroasiatic, Indoeuropean, Austronesian, Dravidian, and Nigercongo families. We use the Sentence-CROBI architecture to tackle this problem. The model is adapted from its original purpose of paraphrase detection to explore its capacities in a related task with limited resources and in multilingual and monolingual settings. Our approach combines the vector representation of cross-encoders and bi-encoders and possesses high adaptable capacity by combining several pre-trained models. Our system obtained good results on the low-resource languages of the dataset using a multilingual fine-tuning approach. © 2024 Association for Computational Linguistics.","","Computational linguistics; Encoding (symbols); Network coding; Neural networks; Semantics; Fine tuning; Low resource languages; Neural network architecture; Semantic relatedness; Simple++; Vector representations; Network architecture","","979-889176107-0","","Conference paper","Final","All Open Access; Gold Open Access","Scopus","2-s2.0-85215529203"
