"Authors","Author full names","Author(s) ID","Title","Year","Source title","Volume","Issue","Art. No.","Page start","Page end","Cited by","DOI","Link","Affiliations","Authors with affiliations","Abstract","Author Keywords","Index Keywords","ISSN","ISBN","CODEN","Document Type","Publication Stage","Open Access","Source","EID"
"Villegas-Jimenez E.A.; Bello-Guerrero A.H.; Padilla-Torres M.D.; Villagomez-Venegas L.N.; Chavez-Ramirez C.S.","Villegas-Jimenez, Ernesto A. (57216894101); Bello-Guerrero, Ariel H. (60605714900); Padilla-Torres, Michelle D. (60605924900); Villagomez-Venegas, Leslie N. (60605715000); Chavez-Ramirez, Camila S. (60605609000)","57216894101; 60605714900; 60605924900; 60605715000; 60605609000","Development of An Algorithm for Strength Training with Use Haptic Feedback and Artificial Intelligence (AI) Based Enhancement","2025","International Conference on Electrical, Computer, and Energy Technologies, ICECET 2025","","","","","","0","10.1109/ICECET63943.2025.11472504","https://www.scopus.com/pages/publications/105037106711?origin=resultslist","Universidad Nacional Autónoma de México, Facultad de Estudios Superiores Aragón, Estado de México, Mexico","Villegas-Jimenez E.A., Universidad Nacional Autónoma de México, Facultad de Estudios Superiores Aragón, Estado de México, Mexico; Bello-Guerrero A.H., Universidad Nacional Autónoma de México, Facultad de Estudios Superiores Aragón, Estado de México, Mexico; Padilla-Torres M.D., Universidad Nacional Autónoma de México, Facultad de Estudios Superiores Aragón, Estado de México, Mexico; Villagomez-Venegas L.N., Universidad Nacional Autónoma de México, Facultad de Estudios Superiores Aragón, Estado de México, Mexico; Chavez-Ramirez C.S., Universidad Nacional Autónoma de México, Facultad de Estudios Superiores Aragón, Estado de México, Mexico","The increasing popularity of the use of AI in everyday life has enabled the development of virtual systems for human assistance. This research proposes an implemented linear regression model with a vector of random weights, using a mean square error (MSE), based cost function and regularisation and corresponding Python code that integrates AI-based haptic feedback through vibration, specifically designed to optimise weight training.The results of the simulation model analysis show how key biomechanical parameters are identified and used to improve a person's posture by adjusting technique through real-time vibrational stimuli. The development of the system involves physical benefits such as injury prevention, continuous biomechanical monitoring, adaptive programme structuring and haptic vibration feedback for immediate movement correction. Popular and accurate tools for building linguistic models are mentioned, such as machine learning, computer vision and neural networks. Technological tools such as machine learning, computer vision and neural networks, applied to process biomechanical data and trigger personalised vibrational responses, are highlighted. © 2025 IEEE.","AI; biomechanics; haptic feedback; python; strength training; virtual coach","Computational linguistics; Computer programming languages; Computer vision; Feedback; Haptic interfaces; Learning systems; Linear regression; Machine learning; Mean square error; Neural networks; Vibration analysis; Haptic feedbacks; Human assistance; Linear regression modelling; Machine-learning; Means square errors; Neural-networks; Random weight; Strength trainings; Virtual coach; Virtual systems; Biomechanics","","979-833153559-9","","Conference paper","Final","","Scopus","2-s2.0-105037106711"
"Estrella-Ibarra L.F.; León-Cuevas A.D.; Tovar-Arriaga S.","Estrella-Ibarra, Luis Felipe (58960820100); León-Cuevas, Alejandro de (58960603000); Tovar-Arriaga, Saul (56013677600)","58960820100; 58960603000; 56013677600","Nested Contrastive Boundary Learning: Point Transformer Self-Attention Regularization for 3D Intracranial Aneurysm Segmentation","2024","Technologies","12","3","28","","","4","10.3390/technologies12030028","https://www.scopus.com/pages/publications/85188964371?origin=resultslist","Faculty of Engineering, Autonomous University of Queretaro, Santiago de Queretaro, 76010, Mexico; National Autonomous University of Mexico (UNAM), Juriquilla Campus, Santiago de, Queretaro, 76230, Mexico","Estrella-Ibarra L.F., Faculty of Engineering, Autonomous University of Queretaro, Santiago de Queretaro, 76010, Mexico; León-Cuevas A.D., National Autonomous University of Mexico (UNAM), Juriquilla Campus, Santiago de, Queretaro, 76230, Mexico; Tovar-Arriaga S., Faculty of Engineering, Autonomous University of Queretaro, Santiago de Queretaro, 76010, Mexico","In 3D segmentation, point-based models excel but face difficulties in precise class delineation at class intersections, an inherent challenge in segmentation models. This is particularly critical in medical applications, influencing patient care and surgical planning, where accurate 3D boundary identification is essential for assisting surgery and enhancing medical training through advanced simulations. This study introduces the Nested Contrastive Boundary Learning Point Transformer (NCBL-PT), specially designed for 3D point cloud segmentation. NCBL-PT employs contrastive learning to improve boundary point representation by enhancing feature similarity within the same class. NCBL-PT incorporates a border-aware distinction within the same class points, allowing the model to distinctly learn from both points in proximity to the class intersection and from those beyond. This reduces semantic confusion among the points of different classes in the ambiguous class intersection zone, where similarity in features due to proximity could lead to incorrect associations. The model operates within subsampled point clouds at each encoder block stage of the point transformer architecture. It applies self-attention with k = 16 nearest neighbors to local neighborhoods, aligning with NCBL calculations for consistent self-attention regularization in local contexts. NCBL-PT improves 3D segmentation at class intersections, as evidenced by a 3.31% increase in Intersection over Union (IOU) for aneurysm segmentation compared to the base point transformer model. © 2024 by the authors.","3D point cloud segmentation; contrastive learning; intracranial aneurysm segmentation","","22277080","","","Article","Final","All Open Access; Gold Open Access; Green Open Access","Scopus","2-s2.0-85188964371"
"Grandury M.; Aula-Blasco J.; Falcão J.; Fourrier C.; González M.; Martínez G.; Santamaría G.; Agerri R.; Aldama N.; Chiruzzo L.; Conde J.; Gómez H.; Guerrero M.; Ivetta G.; López N.; Plaza-Del-Arco F.M.; Martín-Valdivia M.T.; Montoro H.; Muñoz C.; Reviriego P.; Rosado L.; Vaca A.; Vallecillo-Rodríguez M.E.; Vallego J.; Zubiaga I.","Grandury, María (57576562300); Aula-Blasco, Javier (59172215200); Falcão, Júlia (59156123900); Fourrier, Clémentine (57219768296); González, Miguel (7404551654); Martínez, Gonzalo (58078245000); Santamaría, Gonzalo (57278461800); Agerri, Rodrigo (6508050065); Aldama, Nuria (60068333100); Chiruzzo, Luis (57028436900); Conde, Javier (57221949992); Gómez, Helena (59210224400); Guerrero, Marta (60067971400); Ivetta, Guido (58189892300); López, Natalia (60067915900); Plaza-Del-Arco, Flor Miriam (57191078469); Martín-Valdivia, María Teresa (35088446700); Montoro, Helena (60068098500); Muñoz, Carmen (60068156600); Reviriego, Pedro (19639262200); Rosado, Leire (60067971500); Vaca, Alejandro (57266014000); Vallecillo-Rodríguez, María Estrella (58667250900); Vallego, Jorge (60067916000); Zubiaga, Irune (57680165600)","57576562300; 59172215200; 59156123900; 57219768296; 7404551654; 58078245000; 57278461800; 6508050065; 60068333100; 57028436900; 57221949992; 59210224400; 60067971400; 58189892300; 60067915900; 57191078469; 35088446700; 60068098500; 60068156600; 19639262200; 60067971500; 57266014000; 58667250900; 60067916000; 57680165600","La Leaderboard: A Large Language Model Leaderboard for Spanish Varieties and Languages of Spain and Latin America","2025","Proceedings of the Annual Meeting of the Association for Computational Linguistics","1","","","32482","32524","0","","https://www.scopus.com/pages/publications/105021021376?origin=resultslist","SomosNLP; ETSIT, Universidad Politécnica de Madrid, Spain; Barcelona Supercomputing Center, Spain; Hugging Face; Universidad Carlos III de Madrid, Spain; Instituto de Ingeniería del Conocimiento, Spain; Centro HiTZ - Ixa, Universidad del País Vasco UPV/EHU, Spain; LenguajeNatural.AI; LIACS, Leiden University, Netherlands; Universidad de Jaén, Spain; Universidad Nacional de Córdoba, Argentina; Universidad Nacional Autónoma de México, Mexico; Universidad de la República, Uruguay","Grandury M., SomosNLP, ETSIT, Universidad Politécnica de Madrid, Spain; Aula-Blasco J., Barcelona Supercomputing Center, Spain; Falcão J., Barcelona Supercomputing Center, Spain; Fourrier C., Hugging Face; González M., ETSIT, Universidad Politécnica de Madrid, Spain; Martínez G., Universidad Carlos III de Madrid, Spain; Santamaría G., Instituto de Ingeniería del Conocimiento, Spain; Agerri R., Centro HiTZ - Ixa, Universidad del País Vasco UPV/EHU, Spain; Aldama N., Instituto de Ingeniería del Conocimiento, Spain; Chiruzzo L., Universidad de la República, Uruguay; Conde J., ETSIT, Universidad Politécnica de Madrid, Spain; Gómez H., Universidad Nacional Autónoma de México, Mexico; Guerrero M., Instituto de Ingeniería del Conocimiento, Spain; Ivetta G., Universidad Nacional de Córdoba, Argentina; López N., Instituto de Ingeniería del Conocimiento, Spain; Plaza-Del-Arco F.M., LIACS, Leiden University, Netherlands; Martín-Valdivia M.T., Universidad de Jaén, Spain; Montoro H., Instituto de Ingeniería del Conocimiento, Spain; Muñoz C., Instituto de Ingeniería del Conocimiento, Spain; Reviriego P., ETSIT, Universidad Politécnica de Madrid, Spain; Rosado L., Instituto de Ingeniería del Conocimiento, Spain; Vaca A., LenguajeNatural.AI; Vallecillo-Rodríguez M.E., Universidad de Jaén, Spain; Vallego J.; Zubiaga I., Centro HiTZ - Ixa, Universidad del País Vasco UPV/EHU, Spain","Leaderboards showcase the current capabilities and limitations of Large Language Models (LLMs). To motivate the development of LLMs that represent the linguistic and cultural diversity of the Spanish-speaking community, we present LA LEADERBOARD, the first open-source leaderboard to evaluate generative LLMs in languages and language varieties of Spain and Latin America. LA LEADERBOARD is a community-driven project that aims to establish an evaluation standard for everyone interested in developing LLMs for the Spanish-speaking community. This initial version combines 66 datasets in Basque, Catalan, Galician, and different Spanish varieties, showcasing the evaluation results of 50 models. To encourage community-driven development of leaderboards in other languages, we explain our methodology, including guidance on selecting the most suitable evaluation setup for each downstream task. In particular, we provide a rationale for using fewer few-shot examples than typically found in the literature, aiming to reduce environmental impact and facilitate access to reproducible results for a broader research community. © 2025 Association for Computational Linguistics.","","","0736587X","979-889176251-0","","Conference paper","Final","","Scopus","2-s2.0-105021021376"
"Motilla-Chávez J.A.; Ugalde E.; Galán-Vásquez E.","Motilla-Chávez, José Antonio (59417727300); Ugalde, Edgardo (57202408711); Galán-Vásquez, Edgardo (55758378800)","59417727300; 57202408711; 55758378800","Social networks from dailies: the observer’s point of view","2024","Applied Network Science","9","1","67","","","1","10.1007/s41109-024-00681-9","https://www.scopus.com/pages/publications/85209698127?origin=resultslist","Facultad del Hábitat, Universidad Autónoma de San Luis Potosí, Zona Universitaria Poniente, San Luis Potosí, 79290, Mexico; Instituto de Física, Universidad Autónoma de San Luis Potosí, Zona Universitaria Pedregal, San Luis Potosí, 79295, Mexico; Departamento de Ingeniería de Sistemas Computacionales y Automatización, Instituto de Investigación en Matemáticas Aplicadas y en Sistemas, Universidad Nacional Autónoma de México, Ciudad Universitaria, México City, 01000, Mexico","Motilla-Chávez J.A., Facultad del Hábitat, Universidad Autónoma de San Luis Potosí, Zona Universitaria Poniente, San Luis Potosí, 79290, Mexico; Ugalde E., Instituto de Física, Universidad Autónoma de San Luis Potosí, Zona Universitaria Pedregal, San Luis Potosí, 79295, Mexico; Galán-Vásquez E., Departamento de Ingeniería de Sistemas Computacionales y Automatización, Instituto de Investigación en Matemáticas Aplicadas y en Sistemas, Universidad Nacional Autónoma de México, Ciudad Universitaria, México City, 01000, Mexico","In this paper, we explore the hypothesis that the social network described by an observer in a written document provides a discernible cross-section of the underlying social network. Specifically, we propose that the subnetwork described by the observer is extracted from large social network with a Barabási-Albert structure, following two key premises: (1) the observer identifies and reports nodes and interactions in his local environment, and (2) the observer records the most relevant nodes—those with a high number of connections—as well as the most significant portions of their local environment. We test this hypothesis using personal dailies written in New Spain and Mexico between 1776 and 1873. We compare the structure of these dailies networks to one depicted by a typical subnetwork of a Barabási-Albert network, obtained following the two premises mentioned above. To support our findings, we compare them to the social networks described in two well-known novels. In this work, we implicitly assume the hypothesis that there is a complete, non-subjective social network, including our observer, with a Barabási-Albert structure. The evolution of this underlying social network can shed light on the dynamics of a society over time. Our approach could give place to indicators of the changes in the structure of this enveloping network. This is especially important since, although our historical sources do not offer sufficient data to reconstruct the processes in their entirety, the approach could supply clues or fragments from which we could understand the structure and dynamics of societies over time. © The Author(s) 2024.","Barabási’s model; Dailies; NLP; Social network; Underlying social network","Economic and social effects; Barabasi-Albert networks; Barabasi’s model; Daily; Local environments; Me-xico; S models; Social network; Subnetworks; Underlying social network; Written documents; Social networking (online)","23648228","","","Article","Final","All Open Access; Gold Open Access","Scopus","2-s2.0-85209698127"
"Valdez A.; Gomez-Adorno H.; Márquez F.; Pantaleón J.; Bel-Enguix G.","Valdez, Andric (58679842400); Gomez-Adorno, Helena (55641734200); Márquez, Fernando (59520354300); Pantaleón, Jorge (59520795400); Bel-Enguix, Gemma (56635745900)","58679842400; 55641734200; 59520354300; 59520795400; 56635745900","iimasNLP at SemEval-2024 Task 8: Unveiling structure-aware language models for automatic generated text identification","2024","SemEval 2024 - 18th International Workshop on Semantic Evaluation, Proceedings of the Workshop","","","","1110","1114","0","10.18653/v1/2024.semeval-1.161","https://www.scopus.com/pages/publications/85215507053?origin=resultslist","Universidad Nacional Autónoma de México, Ciudad de México, Mexico; Instituto de Investigaciones en Matemáticas y en Sistemas, Universidad Nacional Autónoma de México, Ciudad de México, Mexico; Instituto de Ingeniería, Universidad Nacional Autónoma de México, Ciudad de México, Mexico","Valdez A., Universidad Nacional Autónoma de México, Ciudad de México, Mexico; Gomez-Adorno H., Instituto de Investigaciones en Matemáticas y en Sistemas, Universidad Nacional Autónoma de México, Ciudad de México, Mexico; Márquez F., Instituto de Investigaciones en Matemáticas y en Sistemas, Universidad Nacional Autónoma de México, Ciudad de México, Mexico; Pantaleón J., Instituto de Investigaciones en Matemáticas y en Sistemas, Universidad Nacional Autónoma de México, Ciudad de México, Mexico; Bel-Enguix G., Instituto de Ingeniería, Universidad Nacional Autónoma de México, Ciudad de México, Mexico","Large language models (LLMs) are artificial intelligence systems that can generate text, translate languages, and answer questions in a human-like way. While these advances are impressive, there is concern that LLMs could also be used to generate fake or misleading content. In this work, as a part of our participation in SemEval-2024 Task-8, we investigate the ability of LLMs to identify whether a given text was written by a human or by a specific AI. We believe that human and machine writing style patterns are different from each other, so integrating features at different language levels can help in this classification task. For this reason, we evaluate several LLMs that aim to extract valuable multilevel information (such as lexical, semantic, and syntactic) from the text in their training processing. Our best scores on Sub-taskA (monolingual) and SubtaskB were 71.5% and 38.2% in accuracy, respectively (both using the ConvBERT LLM); for both subtasks, the baseline (RoBERTa) achieved an accuracy of 74%. © 2024 Association for Computational Linguistics.","","Classification (of information); Computational linguistics; Computer aided language translation; Artificial intelligence systems; Classification tasks; Human like; Language levels; Language model; Lexical semantics; Multilevels; Structure-aware; Text identification; Writing style; Semantics","","979-889176107-0","","Conference paper","Final","All Open Access; Gold Open Access","Scopus","2-s2.0-85215507053"
"López-Ponce F.; Cadena Á.; Salas-Jimenez K.; Preciado Márquez D.; Bel-Enguix G.","López-Ponce, F. (59521022800); Cadena, Ángel (59520364400); Salas-Jimenez, K. (57865862500); Preciado Márquez, D. (59520692700); Bel-Enguix, G. (56635745900)","59521022800; 59520364400; 57865862500; 59520692700; 56635745900","GIL-IIMAS UNAM at SemEval-2024 Task 1: SAND: An In Depth Analysis of Semantic Relatedness Using Regression and Similarity Characteristics","2024","SemEval 2024 - 18th International Workshop on Semantic Evaluation, Proceedings of the Workshop","","","","1288","1292","0","10.18653/v1/2024.semeval-1.186","https://www.scopus.com/pages/publications/85215512595?origin=resultslist","Grupo de Ingeniería Lingüística, UNAM, Mexico; UNAM, Mexico; Departament de Filologia Catalana i Lingüística General, Universitat de Barcelona, Spain","López-Ponce F., Grupo de Ingeniería Lingüística, UNAM, Mexico; Cadena Á., Grupo de Ingeniería Lingüística, UNAM, Mexico, UNAM, Mexico; Salas-Jimenez K., Grupo de Ingeniería Lingüística, UNAM, Mexico, UNAM, Mexico; Preciado Márquez D., Grupo de Ingeniería Lingüística, UNAM, Mexico; Bel-Enguix G., Grupo de Ingeniería Lingüística, UNAM, Mexico, Departament de Filologia Catalana i Lingüística General, Universitat de Barcelona, Spain","The STR shared task aims at detecting the degree of semantic relatedness between sentence pairs in multiple languages. Semantic relatedness relies on elements such as topic similarity, point of view agreement, entailment, and even human intuition, making it a broader field than sentence similarity. The GIL-IIMAS UNAM team proposes a model based in the SAND characteristics composition (Sentence Transformers, AnglE Embeddings, N-grams, Sentence Length Difference coefficient) and classical regression algorithms. This model achieves a 0.83 Spearman Correlation score in the English test, and a 0.73 in the Spanish counterpart, finishing just above the SemEval baseline in English, and second place in Spanish. © 2024 Association for Computational Linguistics.","","Computational linguistics; Regression analysis; Semantics; Embeddings; Human's intuition; In-depth analysis; Model-based OPC; Multiple languages; N-grams; Semantic relatedness; Sentence length; Sentence similarity; Topic similarity","","979-889176107-0","","Conference paper","Final","All Open Access; Gold Open Access","Scopus","2-s2.0-85215512595"
"Santamaria S.B.; Gómez-Adorno H.; Markov I.","Santamaria, Selene Baez (57203985273); Gómez-Adorno, Helena (55641734200); Markov, Ilia (57225431345)","57203985273; 55641734200; 57225431345","Contextualized Graph Representations for Generating Counter-Narratives against Hate Speech","2024","EMNLP 2024 - 2024 Conference on Empirical Methods in Natural Language Processing, Findings of EMNLP 2024","","","","7664","7674","2","10.18653/v1/2024.findings-emnlp.450","https://www.scopus.com/pages/publications/85217617752?origin=resultslist","CLTL, Vrije Universiteit Amsterdam, Amsterdam, Netherlands; IIMAS, Universidad Nacional Autónoma de México, Mexico City, Mexico","Santamaria S.B., CLTL, Vrije Universiteit Amsterdam, Amsterdam, Netherlands; Gómez-Adorno H., IIMAS, Universidad Nacional Autónoma de México, Mexico City, Mexico; Markov I., CLTL, Vrije Universiteit Amsterdam, Amsterdam, Netherlands","Hate speech (HS) is a widely acknowledged societal problem with potentially grave effects on vulnerable individuals and minority groups. Developing counter-narratives (CNs) that confront biases and stereotypes driving hateful narratives is considered an impactful strategy. Current automatic methods focus on isolated utterances to detect and react to hateful content online, often omitting the conversational context where HS naturally occurs. In this work, we explore strategies for the incorporation of conversational history for CN generation, comparing text and graphical representations with varying degrees of context. Overall, automatic and human evaluations show that 1) contextualized representations are comparable to those of isolated utterances, and 2) models based on graph representations outperform text representations, thus opening new research directions for future work. © 2024 Association for Computational Linguistics.","","'current; Automatic evaluation; Automatic method; Graph representation; Graphical representations; Human evaluation; Minority groups; Model-based OPC; Societal problems; Text representation; Computational linguistics","","979-889176168-1","","Conference paper","Final","All Open Access; Gold Open Access; Green Open Access","Scopus","2-s2.0-85217617752"
