"Authors","Author full names","Author(s) ID","Title","Year","Source title","Volume","Issue","Art. No.","Page start","Page end","Cited by","DOI","Link","Affiliations","Authors with affiliations","Abstract","Author Keywords","Index Keywords","ISSN","ISBN","CODEN","Document Type","Publication Stage","Open Access","Source","EID"
"Ek-Chacón E.; Molino-Minero-Re E.; Méndez-Monroy P.E.; Neme A.; Ángeles-Hernández H.","Ek-Chacón, Edgar (57219417925); Molino-Minero-Re, Erik (24725248700); Méndez-Monroy, Paul Erick (26664932000); Neme, Antonio (57195959119); Ángeles-Hernández, Hector (59143925100)","57219417925; 24725248700; 26664932000; 57195959119; 59143925100","Semi-Supervised Training for (Pre-Stack) Seismic Data Analysis","2024","Applied Sciences (Switzerland)","14","10","4175","","","6","10.3390/app14104175","https://www.scopus.com/pages/publications/85194154228?origin=resultslist","Posgrado en Ciencia e Ingeniería de la Computación sede Mérida, Universidad Nacional Autónoma de México, Yucatan, Merida, 97357, Mexico; Instituto de Investigaciones en Matemáticas Aplicadas y en Sistemas (IIMAS), Unidad Académica en el Estado de Yucatán, Universidad Nacional Autónoma de México, Yucatan, Merida, 97357, Mexico; Petróleos Mexicanos (PEMEX), Centro Técnico Administrativo, Región Sur, Campo Sitio Grande 2000, Fraccionamiento Carrizal, Tabasco, Villahermosa, 86030, Mexico","Ek-Chacón E., Posgrado en Ciencia e Ingeniería de la Computación sede Mérida, Universidad Nacional Autónoma de México, Yucatan, Merida, 97357, Mexico; Molino-Minero-Re E., Instituto de Investigaciones en Matemáticas Aplicadas y en Sistemas (IIMAS), Unidad Académica en el Estado de Yucatán, Universidad Nacional Autónoma de México, Yucatan, Merida, 97357, Mexico; Méndez-Monroy P.E., Instituto de Investigaciones en Matemáticas Aplicadas y en Sistemas (IIMAS), Unidad Académica en el Estado de Yucatán, Universidad Nacional Autónoma de México, Yucatan, Merida, 97357, Mexico; Neme A., Instituto de Investigaciones en Matemáticas Aplicadas y en Sistemas (IIMAS), Unidad Académica en el Estado de Yucatán, Universidad Nacional Autónoma de México, Yucatan, Merida, 97357, Mexico; Ángeles-Hernández H., Petróleos Mexicanos (PEMEX), Centro Técnico Administrativo, Región Sur, Campo Sitio Grande 2000, Fraccionamiento Carrizal, Tabasco, Villahermosa, 86030, Mexico","A lack of labeled examples is a problem in different domains, such as text and image processing, medicine, and static reservoir characterization, because supervised learning relies on vast volumes of these data to perform successfully, but this is quite expensive. However, large amounts of unlabeled data exist in these domains. The deep semi-supervised learning (DSSL) approach leverages unlabeled data to improve supervised learning performance using deep neural networks. This approach has succeeded in image recognition, text classification, and speech recognition. Nevertheless, there have been few works on pre-stack seismic reservoir characterization, in which knowledge of rock and fluid properties is fundamental for oil exploration. This paper proposes a methodology to estimate acoustic impedance using pre-stack seismic data and DSSL with a recurrent neural network. The few labeled datasets for training were pre-processed from raw seismic and acoustic impedance data from five borehole logs. The results showed that the acoustic impedance estimation at the well location and outside it was better predicted by the DSSL compared to the supervised version of the same neural network. Therefore, employing a large amount of unlabeled data can be helpful in the development of seismic data interpretation systems. © 2024 by the authors.","acoustic impedance; deep semi-supervised learning; few labels; large unlabeled; pre-stack seismic; pre-training; recurrent neural networks","","20763417","","","Article","Final","All Open Access; Gold Open Access; Green Open Access","Scopus","2-s2.0-85194154228"
"Moreno-Tagle J.C.; Olveres J.; Escalante-Ramírez B.","Moreno-Tagle, José Carlos (57222072240); Olveres, Jimena (35797425500); Escalante-Ramírez, Boris (6701369474)","57222072240; 35797425500; 6701369474","Synthetic versus real: Exploring the impact of synthetic data on medical image classification","2024","Proceedings of SPIE - The International Society for Optical Engineering","12998","","1299802","","","1","10.1117/12.3022261","https://www.scopus.com/pages/publications/85198931127?origin=resultslist","Universidad Nacional Autónoma de México, Mexico City, Mexico; Departamento de Procesamiento de Señales, Facultad de Ingeniería, Universidad Nacional Autónoma de México, Mexico City, Mexico; Centro de Estudios en Computación Avanzada, Universidad Nacional Autónoma de México, Mexico City, Mexico","Moreno-Tagle J.C., Universidad Nacional Autónoma de México, Mexico City, Mexico, Departamento de Procesamiento de Señales, Facultad de Ingeniería, Universidad Nacional Autónoma de México, Mexico City, Mexico; Olveres J., Departamento de Procesamiento de Señales, Facultad de Ingeniería, Universidad Nacional Autónoma de México, Mexico City, Mexico, Centro de Estudios en Computación Avanzada, Universidad Nacional Autónoma de México, Mexico City, Mexico; Escalante-Ramírez B., Departamento de Procesamiento de Señales, Facultad de Ingeniería, Universidad Nacional Autónoma de México, Mexico City, Mexico, Centro de Estudios en Computación Avanzada, Universidad Nacional Autónoma de México, Mexico City, Mexico","This study explores the impact of synthetic medical images, created through Stable Diffusion, on neural network training for lung condition classification. Using a hybrid dataset combining real and synthetic images, diverse state-of-the-art vision models were trained. Neural networks effectively learned from synthetic data, its performance is similar or superior to models trained purely on real images as long as the training is carried out under equal conditions: same architecture, same number of epochs, same training style, same resolution of the input image. We selected ConvNext-small as our test architecture. Its best performance when trained with a hybrid dataset (synthetic and real images) was 89% while when trained with purely real images it was 85%. These results were obtained when evaluated with an external validation data set curated by a radiologist. However, hybrid models seem to show a limit in their performance when exploring different training techniques. In contrast, a simpler architecture trained with only real images can take advantage of more complex training regimes to elevate its final performance. In this regard, our best hybrid-trained model (ConvNext-small) achieved an external validation accuracy of 87% while ResNet-34 attained a 93% validation accuracy trained only on real images. Both models were evaluated with the real-image-only dataset provided by the radiologist. This study concludes by comparing our top AI models and radiologists’ performance levels. © 2024 SPIE.","ConvNets; hybrid dataset; lung condition classification; neural network training; Stable Diffusion; Synthetic medical images; vision Transformers","Biological organs; Image classification; Medical imaging; Network architecture; Neural networks; Condition; Convnet; Hybrid dataset; Lung condition classification; Neural networks trainings; Performance; Real images; Stable diffusion; Synthetic medical image; Vision transformer; Classification (of information)","0277786X","978-151067314-4","PSISD","Conference paper","Final","","Scopus","2-s2.0-85198931127"
"García-Noguez L.R.; Salazar-Colores S.; Mondragón-Rodríguez S.; Tovar-Arriaga S.","García-Noguez, Luis Roberto (58686417900); Salazar-Colores, Sebastián (57204354992); Mondragón-Rodríguez, Siddhartha (56013734200); Tovar-Arriaga, Saúl (56013677600)","58686417900; 57204354992; 56013734200; 56013677600","A Novel Methodology for Data Augmentation in Cognitive Impairment Subjects Using Semantic and Pragmatic Features Through Large Language Models","2025","Technologies","13","8","344","","","0","10.3390/technologies13080344","https://www.scopus.com/pages/publications/105014328547?origin=resultslist","Facultad de Ingeniería, Universidad Autónoma de Querétaro, Queretaro, C.P. 76010, Mexico; Centro de Investigaciones en Óptica, C.P., Leon, 37150, Mexico; Instituto de Neurobiología, Universidad Nacional Autónoma de México Campus Juriquilla, Queretaro, C.P. 76230, Mexico","García-Noguez L.R., Facultad de Ingeniería, Universidad Autónoma de Querétaro, Queretaro, C.P. 76010, Mexico; Salazar-Colores S., Centro de Investigaciones en Óptica, C.P., Leon, 37150, Mexico; Mondragón-Rodríguez S., Instituto de Neurobiología, Universidad Nacional Autónoma de México Campus Juriquilla, Queretaro, C.P. 76230, Mexico; Tovar-Arriaga S., Facultad de Ingeniería, Universidad Autónoma de Querétaro, Queretaro, C.P. 76010, Mexico","In recent years, researchers have become increasingly interested in identifying traits of cognitive impairment using audio from neuropsychological tests. Unfortunately, there is no universally accepted terminology system that can be used to describe language impairment, and considerable variability exists between clinicians, making detection particularly challenging. Furthermore, databases commonly used by the scientific community present sparse or unbalanced data, which hinders the optimal performance of machine learning models. Therefore, this study aims to test a new methodology for augmenting text data from neuropsychological tests in the Pitt Corpus database to increase classification and interpretability results. The proposed method involves augmenting text data with symptoms commonly present in subjects with cognitive impairment. This innovative approach has enabled us to differentiate between two groups in the database better than widely used text augmentation techniques. The proposed method yielded an increase in the metrics, achieving 0.8742 accuracy, 0.8744 F1-score, 0.8736 precision, and 0.8781 recall. It is shown that implementing large language models with commonly observed symptoms in the language of patients with cognitive impairment in text augmentation can improve the results in low-resource scenarios. © 2025 by the authors.","cognitive impairment; low-resource scenarios; memory impairment; Pitt Corpus; text augmentation","Artificial intelligence; Classification (of information); Computational linguistics; Database systems; Human rehabilitation engineering; Learning systems; Terminology; Text processing; Cognitive impairment; Data augmentation; Language model; Low-resource scenario; Memory impairment; Neuropsychological tests; Novel methodology; Pitt corpus; Text augmentation; Text data; Semantics","22277080","","","Article","Final","All Open Access; Gold Open Access; Green Open Access","Scopus","2-s2.0-105014328547"
"Andersen S.T.; Ojeda-Trueba S.-L.; Vásquez J.; Bel-Enguix G.","Andersen, Scott Thomas (57879927800); Ojeda-Trueba, Sergio-Luis (57223270174); Vásquez, Juan (57266047500); Bel-Enguix, Gemma (56635745900)","57879927800; 57223270174; 57266047500; 56635745900","The Mexican Gayze: A Computational Analysis of the Attitudes towards the LGBT+ Population in Mexico on Social Media Across a Decade","2024","NAACL 2024 - 8th Workshop on Online Abuse and Harms, WOAH 2024, Proceedings of the Workshop","","","","178","200","0","10.18653/v1/2024.woah-1.14","https://www.scopus.com/pages/publications/105001872140?origin=resultslist","Posgrado en Ciencia e Ingeniería de la Computación, Universidad Nacional Autónoma de México, Mexico; Instituto de Ingeniería, Universidad Nacional Autónoma de México, Mexico; University of Colorado, Boulder, United States; Universidad Nacional Autónoma de México, Universitat de Barcelona, Spain","Andersen S.T., Posgrado en Ciencia e Ingeniería de la Computación, Universidad Nacional Autónoma de México, Mexico; Ojeda-Trueba S.-L., Instituto de Ingeniería, Universidad Nacional Autónoma de México, Mexico; Vásquez J., University of Colorado, Boulder, United States; Bel-Enguix G., Universidad Nacional Autónoma de México, Universitat de Barcelona, Spain","Thanks to the popularity of social media, data generated by online communities provides an abundant source of diverse language information. This abundance of data allows NLP practitioners and computational linguists to analyze sociolinguistic phenomena occurring in digital communication. In this paper, we analyze the Twitter discourse around the Mexican Spanish-speaking LGBT+ community. For this, we evaluate how the polarity of some nouns related to the LGBT+ community has evolved in conversational settings using a corpus of tweets that cover a time span of ten years. We hypothesize that social media’s fast-moving, turbulent linguistic environment encourages language evolution faster than ever before. Our results indicate that most of the inspected terms have undergone some shift in denotation or connotation. No other generalizations can be observed in the data, given the difficulty that current NLP methods have to account for polysemy, and the wide differences between the various subgroups that make up the LGBT+ community. A fine-grained analysis of a series of LGBT+related lexical terms is also included in this work. © 2024 Association for Computational Linguistics.","","Computational linguistics; Social networking (online); Computational analysis; Digital communications; Generalisation; Language evolution; Language informations; Linguistic environment; Me-xico; On-line communities; Social media; Time span; Tweets","","979-889176105-6","","Conference paper","Final","All Open Access; Gold Open Access","Scopus","2-s2.0-105001872140"
"Acosta G.; Morales E.; Gómez-Adorno H.","Acosta, Guido (60145256900); Morales, Eduardo (60145403500); Gómez-Adorno, Helena (55641734200)","60145256900; 60145403500; 55641734200","UCOM_UNAM_PLN at CheckThat! 2025: Evaluating LLMs in a two-Step Architecture for Numerical Fact Checking","2025","CEUR Workshop Proceedings","4038","","","743","753","0","","https://www.scopus.com/pages/publications/105019058911?origin=resultslist","Maestría en Ciencia de Datos, Universidad Comunera, Monseñor Bogarín, Asunción, 284, Paraguay; Instituto de Investigaciones en Matemáticas Aplicadas y en Sistemas, Universidad Nacional Autónoma de México, Av. Universidad 3000, C.U., Coyoacán, Ciudad de México, Mexico","Acosta G., Maestría en Ciencia de Datos, Universidad Comunera, Monseñor Bogarín, Asunción, 284, Paraguay; Morales E., Maestría en Ciencia de Datos, Universidad Comunera, Monseñor Bogarín, Asunción, 284, Paraguay; Gómez-Adorno H., Instituto de Investigaciones en Matemáticas Aplicadas y en Sistemas, Universidad Nacional Autónoma de México, Av. Universidad 3000, C.U., Coyoacán, Ciudad de México, Mexico","This paper presents the approach developed by the UCOM-UNAM-PLN team for Task 3 of the CLEF 2025 CheckThat! Lab, focused on verifying numerical and temporal claims in Spanish. We propose a two-step fact-checking architecture leveraging large language models (LLMs) in both stages: (1) evidence retrieval through BM25-preselected documents, and (2) veracity classification using zero-shot and few-shot prompting strategies. We conduct a comprehensive evaluation of retrieval techniques—including statistical, embedding-based, and LLM-based models—on the CLEF 2024 development set, identifying GPT-4o as the top-performing retriever. Based on these findings, we deploy GPT-4o for both evidence extraction and classification. Our best-performing pipeline combines few-shot prompting with curated evidence, achieving a macro-averaged F1 score of 0.3595 on the official CLEF 2025 test set. Results highlight the effectiveness of hybrid LLM-based architectures in identifying false claims, while also revealing challenges in handling ambiguous or true statements. This study underscores the potential of combining semantic retrieval and task-specific prompting for robust fact verification in real-world contexts. © 2025 Copyright for this paper by its authors. Use permitted under Creative Commons License Attribution 4.0 International (CC BY 4.0).","Classification; Fact checking; Information Retrieval; LLMS","Architecture; Semantics; Comprehensive evaluation; Embeddings; Evidence extraction; F1 scores; Fact checking; Language model; LLMS; Model-based OPC; Retrieval techniques; Test sets; Classification (of information); Information retrieval","16130073","","","Conference paper","Final","","Scopus","2-s2.0-105019058911"
"Ramírez-Rueda R.; Benítez-Guerrero E.; Mezura-Godoy C.; Bárcenas E.","Ramírez-Rueda, Rolando (57208923504); Benítez-Guerrero, Edgard (15755550600); Mezura-Godoy, Carmen (22735015300); Bárcenas, Everardo (35182396600)","57208923504; 15755550600; 22735015300; 35182396600","A Systematic Literature Review of 10 years of Research on Program Synthesis and Natural Language Processing","2024","Programming and Computer Software","50","8","","725","741","3","10.1134/S0361768824700737","https://www.scopus.com/pages/publications/85217757667?origin=resultslist","Facultad de Estadística e Informática Universidad Veracruzana, Xalapa, Mexico; Facultad de Ingeniería Universidad Nacional Autónoma de México Ciudad de México, Xalapa, Mexico","Ramírez-Rueda R., Facultad de Estadística e Informática Universidad Veracruzana, Xalapa, Mexico; Benítez-Guerrero E., Facultad de Estadística e Informática Universidad Veracruzana, Xalapa, Mexico; Mezura-Godoy C., Facultad de Estadística e Informática Universidad Veracruzana, Xalapa, Mexico; Bárcenas E., Facultad de Ingeniería Universidad Nacional Autónoma de México Ciudad de México, Xalapa, Mexico","Abstract: Program synthesis is the process of automatically generating software from a requirement specification. This paper presents a systematic literature review focused on program synthesis from specifications expressed in natural language. The research problem centers on the complexity of automatically generating accurate and robust code from high-level, ambiguous natural language descriptions – a barrier that limits the broader adoption of automatic code generation in software development. To address this issue, the study systematically examines research published between 2014 and 2024, focusing on works that explore various approaches to program synthesis from natural language inputs. The review follows a rigorous methodology, incorporating search strings tailored to capture relevant studies from five major data sources: IEEE, ACM, Springer, Elsevier, and MDPI. The selection process applied strict inclusion and exclusion criteria, resulting in a final set of 20 high-quality studies. The findings reveal significant advancements in the field, particularly in the integration of large language models (LLMs) with program synthesis techniques. The review also highlights the challenges and concludes by outlining key trends and proposing future research directions aimed at overcoming these challenges and expanding the applicability of program synthesis across various domains. © Pleiades Publishing, Ltd. 2024.","","Ada (programming language); Automatic programming; Input output programs; Natural language processing systems; Problem oriented languages; Specification languages; Abstract programs; Automatic code generations; Language description; Language processing; Natural languages; Program synthesis; Requirements specifications; Research problems; Rigorous methodologies; Systematic literature review; Software design","03617688","","","Article","Final","","Scopus","2-s2.0-85217757667"
"Valdés-Souto F.; Torres-Robledo D.","Valdés-Souto, Francisco (57190186512); Torres-Robledo, Daniel (57221095436)","57190186512; 57221095436","Is It Possible to Use ChatGPT to Perform Measurements Using the COSMIC Method?","2024","Programming and Computer Software","50","8","","674","689","1","10.1134/S0361768824700695","https://www.scopus.com/pages/publications/85217772681?origin=resultslist","National Autonomous University of Mexico, Science Faculty, CDMX, Mexico; National Autonomous University of Mexico Research Institute in Applied Mathematics and Systems, CDMX, Mexico","Valdés-Souto F., National Autonomous University of Mexico, Science Faculty, CDMX, Mexico; Torres-Robledo D., National Autonomous University of Mexico Research Institute in Applied Mathematics and Systems, CDMX, Mexico","Abstract: The process of developing software is intricate and time-consuming. Resource estimation is one of the most important responsibilities in software development. Since it is currently the only acceptable metric, the functional size of the program is used to generate estimating models in a widely accepted manner. On the other hand, functional size measurement takes time. The use of artificial intelligence (AI) to automate certain software development jobs has gained popularity in recent years. Software functional sizing and estimation is one area where artificial intelligence may be used. In this study, we investigate how to apply the concepts and guidelines of the COSMIC method to measurements using ChatGPT 4o, a large language model (LLM). To determine whether ChatGPT can perform COSMIC measurements, we discovered that ChatGPT could not reliably produce accurate findings. The primary shortcomings found in ChatGPT include its incapacity to accurately extract data movements, data groups, and functional users from the text. Because of this, ChatGPT’s measurements fall short of two essential requirements for measurement: accuracy and reproducibility. © Pleiades Publishing, Ltd. 2024.","AI; automatization; CFP; ChatGPT; COSMIC; functional size measurement; LLM; software engineering","Cosmic ray measurement; Strain measurement; Automatization; CFP; ChatGPT; Cosmics; Functional size; Functional Size Measurements; Functionals; Language model; Large language model; Resource estimation; Size determination","03617688","","","Article","Final","","Scopus","2-s2.0-85217772681"
"Lefranc G.; Gatica G.; Vásquez E.; Peña M.","Lefranc, Gastón (7005019896); Gatica, Gabriel (57224552988); Vásquez, Edison (60069152700); Peña, Mario (18038232900)","7005019896; 57224552988; 60069152700; 18038232900","Advanced Algorithm Combinations for Safe Human-Robot Collaboration: A Review and Research Proposal","2025","Procedia Computer Science","266","","","142","149","1","10.1016/j.procs.2025.08.018","https://www.scopus.com/pages/publications/105014151470?origin=resultslist","Pontificia Universidad Católica de Valparaíso, Avda. Brasil2950, Valparaíso, 2430000, Chile; Startup I+D+i Inteligencia Artificial, ARTIFICYAN, Viña del Mar, Chile; JhedAI Startup., Viña del Mar, Chile; IIMAS-UNAM, Ciudad de México, Mexico","Lefranc G., Pontificia Universidad Católica de Valparaíso, Avda. Brasil2950, Valparaíso, 2430000, Chile; Gatica G., Startup I+D+i Inteligencia Artificial, ARTIFICYAN, Viña del Mar, Chile; Vásquez E., JhedAI Startup., Viña del Mar, Chile; Peña M., IIMAS-UNAM, Ciudad de México, Mexico","This paper presents a proposal for integrating Graph Convolutional Neural Network (Graph-CNN), Multimodal Transformer, Soft Actor-Critic with Reward Constrained Policy Optimisation (SAC-RCPO), and TactileGAN algorithms, which are used in human-robot collaboration. This integration addresses challenges such as adaptability, safety, intention recognition, and precise manipulation in dynamic environments. The central hypothesis is that the combination of these algorithms could lead to improvements in manipulation accuracy, collision avoidance, and training efficiency. The methodology evaluates this combination in simulated and controlled laboratory environments that replicate industrial situations. This work considers the human dimension of collaboration, emphasising the importance of interaction, user trust, and ergonomic integration. It also recognises the ethical implications related to safety, transparency, and the responsible implementation of Artificial Intelligence (AI) systems in shared workspaces. The proposed framework has potential applications in the manufacturing, healthcare, and service sectors, aiming to drive the practical adoption of safe and efficient collaborative robots.  © 2025 The Authors.","collaborative robotics; graph-CNN; human-robot interaction; multimodal transformers; reinforcement learning","Collaborative robots; Ergonomics; Graph algorithms; Human computer interaction; Intelligent robots; Man machine systems; Actor critic; Algorithm combinations; Convolutional neural network; Graph-CNN; Human-robot collaboration; Humans-robot interactions; Multi-modal; Multimodal transformer; Reinforcement learnings; Research proposals; Constrained optimization","18770509","","","Conference paper","Final","All Open Access; Gold Open Access","Scopus","2-s2.0-105014151470"
